StateName,DistrictName,BlockName,Season,Sector,Category,Crop,QueryType,QueryText,KccAns,CreatedOn,year,month
ANDHRA PRADESH,ANANTPUR,0   ,NA,AGRICULTURE,0,Others,0,ASKED ABOUT AVAILABILITY OF EQUIPMENTS,INFORMATION GIVEN WHERE ITS AVAILABLE,2008-07-30T06:48:00,2008,7
ANDHRA PRADESH,ANANTPUR,0   ,NA,AGRICULTURE,0,Others,0,ASKED ABOUT WEATHER REPORT,INFORMATION GIVEN FROM INTERENET,2008-07-30T06:48:00,2008,7
ANDHRA PRADESH,GUNTUR,0   ,NA,AGRICULTURE,0,Cotton (Kapas),0,ASKED ABOUT STEM APPLICATION IN COTTON,RECOMMENDED TO USE EMIDACHLOPRID AND WATER IN 1:20 RATIO AS PER DATA,2008-07-30T06:48:00,2008,7
ANDHRA PRADESH,Y S R ,0   ,NA,AGRICULTURE,0,Groundnut (pea nut/mung phalli),0,ASKED ABOUT WEEDICIDES IN GROUND NUT,RECOMMENDED TO SPRAY EMAJITHAPHIR AS PER DATA,2008-07-30T06:48:00,2008,7
ANDHRA PRADESH,KRISHNA,0   ,NA,AGRICULTURE,0,1137,0,ASKED ABOUT RICE NURSERY MANAGENMANT,RECOMMENDED INFORMATION GIVEN AS PER DATA,2008-07-30T06:48:00,2008,7
ANDHRA PRADESH,VISAKHAPATNAM,0   ,NA,AGRICULTURE,0,1137,0,ASKED ABOUT RICE CULTURAL PRACTICES,NA,2008-07-30T06:48:00,2008,7
ANDHRA PRADESH,ANANTPUR,0   ,NA,HORTICULTURE,0,Banana,0,ASKED ABOUT CULTURAL PRACTICES IN BANANA,RECOMMENDED INFORMATION GIVEN AS PER DATA,2008-07-30T06:48:00,2008,7
ANDHRA PRADESH,KURNOOL,0   ,NA,AGRICULTURE,0,Black Gram (urd bean),0,ASKED ABOUT CULTURAL PRACTICES IN BLACK GRAM,RECOMMENDED INFORMATION GIVEN AS PER DATA,2008-07-30T06:48:00,2008,7
ANDHRA PRADESH,ANANTPUR,0   ,NA,HORTICULTURE,0,Radish,0,ASKED ABOUT CULTURAL PRACTICES IN RADISH,RECOMMENDED INFORMATION GIVEN AS PER DATA,2008-07-30T06:48:00,2008,7
