StateName,DistrictName,BlockName,Season,Sector,Category,Crop,QueryType,QueryText,KccAns,CreatedOn,year,month
ANDHRA PRADESH,GUNTUR,0   ,KHARIF,9999,0,9999,9999,ASKED ABOUT THE CONTROL OF MITES IN CHILLY,RECOMMENDED TO SPRAY DICOFOL 5ML/LT,2009-01-12T18:49:16,2009,1
ANDHRA PRADESH,KRISHNA,0   ,KHARIF,9999,0,9999,9999,ASKED ABOUT THE CONTROL OF THRIPS IN CHILLY,RECOMMENDED TO SPRAY PHASOLONE 3ML/LT,2009-01-12T19:03:48,2009,1
ANDHRA PRADESH,WEST GODAVARI,0   ,KHARIF,9999,0,9999,9999,ASKED ABOUT THE CONTROL OF BLAST IN PADDY,RECOMMENDED TO SPRAY TRYCYCLOZOLE@2ML/LIT,2009-01-13T09:51:46,2009,1
ANDHRA PRADESH,PRAKASAM,0   ,KHARIF,9999,0,9999,9999,ASKED ABOUT CONTROL FOR SPOTTED CATREPILLER,RECOMMENDED TO SPRAY ENDOSULFON 2ML+ NUVON 1ML,2009-01-13T12:45:32,2009,1
ANDHRA PRADESH,9999,0   ,KHARIF,9999,0,9999,9999,CALL DISCONNECTED,CALL DISCONNECTED,2009-01-13T16:50:32,2009,1
ANDHRA PRADESH,GUNTUR,0   ,KHARIF,AGRICULTURE,0,1075,3,ASKED ABOU THE CONTROL OF STEM BORER IN MAIZE,RECOMMENDED CARBOFURAN3%GRANULES@3KGS/ACRE,2009-01-13T19:20:40,2009,1
ANDHRA PRADESH,9999,0   ,KHARIF,9999,0,9999,9999,CALL DISCONNECTED,CALL DISCONNECTED,2009-01-13T19:24:23,2009,1
ANDHRA PRADESH,KURNOOL,0   ,KHARIF,9999,0,9999,9999,ASKED ABOUT CONTROL FOR MITE DAMAGE,RECOMMENDED TO SPRAY WETTABLE SULPHER 3GR/LITRE,2009-01-16T09:37:21,2009,1
ANDHRA PRADESH,NELLORE,0   ,KHARIF,AGRICULTURE,0,1137,2,ASKED ABOUT THE CONTROL OF BLAST IN RICE,RECOMMENDED TO SPRAY TRICYCLOZOLE 0.06GM/LT,2009-01-16T11:18:37,2009,1
ANDHRA PRADESH,9999,0   ,KHARIF,9999,0,9999,9999,BLANK CALL,BLANK CALL,2009-01-16T11:59:23,2009,1
ANDHRA PRADESH,CHITTOOR,0   ,KHARIF,9999,0,9999,9999,ASKED ABOUT CONTROL FOR DAMPINGOFF,RECOMMENDED TO SPRAY BLITOX 3GR/LITRE,2009-01-16T13:05:36,2009,1
ANDHRA PRADESH,9999,0   ,KHARIF,9999,0,9999,9999,CALL DISCONNECTED,CALL DISCONNECTED,2009-01-30T20:25:40,2009,1
ANDHRA PRADESH,ANANTPUR,0   ,KHARIF,9999,0,9999,9999,ASKED ABOUT CONTROL FOR ROOT ROT,RECOMMENDED TO SPRAY MANCOZEB 600GM/200LT,2009-01-31T07:02:42,2009,1
ANDHRA PRADESH,EAST GODAVARI,0   ,KHARIF,9999,0,9999,9999,ASKED ABOUT CONTROL FOR GALLMIDGE,RECOMMENDED TO APPLY PHORATE10G 5KG/ACRE,2009-01-31T11:29:54,2009,1
ANDHRA PRADESH,9999,0   ,KHARIF,9999,0,9999,9999,CALL DISCONNECTED,CALL DISCONNECTED,2009-01-31T14:39:03,2009,1
ANDHRA PRADESH,9999,0   ,KHARIF,9999,0,9999,9999,BLANK CALL,BLANK CALL,2009-01-31T14:47:17,2009,1
ANDHRA PRADESH,VIZIANAGARM,0   ,KHARIF,HORTICULTURE,0,1279,29,ASKED ABOUT THE CONTROL OF FRUIT AND SHOOT BORER IN BRINJAL,RECOMMENDED TO SPRAY PROFINOPHOS@2ML/LIT,2009-01-31T15:09:02,2009,1
ANDHRA PRADESH,KRISHNA,0   ,KHARIF,AGRICULTURE,0,1075,21,ASKED ABOUT THE CONTROL OF WEEDS IN MAIZE,RECOMMENDED TO SPRAY ATRAZINE 1.5LT/ACRE,2009-01-31T16:24:05,2009,1
ANDHRA PRADESH,PRAKASAM,0   ,KHARIF,9999,0,9999,9999,ASKED ABOUT THE CONTROL OF MITES,RECOMMENDED TO SPRAY DICOFAL@5ML/LIT,2009-01-31T16:51:21,2009,1
ANDHRA PRADESH,Y S R ,0   ,KHARIF,9999,0,9999,9999,ASKED ABOUT THE CONTROL OF BLAST IN PADDY,RECOMMENDED TO SPRAY TRYCYCLOZOLE@.6GRAMS/LIT,2009-01-31T16:54:48,2009,1
ANDHRA PRADESH,EAST GODAVARI,0   ,KHARIF,9999,0,9999,9999,ASKED ABOUT THE CONTROL OF STEM BORER,RECOMMENDED TO SPRAY CARTAPHYDROCHLORIDE 2GM/LTR,2009-01-31T16:56:31,2009,1
ANDHRA PRADESH,KRISHNA,0   ,JAYAD,AGRICULTURE,0,1075,3,ASKED ABOUT THE CONTROL OF STEM BORER IN MAIZE,RECOMMENDED TO SPRAY ENDOSULPHAN@2ML/LIT,2009-01-31T17:03:30,2009,1
ANDHRA PRADESH,NELLORE,0   ,KHARIF,9999,0,9999,9999,ASKED ABOUT THE CONTROL OF POD BORER,RECOMMENDED TO SPRAY MONOCROTOPHOS@2ML/LIT,2009-01-31T18:16:41,2009,1
ANDHRA PRADESH,KURNOOL,0   ,KHARIF,9999,0,9999,9999,ASKED ABOUT THE CONTROL OF MITES IN CHILLY,RECOMMENDED TO SPRAY DICOFOL 5ML/LT,2009-01-31T19:32:02,2009,1
ANDHRA PRADESH,9999,0   ,KHARIF,9999,0,9999,9999,CALL DISCONNECTED,CALL DISCONNECTED,2009-01-31T21:24:16,2009,1
ANDHRA PRADESH,WEST GODAVARI,0   ,KHARIF,9999,0,9999,9999,ASKED ABOUT CONTROL FOR NEMATODE DAMAGE,RECOMMENDED TO APPLY CARBOFURON 3G GRANULES 40GRS/PLANT,2009-01-26T07:05:00,2009,1
ANDHRA PRADESH,9999,0   ,KHARIF,9999,0,9999,9999,CALL DISCONNECTED,CALL DISCONNECTED,2009-01-26T07:12:33,2009,1
ANDHRA PRADESH,KRISHNA,0   ,KHARIF,9999,0,9999,9999,ASKED ABOUT THE CONTROL OF FRUIT DROP,RECOMMENDED TO SPRAY BLITOX 3GM/LTR,2009-01-19T09:39:51,2009,1
ANDHRA PRADESH,GUNTUR,0   ,KHARIF,9999,0,9999,9999,ASKED ABOUT THE CONTROL O9F STEM BORER DAMAGE,RECOMMENDED TO SPRAY ENDOSULPHAN 2ML/LTR,2009-01-19T09:40:59,2009,1
ANDHRA PRADESH,NELLORE,0   ,KHARIF,9999,0,9999,9999,ASKED ABOUT THE CONTROL OF WHITEFLY DAMAGE,RECOMMENDED TO SPRAY MONOCROTOPHAS 1.5ML/LTR,2009-01-19T12:35:27,2009,1
ANDHRA PRADESH,KRISHNA,0   ,KHARIF,9999,0,9999,9999,ASKED ABOUT CONTROL FOR POWDERY MILDEW,RECOMMENDED TO SPRAY WETTABLE SULPHER 3GR/LITRE,2009-01-21T10:33:48,2009,1
ANDHRA PRADESH,9999,0   ,KHARIF,9999,0,9999,9999,BLANK CALL,BLANK CALL,2009-01-21T10:42:03,2009,1
ANDHRA PRADESH,WEST GODAVARI,0   ,KHARIF,9999,0,9999,9999,ASKED ABOUT THE CONTROL OF FRUIT DROP,RECOMMENDED TO SPRAY PLANOPHIX 1ML/5LTR,2009-01-21T12:26:34,2009,1
ANDHRA PRADESH,NELLORE,0   ,KHARIF,9999,0,9999,9999,ASKED ABOUT THE CONTROL OF YELLOWSTEM BORER,RECOMMENDED TO SPRAY MONOCROTOPHOS@2ML/LIT,2009-01-21T14:46:11,2009,1
ANDHRA PRADESH,9999,0   ,KHARIF,HORTICULTURE,0,Ber,2,WOUND OF CUCUMBER,APPLY COPPER OXYCHLORIDE @4 GM/LIT OF WATER,2009-01-21T17:29:22,2009,1
ANDHRA PRADESH,GUNTUR,0   ,KHARIF,9999,0,9999,9999,ASKED ABOUT THE CONTROL OF PADDY STEM BORER,RECOMMENDED TO SPRAY MONOCROTOPHOS@2ML/LIT,2009-01-21T18:42:31,2009,1
ANDHRA PRADESH,NELLORE,0   ,KHARIF,9999,0,9999,9999,ASKED ABOUT CONTROL FOR BLAST,RECOMMENDED TO APPLY TRICYCLOZOLE 0.6GM/LT,2009-01-21T21:14:53,2009,1
ANDHRA PRADESH,9999,0   ,KHARIF,9999,0,9999,9999,BLANK CALL,BLANK CALL,2009-01-22T07:59:06,2009,1
ANDHRA PRADESH,GUNTUR,0   ,KHARIF,AGRICULTURE,0,1137,21,ASKED ABOUT THE CONTROL OF WEEDS IN RICE,RECOMMENDED TO SPRAY BENTHIOCARB 1.6LT/ACRE,2009-01-20T14:43:33,2009,1
ANDHRA PRADESH,SRIKAKULAM,0   ,KHARIF,9999,0,9999,9999,ASKED ABOUT CONTROL FOR THRIPS DAMAGE,RECOMMENDED TO SPRAY ACEPHATE 1.5GR/LITRE,2009-01-20T16:53:03,2009,1
ANDHRA PRADESH,NELLORE,0   ,KHARIF,9999,0,9999,9999,ASKED ABOUT THE CONTROL OF YELLOW STEM BORER,RECOMMENDED TO SPRAY CORTOP HYDRO CHLORIDE @2GR/LIT,2009-01-22T20:41:43,2009,1
ANDHRA PRADESH,9999,0   ,KHARIF,9999,0,9999,9999,BLANK CALL,BLANK CALL,2009-01-23T11:28:08,2009,1
ANDHRA PRADESH,EAST GODAVARI,0   ,KHARIF,9999,0,9999,9999,ASKED ABOUT CONTROL FOR STEM BORER,RECOMMENDED TO APPLY CARTAPHYDROCHLORIDE 4G GRANULES 8KG/ACRE,2009-01-23T11:30:36,2009,1
ANDHRA PRADESH,KRISHNA,0   ,KHARIF,AGRICULTURE,0,1137,2,ASKED ABOUT CONTROL FOR RICE BLAST,RECOMMENDED TO SPRAY TRICYCLOZOLE 0.6GM/LT,2009-01-23T11:59:09,2009,1
ANDHRA PRADESH,SRIKAKULAM,GARA,KHARIF,9999,0,9999,9999,ASKED ABOUT CONTROL FOR THRIPS DAMAGE,RECOMMENDED TO SPRAY ACEPHATE 1.5GR/LITRE,2009-01-23T12:44:36,2009,1
ANDHRA PRADESH,ANANTPUR,0   ,KHARIF,AGRICULTURE,0,1037,5,ASKED ABOUT VARIETIES FOR GREENGRAM,RECOMMENDED TO PREFER ML-267 OR PUSA 105,2009-01-23T13:39:23,2009,1
ANDHRA PRADESH,GUNTUR,0   ,KHARIF,HORTICULTURE,0,1280,2,ASKED ABOUT THE CONTROL OF FRUIT ROT IN CHILLIES,RECOMMENDED TO SPRAY MANCOZEB@3GR/LIT,2009-01-23T14:09:15,2009,1
ANDHRA PRADESH,EAST GODAVARI,0   ,KHARIF,9999,0,9999,9999,ASKED ABOUT THE CONTROL OF SHEATH BLIGHT IN PADDY,RECOMMENDED TO SPRAY HEXACONAZOLE@2ML/LIT,2009-01-19T15:57:32,2009,1
ANDHRA PRADESH,KRISHNA,0   ,KHARIF,9999,0,9999,9999,ASKED ABOUT CONTROL FOR HELICOVERPA DAMEGE,RECOMMENDED TO SPRAY ENDOSULFON 2ML/LITRE,2009-01-19T16:40:22,2009,1
ANDHRA PRADESH,KRISHNA,0   ,KHARIF,9999,0,9999,9999,ASKED ABOUT THE CONTROL OF YELLOW STEM BORER IN PADDY,RECOMMENDED TO SPRAY MONOCROTOPHOS@2ML/LIT,2009-01-19T17:39:47,2009,1
ANDHRA PRADESH,NELLORE,0   ,KHARIF,9999,0,9999,9999,ASKED ABOUT THE CONTROL OF BPH IN PADDY,RECOMMENDED TO SPRAYETHOFENPHOS@1.5ML/LIT,2009-01-19T18:46:29,2009,1
ANDHRA PRADESH,9999,0   ,KHARIF,9999,0,9999,9999,BLANK CALL,BLANK CALL,2009-01-28T12:05:43,2009,1
ANDHRA PRADESH,GUNTUR,0   ,KHARIF,9999,0,9999,9999,ASKED ABOUT THE INFORMATION BOOKS OF MUSHROOM,ESC TO MANAGE,2009-01-28T13:45:04,2009,1
ANDHRA PRADESH,9999,0   ,KHARIF,9999,0,9999,9999,BLANK CALL,BLANK CALL,2009-01-28T15:32:58,2009,1
ANDHRA PRADESH,ANANTPUR,0   ,KHARIF,9999,0,9999,9999,ASKED ABOUT CONTROL FOR TIKKA LEAF SPOT,RECOMMENDED TO SPRAY CHLOROTHALONIL 400GM/200LT,2009-01-28T19:43:38,2009,1
ANDHRA PRADESH,WEST GODAVARI,0   ,KHARIF,9999,0,9999,9999,ASKED ABOUT CONTROL FOR BLAST,RECOMMENDED TO SPRAY TRICYCLOZOLE 0.6GM/LT,2009-01-29T10:35:47,2009,1
ANDHRA PRADESH,Y S R ,0   ,KHARIF,AGRICULTURE,0,1037,5,ASKED ABOUT VARIETIES FOR REDGRAM,"RECOMMENDED TO CHOOSE KRANTI, SWETHA JYOTHI",2009-01-29T10:38:50,2009,1
ANDHRA PRADESH,GUNTUR,0   ,KHARIF,9999,0,9999,9999,ASKED ABOUT THE CONTROL OF GUMMOSIS,RECOMMENDED FOR THE APPLICATION OF BORDEAUX PASTE,2009-01-20T13:11:18,2009,1
ANDHRA PRADESH,WEST GODAVARI,0   ,KHARIF,9999,0,9999,9999,ASKED ABOUT CONTROL FOR HISPA DAMAGE,RECOMMENDED TO SPRAY CHLORPYRIPOS 2.5GR/LITRE,2009-01-20T14:05:56,2009,1
ANDHRA PRADESH,PRAKASAM,0   ,KHARIF,HORTICULTURE,0,1280,29,ASKED ABOUT THE CONTROL OF THRIPS IN CHILLIES,RECOMMENDED TO SPRAY ACEPHATE@1.5GR/LIT,2009-01-20T15:49:53,2009,1
ANDHRA PRADESH,NELLORE,0   ,KHARIF,9999,0,9999,9999,ASKED ABOUT THE CONTROL OF SHEATH BLIGHT IN PADDY,RECOMMENDED TO SPRAY HEXACONAZOLE@2ML/LIT,2009-01-20T18:03:28,2009,1
ANDHRA PRADESH,KRISHNA,0   ,KHARIF,9999,0,9999,9999,ASKED ABOUT THE CONTROL OF POWDERY MILDEW,RECOMMENDED TO SPRAY CARBENDAZIM 1GM/LTR,2009-01-21T06:32:34,2009,1
ANDHRA PRADESH,9999,0   ,KHARIF,9999,0,9999,9999,BLANK CALL,BLANK CALL,2009-01-21T07:32:08,2009,1
ANDHRA PRADESH,9999,0   ,KHARIF,9999,0,9999,9999,BLANK CALL,BLANK CALL,2009-01-21T07:32:20,2009,1
ANDHRA PRADESH,PRAKASAM,0   ,KHARIF,9999,0,9999,9999,ASKED ABOUT VARIETIES,"RECOMMENDED VARIETIES ARE TRISHULATHA, DHM-103,105, AMBER POPCORN",2009-01-21T08:22:11,2009,1
ANDHRA PRADESH,CHITTOOR,0   ,KHARIF,9999,0,9999,9999,ASKED ABOUT THE CONTROL OF THRIPS DAMAGE,RECOMMENDED TO SPRAY ACEPHATE 1.5GM/LTR,2009-01-21T09:19:00,2009,1
ANDHRA PRADESH,EAST GODAVARI,0   ,KHARIF,9999,0,9999,9999,ASKED ABOUT THE CONTROL OF TIKKA LEAF SPOT IN GROUND NUT,RECOMMENDED TO SPRAY CHLOROTHALANIL 2ML/LT,2009-01-30T09:37:35,2009,1
ANDHRA PRADESH,9999,0   ,KHARIF,9999,0,9999,9999,BLANK CALL,BLANK CALL,2009-01-30T11:16:37,2009,1
ANDHRA PRADESH,9999,0   ,KHARIF,9999,0,9999,9999,BLANK CALL,BLANK CALL,2009-01-30T14:49:46,2009,1
ANDHRA PRADESH,GUNTUR,0   ,KHARIF,AGRICULTURE,0,1037,2,ASKED ABOUT THE CONTROL OF POWDERY MILDEW IN BLACK GRAM,RECOMMENDED TO SPRAY KARATHANE 2ML/LT,2009-01-30T18:15:26,2009,1
ANDHRA PRADESH,9999,0   ,KHARIF,9999,0,9999,9999,CALL DISCONNECTED,CALL DISCONNECTED,2009-01-30T20:13:33,2009,1
ANDHRA PRADESH,9999,0   ,KHARIF,9999,0,9999,9999,BLANK CALL,BLANK CALL,2009-01-30T20:37:59,2009,1
ANDHRA PRADESH,NELLORE,0   ,KHARIF,9999,0,9999,9999,ASKED ABOUT THE CONTROL OF SUCKING PEST DAMAGE,RECOMMENDED TO SPRAY DIMITHOATE 2ML/LTR,2009-01-12T07:20:16,2009,1
ANDHRA PRADESH,9999,0   ,KHARIF,9999,0,9999,9999,CALL DISCONNECTED,CALL DISCONNECTED,2009-01-12T08:50:30,2009,1
ANDHRA PRADESH,WEST GODAVARI,0   ,KHARIF,9999,0,9999,9999,ASKED ABOUT THE CONTROL OF ZINC DEFECIENCY,RECOMMENDED TO SPRAY ZINC SULPHATE 2GM/LTR,2009-01-22T12:45:27,2009,1
ANDHRA PRADESH,KRISHNA,0   ,KHARIF,9999,0,9999,9999,ASKED ABOUT THE IRRIGATION MANAGEMENT,RECOMMENDED TO PROVIDE LIGHT WATER ONCE WITH IN 30 DAYS AND AGAIN WITHIN 60 DAYS,2009-01-22T13:02:07,2009,1
ANDHRA PRADESH,KRISHNA,0   ,KHARIF,AGRICULTURE,0,1037,3,ASKED ABOUT THE CONTROL OF GRAM CATERPILLAR,RECOMMENDED TO SPRAY QUINOLPHAS 2ML/LTR,2009-01-16T08:12:31,2009,1
ANDHRA PRADESH,9999,0   ,KHARIF,HORTICULTURE,0,1268,2,ASKED ABOUT THE FLOWER DROP IIN MANGO,RECOMMENDED TO SPRAY PLANOPHIX@1ML/5LIT,2009-01-13T06:47:58,2009,1
ANDHRA PRADESH,GUNTUR,0   ,KHARIF,9999,0,9999,9999,ASKED ABOUT VARIETIES,GIVEN INFORMATION IS HIMA[J.C.S9426],2009-01-15T10:51:41,2009,1
ANDHRA PRADESH,NELLORE,0   ,KHARIF,9999,0,9999,9999,ASKED ABOUT WEATHER REPORT,"CHANCE OF RAIN ON THURSDAY NIGHT, SATURDAY AND SUNDAY",2009-01-15T11:19:25,2009,1
ANDHRA PRADESH,ANANTPUR,0   ,KHARIF,9999,0,9999,9999,ASKED ABOUT CONTROL FOR LEAFSPOT,RECOMMENDED TO SPRAY BAVISTIN 1GR/LITRE,2009-01-15T11:39:19,2009,1
ANDHRA PRADESH,EAST GODAVARI,0   ,KHARIF,AGRICULTURE,0,1137,2,ASKED ABOUT THE CONTROL OF RICE BLAST,RECOMMENDED TO SORAY TRICYCLOZOLE 0.6GM/LTR,2009-01-15T14:13:45,2009,1
ANDHRA PRADESH,KRISHNA,0   ,KHARIF,9999,0,9999,9999,ASKED ABOUT THE CONTROL OF YELLOW STEM BORER,RECOMMENDED TO SPRAY MONOCROTOPHOS@2ML/LIT,2009-01-24T21:27:28,2009,1
ANDHRA PRADESH,ANANTPUR,0   ,KHARIF,HORTICULTURE,0,1280,29,ASKED ABOUT THE CONTROL OF THRIPS IN CHILLIES,RECOMMENDED TO SPRAY PHASOLONE@3ML/LIT,2009-01-27T12:40:19,2009,1
ANDHRA PRADESH,WEST GODAVARI,0   ,KHARIF,9999,0,9999,9999,ASKED ABOUT CONTROL FOR WEED CONTROL,RECOMMENDED TO SPRAY BENTHIOCORP 1.5-2 LITRES/ACRE,2009-01-27T14:42:44,2009,1
ANDHRA PRADESH,KURNOOL,0   ,KHARIF,9999,0,9999,9999,ASKED ABOUT TEMPERATURE,GIVEN INFORMATION IS IN BETWEEN 18-21CENTIGRADE,2009-01-14T09:37:06,2009,1
ANDHRA PRADESH,CHITTOOR,0   ,KHARIF,AGRICULTURE,0,Sunflower (suryamukhi),3,ASKED ABOUT THE SEED TREATMENT IN SUNFLOWER,RECOMMENDED TO USE IMIDACHLOPRID 5GM/KG OF SEED,2009-01-14T15:03:27,2009,1
ANDHRA PRADESH,ANANTPUR,0   ,KHARIF,HORTICULTURE,0,1279,29,ASKED ABOUT THE CONTROL OF FRUIT AND SHOOT BORER IN BRINJAL,RECOMMENDED TO SPRAY PROPHENOPHOS 2ML/LT,2009-01-14T16:26:41,2009,1
ANDHRA PRADESH,NELLORE,0   ,KHARIF,AGRICULTURE,0,1137,3,ASKED ABOUT THE CONTROL OF GUNDHI BUG IN RICE,RECOMMENDED TO SPRAY MONOCROTOPHOS 1.6ML/LT,2009-01-14T17:09:46,2009,1
ANDHRA PRADESH,9999,0   ,KHARIF,9999,0,9999,9999,BLANK CALL,BLANK CALL,2009-01-14T20:39:54,2009,1
ANDHRA PRADESH,9999,0   ,KHARIF,9999,0,9999,9999,CALL DISCONNECTED,CALL DISCONNECTED,2009-01-14T21:16:47,2009,1
ANDHRA PRADESH,9999,0   ,KHARIF,9999,0,9999,9999,CALL DISCONNECTED,CALL DISCONNECTED,2009-01-14T21:17:35,2009,1
ANDHRA PRADESH,GUNTUR,0   ,KHARIF,9999,0,9999,9999,ASKED ABOUT CONTROL FOR FLOWER DROP,RECOMMENDED TO SPRAY PLANOPHIX 1ML/5LITRES,2009-01-12T09:06:49,2009,1
ANDHRA PRADESH,NELLORE,0   ,KHARIF,9999,0,9999,9999,ASKED ABOUT THE CHANCE OF RAIN FOR COMING TWO DAYS,THERE IS NO CHANCE OF RAIN FOR COMING TWO DAYS,2009-01-12T14:38:33,2009,1
ANDHRA PRADESH,9999,0   ,KHARIF,9999,0,9999,9999,BLANK CALL,BLANK CALL,2009-01-25T15:26:22,2009,1
ANDHRA PRADESH,GUNTUR,0   ,KHARIF,9999,0,9999,9999,ASKED ABOUT THE CONTROL OF STEM BORER,RECOMMENDED TO APPLY CARBOFURAN GRANULES 4KG/ACRE,2009-01-26T11:51:17,2009,1
ANDHRA PRADESH,GUNTUR,0   ,KHARIF,AGRICULTURE,0,1075,21,ASKED ABOUT THE CONTROL OF WEEDS IN MAIZE,RECOMMENDED TO SPRAY 1.5 KG ATRAZIN 50% IN 200LIT WATER/ACRE,2009-01-26T12:06:37,2009,1
ANDHRA PRADESH,KRISHNA,0   ,KHARIF,9999,0,9999,9999,ASKED ABOUT THE CONTROL OF POWDERY MILDEW,RECOMMENDED TO SPRAY TRIDIMORPH 1ML/LTR,2009-01-26T13:56:44,2009,1
ANDHRA PRADESH,WEST GODAVARI,0   ,KHARIF,9999,0,9999,9999,ASKED ABOUT CONTROL FOR GALLMIDGE,RECOMMENDED TO SPRAY PHORATE 5KG/ACRE,2009-01-26T14:11:06,2009,1
ANDHRA PRADESH,PRAKASAM,0   ,KHARIF,9999,0,9999,9999,ASKED ABOUT CONTROL FOR SHEATH ROT,RECOMMENDED TO SPRAY BAVISTIN 1GR/LITRE,2009-01-26T15:06:00,2009,1
ANDHRA PRADESH,9999,0   ,KHARIF,9999,0,9999,9999,WANT TO KNOW ABOUT BEE KEEPING.,ANSWER GIVEN IN DETAILS.,2009-01-24T15:05:53,2009,1
ANDHRA PRADESH,9999,0   ,KHARIF,9999,0,9999,9999,CALL DISCONNECTED,CALL DISCONNECTED,2009-01-24T15:09:42,2009,1
ANDHRA PRADESH,CHITTOOR,0   ,KHARIF,9999,0,9999,9999,ASKED ABOUT THE VARIETIES AS FODDER CROPS,"RECOMMENDED BARSEEM VARIETIES MESKAVI,PUSA JOINT",2009-01-24T16:41:09,2009,1
ANDHRA PRADESH,KRISHNA,0   ,KHARIF,9999,0,9999,9999,ASKED ABOUT THE CONTROL OF WEEDS,RECOMMENDED TO SPRAY BENTHIOCARP 1.5LTR/ACRE,2009-01-24T18:39:08,2009,1
ANDHRA PRADESH,GUNTUR,0   ,KHARIF,9999,0,9999,9999,ASKED ABOUT CONTROL FOR WEED,RECOMMENDED TO SPRAY PENDIMETHYLIN 1.5KG/ACRE,2009-01-23T13:08:42,2009,1
ANDHRA PRADESH,KRISHNA,0   ,KHARIF,9999,0,9999,9999,ASKED ABOUT CONTROL FOR THRIPS,RECOMMENDED TO SPRAY CARBARIL 3GM/LT,2009-01-22T15:17:00,2009,1
ANDHRA PRADESH,PRAKASAM,0   ,KHARIF,9999,0,9999,9999,ASKED ABOUT CONTROL FOR STEMBORER,RECOMMENDED TO SPRAY ENDOSULPHAN 2ML/LT,2009-01-22T17:51:34,2009,1
ANDHRA PRADESH,9999,0   ,KHARIF,9999,0,9999,9999,BLANK CALL,BLANK CALL,2009-01-22T21:11:24,2009,1
ANDHRA PRADESH,9999,0   ,KHARIF,9999,0,9999,9999,BLANK CALL,BLANK CALL,2009-01-22T21:12:10,2009,1
ANDHRA PRADESH,NELLORE,0   ,KHARIF,AGRICULTURE,0,Oil palm,5,ASKED ABOUT VARIETIES FOR SESAMUM,RECOMMENDED TO PREFER RAJESHWARI OR SWETHATILL,2009-01-23T09:35:38,2009,1
ANDHRA PRADESH,EAST GODAVARI,0   ,KHARIF,9999,0,9999,9999,ASKED ABOUT THE CONTROL OF GALLMIDGE,RECOMMENDED TO SPRAY CARBOFURAN 10 KG/ACRE,2009-01-23T11:04:29,2009,1
ANDHRA PRADESH,9999,0   ,KHARIF,9999,0,9999,9999,PRE MATURE FRUIT DROPING OF COCONUT.,APPLY PLANOFIX @1ML/4.5LIT. OF WATER.,2009-01-26T17:30:40,2009,1
ANDHRA PRADESH,9999,0   ,KHARIF,9999,0,9999,9999,CALL DISCONNECTED,CALL DISCONNECTED,2009-01-26T18:32:52,2009,1
ANDHRA PRADESH,9999,0   ,KHARIF,9999,0,9999,9999,PRE MATURE FRUIT DROPING OF COCONUT.,APPLY PLANOFIX @1ML/4.5LIT. OF WATER.,2009-01-26T18:35:32,2009,1
ANDHRA PRADESH,WEST GODAVARI,0   ,KHARIF,9999,0,9999,9999,ASKED ABOUT THE CONTROL OF BPH,RECOMMENDED TO SPRAY ACEPHATE 1.5GM/LTR,2009-01-27T06:15:38,2009,1
ANDHRA PRADESH,9999,0   ,KHARIF,9999,0,9999,9999,CALL DISCONNECTED,CALL DISCONNECTED,2009-01-11T14:35:29,2009,1
ANDHRA PRADESH,CHITTOOR,0   ,KHARIF,9999,0,9999,9999,ASKED ABOUT THE CONTROL OF STEM BORER DAMAGE,RECOMMENDED TO SPRAY CARTAP HYDROCHLORIDE 2GM/LTR,2009-01-27T20:20:23,2009,1
ANDHRA PRADESH,KRISHNA,0   ,KHARIF,9999,0,9999,9999,ASKED ABOUT WEEDICIDE,RECOMMENDED TO APPLY ATRAZINE 1.5LT/ACRE,2009-01-28T07:14:31,2009,1
ANDHRA PRADESH,9999,0   ,KHARIF,9999,0,9999,9999,WANT TO KNOW ABOUT KOLKATA LOCATION,ANSWER GIVEN IN DETAILS,2009-01-28T07:53:04,2009,1
ANDHRA PRADESH,CHITTOOR,0   ,KHARIF,9999,0,9999,9999,ASKED ABOUT CONTROL FOR BPH,RECOMMENDED TO SPRAY ACEPHATE 1.5GR/LITRE,2009-01-28T08:40:48,2009,1
ANDHRA PRADESH,EAST GODAVARI,0   ,KHARIF,9999,0,9999,9999,ASKED ABOUT CONTROL FOR Mg DEFICIENCY,RECOMMENDED TO SPRAY MAGNISHIYAM SULPHATE 10GM/LT,2009-01-28T09:17:39,2009,1
ANDHRA PRADESH,CHITTOOR,0   ,KHARIF,9999,0,9999,9999,ASKED ABOUT CONTROL FOR LEAF FOLDER,RECOMMENDED TO SPRAY ACEPHATE 1.5GM/LT,2009-01-28T09:52:33,2009,1
ANDHRA PRADESH,SRIKAKULAM,0   ,KHARIF,9999,0,9999,9999,ASKED ABOUT CONTROL FOR JASSIDS,RECOMMENDED TO SPRAY DIMETHOATE 2ML/LT,2009-01-28T09:58:13,2009,1
ANDHRA PRADESH,9999,0   ,KHARIF,9999,0,9999,9999,pre mature fruit droping of coconut.,apply planofix @1ml/4.5lit. of water.,2009-01-28T10:54:51,2009,1
ANDHRA PRADESH,CHITTOOR,0   ,KHARIF,9999,0,9999,9999,ASKED ABOUT THE CONTROL OF REDDENING OF THE LEAVES,RECOMMENDED TO SPRAY ZNSO42GM/LT,2009-01-28T11:01:50,2009,1
ANDHRA PRADESH,GUNTUR,0   ,KHARIF,9999,0,9999,9999,ASKED ABOUT THE CONTROL OF XANTHOMONAS IN CHILLY,RECOMMENDED TO SPRAY PLANTAMYCIN 2GM+COC 30GM IN 10LT OF WATER,2009-01-28T11:13:01,2009,1
ANDHRA PRADESH,ANANTPUR,0   ,KHARIF,9999,0,9999,9999,ASKED ABOUT CONTROL FOR GALLMIDGE,RECOMMENDED TO APPLY PHORATE 10G 5KG/ACRE,2009-01-28T13:41:17,2009,1
ANDHRA PRADESH,KRISHNA,0   ,KHARIF,9999,0,9999,9999,ASKED ABOUT CONTROL FOR WEEDS,RECOMMENDED TO SPRAY BENTHIOCORP 1.5-2LITRES/ACRE,2009-01-28T13:59:03,2009,1
ANDHRA PRADESH,9999,0   ,KHARIF,9999,0,9999,9999,BLANK CALL,BLANK CALL,2009-01-28T14:47:56,2009,1
ANDHRA PRADESH,KURNOOL,0   ,KHARIF,AGRICULTURE,0,Sunflower (suryamukhi),2,ASKED ABOUT THE CONTROL OF NECROSIS IN SUNFLOWER,RECOMMENDED TO SPRAY IMIDACHLOPRID 6ML/LT,2009-01-28T17:01:29,2009,1
ANDHRA PRADESH,9999,0   ,KHARIF,9999,0,9999,9999,BLANK CALL,BLANK CALL,2009-01-28T17:38:09,2009,1
ANDHRA PRADESH,9999,0   ,KHARIF,9999,0,9999,9999,DISCONNECTED,DISCONNECTED,2009-01-29T09:14:47,2009,1
ANDHRA PRADESH,CHITTOOR,0   ,KHARIF,AGRICULTURE,0,1137,2,ASKED ABOUT THE CONTROL OF RICE BLAST,RECOMMENDED TO SPRAY TRICYCLOZOLE 0.6GM/LTR,2009-01-23T12:55:57,2009,1
ANDHRA PRADESH,KRISHNA,0   ,KHARIF,9999,0,9999,9999,ASKED ABOUT CONTROL FOR LEAFSPOT,RECOMMENDED TO SPRAY MANCOZEB-45 2.5GR/LITRE,2009-01-16T10:24:21,2009,1
ANDHRA PRADESH,SRIKAKULAM,0   ,KHARIF,9999,0,9999,9999,ASKED WHETHER HE CAN SPRAY FERTILIZER AND A PESTICIDE TOGETHER,ADVICED HIM NOT TO APPLY TOGETHER,2009-01-16T11:19:06,2009,1
ANDHRA PRADESH,KRISHNA,0   ,KHARIF,9999,0,9999,9999,ASKED ABOUT CONTROL FOR STEMBORER DAMAGE,RECOMMENDED TO APPLY 4% CARBOFURON GRANULES 3KGS/ACRE,2009-01-16T12:34:39,2009,1
ANDHRA PRADESH,Y S R ,0   ,KHARIF,9999,0,9999,9999,ASKED ABOUT CONTROL FOR LEAFSPOT,RECOMMENDED TO SPRAY BAVISTIN 1GR/LITRE,2009-01-16T14:17:23,2009,1
ANDHRA PRADESH,NELLORE,0   ,KHARIF,9999,0,9999,9999,ASKED ABOUT THE CONTROL OF YELLOW STEM BORER,RECOMMENDED TO SPRAY MONOCROTOPHOS@2ML/LIT,2009-01-16T18:40:08,2009,1
ANDHRA PRADESH,Y S R ,0   ,KHARIF,9999,0,9999,9999,ASKED ABOUT CONTROL FOR THRIPS,RECOMMENDED TO APPLY IMIDACHLOPRID 0.3GM/LT,2009-01-16T18:44:21,2009,1
ANDHRA PRADESH,GUNTUR,0   ,KHARIF,9999,0,9999,9999,ASKED ABOUT THE CONTROL OF WEEDS IN PADDY,RECOMMENDED PENIMETHALIN,2009-01-16T18:50:57,2009,1
ANDHRA PRADESH,CHITTOOR,0   ,KHARIF,9999,0,9999,9999,ASKED ABOUT THE CONTROL OF APHIDS,RECOMMENDED TO SPRAY ROGOR@2ML/LIT,2009-01-16T19:49:11,2009,1
ANDHRA PRADESH,NELLORE,0   ,KHARIF,9999,0,9999,9999,ASKED ABOUT THE CONTROL OF BPH,RECOMMENDED TO SPRAY ACEPHATE 1.5GM/LTR,2009-01-19T07:09:17,2009,1
ANDHRA PRADESH,WEST GODAVARI,0   ,KHARIF,9999,0,9999,9999,ASKED ABOUT THE CONTROL OF FLOWER DROP,RECOMMENDED TO SPRAY PLANOPHIX 1ML/LTR,2009-01-19T07:20:26,2009,1
ANDHRA PRADESH,KRISHNA,0   ,KHARIF,ANIMAL HUSBANDRY,0,Horse,45,ASKED ABOUT VARIETIES FOR HORSEGRAM,RECOMMENDED TO CHOOSE PDM-1 OR PZM-1 OR PHG-62,2009-01-19T13:09:51,2009,1
ANDHRA PRADESH,EAST GODAVARI,0   ,KHARIF,AGRICULTURE,0,1137,2,ASKED ABOUT THE CONTROL OF BLAST IN RICE,RECOMMENDED TO SPRAY TRICYCLOZOLE 0.06GM/LT,2009-01-19T14:55:03,2009,1
ANDHRA PRADESH,KRISHNA,0   ,KHARIF,AGRICULTURE,0,1075,Fertilizer Use and Availability,ASKED ABOUT THE FERTILISER RECOMMENDATION IN MAIZE,RECOMMENDED 48-24-20,2009-01-19T15:46:21,2009,1
ANDHRA PRADESH,CHITTOOR,0   ,KHARIF,9999,0,9999,9999,ASKED ABOUT THE CONTROL OF GANODERMA IN COCONUT PLANTATIONS,RECOMMENDED 50KGS FYM+5KGS NEEMCAKE+50GRAMS TRICHODERMA VIRIDI,2009-01-21T15:21:55,2009,1
ANDHRA PRADESH,9999,0   ,KHARIF,9999,0,9999,9999,CALL DISCONNECTED,CALL DISCONNECTED,2009-01-21T18:14:22,2009,1
ANDHRA PRADESH,KRISHNA,0   ,KHARIF,9999,0,9999,9999,ASKED ABOUT THE CONTROL OF STEM BORER IN PADDY,RECOMMENDED TO SPRAY CORTOP HYDROCHLORIDE @2ML/LIT,2009-01-21T19:25:21,2009,1
ANDHRA PRADESH,9999,0   ,KHARIF,9999,0,9999,9999,BLANK CALL,BLANK CALL,2009-01-21T21:28:56,2009,1
ANDHRA PRADESH,GUNTUR,0   ,KHARIF,9999,0,9999,9999,ASKED ABOUT THE CONTROL OF STEM BORER DAMAGE,RECOMMENDED TO SPRAY ENDOSULPHAN 2ML/LTR,2009-01-22T08:12:59,2009,1
ANDHRA PRADESH,KURNOOL,0   ,KHARIF,9999,0,9999,9999,ASKED ABOUT CONTROL FOR BLAST,RECOMMENDED TO SPRAY TRICYCLOZOLE 0.6GM/LT,2009-01-13T17:20:45,2009,1
ANDHRA PRADESH,9999,0   ,KHARIF,9999,0,9999,9999,CALL DISCONNECTED,CALL DISCONNECTED,2009-01-13T21:50:22,2009,1
ANDHRA PRADESH,GUNTUR,0   ,KHARIF,9999,0,9999,9999,ASKED ABOUT FERTILIZER APPLICATION,"RECOMMENDED TO APPLY 48KGS N, 24KGS P, 20KGS K",2009-01-17T12:08:47,2009,1
ANDHRA PRADESH,KURNOOL,0   ,KHARIF,9999,0,9999,9999,ASKED ABOUT THE VARIETIES,"RECOMMENDED VARIETIES ARE ARKA ANAMIKA,ARKA ABHAYA",2009-01-17T12:42:57,2009,1
ANDHRA PRADESH,CHITTOOR,0   ,KHARIF,9999,0,9999,9999,ASKE4D ABOUT THE CONTROL OF LEAF SPOT,RECOMMENDED TO SPRAY CARBENDAZIM 2GM/LTR,2009-01-17T13:18:32,2009,1
ANDHRA PRADESH,KRISHNA,0   ,KHARIF,AGRICULTURE,0,1037,2,ASKED ABOUT THE CONTROL OF POWDERY MILDEW IN BLACKGRAM,RECOMMENDED TO SPRAY KARATHANE 1ML/LT,2009-01-17T16:22:02,2009,1
ANDHRA PRADESH,EAST GODAVARI,0   ,KHARIF,9999,0,9999,9999,ASKED ABOUT CONTROL FOR STEMBORER,RECOMMENDED TO SPRAY CHLORIPHYRIPHOS 2ML/LT,2009-01-17T18:31:02,2009,1
ANDHRA PRADESH,SRIKAKULAM,0   ,KHARIF,9999,0,9999,9999,ASKED ABOUT THE FERTILISER RECOMMENDATION IN PADDY,RECOMMENDED 48-24-20,2009-01-19T19:32:20,2009,1
ANDHRA PRADESH,Y S R ,0   ,KHARIF,9999,0,9999,9999,ASKED ABOUT FERTILIZER APPLICATION,"RECOMMENDED TO APPLY 2175GR UREA, 6250GR SSP, 1670GR MOP",2009-01-20T10:03:20,2009,1
ANDHRA PRADESH,GUNTUR,0   ,KHARIF,9999,0,9999,9999,ASKED ABOUT THE CONTROL OF ZINC DEFECIENCY,RECOMMENDED TO SPRAY ZINCSULPHATE 2GM/LTR,2009-01-31T15:44:39,2009,1
ANDHRA PRADESH,GUNTUR,0   ,KHARIF,AGRICULTURE,0,1075,3,ASKED ABOUT THE CONTROL OF STEM BORER IN MAIZE,RECOMMENDED CARBOFURAN GRANULES,2009-01-31T18:23:53,2009,1
ANDHRA PRADESH,9999,0   ,KHARIF,9999,0,9999,9999,BLANK CALL,BLANK CALL,2009-01-31T19:23:18,2009,1
ANDHRA PRADESH,ANANTPUR,0   ,KHARIF,9999,0,9999,9999,ASKED ABOUT THE CONTROL OF LEAF MINER,RECOMMENDED TO SPRAY ENDOSULPHAN@2ML/LIT,2009-01-31T20:10:56,2009,1
ANDHRA PRADESH,NELLORE,0   ,KHARIF,9999,0,9999,9999,ASKED ABOUT CONTROL FOR WEED,RECOMMENDED TO SPRAY BENTHIOCARP 2LT/ACRE,2009-01-29T14:37:15,2009,1
ANDHRA PRADESH,9999,0   ,KHARIF,9999,0,9999,9999,TEST CALL FROM TCIL,ALL INFORMATIONS ARE GIVEN ACCORDING QUERY.,2009-01-29T16:21:56,2009,1
ANDHRA PRADESH,9999,0   ,KHARIF,9999,0,9999,9999,TEST CALL FROM TCIL,ALL INFORMATIONS ARE GIVEN ACCORDING QUERY.,2009-01-29T16:28:48,2009,1
ANDHRA PRADESH,KURNOOL,0   ,KHARIF,AGRICULTURE,0,1075,1,ASKED ABOUT THE SOWING SEASON FOR MAIZE,RECOMMENDED TO SOW IN JANUARY,2009-01-29T17:27:50,2009,1
ANDHRA PRADESH,KRISHNA,0   ,KHARIF,9999,0,9999,9999,ASKED ABOUT CONTROL FOR LEAF FOLDER DAMAGE,RECOMMENDED TO SPRAY CHLORPYRIPOS 2ML/LITRE,2009-01-29T19:16:10,2009,1
ANDHRA PRADESH,PRAKASAM,0   ,KHARIF,9999,0,9999,9999,ASKED ABOUT WEATHER REPORT,NO CHANCE OF RAIN UPTO SUNDAY,2009-01-29T20:31:28,2009,1
ANDHRA PRADESH,KRISHNA,0   ,KHARIF,9999,0,9999,9999,ASKED ABOUT CONTROL FOR LEAF SPOT,RECOMMENDED TO SPRAY BAVISTIN 1GR/LITRE,2009-01-30T06:26:10,2009,1
