StateName,DistrictName,BlockName,Season,Sector,Category,Crop,QueryType,QueryText,KccAns,CreatedOn,year,month
ANDHRA PRADESH,GUNTUR,0   ,KHARIF,AGRICULTURE,0,1137,3,ASKED ABOUT THE CONTROL OF BPH IN RICE,RECOMMENDED TO SPRAY ACEPHATE 1.5GM/LT,2009-01-30T07:14:59,2009,1
ANDHRA PRADESH,WEST GODAVARI,0   ,KHARIF,AGRICULTURE,0,1137,3,ASKED ABOUT THE CONTROL OF GALL MIDGE IN RICE,RECOMMENDED TO SPRAY PHORATE 10G GRANULES 5KG/ACRE,2009-01-30T11:36:42,2009,1
ANDHRA PRADESH,9999,0   ,KHARIF,9999,0,9999,9999,BLANK CALL,BLANK CALL,2009-01-30T15:55:06,2009,1
ANDHRA PRADESH,9999,0   ,KHARIF,9999,0,9999,9999,CALL DISCONNECTED,CALL DISCONNECTED,2009-01-30T19:43:52,2009,1
ANDHRA PRADESH,9999,0   ,KHARIF,9999,0,9999,9999,BLANK CALL,BLANK CALL,2009-01-30T20:36:06,2009,1
ANDHRA PRADESH,WEST GODAVARI,0   ,KHARIF,AGRICULTURE,0,1137,2,ASKED ABOUT THE CONTROL OF RICE BLAST,RECOMMENDED TO SPRAY TRICYCLOZOLE 0.6GM/LTR,2009-01-31T07:55:09,2009,1
ANDHRA PRADESH,KRISHNA,0   ,KHARIF,9999,0,9999,9999,ASKED ABOUT THE FERILISER RECOMMENDATION IN PADDY,RECOMMENDED 48-24-16 AS CROP REQUIREMENTS,2009-01-27T09:10:09,2009,1
ANDHRA PRADESH,KURNOOL,0   ,KHARIF,HORTICULTURE,0,Banana,21,ASKED ABOUT THE CONTROL OF WEEDS IN BANANA,RECOMMENDED TO SPRAY BUTACHLOR 2LT/ACRE,2009-01-27T11:29:29,2009,1
ANDHRA PRADESH,GUNTUR,0   ,KHARIF,9999,0,9999,9999,ASKED ABOUT CONTROL FOR WEEDS,RECOMMENDED TO SPRAY ATRAZINE 1KG/ACRE,2009-01-27T11:34:19,2009,1
ANDHRA PRADESH,9999,0   ,KHARIF,9999,0,9999,9999,TEST CALL,ANSWER GIVEN ACCORDING TO CALL,2009-01-27T14:35:42,2009,1
ANDHRA PRADESH,VISAKHAPATNAM,0   ,KHARIF,HORTICULTURE,0,1279,2,ASKED ABOUT THE CONTROL OF BACTERIAL WILT IN BRINJAL,RECOMMENDED TO CYPERMETHRIN@0.5ML/LIT,2009-01-27T15:59:29,2009,1
ANDHRA PRADESH,KURNOOL,0   ,KHARIF,AGRICULTURE,0,1037,3,ASKED ABOUT THE CONTROL OF GRAM CATERPILLAR,RECOMMENDED TO SPRAY QUINOLPHAS 2ML/LTR,2009-01-28T09:00:57,2009,1
ANDHRA PRADESH,9999,0   ,KHARIF,9999,0,9999,9999,WANT TO KNOW ABOUT KOLKATA LOCATION,ANSWER GIVEN IN DETAILS,2009-01-28T11:53:46,2009,1
ANDHRA PRADESH,NELLORE,0   ,KHARIF,9999,0,9999,9999,ASKED ABOUT THE CONTROL OF SHEATH BLIGHT IN PADDY,RECOMMENDED TO SPRAY HEXACONAZOLE@2ML/LIT,2009-01-26T12:25:59,2009,1
ANDHRA PRADESH,9999,0   ,KHARIF,9999,0,9999,9999,CALL DISCONNECTED,CALL DISCONNECTED,2009-01-26T14:49:40,2009,1
ANDHRA PRADESH,ANANTPUR,0   ,KHARIF,HORTICULTURE,0,1280,1,ASKED ABOUT CHILLI,"GIVEN INFORMATION IS OCT,NOV IS PREFARABLE FOR RABI CROP",2009-01-13T11:37:38,2009,1
ANDHRA PRADESH,9999,0   ,KHARIF,9999,0,9999,9999,BLANK CALL,BLANK CALL,2009-01-14T20:41:39,2009,1
ANDHRA PRADESH,GUNTUR,0   ,KHARIF,9999,0,9999,9999,ASKED ABOUT THE PADDY VARITIES SUITABLE TO SANDY SOILS,"RECOMMENDED VARITIES ARE SOMASHILA,PRABHATH,DEEPTHI, VIKAS,INDRA..",2009-01-16T11:22:28,2009,1
ANDHRA PRADESH,KRISHNA,0   ,KHARIF,AGRICULTURE,0,1037,2,ASKED ABOUT THE CONTROL OF POWDERY MILDEW IN BLACK GRAM,RECOMMENDED TO SPRAY KARATHANE 1ML/LT,2009-01-16T12:04:29,2009,1
ANDHRA PRADESH,PRAKASAM,0   ,KHARIF,AGRICULTURE,0,1137,2,ASKED ABOUT THE CONTROL OF RICE BLAST,RECOMMENDED TO SPRAY TRICYCLOZOLE 0.6GM/LTR,2009-01-16T13:17:52,2009,1
ANDHRA PRADESH,EAST GODAVARI,0   ,KHARIF,9999,0,9999,9999,ASKED ABOUT THE FERTILISER RECOMMDNDATION IN PADDY,RECOMMENDED 48-24-16,2009-01-16T14:40:38,2009,1
ANDHRA PRADESH,9999,0   ,KHARIF,9999,0,9999,9999,BLANK CALL,BLANK CALL,2009-01-11T20:49:53,2009,1
ANDHRA PRADESH,9999,0   ,KHARIF,9999,0,9999,9999,CALL DISCONNECTED,CALL DISCONNECTED,2009-01-12T07:09:26,2009,1
ANDHRA PRADESH,9999,0   ,KHARIF,9999,0,9999,9999,CALL DISCONNECTED,CALL DISCONNECTED,2009-01-12T07:10:46,2009,1
ANDHRA PRADESH,9999,0   ,KHARIF,9999,0,9999,9999,BLANK CALL,BLANK CALL,2009-01-12T07:11:36,2009,1
ANDHRA PRADESH,CHITTOOR,0   ,KHARIF,9999,0,9999,9999,ASKED ABOUT CONTROL FOR POWDERY MILDEW,RECOMMENDED TO SPRAY WETTABLE SULPHER 3GR/LITRE,2009-01-12T08:03:45,2009,1
ANDHRA PRADESH,VISAKHAPATNAM,0   ,KHARIF,9999,0,9999,9999,ASKED ABOUT THE CONTROL OF EARLY BLIGHT,RECOMMENDED TO SPRAYN COPPER OXY CHLORIDE 3GM/LTR,2009-01-12T10:55:03,2009,1
ANDHRA PRADESH,CHITTOOR,0   ,KHARIF,9999,0,9999,9999,ASKED ABOUT CONTROL FOR EARLY BLIGHT,RECOMMENDED TO SPRAY CAPTAN 3GM/LT,2009-01-12T11:56:40,2009,1
ANDHRA PRADESH,GUNTUR,0   ,KHARIF,9999,0,9999,9999,ASKED ABOUT FERTILIZER APPLICATION,RECOMMENDEED TO APPLY1KG UREA 2KG P 2.5KG K,2009-01-15T06:53:11,2009,1
ANDHRA PRADESH,Y S R ,0   ,KHARIF,HORTICULTURE,0,Tomato,29,ASKED ABOUT THE CONTROL OF HELICOVERPA IN TOMATO,RECOMMENDED TO SPRAY QUINOLPHOS 2ML/LT,2009-01-15T11:58:43,2009,1
ANDHRA PRADESH,GUNTUR,0   ,KHARIF,9999,0,9999,9999,ASKED ABOUT VARIETIES,RECOMMENDED TO PREFER SUNGOLD OR KBSH-1,2009-01-15T14:07:39,2009,1
ANDHRA PRADESH,KURNOOL,0   ,KHARIF,9999,0,9999,9999,ASKED ABOUT THE VARIETIES,"RECOMMENDED VARIETIES ARE NANDYALA TELLAJONNA-2,3 CSH-5,NTJ-4",2009-01-15T16:26:02,2009,1
ANDHRA PRADESH,9999,0   ,KHARIF,9999,0,9999,9999,PRE MATURE FRUIT DROPING OF COCONUT.,APPLY PLANOFIX @1ML/4.5LIT. OF WATER.,2009-01-15T20:15:32,2009,1
ANDHRA PRADESH,9999,0   ,KHARIF,9999,0,9999,9999,BLANK CALL,BLANK CALL,2009-01-11T07:35:44,2009,1
ANDHRA PRADESH,KRISHNA,0   ,KHARIF,9999,0,9999,9999,ASKED ABOUT WEEDICIDE,RECOMMENDED TO SPRAY ATRAZINE 1.5KG/ACRE,2009-01-12T16:02:04,2009,1
ANDHRA PRADESH,KRISHNA,0   ,KHARIF,9999,0,9999,9999,ASKED ABOUT CONTROL FOR WHITEFLY DAMAGE,RECOMMENDED TO SPRAY TRIZOPHOS 2.5ML/LITRE,2009-01-12T16:28:53,2009,1
ANDHRA PRADESH,WEST GODAVARI,0   ,KHARIF,9999,0,9999,9999,ASKED ABOUT WEEDICDE,RECOMMENDED TO SPRAY BENTHIOCARB 1.5-2L/200LT,2009-01-12T17:31:07,2009,1
ANDHRA PRADESH,NELLORE,0   ,KHARIF,AGRICULTURE,0,1137,21,ASKED ABOUT THE CONTROL OF WEEDS IN RICE,RECOMMENDED TO SPRAY BENTHIOCARB 1.6LT/ACRE,2009-01-12T18:51:34,2009,1
ANDHRA PRADESH,CHITTOOR,0   ,KHARIF,HORTICULTURE,0,Tomato,29,ASKED ABOUT THE CONTROL OF FRUIT BORER IN TOMATOS,RECOMMENDED RICE BRAN AND JAGGERY TREATMENT WITH MONOCROTOPHOS,2009-01-12T20:48:05,2009,1
ANDHRA PRADESH,9999,0   ,KHARIF,AGRICULTURE,0,1137,2,ASKED ABOUT THE CONTROL OF RICE BLAST,RECOMMENDED TO SPRAY TRYCYCLOZOLE@2ML/LIT,2009-01-13T09:48:54,2009,1
ANDHRA PRADESH,GUNTUR,0   ,KHARIF,AGRICULTURE,0,1075,Fertilizer Use and Availability,ASKED ABOUT THE FERTILISER REQUIREMENT IN MAIZE,RECOMMENDED 48-24-20,2009-01-13T10:42:18,2009,1
ANDHRA PRADESH,VIZIANAGARM,0   ,KHARIF,HORTICULTURE,0,1268,29,ASKED ABOUT THE CONTROL OF MANGO HOPPERS,RECOMMENDED TO SPRAY PHASPHOMIDON 0.5ML/LT,2009-01-23T16:51:08,2009,1
ANDHRA PRADESH,WEST GODAVARI,0   ,KHARIF,9999,0,9999,9999,ASKED ABOUT WEATHER,THERE IS NO CHANCE OF RAIN,2009-01-24T09:43:42,2009,1
ANDHRA PRADESH,Y S R ,0   ,KHARIF,AGRICULTURE,0,Sunflower (suryamukhi),29,ASKED ABOUT THE SEED TREATMENY IN SUNFLOWER,RECOMMENDED TO USE 3GM THYRON OR CAPTON/KG OF SEED,2009-01-24T11:16:28,2009,1
ANDHRA PRADESH,VISAKHAPATNAM,0   ,KHARIF,HORTICULTURE,0,1268,29,ASKED ABOUT THE CONTROL OF FRIUIT DROPIN MANGO,"RECOMMENDEDTO SPRAY 1GR 2,4DIN 100LTR OF WATER",2009-01-24T12:08:38,2009,1
ANDHRA PRADESH,NELLORE,0   ,KHARIF,HORTICULTURE,0,1268,29,ASKED ABOUT THE CONTROL OF MANGO HOPPERS IN MANGO,RECOMMENDED TO SPRAY PHOSPHOMIDON 0.5ML/LT,2009-01-24T14:37:56,2009,1
ANDHRA PRADESH,GUNTUR,0   ,KHARIF,HORTICULTURE,0,1280,2,ASKED ABOUT THE CONTROL OF FRUIT ROT IN CHILLIES,RECOMMENDED TO SPRAY HEXACONAZOLE@2ML/LIT,2009-01-20T15:29:07,2009,1
ANDHRA PRADESH,GUNTUR,0   ,KHARIF,9999,0,9999,9999,ASKED ABOUT CONTROL FOR STEMBORER,RECOMMENDED TO SPRAY CARTOP HYDROCHLORIDE 2GR/LITRE,2009-01-20T21:16:55,2009,1
ANDHRA PRADESH,CHITTOOR,0   ,KHARIF,9999,0,9999,9999,ASKED ABOUT SOWING SEASON FOR EUCOLIPTUS PLANTS,RECOMMENDED TO GROW THE PLANTS IN THE MONTH OF APRIL-MAY,2009-01-21T10:22:47,2009,1
ANDHRA PRADESH,SRIKAKULAM,0   ,KHARIF,AGRICULTURE,0,1037,3,ASKED ABOUT THE CONTROL OF SUCKING PEST IN RED GRAM,RECOMMENDED TO SPRAY ROGOR@1.5GR/LIT,2009-01-22T20:01:29,2009,1
ANDHRA PRADESH,9999,0   ,KHARIF,9999,0,9999,9999,CALL DISCONNECTED,CALL DISCONNECTED,2009-01-22T21:57:01,2009,1
ANDHRA PRADESH,VISAKHAPATNAM,0   ,KHARIF,9999,0,9999,9999,ASKED ABOUT THE CONTRL OF WEEDS,RECOMME4NDED TO PSRAY PARAQUAT 40ML/10LTR,2009-01-23T06:24:23,2009,1
ANDHRA PRADESH,GUNTUR,0   ,KHARIF,9999,0,9999,9999,ASKED ABOUT CONTROL FOR STEM BORER DAMAGE,RECOMMENDED TO APPLY CARBOFURAON GRANULES 3KGS/ACRE,2009-01-23T10:26:03,2009,1
ANDHRA PRADESH,KRISHNA,0   ,KHARIF,9999,0,9999,9999,ASKED ABOUT CONTROL FOR Zn DEFICIENCY,RECOMMENDED TO SPRAY ZnSO4 20KGS/ACRE,2009-01-23T10:54:59,2009,1
ANDHRA PRADESH,9999,0   ,KHARIF,9999,0,9999,9999,CALL DISCONNECTED,CALL DISCONNECTED,2009-01-23T12:35:48,2009,1
ANDHRA PRADESH,9999,0   ,KHARIF,9999,0,9999,9999,CALL DISCONNECTED,CALL DISCONNECTED,2009-01-23T13:24:56,2009,1
ANDHRA PRADESH,EAST GODAVARI,0   ,KHARIF,9999,0,9999,9999,ASKED ABOUT THE CONTROL OF SHEATH BLIGHT IN PADDY,RECOMMENDED TO SPRAY HEXACONAZOLE@2ML/LIT,2009-01-23T13:56:20,2009,1
ANDHRA PRADESH,EAST GODAVARI,0   ,KHARIF,9999,0,9999,9999,ASKED ABOUT CONTROL FOR WEEDS,RECOMMENDED TO SPRAY PENDIMETHYLIN 1.5LT/ACRE,2009-01-21T16:49:41,2009,1
ANDHRA PRADESH,ANANTPUR,0   ,KHARIF,9999,0,9999,9999,ASKED ABOUT ZN DEFICIENCY,RECOMMENDED TO SPRAY ZNSULPHATE 2GM/LT,2009-01-21T16:57:11,2009,1
