StateName,DistrictName,BlockName,Season,Sector,Category,Crop,QueryType,QueryText,KccAns,CreatedOn,year,month
ANDHRA PRADESH,9999,0   ,KHARIF,9999,0,9999,9999,BLANK CALL,BLANK CALL,2009-02-16T08:49:45,2009,2
ANDHRA PRADESH,KRISHNA,0   ,KHARIF,9999,0,9999,9999,ASKED ABOUT CONTROL FOR STORED GRAIN PEST DAMAGE IN PADDY,RECOMMENDED TO SPRAY MALATHION 5ML/LITRE,2009-02-16T10:12:22,2009,2
ANDHRA PRADESH,9999,0   ,KHARIF,9999,0,9999,9999,BLANK CALL,BLANK CALL,2009-02-16T10:45:20,2009,2
ANDHRA PRADESH,WEST GODAVARI,0   ,KHARIF,9999,0,9999,9999,ASKED ABOUT CONTROL FOR RUST DAMAGE,RECOMMENDED TO SPRAY M-45 2.5GR/LITRE,2009-02-16T11:01:54,2009,2
ANDHRA PRADESH,9999,0   ,KHARIF,9999,0,9999,9999,BLANK CALL,BLANK CALL,2009-02-16T12:55:26,2009,2
ANDHRA PRADESH,WEST GODAVARI,0   ,KHARIF,AGRICULTURE,0,1137,2,ASKED ABOUT THE CONTROL OF RICE BLAST,RECOMMENDED TO SPRAY TRICYCLOZOLE 0.6 GM/LTR,2009-02-16T17:21:41,2009,2
ANDHRA PRADESH,KRISHNA,0   ,KHARIF,9999,0,9999,9999,ASKED ABOUT CONTROL FOR SHEATH BLIGHT,RECOMMENDED TO SPRAY HEXACONAZOLE 2ML/LITRE,2009-02-20T10:49:06,2009,2
ANDHRA PRADESH,9999,0   ,KHARIF,9999,0,9999,9999,BLANK CALL,BLANK CALL,2009-02-20T11:26:28,2009,2
ANDHRA PRADESH,PRAKASAM,0   ,KHARIF,9999,0,9999,9999,ASKED ABOUT WEATHER REPORT,NO CHANCE OF RAIN UPTO WEDNUSDAY,2009-02-20T13:16:47,2009,2
ANDHRA PRADESH,ANANTPUR,0   ,KHARIF,9999,0,9999,9999,ASKED ABOUT CONTROL FOR Zn DEFICIENCY,RECOMMENDED TO SPRAY ZnSO4 2GR/LITRE,2009-02-20T13:21:21,2009,2
ANDHRA PRADESH,9999,0   ,KHARIF,9999,0,9999,9999,BLANK CALL,BLANK CALL,2009-02-21T09:05:06,2009,2
ANDHRA PRADESH,NELLORE,0   ,KHARIF,AGRICULTURE,0,Tobacco,3,ASKED ABOUT THE CONTROL OF TOBACCO CATERPILLAR,RECOMMENDED FOR THE APPLICATION OF MONOCROTOPHAS 1.6 ML/LTR,2009-02-21T09:19:59,2009,2
ANDHRA PRADESH,9999,0   ,KHARIF,9999,0,9999,9999,BLANK CALL,BLANK CALL,2009-02-21T09:20:06,2009,2
ANDHRA PRADESH,9999,0   ,KHARIF,9999,0,9999,9999,BLANK CALL,BLANK CALL,2009-02-21T09:23:06,2009,2
ANDHRA PRADESH,9999,0   ,KHARIF,9999,0,9999,9999,BLANK CALL,BLANK CALL,2009-02-21T10:24:02,2009,2
ANDHRA PRADESH,9999,0   ,JAYAD,9999,0,9999,9999,BLANK CALL,BLANK CALL,2009-02-21T11:44:39,2009,2
ANDHRA PRADESH,WEST GODAVARI,0   ,KHARIF,9999,0,9999,9999,ASKED ABOUT CONTROL FOR STEM BORER DAMAGE,RECOMMENDED TO APPLY ENDOSULFON GRANULES 3KGS/ACRE,2009-02-21T12:05:37,2009,2
ANDHRA PRADESH,ANANTPUR,0   ,KHARIF,9999,0,9999,9999,ASKED ABOUT CONTROL FOR ROOT ROT,RECOMMENDED TO SPRAY CARBENDAZIM 1GM/LT,2009-02-21T12:45:06,2009,2
ANDHRA PRADESH,KRISHNA,0   ,KHARIF,9999,0,9999,9999,ASKED ABOUT THE CONTROL OF POWDERY MILDEW,RECOMMENDED TO SPRAY DICOPHAL 1LTR/ACRE,2009-02-16T21:11:47,2009,2
ANDHRA PRADESH,KRISHNA,0   ,KHARIF,9999,0,9999,9999,ASKED ABOUT CONTROL FOR STEM BORER DAMAGE,RECOMMENDED TO SPRAY CARTOP HYDROCHLORIDE 2GR/LITRE,2009-02-17T09:42:45,2009,2
ANDHRA PRADESH,NELLORE,0   ,KHARIF,9999,0,9999,9999,ASKED ABOUT THE CONTROL OF BPH,RECOMMENDE TO SPRAY ACEPHATE 1.5 GM/LTR,2009-02-18T11:38:54,2009,2
ANDHRA PRADESH,NELLORE,0   ,KHARIF,9999,0,9999,9999,ASKED ABOUT CONTROL FOR GUNDHI BUG,RECOMMENDED TO SPRAY ENDOSULPHAN 2ML/LT,2009-02-18T14:21:11,2009,2
ANDHRA PRADESH,NELLORE,0   ,KHARIF,9999,0,9999,9999,ASKED ABOUT CONTROL FOR LEAF FOLDER,RECOMMENDED TO SPRAY CHLORIPHIRIPHOS 2ML/LT,2009-02-18T19:00:57,2009,2
ANDHRA PRADESH,KRISHNA,0   ,KHARIF,9999,0,9999,9999,ASKED ABOUT THE CONTROL OF SHEATH BLIGHT IN PADDY,RECOMMENDED TO SPRAY HEXACONAZOLE@2ML/LITER,2009-02-17T17:46:58,2009,2
ANDHRA PRADESH,9999,0   ,KHARIF,9999,0,9999,9999,BLANK CALL,BLANK CALL,2009-02-17T17:52:16,2009,2
ANDHRA PRADESH,9999,0   ,KHARIF,9999,0,9999,9999,CALL DISCONNECTED,CALL DISCONNECTED,2009-02-17T17:56:02,2009,2
ANDHRA PRADESH,9999,0   ,KHARIF,9999,0,9999,9999,BLANK CALL,BLANK CALL,2009-02-17T21:14:35,2009,2
ANDHRA PRADESH,GUNTUR,0   ,KHARIF,9999,0,9999,9999,ASKED ABOUT THE CONTROL OF APHIDS,RECOMMENDED TO SPRAY 2ML/LTR ENDOSULPHAN,2009-02-20T19:15:44,2009,2
ANDHRA PRADESH,WEST GODAVARI,0   ,KHARIF,9999,0,9999,9999,ASKED ABOUT THE CONTROL OF STEM BORER,RECOMMENDED TO SPRAY CARTAP HYDRO CHLORIDE 2GR/LITRE,2009-02-04T09:44:43,2009,2
ANDHRA PRADESH,KRISHNA,0   ,KHARIF,9999,0,9999,9999,ASKED ABOUT THE CONTROL OF STEM BORER,RECOMMENDED TO SPRAY CARTAPHYDROCHLORIDE 2GM/LTR,2009-02-04T13:11:10,2009,2
ANDHRA PRADESH,GUNTUR,0   ,KHARIF,9999,0,9999,9999,ASKED ABOUT THE CONTROL OF BLAST IN PADDY,RECOMMENDED TO SPRAY TRYCYCLOZOLE@0.06GRAMS/LIT,2009-02-04T15:20:02,2009,2
ANDHRA PRADESH,KRISHNA,0   ,KHARIF,9999,0,9999,9999,ASKED ABOUT CONTROL FOR THRIPS,RECOMMENDED TO SPRAY IMIDACHLOPRID 0.3ML/LT,2009-02-04T15:44:36,2009,2
ANDHRA PRADESH,KURNOOL,0   ,KHARIF,9999,0,9999,9999,ASKEDABOUT CONTROL FOR LEAF FOLDER,RECOMMENDED TO SPRAY ACEPHATE 1GM/LT,2009-02-04T15:58:11,2009,2
ANDHRA PRADESH,WEST GODAVARI,0   ,KHARIF,9999,0,9999,9999,ASKED ABOUT CONTROL FOR STEM BORER,"RECOMMENDED TO APPLY CARTAP HYDROCHLORIDE4G ,8KG/ACRE",2009-02-04T16:07:12,2009,2
ANDHRA PRADESH,EAST GODAVARI,0   ,KHARIF,9999,0,9999,9999,ASKED ABOUT THE CONTROL OF SHEATH BLIGHT IN PADDY,RECOMMENDED TO SPRAY HEXACONAZOLE@2ML/LIT,2009-02-04T16:17:19,2009,2
ANDHRA PRADESH,KRISHNA,0   ,KHARIF,9999,0,9999,9999,ASKED ABOUT THE CONTROL OF YELLOW STEM BORER IN PADDY,RECOMMENDED TO SPRAY CARTAP HYDRO CHLORIDE@2GRAMS/LITRE,2009-02-04T20:26:55,2009,2
ANDHRA PRADESH,9999,0   ,KHARIF,9999,0,9999,9999,BLANK CALL,BLANK CALL,2009-02-04T21:13:50,2009,2
ANDHRA PRADESH,KRISHNA,0   ,KHARIF,9999,0,9999,9999,ASKED ABOUT THE PLANTING SEASON IN GULABI,RECOMMENDED JUNE TO JANUARY,2009-02-05T18:52:35,2009,2
ANDHRA PRADESH,NELLORE,0   ,KHARIF,HORTICULTURE,0,1268,29,ASKED ABOUT THE CONTROL OF LEAF WEBBER IN MANGO,RECOMMENDED TO SPRAY QUINOLPHOS 2ML/LT,2009-02-05T21:20:09,2009,2
ANDHRA PRADESH,VIZIANAGARM,0   ,KHARIF,HORTICULTURE,0,1268,29,ASKED ABOUT THE CONTROL OF LEAF WEBBER IN MANGO,RECOMMENDED TO SPRAY QUINOLPHOS 2ML/LT,2009-02-06T09:18:39,2009,2
ANDHRA PRADESH,VISAKHAPATNAM,0   ,KHARIF,9999,0,9999,9999,ASKED ABOUT CONTROL FOR SUCKING PESTS,RECOMMENDED TO SPRAY ROGOR 2ML/LITRE,2009-02-06T12:39:10,2009,2
ANDHRA PRADESH,WEST GODAVARI,0   ,KHARIF,9999,0,9999,9999,ASKED ABOUT CONTROL FOR BORON DEFICIENCY,RECOMMENDED TO SPRAY 1.5GR/LITRE,2009-02-06T13:33:03,2009,2
ANDHRA PRADESH,VISAKHAPATNAM,0   ,KHARIF,HORTICULTURE,0,Curry Leaf,2,ASKEC ABOUT THE CONTROL OF POWDERY MILDEW IN CUCURBITS,RECOMMENDED TO SPRAY METALAXYL MZ@2GRAMS/LITRE,2009-02-06T15:16:40,2009,2
ANDHRA PRADESH,PRAKASAM,0   ,KHARIF,9999,0,9999,9999,ASKED ABOUT CONTROL FOR Zn DEFICIENCY,RECOMMENDED TO SPRAY ZnSO4 2ML/LITRE,2009-02-05T10:15:52,2009,2
ANDHRA PRADESH,NELLORE,0   ,KHARIF,9999,0,9999,9999,ASKED ABOUT CONTROL FOR POWDERY MILDEW,RECOMMENDED TO SPRAY WETTABLE SULPHER 3GR/LITRE,2009-02-05T10:33:41,2009,2
ANDHRA PRADESH,KRISHNA,0   ,KHARIF,9999,0,9999,9999,ASKED ABOUT THE SUBSIDIES IN OILPALM,ESC TO HORTICULTURE,2009-02-05T11:29:16,2009,2
ANDHRA PRADESH,Y S R ,0   ,KHARIF,9999,0,9999,9999,ASKED ABOUT CONTROL FOR TIKKALEAF SPOT,RECOMMENDED TO SPRAY CHLOROTHALONIL 2GM/LT,2009-02-05T11:33:21,2009,2
ANDHRA PRADESH,GUNTUR,0   ,KHARIF,9999,0,9999,9999,ASKED ABOUT CONTROL FOR BLIGHTENING,RECOMMENDED TO SPRAY REDOMYL 2ML/LITRE,2009-02-05T12:51:02,2009,2
ANDHRA PRADESH,KRISHNA,0   ,KHARIF,9999,0,9999,9999,ASKED ABOUT THE CONTROL OF BLAST IN PADDY,RECOMMENDED TO SPRAY TRYCYCLOZOLE@0.6GRAMS/LITRE,2009-02-05T14:32:10,2009,2
ANDHRA PRADESH,KURNOOL,0   ,KHARIF,AGRICULTURE,0,1137,6,ASKED ABOUT MARKET PRICE,GIVEN INFORMATION IS Rs.3002 PER QUIN,2009-02-05T15:38:24,2009,2
ANDHRA PRADESH,KRISHNA,0   ,KHARIF,9999,0,9999,9999,ASKED ABOUT CONTROL FOR MITE DAMAGE ON FRUITS,RECOMMENDED TO SPRAY TRIZOPHOS 5ML/LITRE,2009-02-07T10:39:59,2009,2
ANDHRA PRADESH,KURNOOL,0   ,KHARIF,AGRICULTURE,0,Oil palm,29,ASKED ABOUT VARIETIES FOR SESAMUM,RECOMMENDED TO CHOOSE SWETHATIL OR RAJESHWARI,2009-02-07T11:35:11,2009,2
ANDHRA PRADESH,CHITTOOR,0   ,KHARIF,AGRICULTURE,0,Sunflower (suryamukhi),1,ASKED ABOUT PLANTING TIME FOR SUNFLOWER,RECOMMENDED TO SOW IN FEBRUARY 1ST WEEK,2009-02-07T12:21:51,2009,2
ANDHRA PRADESH,CHITTOOR,0   ,KHARIF,9999,0,9999,9999,ASKED ABOUT CONTROL TIKKALEAF SPOT,RECOMMENDED TO SPRAY CHLOROTHALONIL 400GM/200LT,2009-02-07T13:50:24,2009,2
ANDHRA PRADESH,EAST GODAVARI,0   ,KHARIF,9999,0,9999,9999,ASKED ABOUT POTASSIUM DEFICIENCY,RECOMMENDED TO SPRAY POTASSIUM SULPHATE 2GM/LT,2009-02-07T17:02:27,2009,2
ANDHRA PRADESH,WEST GODAVARI,0   ,KHARIF,9999,0,9999,9999,ASKED ABOUT THE CONTROL OF YELLOW STEM BORER,RECOMMENDED TO SPRAY cartap CARTAP HYDRO CHLORIDE@2GRAMS/LITER,2009-02-07T19:26:15,2009,2
ANDHRA PRADESH,9999,0   ,KHARIF,9999,0,9999,9999,CALL DISCONNECTED,CALL DISCONNECTED,2009-02-08T15:51:20,2009,2
ANDHRA PRADESH,CHITTOOR,0   ,KHARIF,HORTICULTURE,0,1268,29,ASKED ABOUT THE CONTROL OF LEAF WEBBER IN MANGO,RECOMMENDED TO SPRAY QUINOLPHOS 2ML/LT,2009-02-03T09:44:27,2009,2
ANDHRA PRADESH,KRISHNA,0   ,KHARIF,9999,0,9999,9999,ASKED ABOUT CONTROL Mg DEFICIENCY,RECOMMENDED TO SPRAY MgSO4 5GR/LITRE,2009-02-16T14:23:51,2009,2
ANDHRA PRADESH,WEST GODAVARI,0   ,KHARIF,9999,0,9999,9999,ASKED ABOUT THE CONTROL OF BLAST IN PADDY,RECOMMENDED TO SPRAY TRYCYCLOZOLE@0.6GRAMS/LITER,2009-02-10T06:45:30,2009,2
ANDHRA PRADESH,CHITTOOR,0   ,KHARIF,9999,0,9999,9999,ASKED ABOUT THE CONTROL OF BLAST IN PADDY,RECOMMENDED TO SPRAY TRYCYCLOZOLE@0.6GRAMS/LITER,2009-02-10T10:38:15,2009,2
ANDHRA PRADESH,NELLORE,0   ,KHARIF,HORTICULTURE,0,Guava,2,ASKED ABOUT THE CONTROL OF GUAVA ANTHRACNOSE,RECOMMENDED TO SPRAY BLITOX 3 GM/LTR,2009-02-10T11:49:02,2009,2
ANDHRA PRADESH,NELLORE,0   ,KHARIF,HORTICULTURE,0,1268,29,ASKED ABOUT THE CONTROL OF LEAF WEBBER IN MANGO,RECOMMENDED TO SPRAY QUINOLPHOS 2ML/LT,2009-02-10T12:05:42,2009,2
ANDHRA PRADESH,KRISHNA,0   ,KHARIF,9999,0,9999,9999,ASKED ABOUT UREA FERTILIZER APPLICATION,RECOMMENDED TO APPLY 30KGS UREA IN 30-40 DAS,2009-02-12T16:57:47,2009,2
ANDHRA PRADESH,WEST GODAVARI,0   ,KHARIF,9999,0,9999,9999,ASKED ABOUT THE CONTROL OF FRUIT BORER DAMAGE,RECOMMENDED TO SPRAY PROPHINOPHAS 2ML/LTR,2009-02-12T20:15:07,2009,2
ANDHRA PRADESH,GUNTUR,0   ,KHARIF,9999,0,9999,9999,ASKED ABOUT THE CONTROL OF ZN DEFIECIENCY,RECOMMENDED TO SPRAY ZNSO4 2GM/LT,2009-02-12T20:58:37,2009,2
ANDHRA PRADESH,ANANTPUR,0   ,KHARIF,9999,0,9999,9999,ASKED ABOUT THE CONTROL OF STEM BORER DAMAGE,RECOMMENDED TO SPRAY CARBOFURAN GRANULES 8 KG/ACRE,2009-02-13T07:29:57,2009,2
ANDHRA PRADESH,ANANTPUR,0   ,KHARIF,9999,0,9999,9999,ASKED ABOUT THE SOWING SEASON,INFORMED THAT IT IS FROM JULY TO AUGUST,2009-02-13T08:27:47,2009,2
ANDHRA PRADESH,NELLORE,0   ,KHARIF,9999,0,9999,9999,ASKED ABOUT CONTROL FOR SHEATH BLIGHT,RECOMMENDED TO SPRAY PROPICONAZOLE 1ML/LITRE,2009-02-13T11:22:37,2009,2
ANDHRA PRADESH,9999,0   ,KHARIF,9999,0,9999,9999,BLANK CALL,BLANK CALL,2009-02-15T10:13:33,2009,2
ANDHRA PRADESH,ANANTPUR,0   ,KHARIF,AGRICULTURE,0,Oil palm,5,ASKED ABOUT VARIETIES FOR SESAMUM,RECOMMENDED TO CHOOSE SAGARANUTYALU OR MANJEERA,2009-02-11T15:11:20,2009,2
ANDHRA PRADESH,NELLORE,0   ,KHARIF,ANIMAL HUSBANDRY,0,Dog,45,ASKED ABOUT CONTROL FOR ODOGONIUM SPS.,RECOMMENDED TO SPRAY BENZALCONIUM CHLORIDE 500ML-1LITRE/ACRE,2009-02-11T18:07:06,2009,2
ANDHRA PRADESH,9999,0   ,KHARIF,9999,0,9999,9999,CALL DISCONNECTED,CALL DISCONNECTED,2009-02-11T19:20:21,2009,2
ANDHRA PRADESH,KURNOOL,0   ,KHARIF,HORTICULTURE,0,Tomato,5,ASKED ABOUT VARIETIES FOR TOMATO,RECOMMENDED TO CHOOSE MARUTHAM OR ARKA VARIETIES,2009-02-11T19:31:20,2009,2
ANDHRA PRADESH,9999,0   ,KHARIF,9999,0,9999,9999,BLANK CALL,BLANK CALL,2009-02-12T08:17:45,2009,2
ANDHRA PRADESH,KRISHNA,0   ,KHARIF,HORTICULTURE,0,1280,29,ASKED ABOUT CONTROL FOR GOLDEN YELLOW FRUITS IN CHILLI,ESC TO ATIC,2009-02-12T10:44:54,2009,2
ANDHRA PRADESH,ANANTPUR,0   ,KHARIF,9999,0,9999,9999,ASKED ABOUT CONTROL FOR MITES,RECOMMENDED TO SPRAY ACEPHATE 1GM/LT,2009-02-12T11:11:15,2009,2
ANDHRA PRADESH,9999,0   ,KHARIF,9999,0,9999,9999,BLANK CALL,BLANK CALL,2009-02-12T15:30:12,2009,2
ANDHRA PRADESH,Y S R ,0   ,KHARIF,9999,0,9999,9999,ASKED ABOUT THE CONTROL OF SHEATH BLIGHT IN PADDY,RECOMMENDED TO SPRAY HEXACONAZOLE@2ML/LITER,2009-02-12T15:40:55,2009,2
ANDHRA PRADESH,CHITTOOR,0   ,KHARIF,9999,0,9999,9999,ASKED ABOUT WEATHER REPORT,THERE IS NO CHANCE OF RAIN,2009-02-14T12:20:38,2009,2
ANDHRA PRADESH,9999,0   ,KHARIF,9999,0,9999,9999,BLANK CALL,BLANK CALL,2009-02-14T12:47:50,2009,2
ANDHRA PRADESH,GUNTUR,0   ,KHARIF,9999,0,9999,9999,ASKED ABOUT THE CONTROL OF BLAST IN PADDY,RECOMMENDED TO SPRAY TRYCYCLOZOLE@0.6GRAMS/LITER,2009-02-14T20:01:11,2009,2
ANDHRA PRADESH,9999,0   ,KHARIF,9999,0,9999,9999,BLANK CALL,BLANK CALL,2009-02-15T08:11:09,2009,2
ANDHRA PRADESH,VIZIANAGARM,0   ,KHARIF,9999,0,9999,9999,ASKED ABOUT CONTROL FOR THRIPS,RECOMMENDED TO SPRAY IMEDACHLOPRID 2ML/LT,2009-02-15T08:16:51,2009,2
ANDHRA PRADESH,9999,0   ,KHARIF,9999,0,9999,9999,CALL DISCONNECTED,CALL DISCONNECTED,2009-02-09T08:01:50,2009,2
ANDHRA PRADESH,KRISHNA,0   ,KHARIF,9999,0,9999,9999,ASKED ABOUT SEED TREATMENT,RECOMMENDED TO TREAT THE SEED WITH CARBENDAZIM 2.5GR/KG SEED,2009-02-09T10:12:05,2009,2
ANDHRA PRADESH,KRISHNA,0   ,KHARIF,9999,0,9999,9999,ASKED ABOUT CONTROL FOR STEM BORER DAMAGE,RECOMMENDED TO SPRAY CORTOP HYDRO CHLORIDE 2GR/LITRE,2009-02-09T14:28:14,2009,2
ANDHRA PRADESH,NELLORE,0   ,KHARIF,9999,0,9999,9999,ASKED ABOUT CONTROL FOR RATS DAMAGE,RECOMMENDED TO APPLY BROMADIOLINE WITH OIL,2009-02-09T14:52:08,2009,2
ANDHRA PRADESH,NELLORE,0   ,KHARIF,9999,0,9999,9999,ASKED ABOUT THE CONTROL OF SHEATH BLIGHT IN PADDY,RECOMMMENDED TO SPRAY HEXACONAZOLE@2ML/LITER,2009-02-09T15:28:08,2009,2
ANDHRA PRADESH,9999,0   ,KHARIF,9999,0,9999,9999,WANT TO KNOW ABOUT AGRI MACHINARY,ANSWER GIVEN IN DETAILS,2009-02-13T12:00:54,2009,2
ANDHRA PRADESH,NELLORE,0   ,KHARIF,9999,0,9999,9999,ASKED ABOUT CONTROL FOR BPH,RECOMMENDED TO SPRAY ACEPHATE 1.5GR OR ITHOPHENPROX 1.5ML/LITRE,2009-02-13T12:29:38,2009,2
ANDHRA PRADESH,ANANTPUR,0   ,KHARIF,AGRICULTURE,0,1137,2,ASKED ABOUT THE CONTROL OF RICE BLAST,RECOMMENDED TO SPRAY TRICYCLOZOLE 0.6 GM/LTR,2009-02-13T12:29:43,2009,2
ANDHRA PRADESH,WEST GODAVARI,0   ,KHARIF,AGRICULTURE,0,1037,2,ASKED ABOUT THE CONTROL OF POWDERY MILDEW IN BLACK GRAM,RECOMMENDED TO SPRAY KARATHANE 1ML/LT,2009-02-13T16:49:54,2009,2
ANDHRA PRADESH,9999,0   ,KHARIF,9999,0,9999,9999,CALL DISCONNECTED,CALL DISCONNECTED,2009-02-13T21:11:43,2009,2
ANDHRA PRADESH,ANANTPUR,0   ,KHARIF,9999,0,9999,9999,ASKED ABOUT CONTROL FOR YELLOWING OF LEAVES,ESC TO ATIC,2009-02-10T14:50:59,2009,2
ANDHRA PRADESH,ANANTPUR,0   ,KHARIF,9999,0,9999,9999,ASKED ABOUT CONTROL FOR POD BORER,RECOMMENDED TO APPLY CELPHOS 3GM,2009-02-10T18:17:52,2009,2
ANDHRA PRADESH,9999,0   ,KHARIF,9999,0,9999,9999,BLANK CALL,BLANK CALL,2009-02-10T19:54:07,2009,2
ANDHRA PRADESH,9999,0   ,KHARIF,9999,0,9999,9999,BLANK CALL,BLANK CALL,2009-02-10T20:26:08,2009,2
ANDHRA PRADESH,9999,0   ,KHARIF,9999,0,9999,9999,BLANK CALL,BLANK CALL,2009-02-11T07:47:59,2009,2
ANDHRA PRADESH,NELLORE,0   ,KHARIF,9999,0,9999,9999,ASKED ABOUT6 THE CONTROL OF LEAF SPOT,RECOMMENDED TO SPRAY CARBENDAZIM 200 GM/ACRE,2009-02-11T08:54:05,2009,2
ANDHRA PRADESH,ANANTPUR,0   ,KHARIF,9999,0,9999,9999,ASKED ABOUT CONTROL FOR TIKKALEAF SPOT,RECOMMENDED TO SPRAY CCHLOROTHALONIL 2ML/LT,2009-02-11T09:43:20,2009,2
ANDHRA PRADESH,GUNTUR,0   ,KHARIF,9999,0,9999,9999,ASKED ABOUT THE FERTILIZER DOSAGE,"RECOMMENDED DOSAGE IS 46KG N,24 kg p,20 kg k.",2009-02-11T10:36:46,2009,2
ANDHRA PRADESH,GUNTUR,0   ,KHARIF,9999,0,9999,9999,ASKED ABOUT CONTROL FOR WEED,RECOMMENDED TO SPRAY PENDIMETHALIN 1.5LT/ACRE,2009-02-11T12:10:47,2009,2
ANDHRA PRADESH,Y S R ,0   ,KHARIF,9999,0,9999,9999,ASKED ABOUT THE CONTROL OF SHEATH BLIGHT IN PADDY,RECOMMENDED TO SPRAY HEXACONAZOLE@2ML/LITER,2009-02-16T07:09:51,2009,2
ANDHRA PRADESH,KRISHNA,0   ,KHARIF,9999,0,9999,9999,ASKED ABOUT THE CONTROL OF BLAST IN PADDY,RECOMMENDED TO SPRAY TRYCYCLOZOLE@0.6GRAMS/LITER,2009-02-16T08:13:46,2009,2
ANDHRA PRADESH,WEST GODAVARI,0   ,KHARIF,9999,0,9999,9999,ASKED ABOUT THE CONTROL OF SHATH BLIGHT,RECOMMENDED TO SPRAY HEXACONAZOLE@2ML/LITER,2009-02-16T10:50:54,2009,2
ANDHRA PRADESH,9999,0   ,KHARIF,9999,0,9999,9999,BLANK CALL,BLANK CALL,2009-02-01T08:08:43,2009,2
ANDHRA PRADESH,9999,0   ,KHARIF,9999,0,9999,9999,CALL DISCONNECTED,CALL DISCONNECTED,2009-02-02T09:42:34,2009,2
ANDHRA PRADESH,WEST GODAVARI,0   ,KHARIF,9999,0,9999,9999,ASKED ABOUT CONTROL FOR BLIGHTENING,RECOMMENDED TO SPRAY MANCOZEB 2.5GR/LITRE,2009-02-02T10:05:48,2009,2
ANDHRA PRADESH,EAST GODAVARI,0   ,KHARIF,9999,0,9999,9999,ASKED ABOUT CONTROL FOR WEED,RECOMMENDED TO SPRAY BENTHIOCARP 2LT/ACRE,2009-02-02T10:49:48,2009,2
ANDHRA PRADESH,WEST GODAVARI,0   ,KHARIF,9999,0,9999,9999,ASKED ABOUT CONTROL FOR POWDERY MILDEW,RECOMMENDED TO SPRAY SULPHUR 2GM/LT,2009-02-02T11:44:23,2009,2
ANDHRA PRADESH,CHITTOOR,0   ,KHARIF,9999,0,9999,9999,ASKED ABOUT THE CONTROL OF STEM BORER,RECOMMENDED TO SPRAY CARTAPHYDROCHLORIDE 3GM/LTR,2009-02-02T12:32:40,2009,2
ANDHRA PRADESH,VIZIANAGARM,0   ,KHARIF,9999,0,9999,9999,ASKED ABOUT CONTROL FOR FLOWER DROPPING,RECOMMENDED TO SPRAY PLANOPHIX 1ML/5LT,2009-02-02T14:04:31,2009,2
ANDHRA PRADESH,9999,0   ,KHARIF,9999,0,9999,9999,BLANK CALL,BLANK CALL,2009-02-01T08:09:43,2009,2
ANDHRA PRADESH,GUNTUR,0   ,KHARIF,9999,0,9999,9999,ASKED ABOUT THE CONTROL OF SHEATH BLIGHT IN PADDY,RECOMMENDED TO SPRAY HEXACONZOLE@2ML/LIT,2009-02-03T13:28:47,2009,2
ANDHRA PRADESH,9999,0   ,KHARIF,9999,0,9999,9999,BLANK CALL,BLANK CALL,2009-02-03T15:53:39,2009,2
ANDHRA PRADESH,KRISHNA,0   ,KHARIF,9999,0,9999,9999,ASKED ABOUT THE CONTROL OF BLAST IN PADDY,RECOMMENDED TO SPRAY TRYCYCLOZOLE@.06GRAMS/LIT,2009-02-03T18:16:59,2009,2
ANDHRA PRADESH,KRISHNA,0   ,KHARIF,9999,0,9999,9999,ASKED ABOUT CONTROL FOR STEM BORER,"RECOMMENDED TO SPRAY CARTAP HYDROCHLORIDE 4G , 8KG/ACRE",2009-02-03T20:40:30,2009,2
ANDHRA PRADESH,CHITTOOR,0   ,KHARIF,9999,0,9999,9999,ASKED ABOUT THE CONTROL OF SHEATH BLIGHT,RECOMMENDED TO SPRAY PROPICONOZOLE 1ML/LTR,2009-02-03T21:23:19,2009,2
ANDHRA PRADESH,KRISHNA,0   ,KHARIF,9999,0,9999,9999,ASKED ABOUT CONTROL FOR STEM BORER,RECOMMENDED TO SPRAY ENDOSULPHAN 2ML/LT,2009-02-02T14:28:21,2009,2
ANDHRA PRADESH,9999,0   ,KHARIF,HORTICULTURE,0,1280,2,ATTACK OF VIRUS IN CHILLI,APPLY DIMETHOATE @2 ML/LIT OF WATER,2009-02-02T18:24:09,2009,2
ANDHRA PRADESH,GUNTUR,0   ,KHARIF,9999,0,9999,9999,ASKED ABOUT THE CONTROL OF THRIPS IN CHILLY,RECOMMENDED TO SPRAY PHASOLONE 3ML/LT,2009-02-02T18:51:37,2009,2
ANDHRA PRADESH,WEST GODAVARI,0   ,KHARIF,AGRICULTURE,0,1075,3,ASKED ABOUT THE CONTROL OF STEM BORER IN MAIZE,RECOMMWNEDED TO SPRAY MONOCROTOPHOS@2ML/LIT,2009-02-02T19:04:17,2009,2
ANDHRA PRADESH,9999,0   ,KHARIF,9999,0,9999,9999,BLANK CALL,BLANK CALL,2009-02-02T19:16:32,2009,2
ANDHRA PRADESH,KRISHNA,0   ,KHARIF,AGRICULTURE,0,1037,3,ASKED ABOUT THE CONTROL OF TOBACCO CAETR PILLAR IN GREEN GRAM,RECOMMENDED TO SPRAY CHLORIPIRIPHOS 2ML/LT,2009-02-02T20:42:52,2009,2
ANDHRA PRADESH,CHITTOOR,0   ,KHARIF,9999,0,9999,9999,ASKED ABOUT THE CONTROL OF THRIPS IN CHILLY,RECOMMENDED TO SPRAY PHASOLONE 3ML/LT,2009-02-03T06:27:46,2009,2
ANDHRA PRADESH,9999,0   ,KHARIF,9999,0,9999,9999,FRUIT DROPING OF COCONUT.,APPLY PLANOFIX @1ML/4.5LIT. OF WATER.,2009-02-06T18:17:34,2009,2
ANDHRA PRADESH,SRIKAKULAM,0   ,KHARIF,AGRICULTURE,0,1037,3,ASKED ABOUT THE CONTROL OF SUCKING PEST IN BENGAL GRAM,RECOMMENDED TO SPRAY ACEPHATE@1.5GRAMS/LITER,2009-02-06T19:19:09,2009,2
ANDHRA PRADESH,WEST GODAVARI,0   ,KHARIF,9999,0,9999,9999,ASKED ABOUT THE CONTROL OF BLAST IN PADDY,RECOMMENDED TO SPRAY TRYCYCLOZE@0.6GRAMS/LIT,2009-02-06T19:27:06,2009,2
ANDHRA PRADESH,GUNTUR,0   ,KHARIF,AGRICULTURE,0,1075,3,ASKED ABOUT THE CONTROL OF STEM BOERE IN MAIZE,RECOMMENDED ENDOSULPHAN GRANULES @3KGS/ACRE,2009-02-06T19:42:12,2009,2
ANDHRA PRADESH,CHITTOOR,0   ,KHARIF,9999,0,9999,9999,ASKED ABOUT THE CONTROL OF THRIPS,RECOMMENDED TO SPRAY ACEPHATE 2GM/LTR,2009-02-07T07:06:52,2009,2
ANDHRA PRADESH,WEST GODAVARI,0   ,KHARIF,9999,0,9999,9999,ASKED ABOUT THE CONTROL OF BLAST IN PADDY,RECOMMENDED TO SPRAY TRYCYCLOZOLE@0.6GRAMS/LITER,2009-02-19T11:00:43,2009,2
ANDHRA PRADESH,KRISHNA,0   ,KHARIF,9999,0,9999,9999,ASKED ABOUT CONTROL FOR INSECT DAMAGE,RECOMMENDED TO SPRAY CARBARYL 3GR/LITRE,2009-02-19T13:22:55,2009,2
ANDHRA PRADESH,KRISHNA,0   ,KHARIF,AGRICULTURE,0,1137,2,ASKED ABOUT THE CONTROL OF BLAST IN RICE,RECOMMENDED TO SPRAY TRICYCLOZOLE 0.6GM/LT,2009-02-19T17:17:59,2009,2
ANDHRA PRADESH,9999,0   ,KHARIF,9999,0,9999,9999,BLANK CALL,BLANK CALL,2009-02-19T17:26:45,2009,2
ANDHRA PRADESH,NELLORE,0   ,KHARIF,AGRICULTURE,0,1137,2,ASKED ABOUT THE CONTROL OF BLAST IN RICE,RECOMMENDED TO SPRAY TRICYCLOZOLE 0.6GM/LT,2009-02-19T17:49:32,2009,2
ANDHRA PRADESH,GUNTUR,0   ,KHARIF,9999,0,9999,9999,ASKED ABOUT THE CONTROL OF STEM BORER,RECOMMENDED FOR THE APPLICATION OF CARTAP HYDROCHLORIDE 2 GM/LTR,2009-02-19T18:40:49,2009,2
ANDHRA PRADESH,WEST GODAVARI,0   ,KHARIF,HORTICULTURE,0,1268,29,ASKED ABOUT THE CONTROL OF HOPPERS IN MANGO,RECOMMENDED TO SPRAY PHOSPHOMIDON 2ML/LT,2009-02-19T19:41:27,2009,2
ANDHRA PRADESH,9999,0   ,KHARIF,9999,0,9999,9999,BLANK CALL,BLANK CALL,2009-02-20T08:08:57,2009,2
ANDHRA PRADESH,ANANTPUR,0   ,KHARIF,9999,0,9999,9999,ASKED ABOUT THE CONTROL OF CUTRUS CANKER,RECOMMENDED TO APPLY BLITOX 30GM+STREPTOCYLINE 1GM/10 LTR WATER,2009-02-20T08:26:56,2009,2
ANDHRA PRADESH,9999,0   ,KHARIF,9999,0,9999,9999,BLANK CALL,BLANK CALL,2009-02-20T09:04:26,2009,2
ANDHRA PRADESH,9999,0   ,KHARIF,9999,0,9999,9999,BLANK CALL,BLANK CALL,2009-02-20T09:50:34,2009,2
ANDHRA PRADESH,CHITTOOR,0   ,KHARIF,9999,0,9999,9999,ASKED ABOUT THE CONTROL BLAST IN PADDY,RECOMMENDED TO SPRAY TRYCYCLOZOLE@0.6GRAMS/LITER,2009-02-20T10:28:20,2009,2
ANDHRA PRADESH,ANANTPUR,0   ,KHARIF,9999,0,9999,9999,ASKED ABOUT THE CONTROL OF SHEATH BLIGHT IN PADDY,RECOMMENDED TO SPRAY HEXACONZOLE@2ML/LITER,2009-02-20T11:19:11,2009,2
ANDHRA PRADESH,ANANTPUR,0   ,KHARIF,9999,0,9999,9999,ASKED ABOUT CONTROL FOR GUMMOSIS,RECOMMENDED TO APPLY BORDO PASTE,2009-02-20T11:50:06,2009,2
ANDHRA PRADESH,KRISHNA,0   ,KHARIF,9999,0,9999,9999,ASKED ABOUT CONTROL FOR POWDERY MILDEW,RECOMMENDED TO SPRAY WETTABLE SULPHER 3GR/LITRE,2009-02-20T13:26:21,2009,2
ANDHRA PRADESH,KRISHNA,0   ,KHARIF,9999,0,9999,9999,ASKED ABOUT CONTROL FOR ROOTROT,RECOMMENDED TO APPLY CHASANTCOMPOUND 3GM/LT,2009-02-18T20:13:55,2009,2
ANDHRA PRADESH,KRISHNA,0   ,KHARIF,9999,0,9999,9999,ASKED ABOUT CONTROL FOR THRIPS,RECOMMENDED TO SPRAY IMIDACHLOPRID 0.3ML/LT,2009-02-18T20:22:06,2009,2
ANDHRA PRADESH,KRISHNA,0   ,KHARIF,9999,0,9999,9999,ASKED ABOUT CONTROL FOR BLAST,RECOMMENDED TO APPLY TRICYCLOZOLE 0.6GM/LT,2009-02-24T10:41:15,2009,2
ANDHRA PRADESH,WEST GODAVARI,0   ,KHARIF,HORTICULTURE,0,1268,2,ASKED ABOUT THE CONTROL OF POWDERY MILDEW IN MANGO,RECOMMENDED TO SPRAY KARATHANE 1ML/LT,2009-02-24T11:02:54,2009,2
ANDHRA PRADESH,CHITTOOR,0   ,KHARIF,9999,0,9999,9999,ASKED ABOUT CONTROL FOR POWDERAY MILDEW,RECOMMENDED TO SPRAY DINOCAB1ML/LT,2009-02-24T11:43:41,2009,2
ANDHRA PRADESH,9999,0   ,KHARIF,9999,0,9999,9999,BLANK CALL,BLANK CALL,2009-02-24T13:29:47,2009,2
ANDHRA PRADESH,GUNTUR,0   ,KHARIF,AGRICULTURE,0,1137,29,ASKED ABOUT THE ZN DEFICIENCY IN RICE,RECOMMENDED TO SPRAY ZNSO4 2GM/LT,2009-02-24T13:50:38,2009,2
ANDHRA PRADESH,9999,0   ,KHARIF,9999,0,9999,9999,BLANK CALL,BLANK CALL,2009-02-24T14:01:57,2009,2
ANDHRA PRADESH,CHITTOOR,0   ,KHARIF,9999,0,9999,9999,ASKED ABOUT THE CONTROL OF THRIPS IN CHILLY,RECOMMENDED TO SPRAY PHASOLONE 3ML/LT,2009-02-24T15:19:21,2009,2
ANDHRA PRADESH,9999,0   ,KHARIF,9999,0,9999,9999,BLANK CALL,BLANK CALL,2009-02-24T16:27:10,2009,2
ANDHRA PRADESH,CHITTOOR,0   ,KHARIF,9999,0,9999,9999,ASKED ABOUT CONTROL FOR APHID DAMAGE,RECOMMENDED TO SPRAY TRIZOPHOS 2.5ML/LITRE,2009-02-24T18:20:39,2009,2
ANDHRA PRADESH,KRISHNA,0   ,KHARIF,HORTICULTURE,0,1296,5,ASKED ABOUT POTATO VARIETIES,RECOMMENDED TO CHOOSE KUFRI VARIETIES,2009-02-24T18:36:29,2009,2
ANDHRA PRADESH,KRISHNA,0   ,KHARIF,9999,0,9999,9999,ASKED ABOUT CONTROL FOR SUCKING PESTS,RECOMMENDED TO SPRAY ROGOR 2ML/LITER,2009-02-24T19:16:51,2009,2
ANDHRA PRADESH,9999,0   ,KHARIF,9999,0,9999,9999,BLANK CALL,BLANK CALL,2009-02-22T08:30:57,2009,2
ANDHRA PRADESH,CHITTOOR,0   ,KHARIF,AGRICULTURE,0,Sunnhemp (Patua),2,ASKED ABOUT THE CONTROL OF RED ROT OF SUGARCANE,RECOMMENDED TO APPLY CARBENDAZIM 1 GM/LTR,2009-02-22T13:04:05,2009,2
ANDHRA PRADESH,CHITTOOR,0   ,KHARIF,9999,0,9999,9999,ASKED ABOUT CONTROL FOR THRIPS&MITES,RECOMMENDED TO SPRAY PHASALONE 3ML/LT,2009-02-25T11:25:14,2009,2
ANDHRA PRADESH,KURNOOL,0   ,KHARIF,9999,0,9999,9999,ASKED ABOUT VARIETIES FOR SUMMER SEASON,RECOMMENDED TO CHOOSE TEJA OR T9 OR LAM 623,2009-02-25T14:06:51,2009,2
ANDHRA PRADESH,9999,0   ,KHARIF,9999,0,9999,9999,BLANK CALL,BLANK CALL,2009-02-25T18:32:24,2009,2
ANDHRA PRADESH,9999,0   ,KHARIF,9999,0,9999,9999,BLANK CALL,BLANK CALL,2009-02-25T18:40:24,2009,2
ANDHRA PRADESH,CHITTOOR,0   ,KHARIF,9999,0,9999,9999,ASKED ABOUT CONTROL FOR THRIPS DAMAGE,RECOMMENDED TO SPRAY ACEPHATE 1.5GR/LITRE,2009-02-28T10:38:23,2009,2
ANDHRA PRADESH,KRISHNA,0   ,KHARIF,9999,0,9999,9999,ASKED ABOUT CONTROL FOR LEAF FOLDER DAMAGE,RECOMMENDED TO SPRAY CHLORPYRIPOS 2.5ML/LITRE,2009-02-28T11:19:58,2009,2
ANDHRA PRADESH,WEST GODAVARI,0   ,KHARIF,9999,0,9999,9999,ASKED ABOUT VARIETIES,RECOMMENDED TO CHOOSE TEJA OR LAM 623,2009-02-28T16:47:37,2009,2
ANDHRA PRADESH,SRIKAKULAM,0   ,KHARIF,AGRICULTURE,0,Sunflower (suryamukhi),3,ASKED ABOUT THE CONTROL OF GLH IN SUNFLOWER,RECOMMENDED TO SPRAY THIODICARB 1.5ML/LT,2009-02-18T10:19:15,2009,2
ANDHRA PRADESH,KRISHNA,0   ,KHARIF,AGRICULTURE,0,1137,2,ASKED ABOUT THE CONTROL OF BLAST IN RICE,RECOMMENDED TO SPRAY TRICYCLOZOLE 0.6GM/LT,2009-02-18T10:32:09,2009,2
ANDHRA PRADESH,NELLORE,0   ,KHARIF,9999,0,9999,9999,ASKED ABOUT THE CONTROL OF BPH,RECOMMENDED TO SPRAY ACEPHATE 1.5 GM/LTR,2009-02-18T11:17:10,2009,2
ANDHRA PRADESH,9999,0   ,KHARIF,9999,0,9999,9999,BLANK CALL,BLANK CALL,2009-02-18T12:24:28,2009,2
ANDHRA PRADESH,EAST GODAVARI,0   ,KHARIF,9999,0,9999,9999,ASKED ABOUT THE CONTROL OF STEM BORER,RECOMMENDED TO SPRAY CARTAPHYDROCHLORIDE 2GM/LTR,2009-02-23T09:24:39,2009,2
