StateName,DistrictName,BlockName,Season,Sector,Category,Crop,QueryType,QueryText,KccAns,CreatedOn,year,month
ANDHRA PRADESH,CHITTOOR,0   ,KHARIF,9999,0,9999,9999,ASKED ABOUT FERTILIZER DOSAGE,"RECOMMENDED TO APPLY 48N, 24P, 16K",2009-01-17T20:03:10,2009,1
ANDHRA PRADESH,GUNTUR,0   ,KHARIF,HORTICULTURE,0,1279,29,ASKED ABOUT THE CONTROL OF FRUIT AND SHOOT BORER IN BRINJAL,RECOMMENDED TO SPRAY PROPHENOPHOS 2ML/LT,2009-01-17T20:17:13,2009,1
ANDHRA PRADESH,ANANTPUR,0   ,KHARIF,9999,0,9999,9999,ASKED ABOUT WEATHER,THERE IS NO CHANCE OF RAIN,2009-01-17T21:08:15,2009,1
ANDHRA PRADESH,9999,0   ,KHARIF,9999,0,9999,9999,CALL DISCONNECTED,CALL DISCONNECTED,2009-01-29T12:09:27,2009,1
ANDHRA PRADESH,ANANTPUR,0   ,KHARIF,9999,0,9999,9999,ASKED ABOUT THE PREPARATION OF BOURDO MIXTURE,RECOMMENDED TO PREPARE 1%BOURDO MIXTURE,2009-01-29T13:30:02,2009,1
ANDHRA PRADESH,CHITTOOR,0   ,KHARIF,9999,0,9999,9999,ASKED ABOUT CONTROL FOR WEEDS,RECOMMENDED TO SPRAY OXYFLOROFINE 200ML/200 LITRES,2009-01-29T14:10:33,2009,1
ANDHRA PRADESH,9999,0   ,KHARIF,9999,0,9999,9999,FRUIT ROT OF COCONUT,APPLY COPPER OXYCHLORIDE @4 GM/LIT OF WATER,2009-01-29T14:17:49,2009,1
ANDHRA PRADESH,KRISHNA,0   ,KHARIF,9999,0,9999,9999,ASKED ABOUT CONTROL FOR WEEDS,RECOMMENDED TO SPRAY BENTHIOCOPR 1.5LITRES/ACRE,2009-01-22T11:46:30,2009,1
ANDHRA PRADESH,KRISHNA,0   ,KHARIF,9999,0,9999,9999,ASKED ABOUT CONTROL FOR APHIDS,RECOMMENDED TO SPRAY DIMETHOATE 2ML/LT,2009-01-22T13:29:12,2009,1
ANDHRA PRADESH,WEST GODAVARI,0   ,KHARIF,9999,0,9999,9999,ASKED ABOUT VARIETIES FOR PERENNIAL FOR  DRUMSTICK,RECOMMENDED TO CHOOSE JAFNA,2009-01-22T16:38:45,2009,1
ANDHRA PRADESH,GUNTUR,0   ,KHARIF,HORTICULTURE,0,1280,29,ASKED ABOUT THE CONTROL OF FRUIT BORER IN CHILLIES,RECOMMENDED TO SPRAY MONOCROTOPHOS@2ML/LIT,2009-01-22T16:55:47,2009,1
ANDHRA PRADESH,NELLORE,0   ,KHARIF,9999,0,9999,9999,ASKEDN ABOUT CONTROL FOR BLAST,RECOMMENDED TO SPRAY TRICYCLOZOLE 0.6GM/LT,2009-01-22T17:19:03,2009,1
ANDHRA PRADESH,GUNTUR,0   ,KHARIF,9999,0,9999,9999,ASKED ABOUT THE CONTROL OF SHEATH BLIGHT IN PADDY,RECOMMENDED TO SPRAY HEXACONAZOLE @2ML/LIT,2009-01-22T18:58:59,2009,1
ANDHRA PRADESH,NELLORE,0   ,KHARIF,HORTICULTURE,0,Citrus,2,ASKED ABOUT CONTROL OF PHYTOPTHERA DISEASE IN CITRUS,RECOMMENDED TO SPRAY METALAXYL@2GR/LIT,2009-01-22T19:39:08,2009,1
ANDHRA PRADESH,9999,0   ,KHARIF,9999,0,9999,9999,CALL DISCONNECTED,CALL DISCONNECTED,2009-01-22T21:55:57,2009,1
ANDHRA PRADESH,9999,0   ,KHARIF,9999,0,9999,9999,CALL DISCONNECTED,CALL DISCONNECTED,2009-01-22T21:56:42,2009,1
ANDHRA PRADESH,9999,0   ,KHARIF,9999,0,9999,9999,CALL DISCONNECTED,CALL DISCONNECTED,2009-01-22T21:58:57,2009,1
ANDHRA PRADESH,9999,0   ,KHARIF,9999,0,9999,9999,CALL DISCONNECTED,CALL DISCONNECTED,2009-01-27T15:59:25,2009,1
ANDHRA PRADESH,KRISHNA,0   ,KHARIF,9999,0,9999,9999,ASKED ABOUT CONTROL STEM BORER,RECOMMENDED TO APPLY CARBOFURAN 3G 10KG/ACRE,2009-01-27T16:09:10,2009,1
ANDHRA PRADESH,CHITTOOR,0   ,KHARIF,AGRICULTURE,0,1137,2,ASKED ABOUT THE CONTROL OF RICE BLAST,RECOMMENDED TO SPRAY TRYCYCLOZOLE@0.66GR/LIT,2009-01-27T18:10:33,2009,1
ANDHRA PRADESH,Y S R ,0   ,KHARIF,9999,0,9999,9999,ASKED ABOUT THE CONTROL OF ROOT ROT IN GROUND NUT,RECOMMENDED TO SPRAY MANCOZEB@3GR/LIT,2009-01-27T20:02:39,2009,1
ANDHRA PRADESH,PRAKASAM,0   ,KHARIF,9999,0,9999,9999,ASKED ABOUT CONTROL FOR TIKKA LEAF SPOT,RECOMMENDED TO SPRAY CHLOROTHALONIL 400GM/200LT,2009-01-24T11:00:59,2009,1
ANDHRA PRADESH,NELLORE,0   ,KHARIF,9999,0,9999,9999,ASKED ABOUT THE CONTREOL OF REDDENING OF THE LEAVES,RECOMMENDED TO SPRAY ZNSO4 2GM/LT,2009-01-24T11:31:28,2009,1
ANDHRA PRADESH,EAST GODAVARI,0   ,KHARIF,9999,0,9999,9999,ASKED ABOUT THE CONTROPL OF FLOWER DROP,RECOMMENDED TO PROVIDE NUTRIENTS AND TO SPRAY PLANOPHIX 1ML/5LTR,2009-01-24T17:49:54,2009,1
ANDHRA PRADESH,CHITTOOR,0   ,KHARIF,9999,0,9999,9999,ASKED ABOUT THE CONTROL OF THRIPS,RECOMMENDED TO SPRAY ACEPHATE 1.5GM/LTR,2009-01-24T18:59:20,2009,1
ANDHRA PRADESH,9999,0   ,KHARIF,9999,0,9999,9999,CALL DISCONNECTED,CALL DISCONNECTED,2009-01-26T14:22:24,2009,1
ANDHRA PRADESH,KRISHNA,0   ,KHARIF,AGRICULTURE,0,1137,Fertilizer Use and Availability,ASKED ABOUT THE MG RECOMMENDATION IN RICE,RECOMMENDED TO SPRAY MGSO4 10GM/LT,2009-01-26T20:12:52,2009,1
ANDHRA PRADESH,GUNTUR,0   ,KHARIF,9999,0,9999,9999,ASKED ABOUT CONTROL FOR GUMMOSIS,RECOMMENDED TO PASTE THE STEM WITH BORDO MIXTURE,2009-01-27T10:32:47,2009,1
ANDHRA PRADESH,9999,0   ,KHARIF,9999,0,9999,9999,CALL DISCONNECTED,CALL DISCONNECTED,2009-01-27T11:30:31,2009,1
ANDHRA PRADESH,KRISHNA,0   ,KHARIF,9999,0,9999,9999,ASKED ABOUT THE CONTROL OF WEEDS,RECOMMENDED TO SPRAY BENTHIOCARP 1.5 LTR/ACRE,2009-01-27T14:00:40,2009,1
ANDHRA PRADESH,GUNTUR,0   ,KHARIF,HORTICULTURE,0,1280,29,ASKED ABOUT THE CONTROL OF SUKING PESTS IN CHILLIES,RECOMMENDED TO SPRAY IMIDACLOPRID@2ML/LIT,2009-01-23T14:21:36,2009,1
ANDHRA PRADESH,NELLORE,0   ,KHARIF,AGRICULTURE,0,1137,2,ASKED ABOUT THE CONTROL OF RICE BLAST,RECOMMENDED TO SPRAY TRYCYCLOZOLE@0.66GR/LIT,2009-01-23T17:25:38,2009,1
ANDHRA PRADESH,KURNOOL,0   ,KHARIF,HORTICULTURE,0,Tomato,5,ASKED ABOUT THE VARIETIES IN TOMATO,RECOMMENDED PUSA EARLY DARF VARIETIES,2009-01-23T18:34:09,2009,1
ANDHRA PRADESH,EAST GODAVARI,0   ,KHARIF,AGRICULTURE,0,1137,2,ASKED ABOUT THE CONTROL OF BLAST IN RICE,RECOMMENDED TO SPRAY TRICYCLOZOLE 0.06GM/LT,2009-01-23T19:06:08,2009,1
ANDHRA PRADESH,KRISHNA,0   ,KHARIF,9999,0,9999,9999,ASKED ABOUT THE FERTILIZER APPLICATION,RECOMMENDED TO APPLY CARBOFURAN GRANULES 160 GM/CENT,2009-01-22T09:08:29,2009,1
ANDHRA PRADESH,WEST GODAVARI,0   ,KHARIF,FISHERIES,0,1976,51,ASKED ABOUT FOOD REQUIREMENT FOR FISHES,RECOMMENEDED TO GIVE HUSK WITHOUT OIL AND GROUNDNUT CAKE,2009-01-22T09:45:19,2009,1
ANDHRA PRADESH,KRISHNA,0   ,KHARIF,AGRICULTURE,0,1037,2,ASKED ABOUT THE CONTROL OF ANTHRACNOSE IN BLACKGRAM,RECOMMENDED TO SPRAY COC 3GM/LT,2009-01-24T20:11:43,2009,1
ANDHRA PRADESH,9999,0   ,KHARIF,9999,0,9999,9999,CALL DISCONNECTED,CALL DISCONNECTED,2009-01-26T07:31:56,2009,1
ANDHRA PRADESH,ANANTPUR,0   ,KHARIF,9999,0,9999,9999,ASKED ABOUT THE CONTROL OF THRIPS IN CHILLY,RECOMMENDED TO SPRAY PHASOLONE 3ML/LT,2009-01-26T08:17:29,2009,1
ANDHRA PRADESH,EAST GODAVARI,0   ,KHARIF,9999,0,9999,9999,ASKED ABOUYT THE DOSAGE OF UREA FOR THIRD APPLICATION,RECOMMENDED TO APPLY 20KG UREA/ACRE,2009-01-26T09:45:26,2009,1
ANDHRA PRADESH,WEST GODAVARI,0   ,KHARIF,9999,0,9999,9999,ASKED ABOUT CONTROL FOR BLIGHTENING,RECOMMENDED TO SPRAY MANCOZEB 2.5GR/LITRE,2009-01-28T08:34:29,2009,1
ANDHRA PRADESH,GUNTUR,0   ,KHARIF,9999,0,9999,9999,ASKED FOR REMEDY FOR OVER IRRIGATION,ESC TO ATIC,2009-01-28T09:17:33,2009,1
ANDHRA PRADESH,9999,0   ,KHARIF,9999,0,9999,9999,CALL DISCONNECTED,CALL DISCONNECTED,2009-01-28T09:38:59,2009,1
ANDHRA PRADESH,SRIKAKULAM,0   ,KHARIF,9999,0,9999,9999,ASKED ABOUT CONTROL FOR BROWN SPOT,RECOMMENDED TO SPRAY MANCOZEB MIXED WITH 3%UREA,2009-01-28T11:09:15,2009,1
ANDHRA PRADESH,EAST GODAVARI,0   ,KHARIF,HORTICULTURE,0,1268,29,ASKED ABOUT THE CONTROL OF LEAF WEBBER IN MANGO,RECOMMENDED TO SPRAY QUINOLPHOS 2ML/LT,2009-01-28T12:06:36,2009,1
ANDHRA PRADESH,KRISHNA,0   ,KHARIF,HORTICULTURE,0,1268,2,ASKED ABOUT THE CONTROL OF POWDERY MILDEW IN MANGO,RECOMMENDED TO SPRAY KARATHANE 1ML/LT,2009-01-28T12:34:22,2009,1
ANDHRA PRADESH,9999,0   ,KHARIF,9999,0,9999,9999,BLANK CALL,BLANK CALL,2009-01-28T13:32:57,2009,1
ANDHRA PRADESH,9999,0   ,KHARIF,9999,0,9999,9999,BLANK CALL,BLANK CALL,2009-01-28T14:43:49,2009,1
ANDHRA PRADESH,9999,0   ,KHARIF,9999,0,9999,9999,BLANK CALL,BLANK CALL,2009-01-28T15:54:54,2009,1
ANDHRA PRADESH,9999,0   ,KHARIF,9999,0,9999,9999,CALL DISCONNECTED,CALL DISCONNECTED,2009-01-28T19:43:03,2009,1
ANDHRA PRADESH,9999,0   ,KHARIF,9999,0,9999,9999,pre mature fruit droping of coconut.,apply planofix @1ml/4.5lit. of water.,2009-01-28T21:05:22,2009,1
ANDHRA PRADESH,CHITTOOR,0   ,KHARIF,HORTICULTURE,0,1296,2,ASKED ABOUT CONTROL FOR LATE BLIGHT,RECOMMENDED TO SPRAY CANTAF 2ML/LT,2009-01-28T21:31:03,2009,1
ANDHRA PRADESH,Y S R ,0   ,KHARIF,9999,0,9999,9999,ASKED ABOUT THE CONTROL OF THRIPS DAMAGE,RECOMMENDED TO SPRAY ACEPHATE 2 GM/LTR,2009-01-29T07:00:57,2009,1
ANDHRA PRADESH,9999,0   ,KHARIF,9999,0,9999,9999,BLANK CALL,BLANK CALL,2009-01-21T07:31:21,2009,1
ANDHRA PRADESH,9999,0   ,KHARIF,9999,0,9999,9999,CALL DISCONNECTED,CALL DISCONNECTED,2009-01-30T19:27:02,2009,1
ANDHRA PRADESH,9999,0   ,KHARIF,9999,0,9999,9999,CALL DISCONNECTED,CALL DISCONNECTED,2009-01-31T06:47:11,2009,1
ANDHRA PRADESH,CHITTOOR,0   ,KHARIF,9999,0,9999,9999,ASKED WHETHER HE CAN SPRAY APESTICIDE AND A FUNGICIDE,RECOMMENDED HIM TO TAKEUP SEPERATE SPRAYING,2009-01-31T10:44:21,2009,1
ANDHRA PRADESH,NELLORE,0   ,KHARIF,HORTICULTURE,0,Lemon,29,ASKED ABOUT THE CONTROLOF LEAF FOLDER IN LIMES AND LEMONS,RECOMMENDED TO SPRAY IMIDACHLOPRID 0.5ML/LT,2009-01-31T11:15:00,2009,1
ANDHRA PRADESH,9999,0   ,KHARIF,9999,0,9999,9999,BLANK CALL,BLANK CALL,2009-01-31T12:24:10,2009,1
ANDHRA PRADESH,9999,0   ,KHARIF,9999,0,9999,9999,BLANK CALL,BLANK CALL,2009-01-31T13:26:31,2009,1
ANDHRA PRADESH,ANANTPUR,0   ,KHARIF,AGRICULTURE,0,1037,5,ASKED ABOUT THE VARIETIES IN RED GRAM,RECOMMENDED PRG158,2009-01-31T16:18:02,2009,1
ANDHRA PRADESH,9999,0   ,KHARIF,9999,0,9999,9999,CALL DISCONNECTED,CALL DISCONNECTED,2009-01-31T19:04:57,2009,1
ANDHRA PRADESH,NELLORE,0   ,KHARIF,9999,0,9999,9999,ASKED ABOUT THE FERTILIZER DOSAGE FOR THE 55 DAYS CROP,RECOMMENDED TO APPLY ONLY UREA 15-20 KG/ACRE,2009-01-29T08:43:59,2009,1
ANDHRA PRADESH,9999,0   ,KHARIF,9999,0,9999,9999,BLANK CALL,BLANK CALL,2009-01-29T09:37:21,2009,1
ANDHRA PRADESH,WEST GODAVARI,0   ,KHARIF,AGRICULTURE,0,1075,3,ASKED ABOUT THE CONTROL OF STEM BORER IN MAIZE,RECOMMENDED TO SPRAY MONOCROTOPHOS@2ML/LIT,2009-01-29T11:16:03,2009,1
ANDHRA PRADESH,CHITTOOR,0   ,KHARIF,9999,0,9999,9999,ASKED ABOUT THE FERTILIZER DOSAGE,"RECOMMENDED FOR8KG/N, 20KG/P, 16KG/K",2009-01-29T13:12:12,2009,1
ANDHRA PRADESH,CHITTOOR,0   ,KHARIF,AGRICULTURE,0,Tobacco,3,ASKED ABOUT THE CONTROL OF TOBACCO CATERPILLAR,RECOMMENDED TO SPRAY QUINOLPHAS 2ML/LTR,2009-01-29T15:34:57,2009,1
ANDHRA PRADESH,WEST GODAVARI,0   ,KHARIF,9999,0,9999,9999,ASKED ABOUT CONTROL FOR Zn DEFICIENCY,RECOMMENDED TO SPRAY ZINC SULPHATE 2GM/LT,2009-01-29T17:12:12,2009,1
ANDHRA PRADESH,KRISHNA,0   ,KHARIF,9999,0,9999,9999,ASKED ABOUT CONTROL FOR ROOT ROT &WILT,RECOMMENDED TO APPLY CHESHUNT COMPOUND 3GM/LT,2009-01-21T11:22:04,2009,1
ANDHRA PRADESH,EAST GODAVARI,0   ,KHARIF,9999,0,9999,9999,ASKED ABOUT THE CONTROL OF BROAD LEAF WEEDS IN PADDY,"RECOMMENDED TO SPRAY 2,4D,ETHYL ESTER4%GRNULES @4KGS/ACRE",2009-01-21T17:29:16,2009,1
ANDHRA PRADESH,WEST GODAVARI,0   ,KHARIF,9999,0,9999,9999,ASKED ABOUT CONTROL FOR WEEDS,RECOMMENDED TO SPRAY PENDIMETHALINE 1.3-1.6 LITRES/ACRE,2009-01-30T09:45:52,2009,1
ANDHRA PRADESH,KRISHNA,0   ,KHARIF,9999,0,9999,9999,ASKED WHETHER HE CQAN SPRAY ENDOSULPHAN AND ZINCSULPHATE AT A TIME,ESC TO ATIC,2009-01-17T12:04:54,2009,1
ANDHRA PRADESH,EAST GODAVARI,0   ,KHARIF,HORTICULTURE,0,1324,29,ASKED ABOUT THE SEED VARIETIES OF PAPAYA,RECOMMENDED RED LADY VARIETY PAPAYA,2009-01-17T12:44:08,2009,1
ANDHRA PRADESH,CHITTOOR,0   ,KHARIF,9999,0,9999,9999,ASKED ABOUT WEATHER REPORT,NO CHANCE OF RAIN ON SATURDAY,2009-01-17T13:58:49,2009,1
ANDHRA PRADESH,SRIKAKULAM,0   ,KHARIF,AGRICULTURE,0,1137,3,ASKED ABOUT THE CONTROL OF STEM BORER IN RICE,RECOMMENDED TO SPRAY CARBOFURON 3G GRANULES 10KG/ACRE,2009-01-17T15:13:17,2009,1
ANDHRA PRADESH,NELLORE,0   ,KHARIF,HORTICULTURE,0,1268,2,ASKED ABOUT THE CONTROL OF POWDERY MILDEW IN MANGO,RECOMMENDED TO SPRAY WETTABLE SULPHUR 3GM/LT,2009-01-17T19:04:08,2009,1
ANDHRA PRADESH,KRISHNA,0   ,KHARIF,9999,0,9999,9999,ASKED ABOUT THE CONTROL OF ZINC DEFECIENCY,RECOMMENDED TO SPRAY ZINCSULPHATE 2ML/LTR,2009-01-19T10:11:35,2009,1
ANDHRA PRADESH,NELLORE,0   ,KHARIF,AGRICULTURE,0,1137,2,ASKED ABOUT THE CONTROL OF RICE BLAST,RECOMMENDED TO SPRAY TRICYCLOZOLE 0.6GM/LTR,2009-01-19T12:11:47,2009,1
ANDHRA PRADESH,Y S R ,0   ,KHARIF,9999,0,9999,9999,ASKED ABOUT CONTROL FOR WEEDS,RECOMMENDED TO SPRAY PENDIMETHALINE 1.3-1.6LITRES/ ACRE,2009-01-19T12:12:08,2009,1
ANDHRA PRADESH,KRISHNA,0   ,KHARIF,9999,0,9999,9999,ASKED ABOUT THE SOWING SEASON OF WATER MELON,RECOMMENDED SOWING IS DECEMBER 2ND WEEK TO JANAURY 1ST WEEK,2009-01-19T14:22:07,2009,1
ANDHRA PRADESH,Y S R ,0   ,KHARIF,9999,0,9999,9999,ASKED ABOUT THE CONTROL OF TIKKA LEAF SPOT IN GROUND NUT,RECOMMENDED TO SPRAY CHLOROTHALANIL 400GM/ACRE,2009-01-19T14:47:05,2009,1
ANDHRA PRADESH,KRISHNA,0   ,KHARIF,9999,0,9999,9999,ASKED ABOUT THE FERTILISER RECOMMENDATION,RECOMMENDED 48-24-20,2009-01-19T17:15:32,2009,1
ANDHRA PRADESH,9999,0   ,KHARIF,HORTICULTURE,0,1275,29,PRE MATURE FRUIT DROPING OF BOTTLE GOURD,SPRAY SULFEX @3GM/LIT. OF WATER.,2009-01-16T12:49:07,2009,1
ANDHRA PRADESH,9999,0   ,KHARIF,9999,0,9999,9999,BLANK CALL,BLANK CALL,2009-01-16T14:54:46,2009,1
ANDHRA PRADESH,GUNTUR,0   ,KHARIF,AGRICULTURE,0,1075,29,ASKED ABOUT THE VARIETIES IN MAIZE,RECOMMENDED TO SOW THRISHULATHA OR DHM VARIETIES,2009-01-16T18:23:02,2009,1
ANDHRA PRADESH,CHITTOOR,0   ,KHARIF,9999,0,9999,9999,ASKED ABOUT FERTILIZER,"RECOMMENDED TO APPLY 12KG N, 24KG P, 16KG K",2009-01-16T20:31:00,2009,1
ANDHRA PRADESH,GUNTUR,0   ,KHARIF,9999,0,9999,9999,ASKED ABOUT CONTROL FOR WEEDS,RECOMMENDED TO SPRAY ATRAZINE 1.5KG/ACRE,2009-01-17T11:03:04,2009,1
ANDHRA PRADESH,KURNOOL,0   ,KHARIF,9999,0,9999,9999,ASKED ABOUT THE WEEDICIDES,RECOMMENDED TO SPRAY PENDIMITHALIN 1.5 LTR/ACRE,2009-01-20T09:09:18,2009,1
ANDHRA PRADESH,GUNTUR,0   ,KHARIF,AGRICULTURE,0,1075,3,ASKED ABOUT THE CONTROL OF STEM BORER IN MAIZE,RECOMMENDED TO SPRAY MONOCROTOPHOS@2ML/LIT,2009-01-19T18:34:22,2009,1
ANDHRA PRADESH,NELLORE,0   ,KHARIF,HORTICULTURE,0,Tomato,2,ASKED ABOUT THE CONTROL OF FRUIT ROT IN TOMATOS,RECOMMENDED TO SPRAY HEXACONAZOLE@2ML/LIT,2009-01-19T19:15:50,2009,1
ANDHRA PRADESH,CHITTOOR,0   ,KHARIF,HORTICULTURE,0,1268,2,ASKED ABOUT THE CONTROL OF ANTHRACNOSE IN MANGO,RECOMMENDED TO SPRAY CARBANDAZIM 2.5GM/LT,2009-01-14T18:39:31,2009,1
ANDHRA PRADESH,PRAKASAM,0   ,KHARIF,9999,0,9999,9999,ASKED ABOUT CONTROL FOR FLOWER DROP,RECOMMENDED TO SPRAY PLANOPHIX 1ML/4.5LITRES,2009-01-15T10:25:03,2009,1
ANDHRA PRADESH,KURNOOL,0   ,KHARIF,9999,0,9999,9999,ASKED ABOUT CONTROLFOR BLAST,RECOMMENDED TO SPRAY TRYCYCLOZOLE 0.6GM/LT,2009-01-15T10:39:20,2009,1
ANDHRA PRADESH,KURNOOL,0   ,KHARIF,9999,0,9999,9999,ASKED ABOUT CONTROL FOR APHID DAMAGE,RECOMMENDED TO SPRAY ACEPHATE 0.75GR/LITRE,2009-01-15T12:34:46,2009,1
ANDHRA PRADESH,GUNTUR,0   ,KHARIF,9999,0,9999,9999,ASKED ABOUT CONTROL FOR TIKKA LEAFSPOT,RECOMMENDED TOSPRAY CHLOROTHALONIL 2GM/LT,2009-01-13T20:58:39,2009,1
ANDHRA PRADESH,9999,0   ,KHARIF,9999,0,9999,9999,CALL DISCONNECTED,CALL DISCONNECTED,2009-01-13T21:48:42,2009,1
ANDHRA PRADESH,WEST GODAVARI,0   ,KHARIF,9999,0,9999,9999,ASKED ABOUT CONTROL FOR STEM BORER,RECOMMENDED TO APPLY CARTAPHYDROCHLORIDE 8KG/ACRE,2009-01-14T10:39:09,2009,1
ANDHRA PRADESH,ANANTPUR,0   ,KHARIF,9999,0,9999,9999,ASKED ABOUT CONTROL FOR WEEDS CONTROL,RECOMMENDED TO SPRAY PENDIMETHALINE 1.3-1.6LITRES/ACRE,2009-01-20T15:48:17,2009,1
ANDHRA PRADESH,9999,0   ,KHARIF,9999,0,9999,9999,BLANK CALL,BLANK CALL,2009-01-20T17:46:24,2009,1
ANDHRA PRADESH,CHITTOOR,0   ,KHARIF,AGRICULTURE,0,1137,3,ASKED ABOUT THE CONTROL OF HISPA IN RICE,RECOMMENDED TO SPRAY CHLORIPIRIPHOS 2ML/LT,2009-01-15T18:13:39,2009,1
ANDHRA PRADESH,CHITTOOR,0   ,KHARIF,9999,0,9999,9999,ASKED ABOUT THE CONTROL OF EARLY BLIGHT,RECOMMENDED TO SPRAY CAPTAN 3GM/LTR,2009-01-15T19:07:44,2009,1
ANDHRA PRADESH,Y S R ,0   ,KHARIF,9999,0,9999,9999,ASKED ABOUT THE CONTROL OF LEAF FOLDER,RECOMMENDED TO SPRAY DIMITHOATE 2ML/LTR,2009-01-16T07:35:55,2009,1
ANDHRA PRADESH,9999,0   ,KHARIF,9999,0,9999,9999,CALL DISCONNECTED,CALL DISCONNECTED,2009-01-16T07:59:18,2009,1
ANDHRA PRADESH,EAST GODAVARI,0   ,KHARIF,9999,0,9999,9999,ASKED ABOUT THE CONTROL OF ZINC DEFECIENCY,RECOMMENDED TO APPLY ZINCSULPHATE 20KG/ACRE,2009-01-16T09:49:10,2009,1
ANDHRA PRADESH,KRISHNA,0   ,KHARIF,9999,0,9999,9999,ASKED ABOUT CONTROL FOR WEEDS,RECOMMENDED TO SPRAY PLUCHLORALINE 1 LITRE/ACRE,2009-01-16T10:08:23,2009,1
ANDHRA PRADESH,GUNTUR,0   ,KHARIF,AGRICULTURE,0,1075,3,ASKED ABOUT THE CONTROL OF PINK BORER IN MAIZE,RECOMMENDED TO SPRAY ENDOSULFON GRANULES 3KG/ACRE,2009-01-16T11:15:14,2009,1
ANDHRA PRADESH,9999,0   ,KHARIF,9999,0,9999,9999,BLANK CALL,BLANK CALL,2009-01-13T07:44:10,2009,1
ANDHRA PRADESH,NELLORE,0   ,KHARIF,AGRICULTURE,0,1137,2,ASKED ABOUT THE CONTROL OF RICE BLAST,RECOMMENDED TO SPRAY TRICYCLOZOLE 0.6GM/LTR,2009-01-12T11:31:35,2009,1
ANDHRA PRADESH,GUNTUR,0   ,KHARIF,9999,0,9999,9999,ASKED ABOUT CONTROL FOR APHIDS DAMAGE,RECOMMENDED TO SPRAY METHYL DEMOTONE OR ROGOR 2ML/LITRE,2009-01-12T11:59:50,2009,1
ANDHRA PRADESH,GUNTUR,0   ,KHARIF,AGRICULTURE,0,1075,3,ASKED ABOUT THE CONTROL OF PINK BORER IN MAIZE,RECOMMENDED TO SPRAY ENDOSULFON GRANULES 10KG/ACRE,2009-01-12T15:03:31,2009,1
ANDHRA PRADESH,9999,0   ,KHARIF,9999,0,9999,9999,CONTROL OF FRUIT ROT AND FRUIT DROPPING IN COCONUT.,SPRAY SOHAGA OR SOLOBOR @ 2 GM/LIT. OF WATER.,2009-01-11T07:30:15,2009,1
ANDHRA PRADESH,9999,0   ,KHARIF,9999,0,9999,9999,BLANK CALL,BLANK CALL,2009-01-11T07:34:52,2009,1
ANDHRA PRADESH,CHITTOOR,0   ,KHARIF,9999,0,9999,9999,ASKED ABOUT THE CONTROL OF TIKKA LEAF SPOT,RECOMMENDED TO SPRAY CARBENDAZIM 200 GM/ACRE,2009-01-22T07:40:59,2009,1
ANDHRA PRADESH,PRAKASAM,0   ,KHARIF,9999,0,9999,9999,ASKED ABOUT CONTROL FOR WILT,RECOMMENDED TO SPRAY BLITOX 3GM/LT,2009-01-16T18:32:24,2009,1
ANDHRA PRADESH,KRISHNA,0   ,KHARIF,9999,0,9999,9999,ASKED ABOUT CONTROL FOR BLACKEING OF BRANCHES,RECOMMENDED TO SPRAY BLITOX 3GR/LITRE,2009-01-17T06:14:57,2009,1
ANDHRA PRADESH,KRISHNA,0   ,KHARIF,9999,0,9999,9999,ASKED ABOUT THE CONTROL OF WHITE FLIES,RECOMMENDED TO SPRAY MONOCROTOPHAS 1.6ML/LTR,2009-01-17T08:59:12,2009,1
ANDHRA PRADESH,KURNOOL,0   ,KHARIF,9999,0,9999,9999,ASKED ABOUT CONTROL FOR THRIPS DAMAGE,RECOMMENDED TO SPRAY ACEPHATE 1.5GR/LITRE,2009-01-17T09:48:19,2009,1
ANDHRA PRADESH,CHITTOOR,0   ,KHARIF,9999,0,9999,9999,ASKED ABOUT THE CONTROL OF YELLOW STEM BORER IN PADDY,RECOMMENDED TO SPRAY ENDOSULPHAN@2ML/LIT,2009-01-17T10:33:46,2009,1
ANDHRA PRADESH,SRIKAKULAM,0   ,KHARIF,9999,0,9999,9999,ASKED ABOUT CONTROL FOR MOSAIC,REMOVE &ROGGING THE PLANTS,2009-01-17T16:55:42,2009,1
ANDHRA PRADESH,KRISHNA,0   ,KHARIF,9999,0,9999,9999,ASKED ABOUT CONTROL FOR ZINC DEFICIENCY,RECOMMENDED TO SPRAY ZINC SULPHATE 2GM/LT,2009-01-18T10:10:45,2009,1
ANDHRA PRADESH,9999,0   ,KHARIF,9999,0,9999,9999,BLANK CALL,BLANK CALL,2009-01-18T10:28:26,2009,1
ANDHRA PRADESH,Y S R ,0   ,KHARIF,9999,0,9999,9999,ASKED ABOUT CONTROL FOR MANGU,RECOMMENDED TO SPRAY DIMETHOATE 1.6ML/LT,2009-01-18T14:09:18,2009,1
ANDHRA PRADESH,KURNOOL,0   ,KHARIF,9999,0,9999,9999,ASKED ABOUT FERTILIZER APPLICATION,RECOMMENDED TO APPLY THE FERTILIZER ON 2ND OR 3RD WEEK OF FEBRUARY,2009-01-22T12:34:43,2009,1
ANDHRA PRADESH,CHITTOOR,0   ,KHARIF,9999,0,9999,9999,ASKED ABOUT THE CONTROL OF FLOWER DROP,RECOMMENDED TO SPRAY PLANOPHIX 1ML/5LTR,2009-01-22T12:48:01,2009,1
ANDHRA PRADESH,WEST GODAVARI,0   ,KHARIF,9999,0,9999,9999,ASKED ABOUT CONTROL FOR LEAF FOLDER,RECOMMENDED TO SPRAY ACEPHATE 1.5GM/LT,2009-01-22T13:44:36,2009,1
ANDHRA PRADESH,CHITTOOR,0   ,KHARIF,HORTICULTURE,0,Guava,29,ASKED ABOUT THE CONTROL OF FRUIT DROP IN GUAVA,RECOMMENDED TO SPRAY NAA@5O PPM,2009-01-22T15:21:05,2009,1
ANDHRA PRADESH,Y S R ,0   ,KHARIF,AGRICULTURE,0,Tobacco,3,ASKED ABOUT CONTROL FOR TOBACCO CATERPILLAR,RECOMMENDED TO SPRAY QUINALPHOS 2ML/LT,2009-01-22T17:06:09,2009,1
ANDHRA PRADESH,KRISHNA,0   ,KHARIF,9999,0,9999,9999,ASKED ABOUT THE CONTROL OF REDDENNING OF THE LEAVES,RECOMMENDED TO SPRAY ZNSO4 2GM/LT,2009-01-19T13:58:34,2009,1
ANDHRA PRADESH,WEST GODAVARI,0   ,KHARIF,9999,0,9999,9999,ASKED ABOUT CONTROL FOR WEEDS,RECOMMENDED TO SPRAY FLUCHLORALINE 1.5LITRES/ ACRE,2009-01-20T10:20:23,2009,1
ANDHRA PRADESH,WEST GODAVARI,0   ,KHARIF,9999,0,9999,9999,ASKED ABOUT THE CONTROL OF ZINC DEFECIENCY,RECOMMENDED TO9 SPRAY ZINC SULPHATE 2GM/LTR,2009-01-20T10:33:34,2009,1
ANDHRA PRADESH,9999,0   ,KHARIF,9999,0,9999,9999,lack of fertilizer.,advice to contact the nearest agriculture office or agriculture development officer.,2009-01-18T17:40:57,2009,1
ANDHRA PRADESH,Y S R ,0   ,KHARIF,AGRICULTURE,0,Tobacco,3,ASKED ABOUT THE CONTROL OF TOBACCO CATERPILLAR,RECOMMENDED AND EXPLAINED ABOUT THE PREPERATION AND APPLICATION PROCESS OF POISON BAIT,2009-01-19T06:18:10,2009,1
ANDHRA PRADESH,CHITTOOR,0   ,KHARIF,9999,0,9999,9999,ASKED ABOUT THE CONTROL OF FRUIT AND FLOWER DROP,RECOMMENDED TO SPRAY PLANOPHIX 1ML/5LTR,2009-01-19T06:36:31,2009,1
ANDHRA PRADESH,WEST GODAVARI,0   ,KHARIF,9999,0,9999,9999,ASKED ABOUT THE FERTILIZER DOSAGE,"RECOMMENDED DOSAGE IS 48KG/N, 24KG/P, 20KG/K",2009-01-19T09:08:25,2009,1
ANDHRA PRADESH,CHITTOOR,0   ,KHARIF,9999,0,9999,9999,ASKED ABOUT THE VAIETIES,"RECOMMENDED VARIETIES ARE MSFH-8,KBSH-1,NDSH-1,MORDAN",2009-01-19T09:28:25,2009,1
ANDHRA PRADESH,NELLORE,0   ,KHARIF,9999,0,9999,9999,ASKED ABOUT THE FERTILISER RECOMMENDATION IN GRAIN FILLING STAGE,RECOMMENDED FERTILISERS ARE NITROGEN 16KG/ACRE AND POTASH 10KG/ACRE,2009-01-19T10:01:58,2009,1
ANDHRA PRADESH,PRAKASAM,0   ,KHARIF,9999,0,9999,9999,ASKED ABOUT CONTROL FOR POWDERY MILDEW,RECOMMENDED TO SPRAY WETTABLE SULPHER 3GR/LITRE,2009-01-19T11:15:49,2009,1
ANDHRA PRADESH,WEST GODAVARI,0   ,KHARIF,9999,0,9999,9999,ASKED ABOUT FERTILIZER APPLICATION,"RECOMMENDED TO APPLY 67KGS N, 40KGS P, 48KGS K",2009-01-26T18:04:50,2009,1
ANDHRA PRADESH,9999,0   ,KHARIF,9999,0,9999,9999,BLANK CALL,BLANK CALL,2009-01-27T07:18:01,2009,1
ANDHRA PRADESH,KRISHNA,0   ,KHARIF,HORTICULTURE,0,1280,29,ASKED ABOUT THE CONTROL OF THRIPS IN CHILLIES,RECOMMENDED TO SPRAY ACEPHATE@1.5GRAMS/LIT,2009-01-31T10:24:00,2009,1
ANDHRA PRADESH,NELLORE,0   ,KHARIF,9999,0,9999,9999,ASKED ABOUT THE CONTROL OF STEM BORER DAMAGE,RECOMMENDED TO SPRAY CARTAP HYDROCHLORIDE 2GM/LTR,2009-01-31T12:43:59,2009,1
ANDHRA PRADESH,NELLORE,0   ,KHARIF,AGRICULTURE,0,1037,3,ASKERD ABOUT THE CONTROL OF GRAM CATERPILLAR,RECOMMENDED TO SPRAY SPINOSHAD 0.3 ML/LTR,2009-01-31T13:09:27,2009,1
ANDHRA PRADESH,WEST GODAVARI,0   ,KHARIF,9999,0,9999,9999,ASKED ABOUT THE CONTROL OF HAIRY CATERPILLAR,RECOMMENDED TO SPRAY NDOSULPHAN 2ML/LTR,2009-01-31T14:15:10,2009,1
ANDHRA PRADESH,GUNTUR,0   ,KHARIF,9999,0,9999,9999,ASKED ABOUT CONTROL FOR WEED,RECOMMENDED TO SPRAY ATRAZINE 2LT/ACRE,2009-01-31T18:02:40,2009,1
ANDHRA PRADESH,EAST GODAVARI,0   ,KHARIF,9999,0,9999,9999,ASKED ABOUT CONTROL FOR WEED,RECOMMENDED TO SPRAY BUTACHLORE 1.6LT/ACRE,2009-01-31T21:21:34,2009,1
ANDHRA PRADESH,NELLORE,0   ,KHARIF,9999,0,9999,9999,ASKED ABOUT THE CONTROL OF STEM BORER,RECOMMENDED TO SPRAY cartap hydrochloride 2gm/ltr,2009-01-24T18:22:18,2009,1
ANDHRA PRADESH,Y S R ,0   ,KHARIF,9999,0,9999,9999,ASKED ABOUT THE CONTROL OF SUCKING PESTS,RECOMENDED TO SPRAY ACEPHATE 1GM/LTR,2009-01-24T19:09:44,2009,1
ANDHRA PRADESH,KRISHNA,0   ,KHARIF,9999,0,9999,9999,ASKED WHETHER HE CAN MIX THE FERTILIZER AND WEEDICIDE AND APPLY AT A TIME,RECOMMENDED TO APPLY THEM SEPERATELY,2009-01-28T15:27:54,2009,1
ANDHRA PRADESH,SRIKAKULAM,0   ,KHARIF,9999,0,9999,9999,ASKED ABOUT CONTROL FOR APHIDS DAMAGE,RECOMMENDED TO SPRAY ROGOR 2ML/LITRE,2009-01-28T17:23:14,2009,1
ANDHRA PRADESH,KRISHNA,0   ,KHARIF,9999,0,9999,9999,ASKED ABOUT CONTROL FOR STEMBORER,RECOMMENDED TO SPRAY CORTAP HYDROCHLORIDE 2GR/LITRE,2009-01-28T17:36:59,2009,1
ANDHRA PRADESH,9999,0   ,KHARIF,9999,0,9999,9999,BLANK CALL,BLANK CALL,2009-01-28T17:52:01,2009,1
ANDHRA PRADESH,EAST GODAVARI,0   ,KHARIF,9999,0,9999,9999,ASKED ABOUT CONTROL FOR GALLMIDGE,"RECOMMENDED TO APPLY PHORATE 10G ,5KG/ACRE",2009-01-28T18:13:01,2009,1
ANDHRA PRADESH,KURNOOL,0   ,KHARIF,9999,0,9999,9999,ASKED ABOUT WEEDICIDE,RECOMMENDED TO SPRAY PENDIMETHYLIN 1.6LT/ACRE,2009-01-28T19:14:55,2009,1
ANDHRA PRADESH,9999,0   ,KHARIF,9999,0,9999,9999,BLANK CALL,BLANK CALL,2009-01-28T19:40:36,2009,1
ANDHRA PRADESH,9999,0   ,KHARIF,9999,0,9999,9999,FERTILIZER OF DRUMSTICK,USE 10:26:26 @ 1.5 KG / PLANT WITH 100 GM BORAX AT THE BASE,2009-01-28T21:23:41,2009,1
ANDHRA PRADESH,EAST GODAVARI,0   ,KHARIF,9999,0,9999,9999,ASKED ABOUT REMEDY FOR THE LEAF DROP,RECOMMENDED TO CUT THE LEAVES THERE IS NO OTHER REMEDY.,2009-01-29T08:40:40,2009,1
ANDHRA PRADESH,KRISHNA,0   ,KHARIF,AGRICULTURE,0,1137,2,ASKED ABOUT THE CONTROL OF BLAST IN RICE,RECOMMENDED TO SPRAY TRYCYCLOZOLE@0.66GRAMS/LIT,2009-01-29T10:13:20,2009,1
ANDHRA PRADESH,9999,0   ,KHARIF,9999,0,9999,9999,CALL DISCONNECTED,CALL DISCONNECTED,2009-01-29T13:04:10,2009,1
ANDHRA PRADESH,GUNTUR,0   ,KHARIF,AGRICULTURE,0,1075,5,ASKED ABOUT MAIZE VARITIES,"RECOMMENDED VARITIES ARE TRISHULATHA, MADHURI",2009-01-29T13:51:51,2009,1
ANDHRA PRADESH,9999,0   ,KHARIF,9999,0,9999,9999,FRUIT ROT OF COCONUT,APPLY COPPER OXYCHLORIDE @4 GM/LIT OF WATER,2009-01-29T14:39:43,2009,1
ANDHRA PRADESH,9999,0   ,KHARIF,9999,0,9999,9999,CALL DISCONNECTED,CALL DISCONNECTED,2009-01-25T11:15:40,2009,1
ANDHRA PRADESH,WEST GODAVARI,0   ,KHARIF,9999,0,9999,9999,ASKED ABOUT CONTROL FOR WEED,RECOMMENDED TO SPRAY 1.5LT/ACERE,2009-01-26T09:08:32,2009,1
ANDHRA PRADESH,9999,0   ,KHARIF,9999,0,9999,9999,CALL DISCONNECTED,CALL DISCONNECTED,2009-01-26T10:29:30,2009,1
ANDHRA PRADESH,9999,0   ,KHARIF,9999,0,9999,9999,CALL DISCONNECTED,CALL DISCONNECTED,2009-01-26T10:32:30,2009,1
ANDHRA PRADESH,KRISHNA,0   ,KHARIF,9999,0,9999,9999,ASKED ABOUT THE FERTILIZER DOSAGES,"RECOMMENDED DOSAGES ARE 48KG/N, 24KG/P, 20KG/K",2009-01-29T16:03:04,2009,1
ANDHRA PRADESH,Y S R ,0   ,KHARIF,HORTICULTURE,0,1324,2,ASKED ABOUT THE CONTROL OF POWDERY MILDEW IN PAPAYA,RECOMMENDED TO SPRAY HAXACONAZOLE@2ML/LIT,2009-01-29T20:21:21,2009,1
ANDHRA PRADESH,9999,0   ,KHARIF,9999,0,9999,9999,DISCONNECTED,DISCONNECTED,2009-01-29T20:48:41,2009,1
ANDHRA PRADESH,VISAKHAPATNAM,0   ,KHARIF,HORTICULTURE,0,1280,29,ASKED ABOUT CONTROL FOR CHILLI THRIPS,RECOMMENEDED TO SPRAY ACEPHATE 1.5GR/LITRE,2009-01-30T06:14:31,2009,1
ANDHRA PRADESH,9999,0   ,KHARIF,9999,0,9999,9999,BLANK CALL,BLANK CALL,2009-01-30T06:23:19,2009,1
