StateName,DistrictName,BlockName,Season,Sector,Category,Crop,QueryType,QueryText,KccAns,CreatedOn,year,month
ANDHRA PRADESH,NELLORE,0   ,KHARIF,AGRICULTURE,0,1137,2,ASKED ABOUT THE CONTROL OF RICE BLAST,RECOMMENDED TO SPRAY 0.6 GM/LTR TRICYCLOZOLE,2009-02-09T06:01:41,2009,2
ANDHRA PRADESH,KRISHNA,0   ,KHARIF,9999,0,9999,9999,ASKED ABOUT CONTROL FOR GALLMIDGE DAMAGE,RECOMMENDED TO APPLY CARBOFURON GRANULES 10KGS/ACRE,2009-02-09T10:05:27,2009,2
ANDHRA PRADESH,ANANTPUR,0   ,KHARIF,AGRICULTURE,0,1037,2,ASKED ABOUT THE CONTROL ROOT ROT IN BENGALGRAM,RECOMMENDED TO SPRAY MANCOZEB@2GRAMS/LITER,2009-02-09T10:59:55,2009,2
ANDHRA PRADESH,9999,0   ,KHARIF,9999,0,9999,9999,CALL DISCONNECTED,CALL DISCONNECTED,2009-02-09T11:24:43,2009,2
ANDHRA PRADESH,KRISHNA,0   ,KHARIF,9999,0,9999,9999,ASKED ABOUT CONTROL FOR LEAF SPOT DAMAGE,RECOMMENDED TO SPRAY MANCOZEB 2.5GR/LITRE,2009-02-09T11:56:54,2009,2
ANDHRA PRADESH,WEST GODAVARI,0   ,KHARIF,AGRICULTURE,0,1137,2,ASKED ABOUT THE CONTROL OF BLAST IN RICE,RECOMMENDED TO SPRAY TRICYCLOZOLE 0.6GM/LT,2009-02-09T14:37:59,2009,2
ANDHRA PRADESH,9999,0   ,KHARIF,9999,0,9999,9999,BLANK CALL,BLANK CALL,2009-02-10T19:56:07,2009,2
ANDHRA PRADESH,WEST GODAVARI,0   ,KHARIF,AGRICULTURE,0,Tobacco,3,ASKED ABOUT CONTROL FOR TOBACCO CATERPILLER,RECOMMENDED TO SPRAY QUINOLPHOS 2ML/LITRE,2009-02-10T20:08:13,2009,2
ANDHRA PRADESH,9999,0   ,KHARIF,9999,0,9999,9999,BLANK CALL,BLANK CALL,2009-02-11T08:35:53,2009,2
ANDHRA PRADESH,NELLORE,0   ,KHARIF,9999,0,9999,9999,ASKED ABOUT THE CONTROL OF THRIPS IN CHILLY,RECOMMENDED TO SPRAY PHASOLONE 3ML/LT,2009-02-11T11:09:40,2009,2
ANDHRA PRADESH,KRISHNA,0   ,KHARIF,9999,0,9999,9999,ASKED ABOUT THE CONTROL OF ZINC DEFECIENCY,RECOMMENDED TO SPRAY ZINCSULPHATE 2GM/LTR,2009-02-11T11:17:23,2009,2
ANDHRA PRADESH,Y S R ,0   ,KHARIF,HORTICULTURE,0,1268,29,ASKED ABOUT MANGO VARIETY,GIVEN INFORMATION IS SUVARNAREKHA,2009-02-06T16:49:36,2009,2
ANDHRA PRADESH,KRISHNA,0   ,KHARIF,9999,0,9999,9999,ASKED ABOUT CONTROL FOR THRIPS,RECOMMENDED TO SPRAY DIMETHOATE 2ML/LT,2009-02-06T16:53:02,2009,2
ANDHRA PRADESH,KRISHNA,0   ,KHARIF,9999,0,9999,9999,ASKED ABOUT THE CONTROL OF BLAST IN PADDY,RECOMMENDED TO SPRAY TRYCYCLOZOLE@0.6GRAMS/LIT,2009-02-06T17:52:47,2009,2
ANDHRA PRADESH,WEST GODAVARI,0   ,KHARIF,9999,0,9999,9999,ASKED ABOUT THE CONTROL OF ZINC DEFICIENCY IN PADDY,RECOMMENDE TO SPRAY ZINC SULPHATE@2GRAMS/LIT,2009-02-06T18:48:10,2009,2
ANDHRA PRADESH,EAST GODAVARI,0   ,KHARIF,9999,0,9999,9999,ASKED ABOUT THE CONTROL OF BLAST IN PADDY,RECOMMENDED TO SPRAY TRYCYCLOZE@0.6GRAMS/LIT,2009-02-06T18:51:18,2009,2
ANDHRA PRADESH,WEST GODAVARI,0   ,KHARIF,HORTICULTURE,0,1280,2,ASKED ABOUT THE CONTROL FRUIT ROT IN CHILLIES,RECOMMENDED TO SPRAY HEXACONAZOLE@2ML/LIT,2009-02-06T19:08:51,2009,2
ANDHRA PRADESH,Y S R ,0   ,KHARIF,9999,0,9999,9999,ASKED ABOUT THE VARIETIES IN LADDIES FINGER,RECOMMENDED ARKA ANAMIKA VARIETY,2009-02-06T19:13:50,2009,2
ANDHRA PRADESH,GUNTUR,0   ,KHARIF,9999,0,9999,9999,ASKED ABOUT THE CONTROL OF YELLOW STEM BORER IN PADDY,RECOMMENDED TO SPRAY CHLOROPYRIPHOS@2.5ML/LIT,2009-02-06T20:06:47,2009,2
ANDHRA PRADESH,9999,0   ,KHARIF,9999,0,9999,9999,BLANK CALL,BLANK CALL,2009-02-08T15:57:06,2009,2
ANDHRA PRADESH,PRAKASAM,0   ,KHARIF,9999,0,9999,9999,ASKED ABOUT THE VARIETIES,"RECOMMENDED VARIETIES ARE TEJA,LBG-22,645,648,PANTH-30,90",2009-02-10T10:43:49,2009,2
ANDHRA PRADESH,KURNOOL,0   ,KHARIF,9999,0,9999,9999,ASKED ABOUT THE CONTROL OF FLOWER DROP,RECOMMENDED TO SPRAY PLANOPHIX 1ML/5LTR,2009-02-10T11:11:38,2009,2
ANDHRA PRADESH,CHITTOOR,0   ,KHARIF,HORTICULTURE,0,1324,2,ASKED ABOUT THE CONTROL OF POWDERY MILDEW IN PAPAYA,RECOMMENDED TO SPRAY WATER SOLUBLE SULPHUR 3GM/LT,2009-02-09T18:51:12,2009,2
ANDHRA PRADESH,KRISHNA,0   ,KHARIF,AGRICULTURE,0,1137,3,ASKED ABOUT THE CONTROL OF GALLMIDGE IN RICE,RECOMMENDED TO SPRAY PHORATE 10G GRANULES 10KG/ACRE,2009-02-09T19:06:06,2009,2
ANDHRA PRADESH,GUNTUR,0   ,KHARIF,AGRICULTURE,0,1075,3,ASKED ABOUT THE CONTROL OF PINK BORER IN MAIZE,RECOMMENDED TO SPRAY ENDOSULFON 2ML/LT,2009-02-09T19:10:20,2009,2
ANDHRA PRADESH,9999,0   ,KHARIF,9999,0,9999,9999,BLANK CALL.,BLANK CALL.,2009-02-10T07:35:05,2009,2
ANDHRA PRADESH,EAST GODAVARI,0   ,KHARIF,9999,0,9999,9999,ASKED ABOUT CONTROL FOR FLOWER DROP,RECOMMENDED TO SPRAY PLANOPHIX 1ML/5LITRES,2009-02-24T20:51:23,2009,2
ANDHRA PRADESH,KRISHNA,0   ,KHARIF,9999,0,9999,9999,ASKED ABOUTCONTROL FOR THE BLAST,RECOMMENDED TO SPRAY TRICYCLOZOLE 1.6/LT,2009-02-25T06:58:19,2009,2
ANDHRA PRADESH,PRAKASAM,0   ,KHARIF,9999,0,9999,9999,ASKED ABOUT THE SOWING SEASON OF BITTER GOURD,RECOMMENDED JANUARY-FEBRAVERY MONTHS,2009-02-25T11:48:30,2009,2
ANDHRA PRADESH,Y S R ,0   ,KHARIF,AGRICULTURE,0,1137,2,ASKED ABOUT THE CONTROL OFBLAST IN RICE,RECOMMENDED TO SPRAY TRICYCLOZOLE 0.6GM/LT,2009-02-25T15:25:09,2009,2
ANDHRA PRADESH,WEST GODAVARI,0   ,KHARIF,9999,0,9999,9999,ASKED ABOUT CONTROL FOR WEEDS,RECOMMENDED TO SPRAY BUTACHLOR 4KGS/20 KGS SAND,2009-02-21T19:04:02,2009,2
ANDHRA PRADESH,KRISHNA,0   ,KHARIF,AGRICULTURE,0,1137,2,ASKED ABOUT THE CONTROL OF RICE BLAST,RECOMMENDED TO SPRAY TRICYCLOZOLE 0.6 GM/LTR,2009-02-26T18:42:13,2009,2
ANDHRA PRADESH,GUNTUR,0   ,KHARIF,HORTICULTURE,0,1280,29,ASKED ABOUT CONTROL OF THRIPS IN CHILLIES,RECOMMENDED TO SPRAY ACEPHATE@1.5GRAMS/LITER,2009-02-26T19:45:23,2009,2
ANDHRA PRADESH,9999,0   ,KHARIF,9999,0,9999,9999,BLANK CALL,BLANK CALL,2009-02-22T08:42:57,2009,2
ANDHRA PRADESH,ANANTPUR,0   ,KHARIF,AGRICULTURE,0,Tobacco,3,ASKED ABOUT THE CONTROL OF TOBACCO CATERTPILLAR,RECOMMENDED FOR THE APPLICATION OF QUINOLPHAS 2ML/LTR,2009-02-22T10:03:00,2009,2
ANDHRA PRADESH,9999,0   ,KHARIF,9999,0,9999,9999,BLANK CALL,BLANK CALL,2009-02-22T12:57:46,2009,2
ANDHRA PRADESH,GUNTUR,0   ,KHARIF,9999,0,9999,9999,ASKED ABOUT CONTROL FOR JASSIDS,RECOMMENDED TO SPRAY DIMETHOATE 2ML/LT,2009-02-24T09:08:32,2009,2
ANDHRA PRADESH,NELLORE,0   ,KHARIF,9999,0,9999,9999,ASKED ABOUT CONTROL FOR BPH,RECOMMENDED TO SPRAY ACEPHATE 1.5GM/LT,2009-02-21T12:51:21,2009,2
ANDHRA PRADESH,WEST GODAVARI,0   ,KHARIF,9999,0,9999,9999,ASKED ABOUT CONTROL FOR STEM ROT,RECOMMENDED TO SPRAY HEXACONAZOLE 2ML/LT,2009-02-21T14:45:08,2009,2
ANDHRA PRADESH,KRISHNA,0   ,KHARIF,9999,0,9999,9999,ASKED ABOUT THE MICRONUTRIENT DEFECIENCY,RECOMMENDED FOR THE APPLICATION OF5GM ZINCSULPHATE+2.5GM FERROUS SULPHATE+2GM BORAX+2GM COPPERSULPHATE+3GM MAGNESIUMSULPHATE,2009-02-23T08:43:46,2009,2
ANDHRA PRADESH,EAST GODAVARI,0   ,KHARIF,9999,0,9999,9999,ASKED ABOUT THE SEED TREATEMENT,RECOMMENDED TO DO SEED TREATEMENT WITH RHIZOBIUM,2009-02-23T12:27:05,2009,2
ANDHRA PRADESH,WEST GODAVARI,0   ,KHARIF,9999,0,9999,9999,ASKED ABOUT CONTROL FOR THRIPS DAMAGE,RECOMMENDED TO SPRAY ACEPAHTE 1.5GR/LITRE,2009-02-25T18:40:32,2009,2
ANDHRA PRADESH,WEST GODAVARI,0   ,KHARIF,9999,0,9999,9999,ASKED ABOUT THE CONTROL OF SHEATH BLIGHT,REOMMENDED TO SPRAY HEXACONOZOLE 2ML/LTR,2009-02-25T18:56:42,2009,2
ANDHRA PRADESH,CHITTOOR,0   ,KHARIF,9999,0,9999,9999,ASKED ABOUT CONTROL FOR STEM BORER DAMAGE,RECOMMENDED TO SPRAY CHLORPYRIPOS 2.5ML/LITRE,2009-02-25T18:59:47,2009,2
ANDHRA PRADESH,ANANTPUR,0   ,KHARIF,9999,0,9999,9999,ASKED ABOUT CONTROL FOR THRIPS DAMAGE,RECOMMENDED TO SPRAY CARBARYL 3GR/LITRE,2009-02-25T19:00:32,2009,2
ANDHRA PRADESH,WEST GODAVARI,0   ,KHARIF,AGRICULTURE,0,1137,2,ASKED ABOUT THE CONTROL OF BLAST IN RICE,RECOMMENDERD TO SPRAY TRICYCLOZOLE 0.6GM/LT,2009-02-26T10:07:02,2009,2
ANDHRA PRADESH,CHITTOOR,0   ,KHARIF,9999,0,9999,9999,ASKED ABOUT CONTROL FOR FRUIT SUCKING MOTH,RECOMMENDED TO SPRAY CARBARYL 3GR/LITRE,2009-02-26T11:06:30,2009,2
ANDHRA PRADESH,CHITTOOR,0   ,KHARIF,9999,0,9999,9999,ASKED ABOUT THE CONTROL OF FOLDS IN GROUND NUT,RECOMMENDED TO SPRAT TRIAZOPHOS 2.5ML/LT,2009-02-26T12:32:12,2009,2
ANDHRA PRADESH,9999,0   ,KHARIF,9999,0,9999,9999,BLANK CALL,BLANK CALL,2009-02-26T12:41:52,2009,2
ANDHRA PRADESH,GUNTUR,0   ,KHARIF,9999,0,9999,9999,ASKED ABOUT CONTROL FOR SHOOT&FRUIT BORER,RECOMMENDED TO SPRAY QUNIOLPHPS 2ML/LT,2009-02-26T13:07:49,2009,2
ANDHRA PRADESH,KURNOOL,0   ,KHARIF,AGRICULTURE,0,1137,3,ASKED ABOUT CONTROL FOR RICE BLAST,RECOMMENDED TO SPRAY BEAM 120GR/200 LITRES,2009-02-26T14:25:33,2009,2
ANDHRA PRADESH,9999,0   ,KHARIF,HORTICULTURE,0,Banana,29,CONTROL OF HARMFUL INSECT COMES FROM SOIL IN BANANA FIELD,SPRAY CHLOROPYRIPHOS @ 2 ML/LIT. OF WATER,2009-02-24T13:13:10,2009,2
ANDHRA PRADESH,9999,0   ,KHARIF,9999,0,9999,9999,BLANK CALL,BLANK CALL,2009-02-24T14:20:02,2009,2
ANDHRA PRADESH,9999,0   ,KHARIF,9999,0,9999,9999,BLANK CALL,BLANK CALL,2009-02-24T14:24:26,2009,2
ANDHRA PRADESH,9999,0   ,KHARIF,9999,0,9999,9999,BLANK CALL,BLANK CALL,2009-02-24T16:30:28,2009,2
ANDHRA PRADESH,VIZIANAGARM,0   ,KHARIF,9999,0,9999,9999,ASKED ABOUT CONTROL FOR SUCKING PESTS,RECOMMENDED TO SPRAY ROGOR 2ML/LITRE,2009-02-24T18:17:11,2009,2
ANDHRA PRADESH,CHITTOOR,0   ,KHARIF,9999,0,9999,9999,ASKED ABOUT THE CONTROL OF FLOWER DROP,RECOMMENDED FOR THE APPLICATION OF PLANOPHIX 1ML/5LTR,2009-02-28T06:29:54,2009,2
ANDHRA PRADESH,WEST GODAVARI,0   ,KHARIF,AGRICULTURE,0,1137,2,ASKED ABOUT THE CONTROL OF RICE BLAST,RECOMMENDED TO SPRAY TRICYCLOZOLE 0.6 GM/LTR,2009-02-28T07:06:29,2009,2
ANDHRA PRADESH,9999,0   ,KHARIF,9999,0,9999,9999,BLANK CALL,BLANK CALL,2009-02-28T15:19:11,2009,2
ANDHRA PRADESH,9999,0   ,KHARIF,9999,0,9999,9999,BLANK CALL,BLANK CALL,2009-02-21T09:10:06,2009,2
ANDHRA PRADESH,9999,0   ,KHARIF,9999,0,9999,9999,BLANK CALL,BLANK CALL,2009-02-21T09:28:06,2009,2
ANDHRA PRADESH,9999,0   ,KHARIF,9999,0,9999,9999,BLANK CALL,BLANK CALL,2009-02-21T11:32:21,2009,2
ANDHRA PRADESH,9999,0   ,KHARIF,9999,0,9999,9999,BLANK CALL,BLANK CALL,2009-02-21T11:33:58,2009,2
ANDHRA PRADESH,9999,0   ,JAYAD,9999,0,9999,9999,BLANK CALL,BLANK CALL,2009-02-21T11:53:39,2009,2
ANDHRA PRADESH,GUNTUR,0   ,KHARIF,9999,0,9999,9999,ASKED ABOUT THE THE MARKET VALUE FOR GRASS CUTTER,INFORMED AS PER THE RATES AND SUBSIDIES PROVIDED,2009-02-27T16:57:24,2009,2
ANDHRA PRADESH,CHITTOOR,0   ,KHARIF,9999,0,9999,9999,ASKED ABOUT CONTROL FOR SHEATH BLIGHT,RECOMMENDED TO SPRAY CONTOFF 2ML/LITRE,2009-02-27T17:05:18,2009,2
ANDHRA PRADESH,GUNTUR,0   ,KHARIF,HORTICULTURE,0,1268,29,ASKED ABOUT THE CONTROL OF HOPPERS IN MANGO,RECOMMENDED TO SPRAY PHOSPHOMIDON 1.5ML/LT,2009-02-27T19:11:55,2009,2
ANDHRA PRADESH,9999,0   ,KHARIF,9999,0,9999,9999,CALL DISCONNECTED,CALL DISCONNECTED,2009-02-27T19:47:41,2009,2
ANDHRA PRADESH,NELLORE,0   ,KHARIF,9999,0,9999,9999,ASKED ABOUT CONTROL FOR BPH,RECOMMENDED TO SPRAY ACEPHATE 1.5GR/LITRE,2009-02-28T17:48:07,2009,2
ANDHRA PRADESH,CHITTOOR,0   ,KHARIF,HORTICULTURE,0,1268,29,ASKED ABOUT THE CONTROL OF LEAF WEBBER IN MANGO,RECOMMENDED TO SPRAY QUINOLPHOS@2ML/LITER,2009-02-17T19:37:55,2009,2
ANDHRA PRADESH,KRISHNA,0   ,KHARIF,9999,0,9999,9999,ASKED ABOUT THE CONTROL OF ZINC DEFICIENCY,RECOMMENDED TO SPRAY ZINC SULPHATE@2GRAMS/LITER,2009-02-17T20:09:40,2009,2
ANDHRA PRADESH,9999,0   ,KHARIF,9999,0,9999,9999,BLANK CALL,BLANK CALL,2009-02-17T21:14:35,2009,2
ANDHRA PRADESH,9999,0   ,KHARIF,9999,0,9999,9999,BLANK CALL,BLANK CALL,2009-02-17T21:14:35,2009,2
ANDHRA PRADESH,KURNOOL,0   ,KHARIF,9999,0,9999,9999,ASKED ABOUT CONTROL FOR MITE DAMAGE,RECOMMENDED TO SPRAY DICOPHOL 1 LITRE/ACRE,2009-02-18T09:38:19,2009,2
ANDHRA PRADESH,NELLORE,0   ,KHARIF,9999,0,9999,9999,ASKED ABOUT THE VARIETIES,"RECOMMENDED VARIETIES ARE LGG-407,410,WGG-2,37",2009-02-18T11:55:26,2009,2
ANDHRA PRADESH,CHITTOOR,0   ,KHARIF,9999,0,9999,9999,ASKED ABOUT THE CONTROL OF BLAST IN PADDY,RECOMMENDED TO SPRAY TRYCYCLOZOLE@0.6GRAMS/LITER,2009-02-18T14:30:13,2009,2
ANDHRA PRADESH,WEST GODAVARI,0   ,KHARIF,9999,0,9999,9999,ASKED ABOUT THE CONTROL OF SHEATH BLIGHT IN PADDY,RECOMMENDED TO SPRAY HEXACONAZOLE@2ML/LITER,2009-02-18T15:35:26,2009,2
ANDHRA PRADESH,WEST GODAVARI,0   ,KHARIF,9999,0,9999,9999,ASKED ABOUT THE COMTROL FOR ZINC DEFECIENCY,RECOMMENDED TO SPRAY ZINC SULPHATE 2 GM/LTR,2009-02-16T18:09:41,2009,2
ANDHRA PRADESH,GUNTUR,0   ,KHARIF,9999,0,9999,9999,ASKED ABOUT THE CONTROL OF STEM BORER,RECOMMENDED TO SPRAY CARTAP HYDROCHLORIDE 2 GM/LTR,2009-02-16T20:39:26,2009,2
ANDHRA PRADESH,CHITTOOR,0   ,KHARIF,9999,0,9999,9999,ASKED ABOUT FERTILIZER,"RECOMMENDED TO APPLY UREA 48KG ,24KG PHOSPHORUS, 16KGPOTASH",2009-02-17T09:49:28,2009,2
ANDHRA PRADESH,PRAKASAM,0   ,KHARIF,9999,0,9999,9999,ASKED ABOUT CONTROL FOR SUCKING PESTS,RECOMMENDED TO SPRAY ROGOR 2ML/LITRE,2009-02-17T11:16:39,2009,2
ANDHRA PRADESH,NELLORE,0   ,KHARIF,9999,0,9999,9999,ASKED ABOUT CONTROL FOR GUNDI BUG,RECOMMENDED TO SPRAY MONOCHROTOPHOS 1.6 ML/LT,2009-02-17T11:42:54,2009,2
ANDHRA PRADESH,9999,0   ,KHARIF,9999,0,9999,9999,BLANK CALL,BLANK CALL,2009-02-20T14:45:33,2009,2
ANDHRA PRADESH,ANANTPUR,0   ,KHARIF,9999,0,9999,9999,ASKED FOR THE CONTROL OF BACTERIAL LEAF SPOT,RECOMMENDED FOR THE SPRAY OFD 200MG STREPTOCYCLINE+3 GM BLITOX,2009-02-20T17:16:50,2009,2
ANDHRA PRADESH,VISAKHAPATNAM,0   ,KHARIF,9999,0,9999,9999,ASKED ABOUT INFORMATION FOR TURKEY BIRDS,ESC TO 23311720,2009-02-17T13:12:51,2009,2
ANDHRA PRADESH,NELLORE,0   ,KHARIF,9999,0,9999,9999,ASKED ABOUT INFORMATION ON FORAGE CROPS,GIVEN INFORMATION IS RECOMMENDED TO CHOOSE HYBRID NAPIER OR LUCERNE,2009-02-16T13:22:56,2009,2
ANDHRA PRADESH,NELLORE,0   ,KHARIF,9999,0,9999,9999,ASKED ABOUT CONTROL FOR POWDERY MILDEW,RECOMMENDED TO SPRAY WETTABLE SULPHER 3GR/LITRE,2009-02-16T14:33:51,2009,2
ANDHRA PRADESH,Y S R ,0   ,KHARIF,9999,0,9999,9999,ASKED ABOUT INFORMATION ON MUSHROOM CULTIVATION,ESC TO ATIC,2009-02-16T16:06:20,2009,2
ANDHRA PRADESH,NELLORE,0   ,KHARIF,AGRICULTURE,0,1137,Fertilizer Use and Availability,ASKED ABOUT THE CONTROL OF BLAST IN RICE,RECOMMENDED TO SPRAY TRICYCLOZOLE 0.6GM/LT,2009-02-19T19:10:05,2009,2
ANDHRA PRADESH,KRISHNA,0   ,KHARIF,HORTICULTURE,0,Tomato,29,ASKED ABOUT THE CONTROL OF HELICOVERPA IN TOMATO,RECOMMENDED TO SPRAY ENDOSULFON 2ML/LT,2009-02-19T19:17:39,2009,2
ANDHRA PRADESH,CHITTOOR,0   ,KHARIF,9999,0,9999,9999,ASKED ABOUT THE CONTROL OF FLOWER DROP,RECOMMENDED TO SPRAY PLANOPHIX 1ML/5LTR,2009-02-20T08:32:08,2009,2
ANDHRA PRADESH,9999,0   ,KHARIF,9999,0,9999,9999,BLANK CALL,BLANK CALL,2009-02-20T09:04:26,2009,2
ANDHRA PRADESH,ANANTPUR,0   ,KHARIF,9999,0,9999,9999,ASKED FOR THE CONTROL OF ZINC DEFECIENCY,RECOMMENDED TO SPRAY ZINCSULPHATE 2 GM/LTR,2009-02-20T09:12:44,2009,2
ANDHRA PRADESH,ANANTPUR,0   ,KHARIF,9999,0,9999,9999,ASKED FOR THE CONTROL OF SHEATH BLIGHT,RECOMMENDED TO SPRAY HEXACONOZOLE 2ML/LTR,2009-02-20T09:59:34,2009,2
ANDHRA PRADESH,CHITTOOR,0   ,KHARIF,9999,0,9999,9999,ASKED ABOUT CONTROL FOR THRIPS DAMAGE,RECOMMENDED TO SPRAY SPINOSHAD 0.75ML/LITRE,2009-02-20T10:05:41,2009,2
ANDHRA PRADESH,CHITTOOR,0   ,KHARIF,9999,0,9999,9999,ASKED ABOUT THE CONTROL OF BLAST IN PADDY,RECOMMENDED TO SPRAY TRYCYCLOZOLE@0.6GRAMS/LITER,2009-02-20T10:47:45,2009,2
ANDHRA PRADESH,KRISHNA,0   ,KHARIF,9999,0,9999,9999,ASKED ABOUT THE CONTROL OF YELLOW STEM BORER,RECOMMENDED TO SPRAY CARTAP HYDRO CHLORIDE@2.5GRAMS/LITER,2009-02-20T11:47:41,2009,2
ANDHRA PRADESH,PRAKASAM,0   ,KHARIF,9999,0,9999,9999,ASKED ABOUT THE CONTROL OF SHEATH BLIGHT IN PADDY,RECOMMENDED TO SPRAY HEXACONAZOLE@2ML/LITER,2009-02-14T19:42:39,2009,2
ANDHRA PRADESH,VIZIANAGARM,0   ,KHARIF,AGRICULTURE,0,1075,3,ASKED ABOUT THE CONTROL OF STEM BORER IN MAIZE,RECOMMENDED CARBOFURAN GRANULES@3KGS/ACRE,2009-02-14T20:24:09,2009,2
ANDHRA PRADESH,9999,0   ,KHARIF,9999,0,9999,9999,DISCONNECTED,DISCONNECTED,2009-02-17T17:48:38,2009,2
ANDHRA PRADESH,9999,0   ,KHARIF,9999,0,9999,9999,BLANK CALL,BLANK CALL,2009-02-17T17:50:21,2009,2
ANDHRA PRADESH,9999,0   ,KHARIF,9999,0,9999,9999,BLANK CALL,BLANK CALL,2009-02-17T17:52:16,2009,2
ANDHRA PRADESH,9999,0   ,KHARIF,9999,0,9999,9999,CALL DISCONNECTED,CALL DISCONNECTED,2009-02-17T17:56:02,2009,2
ANDHRA PRADESH,9999,0   ,KHARIF,9999,0,9999,9999,CALL DISCONNECTED,CALL DISCONNECTED,2009-02-17T17:57:35,2009,2
ANDHRA PRADESH,9999,0   ,KHARIF,9999,0,9999,9999,CALL DISCONNECTED,CALL DISCONNECTED,2009-02-17T17:57:35,2009,2
ANDHRA PRADESH,NELLORE,0   ,KHARIF,AGRICULTURE,0,1137,2,ASKED ABOUT THE CONTROL OF RICE BLAST,RECOMMENDED TO SPRAY TRICYCLOZOLE 0.6 GM/LTR,2009-02-20T19:58:37,2009,2
ANDHRA PRADESH,9999,0   ,KHARIF,9999,0,9999,9999,BLANK CALL,BLANK CALL,2009-02-20T21:16:29,2009,2
ANDHRA PRADESH,CHITTOOR,0   ,KHARIF,HORTICULTURE,0,Banana,2,ASKED ABOUT THE CONTROL OF SIGATOKA LEAF SPOT IN BANANA,RECOMMENDED TO SPRAY MANCOZEB@2.5GRAMS/LITER,2009-02-18T17:08:56,2009,2
ANDHRA PRADESH,GUNTUR,0   ,KHARIF,9999,0,9999,9999,ASKED ABOUT CONTROL FOR Zn DEFICIENCY,RECOMMENDED TO SPRAY ZN SULPHATE 2GM/LT,2009-02-18T17:47:12,2009,2
ANDHRA PRADESH,PRAKASAM,0   ,KHARIF,9999,0,9999,9999,ASKED ABOUT CONTROL FOR GREENLEAF HOPPER,RECOMMENDED TO SPRAY MONOCHROTOPHOS 2.2ML/LT,2009-02-18T19:47:41,2009,2
ANDHRA PRADESH,9999,0   ,KHARIF,9999,0,9999,9999,BLANK CALL,BLANK CALL,2009-02-18T20:09:27,2009,2
ANDHRA PRADESH,KRISHNA,0   ,KHARIF,9999,0,9999,9999,ASKED ABOUT CONTROL FOR MITES,RECOMMENDED TO SPRAY PHASOLENE,2009-02-18T21:10:14,2009,2
ANDHRA PRADESH,EAST GODAVARI,0   ,KHARIF,9999,0,9999,9999,ASKED ABOUT THE CONTROL OF BPH IN PADDY,RECOMMENDED TO SPRAY ACEPHATE @1.5GRAMS /LITER,2009-02-19T09:58:28,2009,2
ANDHRA PRADESH,9999,0   ,KHARIF,9999,0,9999,9999,BLANK CALL,BLANK CALL,2009-02-19T10:24:49,2009,2
ANDHRA PRADESH,NELLORE,0   ,KHARIF,9999,0,9999,9999,ASKED ABOUT CONTROL FOR BPH,RECOMMENDED TO SPRAY APPLOUD 3ML/LITRE,2009-02-19T10:47:43,2009,2
ANDHRA PRADESH,KURNOOL,0   ,KHARIF,9999,0,9999,9999,ASKED ABOUT MARKET INFORMATION,GIVEN INFORMATION IS 850-1100,2009-02-19T11:20:51,2009,2
ANDHRA PRADESH,GUNTUR,0   ,KHARIF,9999,0,9999,9999,ASKED ABOUT THE CONTROL OF BLAST IN PADDY,RECOMMENDED TO SPRAY TRYCYCLOZOLE@0.6GRAMS/LITER,2009-02-19T11:38:02,2009,2
ANDHRA PRADESH,SRIKAKULAM,0   ,KHARIF,ANIMAL HUSBANDRY,0,Rabbit,45,ASKED ABOUT INFORMATION ON RABBITS,ESC TO AH,2009-02-19T12:10:50,2009,2
ANDHRA PRADESH,Y S R ,0   ,KHARIF,9999,0,9999,9999,ASKED ABOUT CONTROL FOR ROOT ROT IN BETELVINE,RECOMMENDED TO SPRAY BLITOX 3GM/LT,2009-02-19T14:58:40,2009,2
ANDHRA PRADESH,CHITTOOR,0   ,KHARIF,AGRICULTURE,0,Tobacco,3,ASKED ABOUT THE CONTROL OF TOBACCO CATERPILLAR,RECOMMENDED TO SPRAY QUINOLPHAS 2ML/LTR,2009-02-19T15:27:40,2009,2
ANDHRA PRADESH,WEST GODAVARI,0   ,KHARIF,HORTICULTURE,0,1268,29,ASKED ABOUT THE CONTROL OF LEAF WEBBER IN MANGO,RECOMMENDED TO SPRAY ENDOSULPHAN@2ML/LIT,2009-02-02T19:29:12,2009,2
ANDHRA PRADESH,KRISHNA,0   ,KHARIF,HORTICULTURE,0,1280,29,ASKED ABOUT THE CONTROL OF THRIPS IN CHILLIES,RECOMMENDED TO SPRAY ACEPHATE@1.5GRAMS/LITRE,2009-02-02T19:35:40,2009,2
ANDHRA PRADESH,GUNTUR,0   ,KHARIF,AGRICULTURE,0,1075,3,ASKED ABOUT THE CONTROL OF PINK BORER IN MAIZE,RECOMMNEDED TO SPRAY ENDOSULFON 2ML/LT,2009-02-02T20:30:56,2009,2
ANDHRA PRADESH,GUNTUR,0   ,KHARIF,AGRICULTURE,0,1075,3,ASKED ABOUT THE CONTROL OF SPOTTED STEM BORER IN MAIZE,RECOMMENDED TO SPRAY ENDOSULFON GRANULES 10KG/ACRE,2009-02-03T09:35:00,2009,2
ANDHRA PRADESH,KRISHNA,0   ,KHARIF,9999,0,9999,9999,ASKED ABOUT THE CONTROL OF DIE BACK AND FRUIT ROT IN CHILLY,RECOMMENDED TO SPRAY MANCOZEB 3GM/LT,2009-02-03T10:03:47,2009,2
ANDHRA PRADESH,WEST GODAVARI,0   ,KHARIF,HORTICULTURE,0,Cabbage,Weather,ASKED ABOUT CONTROL FOR CABBAGE BORER,RECOMMENDED TO SPRAY ENDOSULFON 2ML/LITRE,2009-02-06T13:09:50,2009,2
ANDHRA PRADESH,KRISHNA,0   ,KHARIF,9999,0,9999,9999,ASKED ABOUT CONTROL FOR WEED,RECOMMENDED TO SPRAY PENDIMETHALIN 2LT/ACRE,2009-02-06T15:37:44,2009,2
ANDHRA PRADESH,NELLORE,0   ,KHARIF,9999,0,9999,9999,ASKED ABOUT THE CONTROL OF STEM BORER IN PADDY,RECOMMENDED TO SPRAY ENDOSULPHAN@2ML/LIT,2009-02-06T18:13:10,2009,2
ANDHRA PRADESH,WEST GODAVARI,0   ,KHARIF,AGRICULTURE,0,Coriander,29,ASKED ABOUT THE VARIETIES IN CORIANDER,RECOMMENDED LAMSELECTION VARIETY,2009-02-06T18:46:15,2009,2
ANDHRA PRADESH,9999,0   ,KHARIF,9999,0,9999,9999,BLANK CALL,BLANK CALL,2009-02-06T20:42:56,2009,2
ANDHRA PRADESH,9999,0   ,KHARIF,9999,0,9999,9999,CALL DISCONNECTED,CALL DISCONNECTED,2009-02-06T21:46:42,2009,2
ANDHRA PRADESH,KRISHNA,0   ,KHARIF,9999,0,9999,9999,ASKED ABOUT CONTROL FOR WILT,RECOMMENDED TO SPRAY BLITOX 3GM/LT,2009-02-03T15:49:58,2009,2
ANDHRA PRADESH,PRAKASAM,0   ,KHARIF,9999,0,9999,9999,ASKED ABOUT CONTROL FOR MITES,RECOMMENDED TO SPRAY DICOFAL 5ML/LT,2009-02-03T16:05:10,2009,2
ANDHRA PRADESH,CHITTOOR,0   ,KHARIF,9999,0,9999,9999,ASKED ABOUT CONTROL FOR THRIPS,RECOMMENDED TO SPRAY DIMETHOATE 2ML/LT,2009-02-03T16:59:24,2009,2
ANDHRA PRADESH,ANANTPUR,0   ,KHARIF,9999,0,9999,9999,ASKED ABOUT THE CONTROL OF TIKKA LEAF SPOT,RECOMMENDED TO SPRAY CHLOROTHALONIL 400 GM/ACRE,2009-02-03T17:01:40,2009,2
ANDHRA PRADESH,9999,0   ,KHARIF,9999,0,9999,9999,BLANK CALL,BLANK CALL,2009-02-04T06:15:23,2009,2
ANDHRA PRADESH,EAST GODAVARI,0   ,KHARIF,9999,0,9999,9999,ASKED ABOUT THE FERTILIZER APPLICATION,"RECOMMENDED FERTILIZERS ARE 48KG/N, 24KG/P, 16KG/K",2009-02-04T07:59:01,2009,2
ANDHRA PRADESH,9999,0   ,KHARIF,9999,0,9999,9999,CALL DISCONNECTED,CALL DISCONNECTED,2009-02-01T10:02:14,2009,2
ANDHRA PRADESH,9999,0   ,KHARIF,9999,0,9999,9999,BLANK CALL,BLANK CALL,2009-02-01T15:07:27,2009,2
ANDHRA PRADESH,ANANTPUR,0   ,KHARIF,HORTICULTURE,0,1268,29,ASKED ABOUT THE CONTROL OF POWDERY MILDEW IN MANGO,RECOMMENDED TO SPRAY KARATHANE 1ML/LT,2009-02-06T06:55:22,2009,2
ANDHRA PRADESH,KRISHNA,0   ,KHARIF,HORTICULTURE,0,1268,2,ASKED ABOUT THE CONTROL OF SOOTY MOULD IN MANGO,RECOMMENDED TO SPRAY ENDOSULFON 2ML/LT OR MONOCROTOPHOS 1.6ML/LT IN 15 DAYS TWO TIMES,2009-02-06T08:28:38,2009,2
ANDHRA PRADESH,NELLORE,0   ,KHARIF,9999,0,9999,9999,ASKED ABOUT THE CONTROL OF REDDENING OF THE LEAVES,RECOMMENDED TO SPRAY ZNSO4 2GM/LT,2009-02-06T08:53:22,2009,2
ANDHRA PRADESH,KRISHNA,0   ,KHARIF,9999,0,9999,9999,ASKED ABOUT CONTROL FOR WEEDS,RECOMMENDED TO SPRAY GLYPHOSATE 8ML/LITRE,2009-02-06T09:38:27,2009,2
ANDHRA PRADESH,ANANTPUR,0   ,KHARIF,9999,0,9999,9999,ASKED ABOUT CONTROL FOR BORON DEFICIENCY,RECOMMENDED TO SPRAY BOROX 2GR/LITRE,2009-02-06T10:02:46,2009,2
ANDHRA PRADESH,KRISHNA,0   ,KHARIF,9999,0,9999,9999,ASKED ABOUT THE CONTROL OF JASSIDS,RECOMMENDED TO SPRAY ACEPHATE 1.5GM/LT,2009-02-02T16:15:36,2009,2
ANDHRA PRADESH,NELLORE,0   ,KHARIF,9999,0,9999,9999,ASKED ABOUT CONTROL FOR LEAF GALLS,RECOMMENDED TO SPRAY PHOSPOMIDON 1ML/LITRE,2009-02-04T10:14:32,2009,2
ANDHRA PRADESH,PRAKASAM,0   ,KHARIF,9999,0,9999,9999,ASKED ABOUT CONTROL FOR STEM BORER,RECOMMENDED TO SPRAY CARTAPHYDROCHLORIDE 2GM/LT,2009-02-04T10:22:57,2009,2
ANDHRA PRADESH,GUNTUR,0   ,KHARIF,9999,0,9999,9999,ASKED ABOUT THE REMEDY FOR OVER IRRIGATION,ESC TO ATIC,2009-02-04T11:22:44,2009,2
ANDHRA PRADESH,Y S R ,0   ,KHARIF,9999,0,9999,9999,ASKED ABOUT APPLICATION OF EXCESS WATER TO THE FIELD,RECOMMENDED TO APPLY 20KG UREA,2009-02-04T12:14:28,2009,2
ANDHRA PRADESH,KRISHNA,0   ,KHARIF,9999,0,9999,9999,ASKED ABOUT CONTROL FOR Zn DEFICIENCY,RECOMMENDED TO SPRAY 2GM/LT,2009-02-04T15:41:00,2009,2
ANDHRA PRADESH,CHITTOOR,0   ,KHARIF,9999,0,9999,9999,ASKED ABOUT CONTROL FOR HELICOVERPA,RECOMMENDED TO SPRAY ENDOSULPHAN 2ML/LT,2009-02-04T17:25:32,2009,2
ANDHRA PRADESH,GUNTUR,0   ,KHARIF,AGRICULTURE,0,1137,21,ASKED ABOUT THE CONTROL OF WEEDS IN RICE,RECOMMENDED TO SPRAY BENTHIOCARB 1.5LT/ACRE,2009-02-04T18:54:56,2009,2
ANDHRA PRADESH,VIZIANAGARM,0   ,KHARIF,AGRICULTURE,0,1137,3,ASKED ABOUT THE CONTROL OF BPH IN RICE,RECOMMENDED TO SPRAY ACEPHATE 1.5GM/LT,2009-02-04T19:50:20,2009,2
ANDHRA PRADESH,9999,0   ,KHARIF,9999,0,9999,9999,BLANK CALL,BLANK CALL,2009-02-04T21:09:50,2009,2
ANDHRA PRADESH,9999,0   ,KHARIF,9999,0,9999,9999,BLANK CALL,BLANK CALL,2009-02-05T07:07:55,2009,2
ANDHRA PRADESH,9999,0   ,KHARIF,9999,0,9999,9999,BLANK CALL,BLANK CALL,2009-02-05T08:10:12,2009,2
ANDHRA PRADESH,KRISHNA,0   ,KHARIF,9999,0,9999,9999,ASKED ABOUT CONTROL FOR GALLMIDGE DAMAGE,RECOMMENDED TO APPLY CARBOFURON GRANULES 10KGS/ACRE,2009-02-05T09:41:09,2009,2
ANDHRA PRADESH,KURNOOL,0   ,KHARIF,9999,0,9999,9999,ASKED ABOUT THE CONTROL OF STEM BORER,RECOMMENDED TO SPRAY CARTAP HYDROCHLORIDE 2GM/LTR,2009-02-05T10:49:26,2009,2
ANDHRA PRADESH,Y S R ,0   ,KHARIF,9999,0,9999,9999,ASKED ABOUT CONTROL FOR FRUIT BORER,RECOMMENDED TO SPRAY PROPHINOPHOS 2ML/LT,2009-02-05T11:49:43,2009,2
ANDHRA PRADESH,WEST GODAVARI,0   ,KHARIF,AGRICULTURE,0,1075,29,ASKED ABOUT VARIETIES FOR MAIZE,RECOMMENDED TO CHOOSE DHM-103 OR 105 OR 107,2009-02-05T12:24:11,2009,2
ANDHRA PRADESH,WEST GODAVARI,0   ,KHARIF,9999,0,9999,9999,ASKED ABOUT CONTROL FOR GALLMIDGE,"RECOMMENDED TO APPLY PHORATE 10G, 5KG/ACRE",2009-02-05T12:40:11,2009,2
ANDHRA PRADESH,EAST GODAVARI,0   ,KHARIF,9999,0,9999,9999,ASKED ABOUT CONTROL FOR STEM BORER DAMAGE,RECOMMENDED TO APPLY CORTOP HYDROCHLORIDE GRANULES 8KGS/ACRE,2009-02-05T13:29:59,2009,2
ANDHRA PRADESH,EAST GODAVARI,0   ,KHARIF,9999,0,9999,9999,ASKED ABOUT CONTROL FOR WEEDS,RECOMMENDED TO SPRAY PARAQUAT 40ML/10LT,2009-02-05T16:53:07,2009,2
ANDHRA PRADESH,WEST GODAVARI,0   ,KHARIF,AGRICULTURE,0,1137,2,ASKED ABOUT THE CONTROL OF BLAST IN RICE,RECOMMENDED TO SPRAY TRICYCLOZOLE 0.6GM/LT,2009-02-11T11:15:33,2009,2
ANDHRA PRADESH,GUNTUR,0   ,KHARIF,9999,0,9999,9999,ASKED ABOUT CONTROL FOR STEM BORER,RECOMMENDED TO SPRAY ENDOSULPHAN 2ML/LT,2009-02-11T11:29:56,2009,2
ANDHRA PRADESH,KRISHNA,0   ,KHARIF,AGRICULTURE,0,1137,Fertilizer Use and Availability,ASKED ABOUT THE FERTILISER RECOMMENDATION IN RICE,RECOMMENDED N-P-K FERTILISERS IN THE RANGE OF 48-24-16KG/ACRE,2009-02-11T18:10:25,2009,2
ANDHRA PRADESH,GUNTUR,0   ,KHARIF,AGRICULTURE,0,1137,2,ASKED ABOUT THE CONTROL OF BLAST IN RICE,RECOMMENDED TO SPRAY TRICYCLOZOLE 0.6GM/LT,2009-02-11T18:35:33,2009,2
ANDHRA PRADESH,9999,0   ,KHARIF,9999,0,9999,9999,BLANK CALL,BLANK CALL,2009-02-11T19:24:04,2009,2
ANDHRA PRADESH,WEST GODAVARI,0   ,KHARIF,9999,0,9999,9999,ASKED ABOUT CONTROL FOR STEM BORER DAMAGE,RECOMMENDED TO SPRAY CORTOP HYDROCHLORIDE 2GR/LITRE,2009-02-11T19:26:34,2009,2
ANDHRA PRADESH,9999,0   ,KHARIF,9999,0,9999,9999,BLANK CALL,BLANK CALL,2009-02-12T08:19:45,2009,2
ANDHRA PRADESH,CHITTOOR,0   ,KHARIF,9999,0,9999,9999,ASKED ABOUT MARKET INFORMATION,GIVEN PRICE IS 900-990,2009-02-12T09:24:40,2009,2
