StateName,DistrictName,BlockName,Season,Sector,Category,Crop,QueryType,QueryText,KccAns,CreatedOn,year,month
ANDHRA PRADESH,WEST GODAVARI,0   ,KHARIF,9999,0,9999,9999,ASKED ABOUT CONTROL FOR POWDERY MILDEW,RECOMMENDED TO SPRAY WETTABLE SULPHER 3GR/LITRE,2009-02-12T09:49:05,2009,2
ANDHRA PRADESH,GUNTUR,0   ,KHARIF,9999,0,9999,9999,ASKED ABOUT CONTROL FOR WILT,RECOMMENDED TO SPRAY COC 3GM/LT,2009-02-12T11:42:13,2009,2
ANDHRA PRADESH,PRAKASAM,0   ,KHARIF,AGRICULTURE,0,Cotton (Kapas),3,ASKED ABOUT THE CONTROL OF SUCKING PEST IN COTTON,RECOMMENDED TO SPRAY IMIDACLOPRID@2ML/LITER,2009-02-13T19:51:25,2009,2
ANDHRA PRADESH,WEST GODAVARI,0   ,KHARIF,9999,0,9999,9999,ASKED ABOUT THE CONTROL OF ZINC DEFICIENCY,RECOMMENDED TO SPRAY ZINC SULPHATE@2ML/LITER,2009-02-13T20:34:21,2009,2
ANDHRA PRADESH,EAST GODAVARI,0   ,KHARIF,9999,0,9999,9999,ASKED ABOUT CONTROL FOR SHEATH BLIGHT,RECOMMENDED TO SPRAY HEXACONAZOLE 2ML/LT,2009-02-14T07:06:12,2009,2
ANDHRA PRADESH,EAST GODAVARI,0   ,KHARIF,AGRICULTURE,0,1137,2,ASKED ABOUT CONTROL FOR RICE BLAST,RECOMMENDED TO SPRAY TRICYCLOZOLE 120GR/200 LITRES/ ACRE,2009-02-14T09:46:42,2009,2
ANDHRA PRADESH,NELLORE,0   ,KHARIF,9999,0,9999,9999,ASKED ABOUT CONTROL FOR GUNDIBUG,RECOMMENDED TO SPRAY ENDOSULPHON 2ML/LT,2009-02-14T10:12:36,2009,2
ANDHRA PRADESH,NELLORE,0   ,KHARIF,9999,0,9999,9999,ASKED ABOUT CONTROL FOR IRON DEFICIENCY,RECOMMENDED TO SPRAY IRONSULPHATE 20GM/LT,2009-02-14T12:42:34,2009,2
ANDHRA PRADESH,9999,0   ,KHARIF,9999,0,9999,9999,BLANK CALL,BLANK CALL,2009-02-14T12:55:50,2009,2
ANDHRA PRADESH,GUNTUR,0   ,KHARIF,9999,0,9999,9999,ASKED ABOUT CONTROL FOR LEAF FOLDER DAMAGE,RECOMMENDED TO SPRAY CHLORPYRIPOS 2.5ML/LITRE,2009-02-14T13:48:34,2009,2
ANDHRA PRADESH,9999,0   ,KHARIF,9999,0,9999,9999,CALL DISCONNECTED,CALL DISCONNECTED,2009-02-09T16:52:13,2009,2
ANDHRA PRADESH,KRISHNA,0   ,KHARIF,HORTICULTURE,0,1268,29,ASKED ABOUT THE CONTROL OF MANGO HOPPERS IN MANGO,RECOMMENDED TO SPRAY PHOSPHOMIDON 0.5ML/LT,2009-02-09T18:39:06,2009,2
ANDHRA PRADESH,CHITTOOR,0   ,KHARIF,9999,0,9999,9999,ASKED ABOUT THE CONTROL OF SHEATH BLIGHT IN PADDY,RECOMMENDED TO SPRAY HEXACONAZOLE@2ML/LITER,2009-02-10T07:23:23,2009,2
ANDHRA PRADESH,9999,0   ,KHARIF,9999,0,9999,9999,BLANK CALL,BLANK CALL,2009-02-10T10:12:37,2009,2
ANDHRA PRADESH,NELLORE,0   ,KHARIF,HORTICULTURE,0,Tomato,29,ASKED ABOUT THE CONTROL OF HELICOVERPA IN TOMATO,RECOMMENDED TO SPRAY QUINOLPHOS 2ML/LT,2009-02-10T11:16:46,2009,2
ANDHRA PRADESH,ANANTPUR,0   ,KHARIF,9999,0,9999,9999,ASKED ABOUT THE CONTROL OF TIKKA LEAF SPOT IN GROUND NUT,RECOMMENDED TO SPRAY CHLOROTHALANIL 2ML/LT,2009-02-10T13:21:48,2009,2
ANDHRA PRADESH,KURNOOL,0   ,KHARIF,9999,0,9999,9999,ASKED ABOUT THE SOWING SEASON,RECOMMENDED TO TAKE UP SOWING THIS MONTH,2009-02-12T16:10:12,2009,2
ANDHRA PRADESH,EAST GODAVARI,0   ,KHARIF,HORTICULTURE,0,1280,29,ASKED ABOUT THE CONTROL OF THRIPS IN CHILLIES,RECOMMENDED TO SPRAY ACEPHATE@1.5GRAMS/LITER,2009-02-13T14:10:18,2009,2
ANDHRA PRADESH,CHITTOOR,0   ,KHARIF,9999,0,9999,9999,ASKED ABOUT THE N-P-K RECOMMENDATION IN SUGAR CANE,RECOMMENDED N-P-K ARE 90-40-48KG/ACRE,2009-02-13T16:49:10,2009,2
ANDHRA PRADESH,EAST GODAVARI,0   ,KHARIF,9999,0,9999,9999,ASKED ABOUT APPLICATION OF NEEM OIL,RECOMMENDED TO SPRAY 5ML/LITRE,2009-02-10T14:22:46,2009,2
ANDHRA PRADESH,PRAKASAM,0   ,KHARIF,AGRICULTURE,0,Tobacco,3,ASKED ABOUT CONTROL FOR WHITEFLY DAMAGE IN TOBACCO,RECOMMENDED TO SPRAY ACEPATE 1GR/LITRE,2009-02-10T15:20:29,2009,2
ANDHRA PRADESH,KRISHNA,0   ,KHARIF,AGRICULTURE,0,1137,2,ASKED ABOUT THE CONTROL OF BLAST IN RICE,RECOMMENDED TO SPRAY TRICYCLOZOLE 0.6GM/LT,2009-02-10T16:22:03,2009,2
ANDHRA PRADESH,GUNTUR,0   ,KHARIF,AGRICULTURE,0,1075,3,ASKED ABOUT THE CONTROL OF PINK BORER IN MAIZE,RECOMMENDED TO SPRAY ENDOSULFON GRANULES 10KG/ACRE,2009-02-10T17:30:20,2009,2
ANDHRA PRADESH,KRISHNA,0   ,KHARIF,AGRICULTURE,0,1137,3,ASKED ABOUT THE CONTROL OF SYEM BORER IN RICE,RECOMMENDED TO SPRAY CARBOFURON 3G GRANULES 10KG/ACRE,2009-02-10T17:41:38,2009,2
ANDHRA PRADESH,VIZIANAGARM,0   ,KHARIF,9999,0,9999,9999,ASKED ABOUT CONTROL FOR LEAF FOLDER,RECOMMENDED TO APPLY QUINALPHOS 2ML/LT,2009-02-10T19:06:59,2009,2
ANDHRA PRADESH,GUNTUR,0   ,KHARIF,9999,0,9999,9999,ASKED ABOUT CONTROL FOR WEED,RECOMMENDED TO SPRAY PENDIMETHALIN 1.6LT/ACRE,2009-02-10T19:19:44,2009,2
ANDHRA PRADESH,9999,0   ,KHARIF,9999,0,9999,9999,BLANK CALL,BLANK CALL,2009-02-10T20:20:06,2009,2
ANDHRA PRADESH,9999,0   ,KHARIF,9999,0,9999,9999,BLANK CALL,BLANK CALL,2009-02-12T20:04:00,2009,2
ANDHRA PRADESH,9999,0   ,KHARIF,9999,0,9999,9999,BLANK CALL,BLANK CALL,2009-02-08T17:51:03,2009,2
ANDHRA PRADESH,PRAKASAM,0   ,KHARIF,9999,0,9999,9999,ASKED ABOUT CONTROL FOR STEM BORER DAMAGE,RECOMMENDED TO SPRAY CORTOP HYDROCHLORIDE 2GR/LITRE,2009-02-09T12:11:14,2009,2
ANDHRA PRADESH,GUNTUR,0   ,KHARIF,HORTICULTURE,0,1280,29,ASKED ABOUT THE CONTROL OF THRIPS IN CHILLIES,RECOMMENDED TO SPRAY ACEPHATE@1.5GRAMS/LITER,2009-02-09T16:31:03,2009,2
ANDHRA PRADESH,9999,0   ,KHARIF,9999,0,9999,9999,CALL DISCONNECTED,CALL DISCONNECTED,2009-02-07T09:51:33,2009,2
ANDHRA PRADESH,NELLORE,0   ,KHARIF,9999,0,9999,9999,ASKED ABOUT CONTROL FOR STEM ROT,RECOMMENDED TO SPRAY TILT 1ML/LT,2009-02-07T11:48:18,2009,2
ANDHRA PRADESH,EAST GODAVARI,0   ,KHARIF,9999,0,9999,9999,ASKED THAT WILL THERE BE ANY PROBLEM IF THERE IS GROWTH OF AZOLLA IN PADDY FIELD,INFORMED THAT IT IS USEFUL TO THE FIELD AND THERE IS NO PROBLEM WITH THAT,2009-02-07T12:20:49,2009,2
ANDHRA PRADESH,NELLORE,0   ,KHARIF,HORTICULTURE,0,1268,29,ASKED ABOUT THE CONTROL OF SUCKING PEST IN MANGO,RECOMMENDED TO SPRAY ACEPHATE@1.5GRAMS/LIT,2009-02-07T16:58:38,2009,2
ANDHRA PRADESH,CHITTOOR,0   ,KHARIF,HORTICULTURE,0,Ber,29,ASKED ABOUT THE VARIETIES IN CUCUMBER,RECOMMENDED TO SOW SHAKTHI VARIETY,2009-02-07T18:45:25,2009,2
ANDHRA PRADESH,CHITTOOR,0   ,KHARIF,9999,0,9999,9999,ASKED ABOUT THE SOWING SEASON,INFORMED THAT IT IS FROM MID APRIL TO MAY 1ST WEEK,2009-02-22T11:21:29,2009,2
ANDHRA PRADESH,GUNTUR,0   ,KHARIF,9999,0,9999,9999,ASKED ABOUT CONTROL FOR POWDERY MILDEW,RECOMMENDED TO APPLY SULPHUR 2GM/LT,2009-02-25T09:55:30,2009,2
ANDHRA PRADESH,ANANTPUR,0   ,KHARIF,HORTICULTURE,0,1280,29,ASKED ABOUT THE CONTROL OF THRIPS IN CHILLIES,RECOMMENDED TO SPRAY ACEPHATE@1.5GRAMS/LITER,2009-02-25T15:58:00,2009,2
ANDHRA PRADESH,GUNTUR,0   ,KHARIF,HORTICULTURE,0,1280,29,ASKED ABOUT THE CONTROL OF THRIPS IN CHILLIES,RECOMMENDED TO SPRAY ACEPHATE@1.5GRAMS/LITER,2009-02-23T20:43:26,2009,2
ANDHRA PRADESH,ANANTPUR,0   ,KHARIF,9999,0,9999,9999,ASKED ABOUT THE CONTROL OF BLAST IN PADDY,RECOMMENDED TO SPRAY TRYCYCLOZOLE@0.6GRAMS/LITER,2009-02-24T09:43:19,2009,2
ANDHRA PRADESH,ANANTPUR,0   ,KHARIF,9999,0,9999,9999,ASKED ABOUT CONTROL FOR SUCKING PEST,RECOMMENDED TO SPRAY MALATHION 1ML/LT,2009-02-23T10:12:45,2009,2
ANDHRA PRADESH,9999,0   ,KHARIF,9999,0,9999,9999,BLANK CALL,BLANK CALL,2009-02-18T20:09:27,2009,2
ANDHRA PRADESH,9999,0   ,KHARIF,9999,0,9999,9999,BLANK CALL,BLANK CALL,2009-02-18T21:46:49,2009,2
ANDHRA PRADESH,NELLORE,0   ,KHARIF,9999,0,9999,9999,ASKED ABOUT THE CONTROL OF BPH IN PADDY,RECOMMENDED TO SPRAY ACEPHATE@1.5GRAMS/LITER,2009-02-19T08:13:29,2009,2
ANDHRA PRADESH,SRIKAKULAM,0   ,KHARIF,9999,0,9999,9999,ASKED ABOUT CONTROL FOR Mg DEFICIENCY,RECOMMENDED TO SPRAY MgSO4 2GR/LITRE,2009-02-19T09:50:58,2009,2
ANDHRA PRADESH,CHITTOOR,0   ,KHARIF,9999,0,9999,9999,ASKED ABOUT FERTILIZER INFORMATION,"RECOMMENDED TO APPLY 48KG N, 24KG P,24KG K",2009-02-19T14:14:56,2009,2
ANDHRA PRADESH,CHITTOOR,0   ,KHARIF,9999,0,9999,9999,ASKED ABOUT CONTROL FOR FLOWER DROPPING,RECOMMENDED TO SPRAY PLONOFIX 1ML/LT,2009-02-19T15:51:28,2009,2
ANDHRA PRADESH,GUNTUR,0   ,KHARIF,9999,0,9999,9999,ASKED ABOUT CONTROL FOR APHIDS,RECOMMENDED TO SPRAY ACEPHATE 1GM/LT,2009-02-21T16:49:58,2009,2
ANDHRA PRADESH,9999,0   ,KHARIF,9999,0,9999,9999,CALL DISCONNECTED,CALL DISCONNECTED,2009-02-21T18:13:34,2009,2
ANDHRA PRADESH,9999,0   ,KHARIF,9999,0,9999,9999,BLANK CALL,BLANK CALL,2009-02-21T20:16:03,2009,2
ANDHRA PRADESH,9999,0   ,KHARIF,9999,0,9999,9999,CALL DISCONNECTED,CALL DISCONNECTED,2009-02-22T06:49:54,2009,2
ANDHRA PRADESH,9999,0   ,KHARIF,9999,0,9999,9999,BLANK CALL,BLANK CALL,2009-02-22T08:48:57,2009,2
ANDHRA PRADESH,KRISHNA,0   ,KHARIF,9999,0,9999,9999,ASKED ABOUT THE CONTROL OF SHE5TH BLIGHT IN PADDY,RECOMMENDEDE TO SPRAY HEXACONAZOLE@2ML/LITER,2009-02-26T19:16:50,2009,2
ANDHRA PRADESH,KURNOOL,0   ,KHARIF,9999,0,9999,9999,ASKED ABOUT VARIETIES,RECOMMENDED TO CHOOSE MAHICO HYBRIDS,2009-02-27T09:51:43,2009,2
ANDHRA PRADESH,9999,0   ,KHARIF,9999,0,9999,9999,BLANK CALL,BLANK CALL,2009-02-25T18:26:24,2009,2
ANDHRA PRADESH,NELLORE,0   ,KHARIF,9999,0,9999,9999,ASKED ABOUT CONTROL FOR STEM BORER DAMAGE,RECOMMENDED TO SPRAY CHLORPYRIPOS 2.5ML/LITRE,2009-02-26T10:59:24,2009,2
ANDHRA PRADESH,NELLORE,0   ,KHARIF,9999,0,9999,9999,ASKED ABOUT CONTROL FOR BPH,RECOMMENDED TO SPRAY ACEPHATE 1.5GR/LITRE,2009-02-26T11:13:09,2009,2
ANDHRA PRADESH,9999,0   ,KHARIF,9999,0,9999,9999,BLANK CALL,BLANK CALL,2009-02-26T12:44:52,2009,2
ANDHRA PRADESH,9999,0   ,KHARIF,9999,0,9999,9999,BLANK CALL,BLANK CALL,2009-02-26T12:48:52,2009,2
ANDHRA PRADESH,9999,0   ,KHARIF,9999,0,9999,9999,CALL DISCONNECTED,CALL DISCONNECTED,2009-02-27T18:27:08,2009,2
ANDHRA PRADESH,ANANTPUR,0   ,KHARIF,9999,0,9999,9999,ASKED ABOUT THE SOWING SEASON,INFORMED THAT IT IS FROM OCTOBER-15 TO NOVEMBER-15,2009-02-27T19:18:18,2009,2
ANDHRA PRADESH,EAST GODAVARI,0   ,KHARIF,AGRICULTURE,0,1137,2,ASKED ABOUT THE CONTROL OF RICE BLAST,RECOMMENDED TO SPRAY TRICYCLOZOLE 0.6 GM/LTR,2009-02-28T09:10:44,2009,2
ANDHRA PRADESH,9999,0   ,KHARIF,9999,0,9999,9999,BLANK CALL,BLANK CALL,2009-02-16T10:45:20,2009,2
ANDHRA PRADESH,KURNOOL,0   ,KHARIF,HORTICULTURE,0,Onion,5,ASKED ABOUT THE VARIETIES IN ONION,RECOMMENDEDE ARKA PRAGATHI VARIETY,2009-02-16T11:14:24,2009,2
ANDHRA PRADESH,KRISHNA,0   ,KHARIF,9999,0,9999,9999,ASKED ABOUT CONTROL FOR SPOTTED BOLLWORM,RECOMMENDED TO SPRAY CARBARYL 3GR/LITRE,2009-02-16T11:56:47,2009,2
ANDHRA PRADESH,CHITTOOR,0   ,KHARIF,9999,0,9999,9999,ASKED ABOUT CONTROL FOR LEAF SPOTS,RECOMMENDED TO SPRAY BAVISTIN 1GR/LITRE,2009-02-16T15:06:32,2009,2
ANDHRA PRADESH,GUNTUR,0   ,KHARIF,9999,0,9999,9999,ASKED ABOUT VARIETIES,RECOMMENDED TO CHOOSE T9 OR LBG 20,2009-02-16T16:19:08,2009,2
ANDHRA PRADESH,PRAKASAM,0   ,KHARIF,AGRICULTURE,0,1137,2,ASKED ABOUT THE CO TROL OF BLAST IN RICE,RECOMMENDED TO SPRAY TRICYCLOZOLE 0.6GM/LT,2009-02-14T12:31:41,2009,2
ANDHRA PRADESH,9999,0   ,KHARIF,9999,0,9999,9999,CONTROL OF STEM ROT IN ROSE.,SPRAY MANCOZEB @ 2.5 GM/LIT. OF WATER.,2009-02-14T20:40:55,2009,2
ANDHRA PRADESH,KRISHNA,0   ,KHARIF,AGRICULTURE,0,1137,2,ASKED ABOUT CONTROL FOR RICE BLAST,RECOMMENDED TO SPRAY BEAM 120GR/200 LITRES/ ACRE,2009-02-11T20:15:26,2009,2
ANDHRA PRADESH,9999,0   ,KHARIF,9999,0,9999,9999,BLANK CALL,BLANK CALL,2009-02-11T21:50:01,2009,2
ANDHRA PRADESH,WEST GODAVARI,0   ,KHARIF,9999,0,9999,9999,ASKED ABOUT CONTROL FOR THRIPS,RECOMMENDED TO SPRAY DIMETHOATE 2ML/LT,2009-02-12T06:23:12,2009,2
ANDHRA PRADESH,NELLORE,0   ,KHARIF,9999,0,9999,9999,ASKED ABOUT CONTROL FOR TOBACO CATERPILLER,RECOMMENDED TO SPRAY MONOCHROTOPHOS 1.6ML/LT,2009-02-12T09:17:26,2009,2
ANDHRA PRADESH,PRAKASAM,0   ,KHARIF,9999,0,9999,9999,ASKED ABOUT CONTROL FOR PEST ATTACK ON PADDY BAGS,RECOMMENDED TO APPLY ALUMINIUM PHOSPIDE,2009-02-12T10:09:34,2009,2
ANDHRA PRADESH,9999,0   ,KHARIF,9999,0,9999,9999,BLANK CALL,BLANK CALL,2009-02-28T15:12:31,2009,2
ANDHRA PRADESH,WEST GODAVARI,0   ,KHARIF,AGRICULTURE,0,Tobacco,29,ASKED ABOUT CONTROL FOR ORABANCHE PLANTS IN TOBACCO CROP,RECOMMENDED TO SPRAY ALLYL ALCHOHAL 1ML/LITRE,2009-02-28T17:15:15,2009,2
ANDHRA PRADESH,CHITTOOR,0   ,KHARIF,9999,0,9999,9999,ASKED ABOUT THE CONTROL OF FLOWER DROP,RECOMMENMDED TO SPRWAY PLANOPHIX 1ML/5LTR,2009-02-02T06:44:49,2009,2
ANDHRA PRADESH,VIZIANAGARM,0   ,KHARIF,9999,0,9999,9999,ASKED ABOUT THE CONTROL OF FRUIT DROP,RECOMMENDED TO APPLY POTASH AND BLITOX 3GM/LTR,2009-02-02T07:21:46,2009,2
ANDHRA PRADESH,9999,0   ,KHARIF,9999,0,9999,9999,BLANK CALL,BLANK CALL,2009-02-02T08:24:34,2009,2
ANDHRA PRADESH,WEST GODAVARI,0   ,KHARIF,9999,0,9999,9999,ASKED ABOUT CONTROL FOR STEM BORER DAMAGE,RECOMMENDED TO APPLY ENDOSULFON 3KGS/ACRE,2009-02-02T10:07:23,2009,2
ANDHRA PRADESH,9999,0   ,KHARIF,9999,0,9999,9999,CALL DISCONNECTED,CALL DISCONNECTED,2009-02-02T12:39:08,2009,2
ANDHRA PRADESH,CHITTOOR,0   ,KHARIF,9999,0,9999,9999,ASKED ABOUT CONTROL FOR SHEATH BLIGHT,RECOMMENDED TO SPRAY TILT 1ML/LITRE,2009-02-02T13:23:52,2009,2
ANDHRA PRADESH,9999,0   ,KHARIF,9999,0,9999,9999,BLANK CALL,BLANK CALL,2009-02-01T08:11:43,2009,2
ANDHRA PRADESH,GUNTUR,0   ,KHARIF,AGRICULTURE,0,1075,3,ASKED ABOUT THE CONTROL OF SPOTTED STEM BORER IN MAIZE,RECOMMENDED TO SPRAY ENDOSULFON 2ML/LT,2009-02-03T10:21:07,2009,2
ANDHRA PRADESH,KRISHNA,0   ,KHARIF,AGRICULTURE,0,1037,2,ASKED ABOUT THE CONTROL OF RUST IN BLACK GRAM,RECOMMENDED TO SPARY CHLOROTHALONIL@2.5GRAMS/LIT,2009-02-03T12:40:29,2009,2
ANDHRA PRADESH,CHITTOOR,0   ,KHARIF,HORTICULTURE,0,1296,29,ASKED ABOUT THE CONTROL OF LEAF EATING CATTERPILLER IN POTATO,RECOMMENDED TO SPRAY ENDOSULPHAN@2ML/LIT,2009-02-03T13:16:14,2009,2
ANDHRA PRADESH,PRAKASAM,0   ,KHARIF,9999,0,9999,9999,ASKED ABOUT CONTROL FOR STEM BORER DAMAGE,RECOMMENDED TO SPRAY ENDOSULFON 3KGS/ACRE,2009-02-03T14:12:39,2009,2
ANDHRA PRADESH,ANANTPUR,0   ,KHARIF,9999,0,9999,9999,ASKED ABOUT CONTROL FOR TIKKALEAF SPOT,RECOMMENDED TO SPRAY CHLOROTHALONIL 400GM/ACRE,2009-02-04T12:29:35,2009,2
ANDHRA PRADESH,EAST GODAVARI,0   ,KHARIF,AGRICULTURE,0,1137,2,ASKED ABOUT CONTROL FOR RICE BLAST,RECOMMENDED TO SPRAY TRICYCLOZOLE 120GR/200 LITRES,2009-02-04T13:52:52,2009,2
ANDHRA PRADESH,ANANTPUR,0   ,KHARIF,9999,0,9999,9999,ASKED ABOUT THE CONTROL OF YELLOW STEM BORER,RECOMMENDED TO SPRAY CARTAP HYDRO CHLORIDE@2GRAMS/LIT,2009-02-04T14:59:01,2009,2
ANDHRA PRADESH,EAST GODAVARI,0   ,KHARIF,9999,0,9999,9999,ASKED ABOUT CONTROL FOR WEED,RECOMMENDED TO APPLY BUTACHLORE 1.5-2LT/ACRE,2009-02-04T15:55:30,2009,2
ANDHRA PRADESH,KURNOOL,0   ,KHARIF,HORTICULTURE,0,1280,29,ASKED ABOUT THE CONTROL OF THRIPS IN CHILLIES,RECOMMENDED TO SPRAY ACEPHATE@1.5GRAMS/LIT,2009-02-04T16:10:58,2009,2
ANDHRA PRADESH,NELLORE,0   ,KHARIF,9999,0,9999,9999,ASKED ABOUT THE CONTROL OF BLAST IN PADDY,RECOMMENDED TO SPRAY TRYCYCLOZOLE@0.06GRAMS/LITER,2009-02-04T16:19:45,2009,2
ANDHRA PRADESH,NELLORE,0   ,KHARIF,9999,0,9999,9999,ASKED ABOUT WEATHER REPORT,NO CHANCE OF RAIN ON TUESDAY,2009-02-04T16:21:27,2009,2
ANDHRA PRADESH,NELLORE,0   ,KHARIF,AGRICULTURE,0,1137,3,ASKED ABOUT THE CONTROL OF HISPA IN RICE,RECOMMENDED TO SPRAY CHLORIPIRIPHOS 2ML/LT,2009-02-02T15:41:29,2009,2
ANDHRA PRADESH,KRISHNA,0   ,KHARIF,AGRICULTURE,0,1137,2,ASKLED ABOUT THE CONTROL OF BLAST IN RICE,RECOMMENDED TO SPRAY TRICYCLOZOLE 0.06GM/LT,2009-02-02T16:37:53,2009,2
ANDHRA PRADESH,WEST GODAVARI,0   ,KHARIF,9999,0,9999,9999,ASKED ABOUT THE CONTROL OF YELLOW STEM BORER,RECOMMENDED TO SPRAY ENDOSULPHAN@2ML/LIT,2009-02-02T17:59:01,2009,2
ANDHRA PRADESH,EAST GODAVARI,0   ,KHARIF,9999,0,9999,9999,ASKED ABOUT THE CONTROL OF BLAST IN PADDY,RECOMMENDED TO SPRAY TRYCYCLOZOLE@.6GRAMS/LIT,2009-02-02T19:19:27,2009,2
ANDHRA PRADESH,NELLORE,0   ,KHARIF,9999,0,9999,9999,ASKED ABOUT THE CONTROL OF SHEATH BLIGHT IN PADDY,RECOMMENDED TO SPRAY HEXACONAZOLE@2ML/LIT,2009-02-03T14:29:11,2009,2
ANDHRA PRADESH,GUNTUR,0   ,KHARIF,9999,0,9999,9999,ASKED ABOUT THE VARIETIES IN KORRA,RECOMMENDED KRISHNADEVARAYA VARIETY AS A SUMMER CROP,2009-02-03T16:32:25,2009,2
ANDHRA PRADESH,9999,0   ,KHARIF,9999,0,9999,9999,DISCONNECTED,DISCONNECTED,2009-02-17T17:46:23,2009,2
ANDHRA PRADESH,9999,0   ,KHARIF,9999,0,9999,9999,BLANK CALL,BLANK CALL,2009-02-17T17:50:21,2009,2
ANDHRA PRADESH,9999,0   ,KHARIF,9999,0,9999,9999,BLANK CALL,BLANK CALL,2009-02-17T17:50:21,2009,2
ANDHRA PRADESH,9999,0   ,KHARIF,9999,0,9999,9999,BLANK CALL,BLANK CALL,2009-02-17T17:52:16,2009,2
ANDHRA PRADESH,9999,0   ,KHARIF,9999,0,9999,9999,CALL DISCONNECTED,CALL DISCONNECTED,2009-02-17T17:56:02,2009,2
ANDHRA PRADESH,9999,0   ,KHARIF,9999,0,9999,9999,CALL DISCONNECTED,CALL DISCONNECTED,2009-02-17T17:56:02,2009,2
ANDHRA PRADESH,9999,0   ,KHARIF,9999,0,9999,9999,BLANK CALL,BLANK CALL,2009-02-17T21:14:35,2009,2
ANDHRA PRADESH,KRISHNA,0   ,KHARIF,AGRICULTURE,0,1137,2,ASKED ABOUT THE CONTROL OF RICE TUNGRO VIRUS,RECOMMENDED TO REMOVE EFFECTED TILLERS,2009-02-18T06:41:47,2009,2
ANDHRA PRADESH,9999,0   ,KHARIF,9999,0,9999,9999,CALL DISCONNECTED,CALL DISCONNECTED,2009-02-18T08:44:56,2009,2
ANDHRA PRADESH,9999,0   ,KHARIF,9999,0,9999,9999,BLANK CALL,BLANK CALL,2009-02-04T21:11:50,2009,2
ANDHRA PRADESH,9999,0   ,KHARIF,9999,0,9999,9999,BLANK CALL,BLANK CALL,2009-02-04T21:52:12,2009,2
ANDHRA PRADESH,9999,0   ,KHARIF,9999,0,9999,9999,BLANK CALL,BLANK CALL,2009-02-04T21:55:12,2009,2
ANDHRA PRADESH,9999,0   ,KHARIF,9999,0,9999,9999,BLANK CALL,BLANK CALL,2009-02-05T08:05:12,2009,2
ANDHRA PRADESH,PRAKASAM,0   ,KHARIF,9999,0,9999,9999,ASKED ABOUT THE CONTROL OF CANKER,RECOMMENDED TO SPRAY 1GM STREPTOCYCLIN + 30 GM BLITOX IN 10 LTR WATER AND ALSO APPLY BORDEAUX PASTE,2009-02-05T13:12:04,2009,2
ANDHRA PRADESH,GUNTUR,0   ,KHARIF,9999,0,9999,9999,ASKED ABOUT CONTROL FOR FLOWER DROP,RECOMMENDED TO SPRAY PLANOPHIX 1ML/ 4.5LITRES,2009-02-05T13:39:27,2009,2
ANDHRA PRADESH,KRISHNA,0   ,KHARIF,AGRICULTURE,0,1137,2,ASKED ABOUT THE CONTROL OF BLAST IN RICE,RECOMMENDED TO SPRAY TRICYCLOZOLE 0.6GM/LT,2009-02-06T09:35:19,2009,2
ANDHRA PRADESH,NELLORE,0   ,KHARIF,9999,0,9999,9999,ASKED ABOUT WEATHER,THERE IS NO CHANCE OF RAIN,2009-02-06T09:47:57,2009,2
ANDHRA PRADESH,KRISHNA,0   ,KHARIF,9999,0,9999,9999,ASKED ABOUT THE VARIETIES IN MUSTURD,RECOMMENDED TO SOW SWETHATHIL VARIETY,2009-02-06T17:41:02,2009,2
ANDHRA PRADESH,ANANTPUR,0   ,KHARIF,HORTICULTURE,0,Curry Leaf,29,ASKED ABOUT THE VARIETIES IN CUCURBITS,RECOMMENDED PUSA NASDEER VARIETY,2009-02-05T17:24:01,2009,2
ANDHRA PRADESH,WEST GODAVARI,0   ,KHARIF,AGRICULTURE,0,1075,Fertilizer Use and Availability,ASKED ABOUT THE FERTILISER REQUIREMENT IN MAIZE,"RECOMMENSED FERTILISERS ARE N-P-K,48-24-20KG/ACRE",2009-02-05T18:45:13,2009,2
ANDHRA PRADESH,EAST GODAVARI,0   ,KHARIF,AGRICULTURE,0,1137,2,ASKED ABOUT THE CONTROL OF BLAST IN RICE,RECOMMENDED TO SPRAY TRICYCLOZOLE 0.6GM/LT,2009-02-05T19:28:17,2009,2
ANDHRA PRADESH,9999,0   ,KHARIF,9999,0,9999,9999,BLANK CALL,BLANK CALL,2009-02-06T08:25:55,2009,2
ANDHRA PRADESH,ANANTPUR,0   ,KHARIF,HORTICULTURE,0,Curry Leaf,29,ASKED ABOUT THE CONTROL SUCKING PEST IN CUCURBITS,RECOMMENDED TO SPRAY ACEPHATE@1.5GRAMS/LITER,2009-02-06T20:56:57,2009,2
ANDHRA PRADESH,ANANTPUR,0   ,KHARIF,9999,0,9999,9999,ASKED ABOUT THE FERTILIZER DOSAGE,RECOMMENDED TO APPLY 50 GM P/PIT AND 200GM UREA AND200GM POTASH/PLANT,2009-02-07T06:41:36,2009,2
ANDHRA PRADESH,ANANTPUR,0   ,KHARIF,9999,0,9999,9999,ASKED ABOUT THE CONTROL OF BPH,RECOMMENDED TO SPRAY ACEPHATE 1.5 GM/LTR,2009-02-07T09:25:50,2009,2
ANDHRA PRADESH,KRISHNA,0   ,KHARIF,9999,0,9999,9999,ASKED BOUT CONTROL FOR STEM BORER DAMAGE,RECOMMENDED TO SPRAY CORTOP HYDROCHLORIDE,2009-02-07T10:09:37,2009,2
ANDHRA PRADESH,NELLORE,0   ,KHARIF,9999,0,9999,9999,ASKED ABOUT VARIETIES FOR PADDY,RECOMMENDED TO CHOOSE BHARANI OR SOMASHILA,2009-02-07T11:31:33,2009,2
ANDHRA PRADESH,KRISHNA,0   ,KHARIF,9999,0,9999,9999,ASKED ABOUT CONTROL FOR WEED,RECOMMENDED TO APPLY 1.5-2LT/ACRE,2009-02-07T12:02:39,2009,2
ANDHRA PRADESH,GUNTUR,0   ,KHARIF,9999,0,9999,9999,ASKED ABOUT THE VARIETIES,"RECOMMENDED VARIETIES ARE SWARNA,PRATHIBA,VIJETHA,SRIKAKULAM SANNALU",2009-02-09T07:15:42,2009,2
ANDHRA PRADESH,KURNOOL,0   ,KHARIF,9999,0,9999,9999,ASKED ABOUT THE CONTROL OF SHEATH ROT,RECOMMENDED TO SPRAY HEXACONOZOLE 2ML/LTR,2009-02-09T08:47:07,2009,2
ANDHRA PRADESH,NELLORE,0   ,KHARIF,9999,0,9999,9999,ASKED ABOUT THE CONTROL SHEATH ROT IN PADDY,RECOMMENDED TO SPRAY CARBENDAZIM@1GRAM/LITER,2009-02-09T11:34:16,2009,2
ANDHRA PRADESH,9999,0   ,KHARIF,9999,0,9999,9999,BLANK CALL,BLANK CALL,2009-02-15T21:56:14,2009,2
ANDHRA PRADESH,9999,0   ,KHARIF,9999,0,9999,9999,BLANK CALL,BLANK CALL,2009-02-16T07:12:29,2009,2
ANDHRA PRADESH,9999,0   ,KHARIF,9999,0,9999,9999,CALL DISCONNECTED,CALL DISCONNECTED,2009-02-16T07:59:29,2009,2
ANDHRA PRADESH,9999,0   ,KHARIF,9999,0,9999,9999,CALL DISCONNECTED,CALL DISCONNECTED,2009-02-16T07:59:29,2009,2
ANDHRA PRADESH,GUNTUR,0   ,KHARIF,9999,0,9999,9999,ASKED ABOUT CONTROL FOR SUCKING PESTS,RECOMMENDED TO SPRAY MONOCHROTOPOS 1.6GR/LITRE,2009-02-13T09:59:42,2009,2
ANDHRA PRADESH,ANANTPUR,0   ,KHARIF,9999,0,9999,9999,ASKED ABOUT SUBSIDY ON POWER TILLER,"GIVEN INFORMATION IS 30000 SUBSIDY ON THAT, IT WILL AVAILABLE ON Rs.1,09,840",2009-02-13T10:22:22,2009,2
ANDHRA PRADESH,Y S R ,0   ,KHARIF,9999,0,9999,9999,ASKED ABOUT THE CONTROL OF ROOT AND STEM ROT,RECOMMENDED TO APPLY BORDEAUX MIXTURE 4LTR/PLANT,2009-02-13T11:12:33,2009,2
ANDHRA PRADESH,9999,0   ,KHARIF,9999,0,9999,9999,BLANK CALL,BLANK CALL,2009-02-13T11:21:49,2009,2
ANDHRA PRADESH,WEST GODAVARI,0   ,KHARIF,AGRICULTURE,0,1137,2,ASKED ABOUT THE CONTROL OF BLAST IN RICE,RECOMMENDED TO SPRAY TRICYCLOZOLE 0.6GM/LT,2009-02-13T11:47:55,2009,2
ANDHRA PRADESH,9999,0   ,KHARIF,9999,0,9999,9999,BLANK CALL,BLANK CALL,2009-02-13T12:15:33,2009,2
ANDHRA PRADESH,PRAKASAM,0   ,KHARIF,AGRICULTURE,0,1137,2,ASKED ABOUT THE CONTROL OF RICE BLAST,RECOMMENDED TO SPRAY CARTAPHYDROCHLORIDE 2GM/LTR,2009-02-13T12:40:46,2009,2
ANDHRA PRADESH,KRISHNA,0   ,KHARIF,AGRICULTURE,0,1137,2,ASKED ABOUT THE CONTROL OF BLAST IN RICE,RECOMMENDED TO SPRAY TRICYCLOZOLE 0.6GM/LT,2009-02-13T16:31:05,2009,2
ANDHRA PRADESH,ANANTPUR,0   ,KHARIF,HORTICULTURE,0,1280,2,ASKED ABOUT THE CONTROL OF THRIPS IN CHILLIES,RECOMMENDED TO SPRAY ACEPHATE@1.5GRAMS/LITER,2009-02-13T18:29:58,2009,2
ANDHRA PRADESH,9999,0   ,KHARIF,9999,0,9999,9999,BLANK CALL,BLANK CALL,2009-02-16T20:05:47,2009,2
ANDHRA PRADESH,CHITTOOR,0   ,KHARIF,9999,0,9999,9999,ASKED ABOUT THE CONTROL OF BPH,RECOMMENDED TO SPRAY ACEPHATE 1.5 GM/LTR,2009-02-16T20:07:27,2009,2
ANDHRA PRADESH,CHITTOOR,0   ,KHARIF,AGRICULTURE,0,1037,3,ASKED ABOUT THE CONTROL OF GRAM CATERPILLAR,RECOMMENDED TO APPLY QUINOLPHAS 2ML/LTR,2009-02-17T07:18:36,2009,2
ANDHRA PRADESH,CHITTOOR,0   ,KHARIF,9999,0,9999,9999,ASKED ABOUT THE CONTROL OF INTERNODE BORER,RECOMMENDED TO SPRAY ENDOSULPHAN 2ML/LTR,2009-02-17T10:10:13,2009,2
ANDHRA PRADESH,GUNTUR,0   ,KHARIF,9999,0,9999,9999,ASKED ABOUT THE CONTROL OFROOT AND STEM ROT,RECOMMENDED TO APPLY CABENDAZIM 1GM/LTR,2009-02-17T10:35:51,2009,2
ANDHRA PRADESH,KURNOOL,0   ,KHARIF,9999,0,9999,9999,ASKED ABOUT THE CONTROL OF TIKKA LEAF SPOT IN GROUND NUT,RECOMMENDED TO SPRAY HEXACONAZOLE@2ML/LITER,2009-02-12T12:48:44,2009,2
ANDHRA PRADESH,KRISHNA,0   ,KHARIF,9999,0,9999,9999,ASKED ABOUT THE CONTROL OF SPOTTED POD BORER,RECOMMENDED TO SPRAY QUINOLPHAS 2ML/LKTR,2009-02-11T07:42:17,2009,2
ANDHRA PRADESH,NELLORE,0   ,KHARIF,9999,0,9999,9999,ASKED ABOUT THE CONTROLOF LEAF BLIGHT,ESC TO ATIC,2009-02-11T12:11:52,2009,2
ANDHRA PRADESH,9999,0   ,KHARIF,9999,0,9999,9999,BLANK CALL,BLANK CALL,2009-02-09T16:55:34,2009,2
ANDHRA PRADESH,NELLORE,0   ,KHARIF,9999,0,9999,9999,ASKJED ABOUT THE SOWING SEASON IN RAGI,RECOMMENDED SOWING SEASON IS JANAURAY-FEBRAURY IN SUMMER,2009-02-10T11:04:08,2009,2
ANDHRA PRADESH,CHITTOOR,0   ,KHARIF,9999,0,9999,9999,ASKED ABOUT THE UREA APPLICATION,"RECOMMENDED TO APPLY 60 KG UREA UN EQUAL 3 SPLITS OF 20 KG EACH AT 30,45AND 60 DYAS OF GROWTH",2009-02-10T12:41:50,2009,2
ANDHRA PRADESH,KURNOOL,0   ,KHARIF,9999,0,9999,9999,ASKED ABOUT THE CONTROL OF EARLY BLIGHT,RECOMMENDED TO SPRAY COPPER OXY CHLORIDE 3GM/LTR,2009-02-10T12:42:29,2009,2
ANDHRA PRADESH,CHITTOOR,0   ,KHARIF,9999,0,9999,9999,ASKED ABOUT THE CONTROL OF SHEATH BLIGHT IN PADDY,RECOMMENDED TO SPRAY HEXACONAZOLE@2ML/LITER,2009-02-10T12:50:07,2009,2
ANDHRA PRADESH,GUNTUR,0   ,KHARIF,9999,0,9999,9999,ASKED ABOUT THE CONTROL OF THRIPS,RECOMMENDED TO SPRAY ACEPHATE 1.5GM/LTR,2009-02-10T13:10:00,2009,2
ANDHRA PRADESH,KRISHNA,0   ,KHARIF,9999,0,9999,9999,ASKED ABOUT THE CONTROL OF BLAST IN PADDY,RECOMMENDED TO SPRAY TRYCYCLOZOLE@0.6GRAMS/LITER,2009-02-10T13:32:45,2009,2
ANDHRA PRADESH,KRISHNA,0   ,KHARIF,9999,0,9999,9999,ASKED ABOUT CONTROL FOR GALLMIDGE,"RECOMMENDEDN TO APPLY PHORATE10G ,5KG/ACRE",2009-02-07T14:49:00,2009,2
ANDHRA PRADESH,9999,0   ,KHARIF,9999,0,9999,9999,BLANK CALL,BLANK CALL,2009-02-08T09:57:23,2009,2
ANDHRA PRADESH,ANANTPUR,0   ,KHARIF,9999,0,9999,9999,ASKED ABOUT THE CONTROL OF BLAST IN PADDY,RECOMMENDED TO SPRAY TRYCYCLOZOLE@0.6GRAMS/LIT,2009-02-04T17:13:09,2009,2
ANDHRA PRADESH,CHITTOOR,0   ,KHARIF,AGRICULTURE,0,Sunflower (suryamukhi),Fertilizer Use and Availability,ASKED ABOUT THE FERITILISER REQUIREMENT IN SUNFLOWER,RECOMMENDED 30-36-12,2009-02-04T17:26:17,2009,2
ANDHRA PRADESH,KRISHNA,0   ,KHARIF,9999,0,9999,9999,ASKED ABOUT THE VARIETIES IN MUSTURD,RECOMMENDED CHANDANA/HIMA VARIETIES,2009-02-04T17:43:33,2009,2
ANDHRA PRADESH,9999,0   ,KHARIF,9999,0,9999,9999,BLANK CALL,BLANK CALL,2009-02-04T18:22:57,2009,2
ANDHRA PRADESH,WEST GODAVARI,0   ,KHARIF,9999,0,9999,9999,ASKED ABOUT THE CONTROL OF BLAST IN PADDY,RECOMMENDED VTO SPRAY TRYCYCLOZOLE@0.6GRAMS/LIT,2009-02-04T18:51:56,2009,2
ANDHRA PRADESH,PRAKASAM,0   ,KHARIF,AGRICULTURE,0,1075,3,ASKED ABOUT THE CONTROL OF SUCKING PEST IN MAIZE,RECOMMENDED TO SPRAY ACEPHATE@1.5GRAMS/LIT,2009-02-04T19:05:46,2009,2
ANDHRA PRADESH,CHITTOOR,0   ,KHARIF,9999,0,9999,9999,ASKED ABOUT THE CONTROL OF DIEBACK DISEASE,RECOMMENDED TO PSRAY COPPER OXY CHLORIDE 3GM/LTR,2009-02-10T14:41:17,2009,2
ANDHRA PRADESH,GUNTUR,0   ,KHARIF,9999,0,9999,9999,ASKED ABOUT CONTROL FOR WEED,RECOMMENDED TO SPRAY ATRAZINE 2LT/ACRE,2009-02-10T17:58:01,2009,2
ANDHRA PRADESH,9999,0   ,KHARIF,9999,0,9999,9999,BLANK CALL,BLANK CALL,2009-02-10T20:24:08,2009,2
ANDHRA PRADESH,9999,0   ,KHARIF,9999,0,9999,9999,BLANK CALL,BLANK CALL,2009-02-10T20:25:08,2009,2
ANDHRA PRADESH,KURNOOL,0   ,KHARIF,9999,0,9999,9999,ASKED ABOUT CONTROL FOR ROOT ROT,RECOMMENDED TO SPRAY BLITOX 3GR/LITRE,2009-02-10T20:31:17,2009,2
