StateName,DistrictName,BlockName,Season,Sector,Category,Crop,QueryType,QueryText,KccAns,CreatedOn,year,month
ANDHRA PRADESH,GUNTUR,0   ,JAYAD,9999,0,9999,9999,ASKED ABOUT THE VARITES,"INFORMED TO SOW SWARNAMUKHI(OR), SWATHI(OR) VIJETHA",2009-09-27T13:21:20,2009,9
ANDHRA PRADESH,EAST GODAVARI,0   ,JAYAD,9999,0,9999,9999,ASKED ABOUT THE CONTROL OF TUNGROVIRUS,RECOMENDED TO SPRAY CARBORYL 2.5KG/HA,2009-09-27T14:42:52,2009,9
ANDHRA PRADESH,NELLORE,0   ,JAYAD,9999,0,9999,9999,ASKED ABOUT THE SEED TREATMENT,SUGGESTED TO TREAT THE SEED WITH CARBENDAZIM @ 2.5g/kg OF SEED.,2009-09-26T15:30:01,2009,9
ANDHRA PRADESH,CHITTOOR,0   ,JAYAD,9999,0,9999,9999,ASKED ABOUT CONTROL OF EARLY BLIGHT,RECOMENDED FOR THE APPLICATION OF CAPTAN 3GM/LIT,2009-09-26T16:39:10,2009,9
ANDHRA PRADESH,KRISHNA,0   ,JAYAD,9999,0,9999,9999,ASKED ABOUT OF CONTROL OF IRON DEFICENCY,RECOMENDED FOR THE APPLICATION OF ANNABEDI 20-30GM WITH 2-3GM LEMON SAIL/LIT,2009-09-26T18:47:51,2009,9
ANDHRA PRADESH,KRISHNA,0   ,JAYAD,9999,0,9999,9999,ASKED ABOUT OF CONTROL OF IRON DEFICENCY,RECOMENDED FOR THE APPLICATION OF ANNABEDI 20-30GM WITH 2-3GM LEMON SAIL/LIT,2009-09-26T18:50:47,2009,9
ANDHRA PRADESH,GUNTUR,0   ,JAYAD,9999,0,9999,9999,ASKED ABOUT THE VARITES,"INFORMED THAT TO SOW NANDYALASANNALU(N.D.L.R-8), M.T.U-1010",2009-09-30T12:03:29,2009,9
ANDHRA PRADESH,9999,0   ,JAYAD,9999,0,9999,9999,Call Disconnected,Call Disconnected,2009-09-24T09:10:47,2009,9
ANDHRA PRADESH,CHITTOOR,0   ,JAYAD,9999,0,9999,9999,ASKED ABOUT THE FERTILIZER(GYPSUM) DOSAGE,RECOMENDED TO SPRAY 1.5 TONNS/2ACRE,2009-09-24T09:27:11,2009,9
ANDHRA PRADESH,EAST GODAVARI,0   ,JAYAD,9999,0,9999,9999,ASKED ABOUT THE CONTROL OF STEM BORER.,RECOMMENDED TO SPRAY CHLORIPYRIPHOS @ 2.5ml/lit OF WATER.,2009-09-24T11:08:23,2009,9
ANDHRA PRADESH,9999,0   ,JAYAD,9999,0,9999,9999,Test Call,Test Call,2009-09-24T11:50:02,2009,9
ANDHRA PRADESH,CHITTOOR,0   ,JAYAD,9999,0,9999,9999,ASKED ABOUT SOWING SEASON,INFORMED TO THAT SOWING SEASOL IS OCT-NOV,2009-09-28T11:02:35,2009,9
ANDHRA PRADESH,PRAKASAM,0   ,JAYAD,9999,0,9999,9999,ASKED ABOUT THE CONTROL OF BPH,RECOMENDED FOR THE APPLICATION OF MONOCROTOPHOS 2.2ML/LIT,2009-09-28T12:45:04,2009,9
ANDHRA PRADESH,PRAKASAM,0   ,JAYAD,9999,0,9999,9999,ASKED ABOUT THE CONTROL OF BPH,RECOMENDED FOR THE APPLICATION OF MONOCROTOPHOS 2.2ML/LIT,2009-09-28T12:46:39,2009,9
ANDHRA PRADESH,NELLORE,0   ,JAYAD,9999,0,9999,9999,ASKED ABOUT THE CONTROL OF WEEDS IN PADDY.5 MDAYS AFTER PLANTING.,RECOMMENDED TO SPRAY BUTACHLORE 50% EC [1-1.5LIT/ACRE],2009-09-28T13:24:20,2009,9
ANDHRA PRADESH,VISAKHAPATNAM,0   ,JAYAD,AGRICULTURE,0,1136,6,ASKED ABOUT THE COST OF BAJRA [NARSARAOPET[VAR],INFORMED ABOUT THE COST AS MAX.1000 Rs/Quintal.,2009-09-28T14:44:56,2009,9
ANDHRA PRADESH,GUNTUR,0   ,JAYAD,9999,0,9999,9999,ASKED ABOUT THE CONTROL OF PEST,RECOMENDED FOR THE APPLICATION OF DICOFOL2.7ML/LIT,2009-09-08T08:17:20,2009,9
ANDHRA PRADESH,Y S R ,0   ,JAYAD,9999,0,9999,9999,ASKED ABOUT CONTROL OF FLOWER AND FRUITS DROPING,RECOMMENDED FOR THE APPLICATION OF PLANOFIX 2ML/10LIT,2009-09-09T08:24:10,2009,9
ANDHRA PRADESH,KURNOOL,0   ,JAYAD,9999,0,9999,9999,ASKED ABOUT THE CONTROL OF LEAF BLIGHT,RECOMMENDED TO SPRAY MANCOZEB@3G/LIT OF WATER,2009-09-11T18:16:12,2009,9
ANDHRA PRADESH,Y S R ,0   ,JAYAD,9999,0,9999,9999,ASKED ABOUT THE CONTROL OF STEMBORER,RECOMENDED FOR THE APPLICATION OF CARTAPHYDROCHLORIDE2G/LIT,2009-09-10T13:39:26,2009,9
ANDHRA PRADESH,GUNTUR,0   ,JAYAD,9999,0,9999,9999,ASKED ABOUT LATE SOWING VEARITYS,"INFORMMED TO THAT VARIETIES ARE M.T.U.1010,POLASA PRABA.",2009-09-08T17:20:46,2009,9
ANDHRA PRADESH,Y S R ,0   ,JAYAD,9999,0,9999,9999,ASKED ABOUT CONTROL OF STEM BORER,RECOMMENDED FOR THE APPLICATION OF CHLORIPYRIPHAS 2.5ML/LIT,2009-09-11T09:55:03,2009,9
ANDHRA PRADESH,GUNTUR,0   ,JAYAD,9999,0,9999,9999,ASKED ABOUT CONTROL OF STEMROT,RECOMMENDED FOR THE APPLICATION OF HEXACONAZOLE 2ML/LIT,2009-09-11T11:43:59,2009,9
ANDHRA PRADESH,ANANTPUR,0   ,JAYAD,9999,0,9999,9999,ASKED ABOUT THE CONTROL OF PEST,RECOMENDED FOR THE APPLICATION OF CARBORYL3G/LIT,2009-09-09T18:51:29,2009,9
ANDHRA PRADESH,WEST GODAVARI,0   ,JAYAD,AGRICULTURE,0,Cotton (Kapas),3,ASKED ABOUT THE CONTROL OF STRIPED MEALY BUG IN COTTON.,RECOMMENDED TO SPRAY DICLOROVOS 1ML/LIT.,2009-09-30T19:51:13,2009,9
ANDHRA PRADESH,EAST GODAVARI,0   ,JAYAD,9999,0,9999,9999,ASKED ABOUT THE CONTROL OF WEEDS,RECOMENDED FOR THE APPLICATION OF PARAQUOT 40ML/10LIT,2009-09-22T09:01:41,2009,9
ANDHRA PRADESH,GUNTUR,0   ,JAYAD,9999,0,9999,9999,ASKED ABOUT CONTROL OF DAMPING OFF,RECOMENDED FOR THE APPLICATION OF C0C 3GM/LIT,2009-09-21T13:04:46,2009,9
ANDHRA PRADESH,GUNTUR,0   ,JAYAD,9999,0,9999,9999,ASKED ABOUT THE CONTROL OF STEM BORER,RECOMMENDED FOR THE APPLICATION CARTAPHYDROCHLORIDE 2GM/LTR,2009-09-21T17:56:05,2009,9
ANDHRA PRADESH,9999,0   ,JAYAD,9999,0,9999,9999,Test Call,Test Call,2009-09-21T17:58:13,2009,9
ANDHRA PRADESH,WEST GODAVARI,0   ,JAYAD,9999,0,9999,9999,CONTROL OF STEM ROT IN POINTED GOURD.,SPRAY COPPER OXICLORIDE @ 4 GM/LIT. OF WATER.,2009-09-22T06:14:05,2009,9
ANDHRA PRADESH,KRISHNA,0   ,JAYAD,9999,0,9999,9999,ASKED ABOUT CONTROL OF SUCKING PESTS,RECOMMENDED FOR THE APPLICATION OF IMIDACHLOPRID 0.4ML/LIT,2009-09-11T10:16:55,2009,9
ANDHRA PRADESH,KRISHNA,0   ,JAYAD,9999,0,9999,9999,ASKED ABOUT THEV CONTROL OF WEEDS,RECOMENDED TO SPRAY PARAQUOT 1LIT/ACRE,2009-09-14T11:28:58,2009,9
ANDHRA PRADESH,NELLORE,0   ,JAYAD,9999,0,9999,9999,ASKED ABOUT CONTROL OF WEEDS,RECOMENDED FOR THE APPLICATION OF BUTACHLORE 1-1.5LIT/ACRE,2009-09-25T15:55:22,2009,9
ANDHRA PRADESH,KRISHNA,0   ,JAYAD,9999,0,9999,9999,ASKED ABOUT THE CONTROL OF FRUIT DROP,RECOMENDED FOR THE APPLICATION OF MULTI.K 5-10G/LIT,2009-09-25T16:04:55,2009,9
ANDHRA PRADESH,NELLORE,0   ,JAYAD,9999,0,9999,9999,ASKED TO CONTROL WEEDS IN PADDY NURSERY,"RECOMMENDED TO SPRAY BUTACLORE 2ML/200LIT WATER, 7 DAYS AFTER SOWING",2009-09-25T16:50:31,2009,9
ANDHRA PRADESH,CHITTOOR,0   ,JAYAD,AGRICULTURE,0,Coriander,5,ASKED ABOUT THE VARITIES OF CORIANDER.,"RECOMMENDED TO GROW SINDU, SADANA, SWATHI",2009-09-30T18:28:29,2009,9
ANDHRA PRADESH,SRIKAKULAM,0   ,JAYAD,9999,0,9999,9999,ASKED ABOUT THE CONTROL OF HISPA,RECOMENDED FOR THE APPLICATION OF MONOCROTOPHOS1.6ML/LIT,2009-09-09T19:09:30,2009,9
ANDHRA PRADESH,9999,0   ,JAYAD,9999,0,9999,9999,Call Disconnected,Call Disconnected,2009-09-10T07:06:46,2009,9
ANDHRA PRADESH,9999,0   ,JAYAD,9999,0,9999,9999,pre mature fruit droping coconut.,apply planofix @1ml./4.5 lit. of water.,2009-09-13T08:50:15,2009,9
ANDHRA PRADESH,Y S R ,0   ,JAYAD,9999,0,9999,9999,ASKED ABOUT FERTILISER DOSAGE,INFORMMED TO THAT DOSAGE IS 25KG UREA;150KG SSP;30KG MOP;AND AFTER 30DAYS 25KG UREA,2009-09-12T12:18:31,2009,9
ANDHRA PRADESH,9999,0   ,JAYAD,9999,0,9999,9999,Blank Call,Blank Call,2009-09-15T06:31:31,2009,9
ANDHRA PRADESH,GUNTUR,0   ,JAYAD,9999,0,9999,9999,ASKED ABOUT CONTROL OF LEAF HOPPERS,RECOMENDED FOR THE APPLICATION OF MONOCROTOPHOS 2.2ML/LIT,2009-09-25T17:30:50,2009,9
ANDHRA PRADESH,KRISHNA,0   ,JAYAD,9999,0,9999,9999,ASKED ABOUT THE CONTROL OF ZINC DEFICIENCY ON STANDING CROP,"ADVISED TO SPRAY ZINC SULPHATE 2GR/LIT,TWO TIMES WITH IN A WEEK.",2009-09-25T18:37:39,2009,9
ANDHRA PRADESH,KRISHNA,0   ,JAYAD,9999,0,9999,9999,ASKED ABOUT THE CONTROL OF ZINC DEFICIENCY ON STANDING CROP,"ADVISED TO SPRAY ZINC SULPHATE 2GR/LIT,TWO TIMES WITH IN A WEEK.",2009-09-25T18:37:53,2009,9
ANDHRA PRADESH,Y S R ,0   ,JAYAD,9999,0,9999,9999,ASKED ABOUT CONTROL OF IRON DEFICENCY,RECOMENDED FOR THE APPLICATION OF ANNABEDI 20-30GR WITH 2-3GR/LIT,2009-09-25T18:53:41,2009,9
ANDHRA PRADESH,NELLORE,0   ,JAYAD,9999,0,9999,9999,ASKED ABOUT THE USAGE AND AVAILABILITY OF BIO FERTILIZERS,ADVISED TO CONTACT SCIENTIST 08654-288245,2009-09-26T12:37:04,2009,9
ANDHRA PRADESH,NELLORE,0   ,JAYAD,9999,0,9999,9999,ASKED ABOUT THE USAGE AND AVAILABILITY OF BIO FERTILIZERS,ADVISED TO CONTACT SCIENTIST 08654-288245,2009-09-26T12:39:54,2009,9
ANDHRA PRADESH,VIZIANAGARM,0   ,JAYAD,9999,0,9999,9999,SAKED ABOUT THE CONTROL OF RUST DISEASE,RECOMMENDED TO SPRAY MANCOZE4B @ 2.5g/lit OF WATER.,2009-09-26T12:56:17,2009,9
ANDHRA PRADESH,KRISHNA,0   ,JAYAD,9999,0,9999,9999,SAKED ABOUT THE CONTROL OF JASSIDS.,RECOMMENDED TO APPLY THE PASTE OF MONOCROTOPHOS:WATER[1:4]NEAR THE BASE OF STEM.,2009-09-28T12:03:49,2009,9
ANDHRA PRADESH,NELLORE,0   ,JAYAD,ANIMAL HUSBANDRY,0,964,45,ASKED ABOUT THE MILCHING OF BUFFALOS WITH MACHINE &COST OF MACHINE.,RECOMMENDED TO CONSULT PRINCIPAL SCIENTIST-08814-284444,2009-09-29T07:02:45,2009,9
ANDHRA PRADESH,PRAKASAM,0   ,JAYAD,9999,0,9999,9999,ASKED ABOUT THE CONTROL OF THRIPS,RECOMMENDED TO SPRAY CARBARIL-3GR OR FASALON-3ML/LIT.,2009-09-29T08:19:53,2009,9
ANDHRA PRADESH,9999,0   ,JAYAD,9999,0,9999,9999,Blank Call,Blank Call,2009-09-29T08:52:16,2009,9
ANDHRA PRADESH,9999,0   ,JAYAD,9999,0,9999,9999,Blank Call,Blank Call,2009-09-04T21:45:59,2009,9
ANDHRA PRADESH,NELLORE,0   ,JAYAD,9999,0,9999,9999,ASKED ABOUT CONTROL OF FLOWER DROPING,RECOMMENDED TO SPRAY BLITOX 3GM/LIT,2009-09-12T12:38:17,2009,9
ANDHRA PRADESH,PRAKASAM,0   ,JAYAD,9999,0,9999,9999,ASKED ABOUT THE SOWING SEASON,RECOMENDED TO SOW DURING OCTOBER,2009-09-14T13:16:45,2009,9
ANDHRA PRADESH,PRAKASAM,0   ,JAYAD,9999,0,9999,9999,ASKED ABOUT THE CONTROL OF SUCKING PEST,RECOMENDED TO APPLY MONOCROTPPHOS1.6ML/LIT,2009-09-14T14:47:27,2009,9
ANDHRA PRADESH,EAST GODAVARI,0   ,JAYAD,9999,0,9999,9999,ASKED ABOUT THE CONTROL OF WEEDS,RECOMMENDED TO SPRAY PENDIMETHALIN @ 1.5L/ACRE,2009-09-05T11:44:32,2009,9
ANDHRA PRADESH,9999,0   ,JAYAD,9999,0,9999,9999,Call Disconnected,Call Disconnected,2009-09-08T11:18:26,2009,9
ANDHRA PRADESH,WEST GODAVARI,0   ,JAYAD,9999,0,9999,9999,ASKED ABOUT THE CONTROL FOR THRIPS,RECOMMENDED TO SPRAY CARBORYL @ 600g/acre OR FASALONE @ 400ml/acre.,2009-09-04T12:25:33,2009,9
ANDHRA PRADESH,EAST GODAVARI,0   ,JAYAD,9999,0,9999,9999,ASKED ABOUT THE WEATHER REPORT,GIVEN THE WEATHER REPORT TO THE FARMER.,2009-09-27T10:06:53,2009,9
ANDHRA PRADESH,EAST GODAVARI,0   ,JAYAD,9999,0,9999,9999,ASKED ABOUT THE CONTROL OF TUNGROVIRUS,RECOMENDED TO SPRAY CARBORYL 2.5KG/HA,2009-09-27T14:43:31,2009,9
ANDHRA PRADESH,EAST GODAVARI,0   ,JAYAD,9999,0,9999,9999,ASKED ABOUT CONTROL OF BPH,RECOMMENDED FOR THE APPLICATION OF MONOCROTAPHOS 2.2ML/LIT,2009-09-06T12:50:05,2009,9
ANDHRA PRADESH,9999,0   ,JAYAD,9999,0,9999,9999,Test Call,Test Call,2009-09-29T17:59:33,2009,9
ANDHRA PRADESH,PRAKASAM,0   ,JAYAD,9999,0,9999,9999,ASKED ABOUT THE CONTROL OF BLAST,RECOMENDED FOR THE APPLICATION OF EDIPHENPOS 1ML/LIT,2009-09-30T06:51:16,2009,9
ANDHRA PRADESH,ANANTPUR,0   ,JAYAD,9999,0,9999,9999,ASKED ABOUT THE CONTROL OF CASEWORM IN PADDY.,RECOMMENDED TO DRAIN WATER FROM THE FIELD AND SPRAY CHLOROPYRIPHOS 2ML/LIT.,2009-09-30T15:06:21,2009,9
ANDHRA PRADESH,Y S R ,0   ,JAYAD,HORTICULTURE,0,1268,2,ASKED ABOUT THE CONTROL OF LEAF WEBBER IN MANGO,RECOMMENDED TO SPRAY CARBARIL 3GR/LIT,2009-09-26T13:08:37,2009,9
ANDHRA PRADESH,ANANTPUR,0   ,JAYAD,AGRICULTURE,0,1653,2,ASKED ABOUT THE CONTROL MEASURES OF TIKKA LEAF SPOT OF GROUNDNUT,RECOMMENDED TO SPRAY CHLOROTHALONIL 400GR/200LIT WATER FOR 1 ACRE,2009-09-26T15:12:47,2009,9
ANDHRA PRADESH,ANANTPUR,0   ,JAYAD,AGRICULTURE,0,1653,2,ASKED ABOUT THE CONTROL MEASURES OF TIKKA LEAF SPOT OF GROUNDNUT,RECOMMENDED TO SPRAY CHLOROTHALONIL 400GR/200LIT WATER FOR 1 ACRE,2009-09-26T15:15:19,2009,9
ANDHRA PRADESH,NELLORE,0   ,JAYAD,9999,0,9999,9999,ASKED ABOUT THE SEED TREATMENT,SUGGESTED TO TREAT THE SEED WITH CARBENDAZIM @ 2.5g/kg OF SEED.,2009-09-26T15:33:03,2009,9
ANDHRA PRADESH,GUNTUR,0   ,JAYAD,9999,0,9999,9999,ASKED ABOUT CONTROL OF IRON DEFICENCY,RECOMENDED FOR THE APPLICATION OF 20-30GM ANNABEDI WITH 2-3GM LEMONSALT/LIT,2009-09-26T16:21:33,2009,9
ANDHRA PRADESH,GUNTUR,0   ,JAYAD,9999,0,9999,9999,ASKED ABOUT CONTROL OF IRON DEFICENCY,RECOMENDED FOR THE APPLICATION OF 20-30GM ANNABEDI WITH 2-3GM LEMONSALT/LIT,2009-09-26T16:21:45,2009,9
ANDHRA PRADESH,EAST GODAVARI,0   ,JAYAD,9999,0,9999,9999,ASKED ABOUT CONTROL OF STEM BORER,RECOMENDED FOR THE APPLICATION OF CHLORIPYRIPHOS 2ML/LIT,2009-09-26T19:47:49,2009,9
ANDHRA PRADESH,EAST GODAVARI,0   ,JAYAD,9999,0,9999,9999,ASKED ABOUT THE SEED TREATMENT,SUGGESTED TO TREAT THE SEED WITH THIRAM OR CAPTON @ 3g/kg SEED,2009-09-27T08:39:10,2009,9
ANDHRA PRADESH,NELLORE,0   ,JAYAD,9999,0,9999,9999,ASKED ABOUT THE CONTROL OF PEST,RECOMENDED FOR THE APPLICATION OF NEEM OIL 0.5ML/LIT,2009-09-01T07:36:06,2009,9
ANDHRA PRADESH,9999,0   ,JAYAD,9999,0,9999,9999,Call Disconnected,Call Disconnected,2009-09-01T10:34:20,2009,9
ANDHRA PRADESH,KURNOOL,0   ,JAYAD,AGRICULTURE,0,1137,2,ASKED ABOUT CONTROL OF RICE BLAST,RECOMMENDED TO SPRAY TRICYCLOZOLE 0.6GM/LT,2009-09-01T13:12:57,2009,9
ANDHRA PRADESH,NELLORE,0   ,JAYAD,9999,0,9999,9999,ASKED ABOUT THE CONTROL OF BUD DROP,RECOMENDED FOR THE APPLICATION OF NAPTHALIN ACETIC ACID,2009-09-21T09:21:24,2009,9
ANDHRA PRADESH,KRISHNA,0   ,JAYAD,AGRICULTURE,0,1037,3,ASKED ABOUT THE CONTROL OF GRAMCATER PILLAR,RECOMENDED TO SPRAY ENDOSULFON 2ML/LIT WITH N.P.V VIRUS SOLUTION 500L/HEC,2009-09-24T08:34:36,2009,9
ANDHRA PRADESH,CHITTOOR,0   ,JAYAD,9999,0,9999,9999,ASKED ABOUT THE FERTILIZER(GYPSUM) DOSAGE,RECOMENDED TO SPRAY 1.5 TONNS/2ACRE,2009-09-24T09:28:09,2009,9
ANDHRA PRADESH,KRISHNA,0   ,JAYAD,HORTICULTURE,0,1280,2,ASKED ABOUT THE CONTROL OF THRIPS IN CHILLI,RECOMMENDED TO SPRAY DIMETOATE 2ML/LIT,2009-09-24T10:21:14,2009,9
ANDHRA PRADESH,9999,0   ,JAYAD,9999,0,9999,9999,Test Call,Test Call,2009-09-23T08:56:32,2009,9
ANDHRA PRADESH,9999,0   ,JAYAD,9999,0,9999,9999,Blank Call,Blank Call,2009-09-13T08:05:52,2009,9
ANDHRA PRADESH,GUNTUR,0   ,JAYAD,9999,0,9999,9999,ASKED ABOUT THE CONTROL OF STEM BORER IN PADDY.,"RECOMMENDED TO BROADCAST CARATAP HYDROCHLORIDE 4G 8KGS/ACRE.OR CARBOFURON 3G,10KGS/ACRE.",2009-09-29T12:51:17,2009,9
ANDHRA PRADESH,PRAKASAM,0   ,JAYAD,9999,0,9999,9999,ASKED ABOUT THE SEED TREATMENT,RECOMENDED FOR THE APPLICATION OF MANCOZEB 3G/KG SEED,2009-09-29T14:40:46,2009,9
ANDHRA PRADESH,GUNTUR,0   ,JAYAD,9999,0,9999,9999,ASKED ABOUT THE CONTROL OF WHITE FLY,RECOMENDED TO SPRAY TRIAZOPOS 2.5ML/LIT,2009-09-29T14:52:48,2009,9
ANDHRA PRADESH,PRAKASAM,0   ,JAYAD,9999,0,9999,9999,ASKED ABOUT THE CONTROL OF DAMPING OFF,RECOMMENDED TO APPLY COC @ 3g/lit OF WATER AND POUR NEAR THE ROOTS,2009-09-29T17:49:00,2009,9
ANDHRA PRADESH,NELLORE,0   ,JAYAD,9999,0,9999,9999,ASKED ABOUT THE CONTROL OF GREEN LEAF HOPPER IN PADDY.,RECOMMENDED TO SPRAY ETHOFENPHOS 1.6ML/LIT OR MONOCROTOPHOS 2.2ML/LIT.,2009-09-30T15:42:35,2009,9
ANDHRA PRADESH,KRISHNA,0   ,JAYAD,HORTICULTURE,0,1280,29,ASKED ABOUT THE CONTROL OF THRIPS IN CHILLI.,RECOMMENDED TO SPRAY DIMETH0ATE 2ML/LIT. OR MONOCROTOPHOS 1.6ML/LIT.,2009-09-30T17:18:03,2009,9
ANDHRA PRADESH,KRISHNA,0   ,JAYAD,AGRICULTURE,0,1137,6,ASKED ABOUT THE PRICES OF RICE.,"INFORMED ABOUT THE PRICES AS MIN;1500,MAX;3400",2009-09-30T18:49:12,2009,9
ANDHRA PRADESH,GUNTUR,0   ,JAYAD,9999,0,9999,9999,ASKED ABOUT THE CONTROL OF LEAF SPOTS,RECOMMENDED FOR THE APPLICATION OF BLITOX 3 GM/LTR,2009-09-17T12:09:49,2009,9
ANDHRA PRADESH,KRISHNA,0   ,JAYAD,9999,0,9999,9999,ASKED ABOUT CONTROL OF WEEDS,"RECOMMENDED FOR THE APPLICATION OF 2,4-D SODIUMSALT 400GM IN 200LIT/ACRE",2009-09-09T17:43:43,2009,9
ANDHRA PRADESH,EAST GODAVARI,0   ,JAYAD,9999,0,9999,9999,ASKED ABOUT THE CONTROL OF STEM BHORER,RECOMENDED TO SPRAY CHLOROPYRIPHOS2.5ML/LIT,2009-09-10T10:12:45,2009,9
ANDHRA PRADESH,KRISHNA,0   ,JAYAD,9999,0,9999,9999,ASKED ABOUT CONTROL OF ZINC DIFICENCY,RECOMMENDED FOR THE APPLICATION OF ZINC SULPHATE 2GR/LIT,2009-09-06T09:25:31,2009,9
ANDHRA PRADESH,9999,0   ,JAYAD,9999,0,9999,9999,Call Disconnected,Call Disconnected,2009-09-06T10:07:35,2009,9
ANDHRA PRADESH,GUNTUR,0   ,JAYAD,9999,0,9999,9999,ASKED ABOUT CONTROL OF BPH,RECOMMENDED FOR THE APPLICATION OF MONOCROTAPHOS 2.2ML/LIT,2009-09-09T07:13:25,2009,9
ANDHRA PRADESH,Y S R ,0   ,JAYAD,9999,0,9999,9999,ASKED ABOUT THE CONTROL OF STEM BORER,RECOMENDED FOR THE APPLICATION OF CARTAPHYDROCHLORIDE 2GM/LTR,2009-09-18T17:57:35,2009,9
ANDHRA PRADESH,9999,0   ,JAYAD,9999,0,9999,9999,WANT TO KNOW ABOUT KCC,ANSWER GIVEN IN DETAILS,2009-09-11T17:09:40,2009,9
ANDHRA PRADESH,9999,0   ,JAYAD,9999,0,9999,9999,Blank Call,Blank Call,2009-09-14T06:51:53,2009,9
ANDHRA PRADESH,SRIKAKULAM,0   ,JAYAD,9999,0,9999,9999,ASKE ABOUT FERTLISER DOSAGE,INFORMED TO THAT DOSAGE IS 32KG N;24KG P;16-20KG K,2009-09-12T10:52:52,2009,9
ANDHRA PRADESH,9999,0   ,JAYAD,9999,0,9999,9999,Call Disconnected,Call Disconnected,2009-09-12T14:12:51,2009,9
ANDHRA PRADESH,9999,0   ,JAYAD,9999,0,9999,9999,Test Call,Test Call,2009-09-12T14:14:07,2009,9
ANDHRA PRADESH,9999,0   ,JAYAD,9999,0,9999,9999,Test Call,Test Call,2009-09-02T17:58:06,2009,9
ANDHRA PRADESH,KRISHNA,0   ,JAYAD,9999,0,9999,9999,ASKED ABOUT CONTROL OF BROWN PLANT HOPPER,RECOMENDE FOR THE APPLICATION OF MONOCHROTOPHOS 1.5ML/LIT,2009-09-28T07:47:26,2009,9
ANDHRA PRADESH,KRISHNA,0   ,JAYAD,9999,0,9999,9999,ASKED ABOUT THE CONTROL OF SHEATROT,RECOMENDED FOR THE APPLICATION OF CARBANDAZIM 0.5-1.0G/LIT,2009-09-28T11:50:57,2009,9
ANDHRA PRADESH,KRISHNA,0   ,JAYAD,9999,0,9999,9999,ASKED ABOUT THE CONTROL OF SHEATROT,RECOMENDED FOR THE APPLICATION OF CARBANDAZIM 0.5-1.0G/LIT,2009-09-28T11:53:17,2009,9
ANDHRA PRADESH,EAST GODAVARI,0   ,JAYAD,9999,0,9999,9999,ASKED ABOUT THE CONTROL FOR BLAST,RECOMMENDED TO SPRAY TRICYCLOZOLE @ 0.5g/lit OF WATER.,2009-09-27T09:53:24,2009,9
ANDHRA PRADESH,GUNTUR,0   ,JAYAD,9999,0,9999,9999,ASKED ABOUT THE VARIETY,INFORMED TO SOW T-9 VARIETY,2009-09-27T12:43:21,2009,9
ANDHRA PRADESH,ANANTPUR,0   ,JAYAD,9999,0,9999,9999,ASKED ABOUT THE CONTROL OF WEEDS,RECOMENDED TO SPRAY PENDIMETHALIN 1.3-1.6LIT/ACRE,2009-09-27T13:49:53,2009,9
ANDHRA PRADESH,WEST GODAVARI,0   ,JAYAD,9999,0,9999,9999,ASKED ABOUT THE CONTROL OF HOPPERS,RECOMENDED FOR THE APPLICATION OF CARBARYL 3G/LIT,2009-09-27T17:19:45,2009,9
ANDHRA PRADESH,EAST GODAVARI,0   ,JAYAD,9999,0,9999,9999,ASKED ABOUT CONTROL OF SHEATH BLIGHT,RECOMENDED FOR THE APPLICATON PROPICHONAZAL 1ML/LIT,2009-09-27T18:35:22,2009,9
ANDHRA PRADESH,Y S R ,0   ,JAYAD,HORTICULTURE,0,1268,2,ASKED ABOUT THE CONTROL OF LEAF WEBBER IN MANGO,RECOMMENDED TO SPRAY CARBARIL 3GR/LIT,2009-09-26T13:10:05,2009,9
ANDHRA PRADESH,CHITTOOR,0   ,JAYAD,9999,0,9999,9999,ASKED ABOUT THE CONTROL OF YELLOW STEM BORER,RECOMMENDED FOR THE APPLICATION OF CARBOFURON @ 1KG/HA.,2009-09-26T15:52:13,2009,9
ANDHRA PRADESH,GUNTUR,0   ,JAYAD,9999,0,9999,9999,ASKED ABOUT THE CONTROL OF MITES,"RECOMMENDED TO SPRAY DICOFOL 3ML/5LIT WATER,TWICE IN A WEEK ON GROWING COCONUTS",2009-09-25T19:14:35,2009,9
ANDHRA PRADESH,9999,0   ,JAYAD,9999,0,9999,9999,Blank Call,Blank Call,2009-09-13T13:59:37,2009,9
ANDHRA PRADESH,9999,0   ,JAYAD,9999,0,9999,9999,Blank Call,Blank Call,2009-09-15T06:23:13,2009,9
ANDHRA PRADESH,9999,0   ,JAYAD,9999,0,9999,9999,Call Disconnected,Call Disconnected,2009-09-15T08:47:00,2009,9
ANDHRA PRADESH,9999,0   ,JAYAD,9999,0,9999,9999,Call Disconnected,Call Disconnected,2009-09-08T11:18:20,2009,9
ANDHRA PRADESH,GUNTUR,0   ,JAYAD,9999,0,9999,9999,ASKED ABOUT THE CONTROL OF BPH,RECOMENDED TO SPRAY ACEPHATE 1.5G/LIT,2009-09-08T13:23:09,2009,9
ANDHRA PRADESH,ANANTPUR,0   ,JAYAD,9999,0,9999,9999,ASKED ABOUT THE CONTROL OF STEMBORER,RECOMENDED FOR THE APPLICATION OF CARTAHYDROCHLORIDE2G/LIT,2009-09-10T17:47:33,2009,9
ANDHRA PRADESH,9999,0   ,JAYAD,9999,0,9999,9999,Blank Call,Blank Call,2009-09-05T10:16:43,2009,9
ANDHRA PRADESH,GUNTUR,0   ,JAYAD,9999,0,9999,9999,ASKED ABOUT THE CONTROL OF GALLMIDGE,RECOMMENDED TO PHORATE@5KG/ACRE,2009-09-25T11:05:15,2009,9
ANDHRA PRADESH,EAST GODAVARI,0   ,JAYAD,9999,0,9999,9999,ASKED ABOUT THE FERTILIZER DOSAGE,"INFORMED TO APPLY 30G UREA, 30G MOP/PLANT",2009-09-21T10:33:54,2009,9
ANDHRA PRADESH,NELLORE,0   ,JAYAD,9999,0,9999,9999,ASKED ABOUT THE CONTROL OF SUCKING PEST,RECOMENDED FOR THE APPLICATION OF THIOMETAXOM 0.2G/LIT,2009-09-22T09:52:49,2009,9
ANDHRA PRADESH,9999,0   ,JAYAD,9999,0,9999,9999,Blank Call,Blank Call,2009-09-20T09:34:34,2009,9
ANDHRA PRADESH,GUNTUR,0   ,JAYAD,9999,0,9999,9999,ASKED ABOUT CONNTROL OF STEM BORER,RECOMENDED FOR THE APPLICAITON OF ENDOSULPHON 2ML/LIT,2009-09-20T12:23:58,2009,9
ANDHRA PRADESH,WEST GODAVARI,0   ,JAYAD,9999,0,9999,9999,ASKED ABOUT CONTROL OF LEAF HOPPER,RECOMENDED FOR THE APPLICATION OF MONOCROTOPHOS 1.5ML/LIT,2009-09-25T19:38:42,2009,9
ANDHRA PRADESH,9999,0   ,JAYAD,9999,0,9999,9999,Call Disconnected,Call Disconnected,2009-09-26T10:35:09,2009,9
ANDHRA PRADESH,VIZIANAGARM,0   ,JAYAD,9999,0,9999,9999,SAKED ABOUT THE CONTROL OF RUST DISEASE,RECOMMENDED TO SPRAY MANCOZE4B @ 2.5g/lit OF WATER.,2009-09-26T12:54:06,2009,9
ANDHRA PRADESH,ANANTPUR,0   ,JAYAD,9999,0,9999,9999,ASKED ABOUT THE WEATHER CONDITION.,INFORMED AS PER THE DATA AVAILABLE.,2009-09-30T08:57:14,2009,9
ANDHRA PRADESH,9999,0   ,JAYAD,9999,0,9999,9999,FLOWER DROPING OF COCONUT.,APPLY PLANOFIX @1ML/4.5LIT. OF WATER.,2009-09-28T16:58:06,2009,9
ANDHRA PRADESH,NELLORE,0   ,JAYAD,9999,0,9999,9999,ASKED ABOUT THE CONTROL FOR BPH,RECOMMENDED TO SPRAY ACEPHATE @ 1.5g/lit OF WATER.,2009-09-04T10:48:12,2009,9
ANDHRA PRADESH,9999,0   ,JAYAD,9999,0,9999,9999,Blank Call,Blank Call,2009-09-04T11:04:25,2009,9
ANDHRA PRADESH,PRAKASAM,0   ,JAYAD,9999,0,9999,9999,ASKED ABOUT CONTRPL OF WEDDS,RECOMMENDED TO SPRAY GLYCEL 8ML+20GMAMMONIUMSULPHATE+10GM UREA,2009-09-02T10:15:11,2009,9
ANDHRA PRADESH,GUNTUR,0   ,JAYAD,9999,0,9999,9999,ASKED ABOUT THE CONTROL OF WEEDS,RECOMMENDED FOR THE APPLICATION OF BUTACHLORE 1.5 LTR/ACRE,2009-09-02T12:07:50,2009,9
ANDHRA PRADESH,9999,0   ,JAYAD,9999,0,9999,9999,Call Disconnected,Call Disconnected,2009-09-02T12:21:27,2009,9
ANDHRA PRADESH,9999,0   ,JAYAD,HORTICULTURE,0,1268,Cultural Practices,CULTIVATION OF MANGOSTINE.,ALL INFORMATIONS ARE GIVEN IN DETAILS.,2009-09-02T12:22:30,2009,9
ANDHRA PRADESH,KRISHNA,0   ,JAYAD,HORTICULTURE,0,1280,2,ASKED ABOUT THE CONTROL OF THRIPS IN CHILLI,RECOMMENDED TO SPRAY DIMETOATE 2ML/LIT,2009-09-24T10:19:06,2009,9
ANDHRA PRADESH,CHITTOOR,0   ,JAYAD,9999,0,9999,9999,ASKED ABOUT THE CONTROL FOR LEAF SPOT,RECOMMENDED TO SPRAY COC @ 3g/lit OF WATER.,2009-09-24T11:13:44,2009,9
ANDHRA PRADESH,9999,0   ,JAYAD,9999,0,9999,9999,Call Disconnected,Call Disconnected,2009-09-24T12:52:56,2009,9
ANDHRA PRADESH,ANANTPUR,0   ,JAYAD,9999,0,9999,9999,ASKED ABOUT THE CONTROL OF SUCKING PEST,RECOMENDED FOR THE APPLICATION OF METHYLDEMATON 2ML/LIT,2009-09-25T13:09:23,2009,9
ANDHRA PRADESH,ANANTPUR,0   ,JAYAD,9999,0,9999,9999,ASKED ABOUT THE CONTROL OF SUCKING PEST,RECOMENDED FOR THE APPLICATION OF METHYLDEMATON 2ML/LIT,2009-09-25T13:09:24,2009,9
ANDHRA PRADESH,NELLORE,0   ,JAYAD,9999,0,9999,9999,ASKED ABOUT CONTROL OF WEEDS,RECOMENDED FOR THE APPLICATION OF BUTACHLORE 1-1.5LIT/ACRE,2009-09-25T15:54:09,2009,9
ANDHRA PRADESH,KRISHNA,0   ,JAYAD,9999,0,9999,9999,ASKED ABOUT THE CONTROL OF FRUIT DROP,RECOMENDED FOR THE APPLICATION OF MULTI.K 5-10G/LIT,2009-09-25T16:06:50,2009,9
ANDHRA PRADESH,NELLORE,0   ,JAYAD,9999,0,9999,9999,ASKED ABOUT CONTROL OF FRUIT ROT,RECOMMENDED FOR THE APPLICATION OF COPPER OXYCHLORIDE 3GM/LIT,2009-09-09T10:25:40,2009,9
ANDHRA PRADESH,9999,0   ,JAYAD,9999,0,9999,9999,Blank Call,Blank Call,2009-09-09T10:39:38,2009,9
ANDHRA PRADESH,KURNOOL,0   ,JAYAD,9999,0,9999,9999,ASKED ABOUT THE FERTILISER DOSAGE,RECOMMENDED TO APPLY 30G OF UREA AND POTASH TO EVERY PLANT,2009-09-07T17:13:32,2009,9
ANDHRA PRADESH,EAST GODAVARI,0   ,JAYAD,9999,0,9999,9999,ASKED ABOUT THE CONTROL OF STEM BORER,RECOMMENDED FOR THE APPLICATION OF CARTAPHYDROCHLORIDE 2GM/LTR,2009-09-20T15:08:15,2009,9
