StateName,DistrictName,BlockName,Season,Sector,Category,Crop,QueryType,QueryText,KccAns,CreatedOn,year,month
ANDHRA PRADESH,KURNOOL,DEVANAKONDA,NA,AGRICULTURE,Others,Others,Weather,weather report,"Some sun, then turning cloudy with a shower or thunderstorm around this afternoon",2018-03-16T11:05:55.343,2018,3
ANDHRA PRADESH,PRAKASAM,TRIPURANTHAKAM,NA,AGRICULTURE,Others,Others,Weather,WEATHER REPORT,"CLOUDY WEATHER, CHANCE OF SHOWERS IN YOUR AREA",2018-03-16T11:09:02.53,2018,3
ANDHRA PRADESH,WEST GODAVARI,DENDULURU,NA,AGRICULTURE,Millets,Maize (Makka),Market Information,MARKET INFORMATION OF MAIZE,"MARKET INFORMATION OF MAIZE
MINIMUM PRICE: 1400/- RS/QUINTAL
MAXIMUM PRICE: 1425/- RS/QUINTAL",2018-03-16T09:33:08.057,2018,3
ANDHRA PRADESH,NELLORE,NELLORE,NA,AGRICULTURE,Others,Others,Organic Farming,asking westdecomposer,recommended to apply residues application,2018-03-16T09:42:30.39,2018,3
ANDHRA PRADESH,GUNTUR,BHATTIPROLU,NA,AGRICULTURE,Others,Others,Weather,WEATHER REPORT,THERE IS A CHANCE  OF CLOUDY SHOWERS IN YOUR AREA,2018-03-16T09:48:10.503,2018,3
ANDHRA PRADESH,WEST GODAVARI,NALLAJERLA,NA,AGRICULTURE,Others,Others,Weather,WEATHER REPORT,"MOSTLY CLOUDY WEATHER, CHANCE OF SHOWERS IN YOUR AREA",2018-03-16T12:28:39.017,2018,3
ANDHRA PRADESH,GUNTUR,TENALI,NA,AGRICULTURE,Others,Others,Weather,weather report,"WEATHER REPORT;NO RAIN ,CLOUDY WEATHER OCCUR IN YOUR AREA",2018-03-16T13:23:12.257,2018,3
ANDHRA PRADESH,Y S R ,VONTIMITTA,NA,AGRICULTURE,Cereals,Paddy (Dhan),	Plant Protection	,stem borer in paddy,RECOMMENDED TO SPRAY CARTAP HYDROCHLORIDE 400 GRAMS/ 200 LITRES OF WATER / ACRE,2018-03-16T13:28:48.267,2018,3
ANDHRA PRADESH,VISAKHAPATNAM,CHEEDIKADA,NA,AGRICULTURE,Others,Others,Weather,WEATHER REPORT,"MOSTLY CLOUDY WEATHER OCCUR, CHANCE OF SHOWERS IN YOUR AREA",2018-03-16T11:21:20.673,2018,3
ANDHRA PRADESH,GUNTUR,MACHAVARAM,NA,AGRICULTURE,Others,Others,Weather,WEATHER REPORT,"NO RAIN IN YOUR AREA ,CLOUDY WEATHER OCCUR",2018-03-16T12:17:09.497,2018,3
ANDHRA PRADESH,GUNTUR,PITTALAVANIPALEM,NA,AGRICULTURE,Others,Others,Weather,weather report,"WEATHER REPORT: CLOUDY WEATHER OCCUR,NO CHANCE OF RAINFALL IN YOUR AREA",2018-03-15T19:59:00.08,2018,3
ANDHRA PRADESH,GUNTUR,AMARAVATHI,NA,AGRICULTURE,Others,Others,Weather,WEATHER REPORT,"WEATHER REPORT: CLOUDY TYPE OF WEATHER OCCUR, CHANCE OF RAIN IN YOUR AREA",2018-03-16T17:47:05.267,2018,3
ANDHRA PRADESH,GUNTUR,MACHAVARAM,NA,AGRICULTURE,Others,Others,Weather,WEATHER REPORT,NO RAIN YOUR AREA CLOUDY WEATHER OCCUR,2018-03-16T14:55:04.37,2018,3
ANDHRA PRADESH,GUNTUR,VATTICHERUKURU,RABI,AGRICULTURE,Others,Others,Weather,WEATHER REPORT,"WEATHER INFORMATION : CLOUDY WEATHER , CHANCE OF  RAIN IN YOUR AREA",2018-03-16T15:41:00.77,2018,3
ANDHRA PRADESH,GUNTUR,MACHAVARAM,NA,AGRICULTURE,Others,Others,Weather,WEATHER REPORT,Cloudy weather with a light shower in your area,2018-03-17T08:56:12.82,2018,3
ANDHRA PRADESH,EAST GODAVARI,SEETHANAGARAM,NA,AGRICULTURE,Others,Others,Weather,WEATHER REPORT,Cloudy weather with a light shower in your area,2018-03-17T09:19:08.57,2018,3
ANDHRA PRADESH,EAST GODAVARI,GOLLAPROLU,NA,AGRICULTURE,Others,Others,Weather,WEATHER INFORMATION,": CLOUDY WEATHER , CHANCE OF  SHOWERS IN YOUR AREA",2018-03-17T09:23:56.36,2018,3
ANDHRA PRADESH,ANANTPUR,PAMIDI,NA,AGRICULTURE,Others,Others,Weather,WEATHER INFORMATION,": CLOUDY WEATHER , CHANCE OF  SHOWERS IN YOUR AREA",2018-03-17T09:36:22.493,2018,3
ANDHRA PRADESH,EAST GODAVARI,SAMALKOTA,NA,AGRICULTURE,Cereals,Paddy (Dhan),	Plant Protection	,SHEATH BLIGHT MANAGEMENT IN PADDY,RECOMMENDED TO SPRAT   HEXACONAZOLE+ZINEB (AVATAR)  500  GRAMS / 200 LITRES OF WATER /ACRE,2018-03-17T09:44:09.973,2018,3
ANDHRA PRADESH,KURNOOL,DEVANAKONDA,NA,AGRICULTURE,Others,Others,Weather,WEATHER REPORT,"WEATHER REPORT:CLOUDY TYPE OF WEATHER OCCUR, CHANCE OF RAIN IN YOUR AREA",2018-03-16T20:06:59.287,2018,3
ANDHRA PRADESH,SRIKAKULAM,GANGUVARISIGADAM,NA,AGRICULTURE,Others,Others,Weather,weather report,Cloudy and humid with a shower or thunderstorm in spots,2018-03-17T07:36:21.237,2018,3
ANDHRA PRADESH,Y S R ,KAMALAPURAM,NA,AGRICULTURE,Others,Others,Weather,WEATHER REPORT,"CLOUDY WEATHER  OCCUR ,THERE IS A NO CHANCE TO RAINFALL IN YOUR AREA",2018-03-17T08:15:12.023,2018,3
ANDHRA PRADESH,KRISHNA,MUSUNURU,NA,AGRICULTURE,Others,Others,Weather,weather report,Cloudy and humid with a shower or thunderstorm in spots,2018-03-17T08:30:55.273,2018,3
ANDHRA PRADESH,WEST GODAVARI,PEDAVEGI,NA,AGRICULTURE,Others,Others,Weather,WEATHER REPORT,Cloudy and humid with a shower or thunderstorm in spots,2018-03-16T19:23:19.2,2018,3
ANDHRA PRADESH,ANANTPUR,VIDAPANAKAL,NA,AGRICULTURE,Others,Others,Weather,weather report,"WEATHER REPORT 
CLOUDY WEATHER  OCCUR ,THERE IS A NO CHANCE TO RAINFALL IN YOUR AREA",2018-03-24T18:12:13.873,2018,3
ANDHRA PRADESH,NELLORE,PODALAKUR,NA,HORTICULTURE,Fruits,Mango,	Plant Protection	,mango leaf webber management,RECOMMENDED TO SPRAY  CHLORPYRIFOS  500 ML/200 LITRES OF WATER / ACRE,2018-03-24T18:22:48.64,2018,3
ANDHRA PRADESH,ANANTPUR,PAMIDI,NA,AGRICULTURE,Others,Others,Weather,WEATHER REPORT,"WEATHER REPORT
THERE IS A CHANCE  OF CLOUDY SHOWERS IN YOUR AREA",2018-03-24T18:40:27.237,2018,3
ANDHRA PRADESH,KURNOOL,BANDI ATMAKUR,RABI,AGRICULTURE,Cereals,Paddy (Dhan),	Plant Protection	,PADDY BPH MANAGEMENT,RECOMMENDED TO SPRAY  PYMETROZINE   100 GRAMS /200 LITRES OF WATER/ ACRE,2018-03-24T18:48:26.923,2018,3
ANDHRA PRADESH,KRISHNA,VATSAVAI,NA,AGRICULTURE,Others,Others,Weather,WEATHER REPORT,MOSTLY CLOUDY WEATHER OCCURS IN YOUR AREA,2018-03-24T18:56:43.443,2018,3
ANDHRA PRADESH,GUNTUR,REPALLE,NA,AGRICULTURE,Cereals,Paddy (Dhan),	Plant Protection	,B P H MANAGEMENT IN PADDY,RECOMMENDED TO SPRAY  BUPROFEZIN +ACEPHATE  500 GRAMS /200 LITRES OF WATER/ ACRE,2018-03-14T10:25:48.887,2018,3
ANDHRA PRADESH,WEST GODAVARI,AKIVIDU,NA,AGRICULTURE,Others,Others,	Plant Protection	,PREPARATION OR GEEVAAMRUTHAM,CALL DISCONNECTED BY FARMER,2018-03-14T10:48:56.047,2018,3
ANDHRA PRADESH,CHITTOOR,VENKATAGIRIKOTA,NA,AGRICULTURE,Others,Others,Weather,WEATHER REPORT,Mostly cloudy NO RAIN OCCUR IN YOUR AREA,2018-03-14T11:17:24.73,2018,3
ANDHRA PRADESH,SRIKAKULAM,RAJAM,NA,AGRICULTURE,Others,Others,Weather,weather report,Partly to mostly cloudy with a shower or thunderstorm around,2018-03-16T16:08:27.397,2018,3
ANDHRA PRADESH,NELLORE,ANUMASAMUDRAMPETA,NA,AGRICULTURE,Others,Others,Weather,WEATHER REPORT,"WEATHER REPORT;
CLOUDY WEATHER ,CHANCE OF RAINFALL IN YOUR AREA",2018-03-16T16:13:22.88,2018,3
ANDHRA PRADESH,NELLORE,TADA,NA,AGRICULTURE,Others,Others,Weather,weather report,no rain your area cloudy weather occur,2018-03-16T16:19:42.84,2018,3
ANDHRA PRADESH,ANANTPUR,GUMMAGATTA,NA,AGRICULTURE,Oilseeds,Groundnut (pea nut/mung phalli),	Plant Protection	,GROUNDNUT SUCKING PEST MANAGEMENT,GROUNDNUT SUCKING PEST MANAGEMENT :RECOMMENDED TO SPRAY ACETAMIPRID   40 GRAMS  /200 LITRES OF WATER,2018-03-16T16:24:23.08,2018,3
ANDHRA PRADESH,GUNTUR,NARASARAOPETA,NA,HORTICULTURE,Vegetables,Ridge Gourd,	Plant Protection	,RIDGE GOURD MANAGEMENT:,RIDGE GOURD MANAGEMENT:RECOMMENDED TO SPRAY MALATHION   100 ML + 100 GRAMS SUGAR LITRES OF WATER / ACRE,2018-03-16T16:38:02.83,2018,3
ANDHRA PRADESH,GUNTUR,VINUKONDA,NA,AGRICULTURE,Fiber Crops,Cotton (Kapas),	Plant Protection	,COTTON STEM APPLICATION AGAINST SUCKING PESTS,"RECOMMENDED TO MONOCROTOPHOS AND WATER 1:4 OR IMIDACHLOPRID 200SL AND WATER 1:20 MAKE SOLUTION.APPLY ON STEM AT 30,45,60 DAYS AFTER SOWING.",2018-03-20T17:18:59.19,2018,3
ANDHRA PRADESH,NELLORE,KALUVOYA,NA,AGRICULTURE,Others,Others,Weather,WEATHER REPORT,The rain is not likely to take place in your area,2018-03-20T17:49:30.783,2018,3
ANDHRA PRADESH,PRAKASAM,VOLETIVARI PALEM,NA,HORTICULTURE,Flowers,Marigold,Cultural Practices,MARIGOLD VARIETIES;,"MARIGOLD VARIETIES;Pusa Narangi Gainda, Pusa Basanthi Gainda  and MDU 1",2018-03-20T20:14:03.537,2018,3
ANDHRA PRADESH,CHITTOOR,PILER,NA,AGRICULTURE,Oilseeds,Groundnut (pea nut/mung phalli),Cultural Practices,GROUND NUT SEED RATE,GROUND NUT SEED RATE ; 75 KG PER,2018-03-20T13:47:18.453,2018,3
ANDHRA PRADESH,KURNOOL,TUGGALI,NA,AGRICULTURE,Pulses,Pigeon pea (red gram/arhar/tur),Market Information,REDGRAM MARKET INFORMATION IN KURNOOL,"REDGRAM MARKET INFORMATION IN KURNOOL:
MINIMUM PRICE - 1421/- Rs/ QUINTAL  
MAXIMUM PRICE - 3899/- Rs/ QUINTAL",2018-03-13T19:16:15.593,2018,3
ANDHRA PRADESH,NELLORE,INDUKURPET,NA,AGRICULTURE,Others,Others,Weather,VATAMBEDU VILLAGE WEATHER REPORT,"VATAMBEDU VILLAGE WEATHER REPORT:
NO RAIN ,MOSTLY CLOUDY WEATHER OCCURS IN YOUR AREA.",2018-03-13T20:06:28.237,2018,3
ANDHRA PRADESH,ANANTPUR,NARPALA,NA,HORTICULTURE,Vegetables,Cluster Bean,	Plant Protection	,CLUSTER BEAN POWDER MILDEW MANAGEMENT,RECOMMENDED TO SPRAY DINOCAP 400 ML PER ACRE,2018-03-13T20:25:53.74,2018,3
ANDHRA PRADESH,Y S R ,DUVVUR,NA,AGRICULTURE,Pulses,Pigeon pea (red gram/arhar/tur),Varieties,RED GRAM VARIETIES,"RED GRAM VARIETIES
LRG-41 ,LRG-30 ,LRG-38 ,ICPL-3329(ABHAYA) ,ICPL-85063 ,ICP-8863(MARUTHI) ,WRG-53",2018-03-13T20:52:55.493,2018,3
ANDHRA PRADESH,KURNOOL,NANDYAL,NA,AGRICULTURE,Cereals,Paddy (Dhan),	Plant Protection	,RICE BLAST MANAGEMENT,RECOMMENDED TO SPRAY TRICYCLAZOLE + MANCOZEB  400 GRAMS/150 LITERS OF WATER /ACRE,2018-03-13T21:13:59.28,2018,3
ANDHRA PRADESH,CHITTOOR,SOMALA,NA,HORTICULTURE,Plantation Crops,Coconut,Nutrient Management,COCONUT FRUIT DROP MANAGEMENT,RECOMMENDED TO APPLY MURATE OF POTASH 2 1/2 KGS PER TREE,2018-03-14T07:54:11.98,2018,3
ANDHRA PRADESH,KRISHNA,CHALLAPALLI,NA,AGRICULTURE,Others,Others,Weather,WEATHER REPORT,THERE IS A CHANCE  OF CLOUDY SHOWERS IN YOUR AREA,2018-03-16T10:16:55.61,2018,3
ANDHRA PRADESH,PRAKASAM,CHINAGANJAM,NA,AGRICULTURE,Millets,Buck Wheat (Kaspat),Weather,WEATHER REPORT:,WEATHER REPORT:weather information : rain is not likely to take place in your area.,2018-03-16T16:46:09.517,2018,3
ANDHRA PRADESH,KURNOOL,HALAHARVI,NA,AGRICULTURE,Others,Others,Weather,WEATHER INFORMATION :,"CLOUDY WEATHER , CHANCE OF  RAIN IN YOUR AREA",2018-03-16T18:48:00.69,2018,3
ANDHRA PRADESH,PRAKASAM,CUMBUM,NA,AGRICULTURE,Others,Others,Weather,weather report,"WEATHER REPORT
today a moderate thunderstorm is likely  to take place in your area.",2018-03-16T19:00:04.387,2018,3
ANDHRA PRADESH,Y S R ,VONTIMITTA,NA,AGRICULTURE,Cereals,Paddy (Dhan),	Plant Protection	,yellow stem borer management in paddy,RECOMMENDED TO SPRAY CARTAP HYDROCHLORIDE 400 GRAMS/ 200 LITRES OF WATER / ACRE,2018-03-16T13:38:32.477,2018,3
ANDHRA PRADESH,EAST GODAVARI,SEETHANAGARAM,NA,AGRICULTURE,Others,Others,Weather,WEATHER REPORT,today a moderate thunderstorm is likely  to take place in your area.,2018-03-16T14:11:34.12,2018,3
ANDHRA PRADESH,ANANTPUR,NARPALA,NA,AGRICULTURE,Others,Others,Weather,weather report,"WEATHER REPORT: CLOUDY TYPE OF WEATHER OCCUR, CHANCE OF RAIN IN YOUR AREA",2018-03-16T14:17:48.707,2018,3
ANDHRA PRADESH,KRISHNA,GUDLAVALLERU,NA,AGRICULTURE,Others,Others,Weather,WEATHER REPORT,today a moderate thunderstorm is likely  to take place in your area.,2018-03-16T14:21:24.843,2018,3
ANDHRA PRADESH,NELLORE,NAIDUPETA,NA,AGRICULTURE,Others,Others,Weather,WEATHER REPORT,"WEATHER REPORT: CLOUDY TYPE OF WEATHER OCCUR, CHANCE OF RAIN IN YOUR AREA",2018-03-16T14:23:25.337,2018,3
ANDHRA PRADESH,GUNTUR,VINUKONDA,NA,AGRICULTURE,Others,Others,Weather,WEATHER REPORT :,THERE IS CHANCE OF CLOUDY WEATHER IN YOUR AREA,2018-03-16T16:56:12.377,2018,3
ANDHRA PRADESH,KRISHNA,MOVVA,NA,AGRICULTURE,Others,Others,Weather,WEATHER REPORT,today a moderate thunderstorm is likely  to take place in your area.,2018-03-16T17:26:57.613,2018,3
ANDHRA PRADESH,NELLORE,CHILLAKUR,RABI,AGRICULTURE,Cereals,Paddy (Dhan),	Plant Protection	,paddy BPH management,RECOMMENDED TO SPRAY  BUPROFEZIN +ACEPHATE   330 GRAMS /ACRE,2018-03-23T18:25:13.423,2018,3
ANDHRA PRADESH,ANANTPUR,KUNDURPI,NA,HORTICULTURE,Vegetables,Chillies,	Plant Protection	,CHILLI THRIPS MANAGEMENT,RECOMMENDED TO SPRAY DIFENTHIURON   1.5 GRAMS/ LITRES OF WATER,2018-03-23T18:31:12.603,2018,3
ANDHRA PRADESH,NELLORE,PODALAKUR,NA,HORTICULTURE,Fruits,Citrus,	Plant Protection	,CITRUS SUCKING PESTS MANGEMENT,RECOMMENDED TO SPRAY IMIDACLOPRID  0.4 ML /  LITRES OF WATER,2018-03-22T18:12:03.99,2018,3
ANDHRA PRADESH,Y S R ,SIMHADRIPURAM,NA,HORTICULTURE,Vegetables,Bhindi(Okra/Ladysfinger),Nutrient Management,NUTRIENT MANAGEMENT IN BHENDI,RECOMMENDED TO SPRAY 13 ;0;45 POTASSIUM NITRATE  5 GRAMS/1 LITRE OF WATER,2018-03-22T18:36:08.97,2018,3
ANDHRA PRADESH,PRAKASAM,CHINAGANJAM,NA,AGRICULTURE,Others,Others,Weather,weather report,"weather report;cloudy weather occur , no chance of rainfall in your area",2018-03-22T18:39:58.143,2018,3
ANDHRA PRADESH,GUNTUR,TSUNDUR,NA,AGRICULTURE,Others,Others,Weather,WEATHER REPORT,MOSTLY SUNNY WEATHER OCCUR IN YOUR AREA,2018-03-22T19:08:50.823,2018,3
ANDHRA PRADESH,VISAKHAPATNAM,ROLUGUNTA,NA,HORTICULTURE,Fruits,Mango,Nutrient Management,MANGO FLOWER DROPING:,RECOMMENDED TO SPRAY 13-0-45 ONE KG PER 200 LITRES OF WATER,2018-03-23T14:49:54.73,2018,3
ANDHRA PRADESH,VISAKHAPATNAM,0   ,NA,HORTICULTURE,Fruits,Mango,Nutrient Management,MANGO NUTRIENT MANAGEMENT:,RECOMMENDED TO SPRAY BORAX 2 GR/1 LITRE OF WATER,2018-03-23T15:09:22.977,2018,3
ANDHRA PRADESH,KRISHNA,G.KONDURU,NA,AGRICULTURE,Others,Others,Weather,WEATHER REPORT:,CLOUDY WEATHER OCCUR.NO RAIN IN YOUR AREA.,2018-03-23T15:13:10.283,2018,3
ANDHRA PRADESH,VISAKHAPATNAM,MADUGULA,NA,AGRICULTURE,Cereals,Paddy (Dhan),Fertilizer Use and Availability,paddy fertilizer management,paddy fertilizer management;recommended to urea 40 kg and potash  25 kg/acre,2018-03-23T15:21:50.437,2018,3
ANDHRA PRADESH,NELLORE,CHEJERLA,NA,AGRICULTURE,Fiber Crops,Cotton (Kapas),	Plant Protection	,SUCKING PEST MANAGEMENT IN COTTON,RECOMMENDED TO SPRAY THIAMETHOXAM 40 GRAMS /200 LITRES OF WATER / ACRE,2018-03-22T17:00:11.33,2018,3
ANDHRA PRADESH,SRIKAKULAM,SANTHABOMMALI,RABI,HORTICULTURE,Plantation Crops,Cashew,	Plant Protection	,cashew nut sucking pest,RECOMMENDED TO SPRAY PROFENOFOS 200 ML/200 LITRES OF WATER,2018-03-22T17:07:55.783,2018,3
ANDHRA PRADESH,KURNOOL,ALUR,NA,AGRICULTURE,Fiber Crops,Cotton (Kapas),Market Information,COTTON MARKET INFORMATION,COTTON MARKET INFORMATION:MINIMUM PRICE -Rs3349	/-MAXIMUM PRICE-Rs-5165/-,2018-03-22T17:17:04.657,2018,3
ANDHRA PRADESH,KRISHNA,AGIRIPALLI,NA,AGRICULTURE,Others,Others,Weather,WEATHER,A severe thunderstorm is likely to take place in your area.,2018-03-23T15:46:33.513,2018,3
ANDHRA PRADESH,WEST GODAVARI,PEDAVEGI,NA,AGRICULTURE,Others,Others,Weather,weather report,Very warm and less humid with sunshine and patchy clouds,2018-03-23T16:03:56.91,2018,3
ANDHRA PRADESH,NELLORE,DUTTALUR,NA,AGRICULTURE,Others,Others,Weather,weather report,Sunny to partly cloudy and very warm with low humidity,2018-03-23T16:19:43.62,2018,3
ANDHRA PRADESH,PRAKASAM,DORNALA,NA,AGRICULTURE,Others,Others,Government Schemes,ABOUT GOVERNMENT SCHEMES MANAGMENT,CONTACT  YOUR  MANDAL AGRICULTURE OFFICER,2018-03-23T16:22:29.397,2018,3
ANDHRA PRADESH,KURNOOL,RUDRAVARAM,NA,HORTICULTURE,Vegetables,Chillies,	Plant Protection	,CHILLI DAMPING OFF MANAGEMENT,RECOMMENDED TO SPRAY COPPER OXY CHLORIDE  600  GM /200 LITRES OF WATER / ACRE,2018-03-23T16:27:55.5,2018,3
ANDHRA PRADESH,EAST GODAVARI,KARAPA,NA,AGRICULTURE,Cereals,Paddy (Dhan),	Plant Protection	,PADDY LEAF FOLDER MANAGEMENT:,RECOMMENDED TO SPRAY ACEPHATE 300 GRAMS/ 200 LITRES OF WATER / ACRE,2018-03-23T17:03:39.267,2018,3
ANDHRA PRADESH,KURNOOL,GADIVEMULA,NA,AGRICULTURE,Oilseeds,Groundnut (pea nut/mung phalli),Market Information,ground nut market inforation,"ground nut market inforation :
minimum- 3110 /-Rs/quintal
maximum-4340  /-Rs/quintal
average - 4190/-Rs/quintal",2018-03-22T16:00:00.133,2018,3
ANDHRA PRADESH,ANANTPUR,KANAGANAPALLE,NA,AGRICULTURE,Oilseeds,Groundnut (pea nut/mung phalli),Market Information,groundnut market information,groundnut market information:minimum price Rs-2268/-maximum price Rs-4188/-,2018-03-22T16:02:52.45,2018,3
ANDHRA PRADESH,EAST GODAVARI,UPPALAGUPTAM,NA,AGRICULTURE,Cereals,Paddy (Dhan),	Plant Protection	,paddy brown plant hopper management,DINOTEFURAN 80 GRAMS/200 LITRES OF WATER/ ACRE,2018-03-22T16:07:26.143,2018,3
ANDHRA PRADESH,ANANTPUR,BELUGUPPA,NA,AGRICULTURE,Others,Others,Crop Insurance,crop damage information,,2018-03-22T16:22:11.343,2018,3
ANDHRA PRADESH,Y S R ,CHAKRAYAPET,NA,HORTICULTURE,Condiments and Spices,Turmeric,Market Information,termeric market information,minimum price;;rs;4499/q;maximum price;;rs;6190/q;average price;;6190/q;,2018-03-22T16:28:38.14,2018,3
ANDHRA PRADESH,VISAKHAPATNAM,YELAMANCHILI,NA,AGRICULTURE,Others,Others,Market Information,ASKING ABOUT MARKET RATES TOLL FREE CONTACTNUMBER,Market rate-	1800 1038616,2018-03-15T09:15:28.807,2018,3
ANDHRA PRADESH,WEST GODAVARI,CHINTALAPUDI,NA,HORTICULTURE,Fruits,Banana,Nutrient Management,banana nutrient(boran deficiency  ) management,recommended to spray borax 2gm / lit of water,2018-03-15T09:37:00.973,2018,3
ANDHRA PRADESH,KRISHNA,GHANTASALA,NA,AGRICULTURE,Oilseeds,Groundnut (pea nut/mung phalli),	Plant Protection	,SUCKING PEST MANAGEMENT IN GROUNDNUT,RECOMMENDED TO SPRAY DIMETHOATE  400 ML /200 LITRES OF WATER /ACRE,2018-03-15T09:48:39.88,2018,3
ANDHRA PRADESH,KURNOOL,UYYALAWADA,NA,HORTICULTURE,Vegetables,Ridge Gourd,Nutrient Management,nutrient management in ridge gourd,RECOMMENDED TO SPRAY (multi-k) 13-0-45 1KG/ACER,2018-03-15T10:07:57.167,2018,3
ANDHRA PRADESH,WEST GODAVARI,UNDRAJAVARAM,NA,AGRICULTURE,Cereals,Paddy (Dhan),	Plant Protection	,PADDY GALL MIDGE MANAGEMENT,RECOMMENDED TO SPRAY  FIPRONIL  400 ML / 200 LITRES OF WATER /ACRE,2018-03-11T19:36:04.243,2018,3
ANDHRA PRADESH,GUNTUR,TADIKONDA,NA,AGRICULTURE,Others,Others,Weather,WEATHER REOPORT,Very warm with sunshine and patchy clouds,2018-03-14T17:26:05.703,2018,3
ANDHRA PRADESH,KRISHNA,MACHILIPATNAM,NA,AGRICULTURE,Millets,Barnyard Millet (Kundiraivlli/Sawan,Weather,WEATHER REPORT:,"32°C RealFeel® 35° , Mostly sunny,Winds from the S
12 km/h
Humidity: 56%
Pressure: 1008.00 mb ?
UV Index: 1
Cloud Cover: 27%
Ceiling: 9144 m
Dew Point: 22° C
Visibility: 16 km",2018-03-14T17:33:15.897,2018,3
ANDHRA PRADESH,Y S R ,SIMHADRIPURAM,NA,HORTICULTURE,Vegetables,Bhindi(Okra/Ladysfinger),	Plant Protection	,bhendi shoot borer management,RECOMMENDED TO SPRAY PROFENOFOS 400 ML/200 LITRES OF WATER /  ACRE,2018-03-14T17:42:12.307,2018,3
ANDHRA PRADESH,KRISHNA,VATSAVAI,NA,AGRICULTURE,Others,Others,Weather,WEATHER REPORT,"NO RAIN IN YOUR AREA ,CLOUDY WEATHER OCCUR",2018-03-14T17:51:22.03,2018,3
ANDHRA PRADESH,EAST GODAVARI,P.GANNAVARAM,RABI,AGRICULTURE,Cereals,Paddy (Dhan),	Plant Protection	,PADDY BLAST MANAGEMENT,RECOMMENDED TO SPRAY   TEBUCONAZOLE + TRIFLOXYSTROBIN  (NATEVO)160 GRAMS /200 LITRES OF WATER /ACRE,2018-03-14T17:52:21.203,2018,3
ANDHRA PRADESH,ANANTPUR,VIDAPANAKAL,NA,AGRICULTURE,Others,Others,Weather,WEATHER REPORT,WEATHER REPORT : Mostly cloudy,2018-03-14T20:40:13.177,2018,3
ANDHRA PRADESH,CHITTOOR,RAMAKUPPAM,NA,HORTICULTURE,Fruits,Banana,Agriculture Mechanization,BANANA CIGAR END ROT MANAGEMENT,RRECOMMENDED TO SPRAY PROPICONAZOLE    200 ML / 200 LITRES OF WATER /ACRE,2018-03-14T20:57:54.22,2018,3
ANDHRA PRADESH,ANANTPUR,KUDAIR,NA,AGRICULTURE,Others,Others,Weather,WEATHER REPORT,WEATHER REPORT: NO RAIN IN YOUR AREA CLOUDY WEATHER OCCUR,2018-03-15T06:24:18.203,2018,3
ANDHRA PRADESH,EAST GODAVARI,RAYAVARAM,NA,HORTICULTURE,Vegetables,Ridge Gourd,	Plant Protection	,ridge gourd whitefly,RECOMMENDED TO SPRAY IMIDACLOPRID  60 ML /200 LITRES OF WATER / ACRE,2018-03-14T18:07:03.807,2018,3
ANDHRA PRADESH,ANANTPUR,GARLADINNE,NA,AGRICULTURE,Others,Others,Weather,weather report :,weather report :no rain in your area cloudy weather occur,2018-03-22T20:40:30.827,2018,3
ANDHRA PRADESH,EAST GODAVARI,GOLLAPROLU,NA,AGRICULTURE,Others,Others,Weather,weather report,"weather report;cloudy weather occur , no chance of rainfall in your area",2018-03-22T21:59:31.257,2018,3
ANDHRA PRADESH,NELLORE,KALIGIRI,NA,AGRICULTURE,Others,Others,Weather,WEATHER REPORT,NO RAIN YOUR AREA  MOSTLY SUNNY WEATHER OCCUR AND CLOUDY WEATHER ALSO OCCUR,2018-03-23T06:54:45.88,2018,3
ANDHRA PRADESH,PRAKASAM,KONDAPI,NA,HORTICULTURE,Vegetables,Chillies,Seeds and Planting Material,chilli research centre  toll free number,chilli research centre  guntur  toll free number -863–2524017,2018-03-23T10:55:29.143,2018,3
ANDHRA PRADESH,EAST GODAVARI,AMBAJIPETA,NA,AGRICULTURE,Cereals,Paddy (Dhan),	Plant Protection	,PADDY BLAST MANAGEMENT,RECOMMENDED TO SPRAY TRICYCLAZOLE + MANCOZEB  400 GRAMS/200 LITRES OF WATER /ACRE,2018-03-23T11:14:41.55,2018,3
ANDHRA PRADESH,CHITTOOR,YERRAVARIPALEM,NA,HORTICULTURE,Vegetables,Watermelon,	Plant Protection	,WATER MENON SUCKING PEST MANAGEMENT,RECOMMENDED TO SPRAY TRIAZOPHOS 300 ML /200 LITRES OF WATER / ACRE,2018-03-13T10:03:10.593,2018,3
ANDHRA PRADESH,NELLORE,THOTAPALLIGUDUR,NA,AGRICULTURE,Cereals,Paddy (Dhan),	Plant Protection	,RICE BLAST MANAGEMENT IN PADDY,RECOMMENDED TO SPRAT   HEXACONAZOLE+ZINEB   500 GRAMS / 150 LITERS OF WATER /ACRE  .,2018-03-13T10:15:58.85,2018,3
ANDHRA PRADESH,CHITTOOR,GANGADHARA NELLORE,NA,HORTICULTURE,Vegetables,Chillies,	Plant Protection	,MIDGE FLY MANAGEMENT IN CHILLI  MANAGEMENT IN CHILLI,RECOMMENDED TO SPRAY TRIAZOPHOS 300 ML /200 LITRES OF WATER / ACRE,2018-03-13T11:11:13.267,2018,3
ANDHRA PRADESH,CHITTOOR,SOMALA,NA,AGRICULTURE,Others,Others,Weather,WEATHER REPORT,"WEATHER REPORT
WEATHER REPORT: NO RAIN IN YOUR AREA CLOUDY",2018-03-13T11:12:06.007,2018,3
ANDHRA PRADESH,CHITTOOR,KARVETINAGAR,NA,HORTICULTURE,Vegetables,Chillies,	Plant Protection	,THIRPS MANAGEMENT IN CHILLI,RECOMMENDED TO SPRAY DIFENTHIURON   300 GRAMS/200 LITRES OF WATER /ACRE,2018-03-13T11:28:26.263,2018,3
ANDHRA PRADESH,NELLORE,OZILI,NA,AGRICULTURE,Cereals,Paddy (Dhan),	Plant Protection	,BROWN PLANT HOPPER MANAGEMENT IN PADDY,RECOMMENDED TO SPRAY  BUPROFEZIN +ACEPHATE   500 GRAMS /ACRE    .,2018-03-13T11:48:29.297,2018,3
ANDHRA PRADESH,CHITTOOR,CHITTOOR,NA,AGRICULTURE,Oilseeds,Groundnut (pea nut/mung phalli),	Plant Protection	,LEAF SPOT MANAGEMENT IN GROUNDNUT,CALL DISCONNECTED BY FARMER,2018-03-14T14:01:49.817,2018,3
ANDHRA PRADESH,GUNTUR,PITTALAVANIPALEM,NA,AGRICULTURE,Others,Others,Weather,weather report,"WEATHER REPORT: CLOUDY WEATHER OCCUR,NO CHANCE OF RAINFALL IN YOUR AREA",2018-03-14T14:47:18.58,2018,3
ANDHRA PRADESH,ANANTPUR,MUDIGUBBA,NA,HORTICULTURE,Vegetables,Drum Stick,Fertilizer Use and Availability,DRUM STICK NUTRIENT MANAGEMENT,RECOMMENDED TO SPRAY  MULTI NUTRIENT MIXTURE 5 GR/1 LITRE OF WATER,2018-03-14T15:48:30.797,2018,3
ANDHRA PRADESH,GUNTUR,VATTICHERUKURU,NA,AGRICULTURE,Others,Others,Weather,WEATHER REPORT,"NO RAIN IN YOUR AREA ,CLOUDY WEATHER OCCUR",2018-03-14T15:58:33.92,2018,3
ANDHRA PRADESH,EAST GODAVARI,MAMIDIKUDURU,NA,AGRICULTURE,Cereals,Paddy (Dhan),	Plant Protection	,PADDY SHEATH BLIGHT MANAGEMENT,RECOMMENDED TO SPRAY   HEXACONAZOLE+ZINEB   500 GRAMS / 200 LITRES OF WATER /ACRE,2018-03-14T16:01:47.53,2018,3
ANDHRA PRADESH,KRISHNA,BAPULAPADU,NA,AGRICULTURE,Others,Others,Weather,NIMMAGADDA VILLAGE WEATHER REPORT,"NIMMAGADDA VILLAGE WEATHER REPORT:
NO RAIN ,MOSTLY CLOUDY WEATHER OCCURS IN YOUR AREA.",2018-03-14T19:35:31.597,2018,3
ANDHRA PRADESH,GUNTUR,ROMPICHERLA,NA,AGRICULTURE,Others,Others,Government Schemes,contact agriculture officer,contact agriculture officer,2018-03-14T19:36:07.41,2018,3
ANDHRA PRADESH,ANANTPUR,VAJRAKARUR,NA,AGRICULTURE,Others,Others,Weather,GADE HOTHUR VILLAGE WEATHER REPORT,"GADE HOTHUR VILLAGE WEATHER REPORT:
NO RAIN ,MOSTLY CLOUDY WEATHER OCCURS IN YOUR AREA.",2018-03-14T19:49:01.35,2018,3
ANDHRA PRADESH,ANANTPUR,VIDAPANAKAL,NA,AGRICULTURE,Others,Others,Weather,weather report,Mostly cloudy with a couple of showers and a thunderstorm,2018-03-15T07:12:41.257,2018,3
ANDHRA PRADESH,KURNOOL,DEVANAKONDA,NA,AGRICULTURE,Others,Others,Weather,weather report,Plenty of clouds,2018-03-15T07:34:23.293,2018,3
ANDHRA PRADESH,KURNOOL,KRISHNAGIRI,NA,AGRICULTURE,Others,Others,	Water Management	,weather report,"WEATHER REPORT;NO RAIN ,CLOUDY WEATHER OCCUR IN YOUR AREA",2018-03-15T07:55:48.343,2018,3
ANDHRA PRADESH,KURNOOL,PATTIKONDA,NA,AGRICULTURE,Others,Others,Weather,weather report,weather report : Plenty of clouds,2018-03-15T08:28:39.41,2018,3
ANDHRA PRADESH,GUNTUR,KAREMPUDI,NA,AGRICULTURE,Others,Others,Weather,weather report,weather report : Plenty of clouds,2018-03-15T08:29:41.503,2018,3
ANDHRA PRADESH,PRAKASAM,CHINAGANJAM,NA,HORTICULTURE,Vegetables,Curry Leaf,	Plant Protection	,SUCKING PEST MANAGEMENT IN CURRY LEAF,RECOMMENDED TO SPRAY THIAMETHOXAM 40 GRAMS /200 LITRES OF WATER / ACRE,2018-03-15T08:39:15.827,2018,3
ANDHRA PRADESH,KURNOOL,C.BELAGAL,NA,HORTICULTURE,Vegetables,Onion,Cultural Practices,sowing time of onion,Not recommended to sow onion now,2018-03-15T08:50:48.57,2018,3
ANDHRA PRADESH,ANANTPUR,ATMAKUR,NA,AGRICULTURE,Others,Others,Government Schemes,government schemes,RECOMMENDED TO CONTACT YOUR AGRICULTURE OFFICER,2018-03-14T16:09:45.24,2018,3
ANDHRA PRADESH,ANANTPUR,RAPTADU,NA,AGRICULTURE,Cereals,Paddy (Dhan),	Plant Protection	,paddy stem borer management,RECOMMENDED TO SPRAY CARTAP HYDROCHLORIDE 400 GRAMS/ 200 LITRES OF WATER / ACRE,2018-03-14T16:32:41.847,2018,3
ANDHRA PRADESH,KURNOOL,KRISHNAGIRI,NA,HORTICULTURE,Vegetables,Bhindi(Okra/Ladysfinger),	Plant Protection	,BHENDI ROOT ROT MANAGEMENT,RECOMMENDED  TO DRENCH  COPPER OXY CHLORIDE  3 GRAMS / 1 LITRE OF WATER,2018-03-14T12:11:13.827,2018,3
ANDHRA PRADESH,CHITTOOR,YADAMARI,NA,HORTICULTURE,Vegetables,Watermelon,	Plant Protection	,SUCKING PEST MANAGEMENT IN WATERMELON,RECOMMENDED TO SPRAY DIMETHOATE  400ML /200 LITERS OF WATER /ACRE,2018-03-14T12:52:21.393,2018,3
ANDHRA PRADESH,NELLORE,KAVALI,NA,AGRICULTURE,Others,Others,Weather,WEATHER REPORT;,"cloudy weather occur, no rain in your area",2018-03-14T13:06:18.997,2018,3
ANDHRA PRADESH,GUNTUR,RAJUPALEM,NA,HORTICULTURE,Vegetables,Cucumber,	Plant Protection	,CUCUMBER MITE MANAGEMENT,RECOMMENDED TO SPRAY DICOFOL 1 LITRE  /200 LITRES OF WATER /ACRE,2018-03-14T17:14:27.623,2018,3
