StateName,DistrictName,BlockName,Season,Sector,Category,Crop,QueryType,QueryText,KccAns,CreatedOn,year,month
ANDHRA PRADESH,GUNTUR,ROMPICHERLA,NA,AGRICULTURE,Cereals,Paddy (Dhan),	Plant Protection	,stem borer management in paddy,RECOMMENDED TO SPRAY CARTAP HYDROCHLORIDE 400 GRAMS/ 200 LITRES OF WATER / ACRE,2018-03-06T13:22:48.983,2018,3
ANDHRA PRADESH,KRISHNA,KANCHIKACHERLA,NA,HORTICULTURE,Vegetables,"Colocasia (Arvi, Arbi)",	Plant Protection	,COLOCASIA LEAF SPOT MANAGEMENT,RECOMMENDED TO SPRAY CARBENDAZIM + MANCOZEB    400  GRAMS,2018-03-06T13:32:21.357,2018,3
ANDHRA PRADESH,GUNTUR,DURGI,NA,AGRICULTURE,Cereals,Paddy (Dhan),	Plant Protection	,paddy blast,RECOMMENDED TO SPRAY   TEBUCONAZOLE + TRIFLOXYSTROBIN  160 GRAMS /200 LITRES OF WATER /ACRE,2018-03-06T14:11:41.637,2018,3
ANDHRA PRADESH,VIZIANAGARM,PARVATHIPURAM,NA,HORTICULTURE,Fruits,Guava,	Plant Protection	,MEALY BUG MANAGEMENT IN GUAVA,RECOMMENDED TO SPRAY MALATHION   2 ML /1 LITRE OF WATER,2018-03-06T14:14:02.933,2018,3
ANDHRA PRADESH,CHITTOOR,CHANDRAGIRI,NA,HORTICULTURE,Fruits,Mango,	Plant Protection	,MANGO SUCKING PEST MANAGEMENT,RECOMMENDED TO SPRAY DIMETHOATE  400ML /200 LITRES OF WATER /ACRE,2018-03-06T14:15:40.75,2018,3
ANDHRA PRADESH,Y S R ,SIMHADRIPURAM,NA,AGRICULTURE,Others,Others,Organic Farming,MAKING OF JEEVAMRUTHAM:,"MAKING OF JEEVAMRUTHAM:
10kg COWDUNG, 10 COW URINE, 2KG REDGRAM POWER, 100LIT OF WATER AND 2KG JAGGARY",2018-03-06T14:29:28.58,2018,3
ANDHRA PRADESH,NELLORE,NAIDUPETA,NA,AGRICULTURE,Cereals,Paddy (Dhan),Market Information,paddy market infromation,paddy market infromation : 1600 -1700/-Rs/qtl,2018-03-06T14:39:42.213,2018,3
ANDHRA PRADESH,GUNTUR,KAREMPUDI,NA,AGRICULTURE,Oilseeds,Groundnut (pea nut/mung phalli),Cultural Practices,grounut sowing time,recommended to grow in rabi,2018-03-06T15:05:27.323,2018,3
ANDHRA PRADESH,WEST GODAVARI,JEELUGUMILLI,NA,HORTICULTURE,Fruits,Hazlenut,Cultural Practices,ANJEER CULTIVATION PRACTICES,1800 425 2960: Horticulture-AP,2018-03-06T08:32:41.42,2018,3
ANDHRA PRADESH,Y S R ,RAYACHOTY,NA,AGRICULTURE,Pulses,Black Gram (urd bean),Sowing Time and Weather,black gram sowing time:,recommended sowing time for black gram is January  to February,2018-03-07T14:53:59.253,2018,3
ANDHRA PRADESH,CHITTOOR,PULICHERLA H/O REDDIVARIPALLE,NA,HORTICULTURE,Fruits,Banana,	Plant Protection	,stem rot in banana,RECOMMENDED  TO DRENCH  COPPER OXY CHLORIDE  3 GRAMS / 1 LITRE OF WATER,2018-03-09T14:03:51.263,2018,3
ANDHRA PRADESH,VISAKHAPATNAM,GOLUGONDA,NA,HORTICULTURE,Vegetables,Ridge Gourd,	Plant Protection	,downy mildew in ridgeguard,RECOMMENDED TO SPRAY MANCOZEB   600 GRAMS / 200 LITRES OF WATER / ACRE,2018-03-10T08:23:04.797,2018,3
ANDHRA PRADESH,WEST GODAVARI,NALLAJERLA,NA,HORTICULTURE,Plantation Crops,Cashew,Nutrient Management,CASHEW NUT NUTRIENT MANAGEMENT,RECOMMENDED TO SPRAY 13;0;45 / POTASSIUM NITRATE  5 GRAMS/1 LITRE OF WATER,2018-03-10T09:49:03.687,2018,3
ANDHRA PRADESH,Y S R ,OBULAVARIPALLE,NA,HORTICULTURE,Fruits,Papaya,	Plant Protection	,papaya ring spot virus,RECOMMENDED TO SPRAY  FIPRONIL  400 ML / 200 LITRES OF WATER /ACRE,2018-03-10T09:52:17.433,2018,3
ANDHRA PRADESH,NELLORE,KODAVALUR,NA,AGRICULTURE,Cereals,Paddy (Dhan),	Plant Protection	,false smut in paddy management,RECOMMENDED TO SPRAY PROPICONAZOLE    200 ML / 200 LITRES OF WATER /ACRE,2018-03-10T09:57:10.023,2018,3
ANDHRA PRADESH,KRISHNA,MACHILIPATNAM,NA,HORTICULTURE,Fruits,Mango,Nutrient Management,NUTRIENT MANAGEMENT IN MANGO,RECOMMENDED TO SPRAY 13 ;0;45 POTASSIUM NITRATE  5 GRAMS/1 LITRE OF WATER,2018-03-10T10:05:07.783,2018,3
ANDHRA PRADESH,NELLORE,GUDUR,NA,HORTICULTURE,Vegetables,Chillies,	Plant Protection	,VIRUS MANGEMENT,RECOMMENDED SPRAY DIMETHOATE(ROGAR   ROGARIN)  400ML /ACRE IN 200 LITER WATER,2018-03-10T10:15:42.173,2018,3
ANDHRA PRADESH,VIZIANAGARM,DATTIRAJERU,NA,HORTICULTURE,Vegetables,Ridge Gourd,	Plant Protection	,RIDGE GOURD SUCKING PEST MANAGEMENT,RECOMMENDED TO SPRAY ACETAMIPRID   40 GRAMS /200 LITRES OF WATER,2018-03-10T10:24:38.59,2018,3
ANDHRA PRADESH,WEST GODAVARI,KOVVUR,NA,AGRICULTURE,Cereals,Paddy (Dhan),Varieties,"SALINE RESISTANCE PADDY VARIETIES  























































































































































































































SALINE RESISTANCE PADDY VARIETIES","SALINE RESISTANCE PADDY VARIETIES  : VIJETHA , SWARNA , EKASHILA",2018-03-10T10:27:08.31,2018,3
ANDHRA PRADESH,KURNOOL,TUGGALI,NA,HORTICULTURE,Vegetables,Ridge Gourd,Nutrient Management,RIDGE GOUR NUTRIENT MANGEMENT,RECOMMENDED TO SPRAY POTASSIUM NITRATE 13-0-45 1  KG/ACRE IN 200 LT WATER,2018-03-10T10:42:43.043,2018,3
ANDHRA PRADESH,GUNTUR,MACHAVARAM,NA,HORTICULTURE,Vegetables,Chillies,	Plant Protection	,CHILLI THRIPS MANAGEMENT:,RECOMMENDED TO SPRAY  FIPRONIL  400 ML/ 200 LITRES OF WATER /ACRE,2018-03-09T14:52:54.523,2018,3
ANDHRA PRADESH,KURNOOL,GONEGANDLA,NA,AGRICULTURE,Fiber Crops,Cotton (Kapas),Market Information,COTTON MARKET INFORMATION,"COTTON MARKET INFORMATION:MINIMUM PRICE -Rs3400 /-  QUINTAL  
MAXIMUM PRICE -Rs5099/- QUINTAL      AVERAGE PRICE-Rs4325/-QUINTAL",2018-03-09T14:56:17.497,2018,3
ANDHRA PRADESH,GUNTUR,ROMPICHERLA,NA,AGRICULTURE,Pulses,Green Gram (Moong Bean/ Moong),	Plant Protection	,green gram powdery mildew management,RECOMMENDED TO SPRAY CARBENDAZIM   200  GRAMS/  200 LITRES OF WATER /ACRE,2018-03-09T14:57:17.773,2018,3
ANDHRA PRADESH,NELLORE,VINJAMUR,NA,HORTICULTURE,Fruits,Orange,Bio-Pesticides and Bio-Fertilizers,fruit drop in orange,recommended ? to spray planofix 4.5 ml/20 litre,2018-03-09T18:52:21.48,2018,3
ANDHRA PRADESH,GUNTUR,SATTENAPALLE,NA,HORTICULTURE,Fruits,Papaya,Nutrient Management,PAPAYA NUTRIENT MANAGEMENT,RECOMMENDED TO SPRAY AGROMIN MAX 3 GR/1 LITRE OF WATER,2018-03-09T18:53:46.683,2018,3
ANDHRA PRADESH,NELLORE,VENKATAGIRI,NA,AGRICULTURE,Cereals,Paddy (Dhan),	Plant Protection	,PADDY STEM BORER MANAGEMENT ;,RECOMMENDED TO SPRAY CARTAP HYDROCHLORIDE 400 GRAMS/ 200 LITRES OF WATER / ACRE,2018-03-09T19:56:07.32,2018,3
ANDHRA PRADESH,NELLORE,PODALAKUR,NA,HORTICULTURE,Fruits,Citrus,	Plant Protection	,citrus sucking pest management,RECOMMENDED TO SPRAY DIMETHOATE  400 ML /200 LITRES OF WATER /ACRE,2018-03-09T19:58:02.593,2018,3
ANDHRA PRADESH,KRISHNA,VATSAVAI,NA,AGRICULTURE,Others,Others,Weather,WEATHER REPORT:,"CLOUDY WEATHER OCCUR,NO CHANCE OF RAINFALL IN YOUR AREA",2018-03-14T20:20:08.41,2018,3
ANDHRA PRADESH,EAST GODAVARI,GOKAVARAM,NA,HORTICULTURE,Fruits,Citrus,	Plant Protection	,citrus mite,RECOMMENDED TO SPRAY  PROPARGITE   200 ML /200 LITRES OF WATER / ACRE,2018-03-14T20:40:52.45,2018,3
ANDHRA PRADESH,KURNOOL,KOSIGI,NA,AGRICULTURE,Others,Others,Weather,WEATHER REPORT,"WEATHER REPORT
THERE IS A CHANCE  OF CLOUDY WEATHER OCCUR IN YOUR AREA",2018-03-14T20:54:36.693,2018,3
ANDHRA PRADESH,GUNTUR,MACHAVARAM,JAYAD,HORTICULTURE,Vegetables,Ridge Gourd,Nutrient Management,ridge gourd nutrient management,RECOMMENDED TO SPRAY BORAX 2 GR/1 LITRE OF WATER,2018-03-14T14:56:33.677,2018,3
ANDHRA PRADESH,ANANTPUR,AMADAGUR,RABI,AGRICULTURE,Pulses,Pigeon pea (red gram/arhar/tur),Varieties,red gram varieties,recommended red gram varieties;  L.R.G-41.,2018-03-14T15:15:03.287,2018,3
ANDHRA PRADESH,SRIKAKULAM,NARASANNAPETA,NA,AGRICULTURE,Sugar and Starch Crops,Sugarcane (Noble Cane),Weed Management,SUGAR CANE WEED MANAGEMENT,"RECOMMENDED TO SPRAY ATRAZINE(ATRATOP , SOLARO ) 800 GRAMS PER ACRE",2018-03-14T15:23:15.087,2018,3
ANDHRA PRADESH,ANANTPUR,VAJRAKARUR,NA,AGRICULTURE,Others,Others,Cultural Practices,ABOUT CHEMICAL CONCENTRATION,EXPIRED DATE CHEMICAL ARE NOT USING IN FIELD ;,2018-03-14T15:28:37.33,2018,3
ANDHRA PRADESH,ANANTPUR,NARPALA,NA,HORTICULTURE,Vegetables,Chillies,	Plant Protection	,SUCKING PEST MANAGEMENT IN CHILLI,RECOMMENDED TO SPRAY SPINOSAD 75 GRAM/200 LITRES OF WATER / ACRE,2018-03-14T12:08:10.227,2018,3
ANDHRA PRADESH,PRAKASAM,YERRAGONDAPALEM,NA,HORTICULTURE,Fruits,Citrus,	Plant Protection	,citrus mite management,RECOMMENDED TO SPRAY DICOFOL 1 LITRE  /200 LITRES OF WATER /ACRE,2018-03-14T17:09:35.503,2018,3
ANDHRA PRADESH,ANANTPUR,KANEKAL,JAYAD,AGRICULTURE,Pulses,Green Gram (Moong Bean/ Moong),Sowing Time and Weather,green gram sowing time,recommneded green gram sowing time ;february -march,2018-03-14T17:12:39.833,2018,3
ANDHRA PRADESH,KURNOOL,C.BELAGAL,NA,AGRICULTURE,Fiber Crops,Cotton (Kapas),Market Information,cotton market information,"COTTON MARKET INFORMATION 
MINIMUM PRICE:3000 /- RS/QUINTAL
MAXIMUM PRICE:5050 /- RS/QUINTAL",2018-03-14T17:21:31.013,2018,3
ANDHRA PRADESH,EAST GODAVARI,AMBAJIPETA,NA,HORTICULTURE,Flowers,Jasmine,Nutrient Management,jasmine nutrient management,recommended to apply ;;120GRAMS  DAP;;50 GRAMS ;;POTASH/PLANT,2018-03-14T17:29:26.397,2018,3
ANDHRA PRADESH,Y S R ,SIMHADRIPURAM,NA,HORTICULTURE,Fruits,Mosambi,	Plant Protection	,mosambi powdery mildew,RECOMMENDED TO SPRAY AZOXYSTROBIN  150 ML /200 LITRES OF WATER /ACRE,2018-03-14T17:37:43.463,2018,3
ANDHRA PRADESH,NELLORE,ALLUR,NA,AGRICULTURE,Cereals,Paddy (Dhan),	Plant Protection	,PADDY SHEATH BLIGHT MANAGEMENT:,RECOMMENDED TO SPRAY PROPICONAZOLE    200 ML / 200 LITERS OF WATER /ACRE,2018-03-15T12:21:27.44,2018,3
ANDHRA PRADESH,ANANTPUR,VIDAPANAKAL,NA,AGRICULTURE,Cereals,Paddy (Dhan),Weather,WEATHER REPORT:,WEATHER REPORT: 31°C RealFeel® 34°C Cloudy,2018-03-15T12:37:35.927,2018,3
ANDHRA PRADESH,CHITTOOR,PALAMANER,NA,HORTICULTURE,Vegetables,Tomato,	Plant Protection	,tomato fruit borer management,RECOMMENDED TO SPRAY EMAMECTIN BENZOATE  90 GRAMS /150 LITRES OF WATER / ACRE,2018-03-15T12:47:44.627,2018,3
ANDHRA PRADESH,ANANTPUR,KADIRI,NA,AGRICULTURE,Others,Others,Weather,WEATHER REPORT,THERE IS A CHANCE  OF CLOUDY WEATHER OCCUR IN YOUR AREA,2018-03-15T12:54:06.847,2018,3
ANDHRA PRADESH,KURNOOL,DEVANAKONDA,NA,AGRICULTURE,Others,Others,Weather,WEATHER REPORT,MOSTLY CLOUDY WEATHER OCCUR IN YOUR AREA,2018-03-15T13:20:39.703,2018,3
ANDHRA PRADESH,CHITTOOR,CHOWDEPALLE,NA,HORTICULTURE,Vegetables,Tomato,Fertilizer Use and Availability,FERTILIZER USE RECOMMEDATION,RECOMMENDED TO USE GYPSUM 200 KILOS PER ACRE,2018-03-15T10:56:06.96,2018,3
ANDHRA PRADESH,EAST GODAVARI,YELESWARAM,NA,AGRICULTURE,Cereals,Paddy (Dhan),	Plant Protection	,stem borer management in paddy,RECOMMENDED TO SPRAY CARTAP HYDROCHLORIDE 400 GRAMS/ 200 LITRES OF WATER / ACRE,2018-03-15T16:14:51.007,2018,3
ANDHRA PRADESH,EAST GODAVARI,KORUKONDA,NA,HORTICULTURE,Fruits,Mango,Nursery Management,MANGO FLOWER DROPPING MANAGEMENT:,recommended to spray (13;0;45) potassium nitrate 5 gr/liter of water,2018-03-15T16:21:08.79,2018,3
ANDHRA PRADESH,KURNOOL,VELDURTHI,NA,HORTICULTURE,Fruits,Mango,Nutrient Management,MANGO FLOWER DROP  MANAGEMENT ;,RECOMMENDED TO SPRAY NAPHTHALENE ACETIC ACID 50 ML/ 200 LITRES OF WATER /ACRE,2018-03-15T16:40:33.92,2018,3
ANDHRA PRADESH,Y S R ,CHINNAMANDEM,NA,HORTICULTURE,Condiments and Spices,Turmeric,Market Information,TURMERIC MARKET INFORMATION,MARKET INFORMATION ; 5412 MINIMUM PRICE- ; MAXIMUM PRICE -6726,2018-03-15T17:06:55.357,2018,3
ANDHRA PRADESH,ANANTPUR,KANAGANAPALLE,NA,AGRICULTURE,Others,Others,Weather,WEATHER REPORT,THERE IS A CHANCE  OF CLOUDY WEATHER OCCUR IN YOUR AREA,2018-03-15T17:13:35.213,2018,3
ANDHRA PRADESH,SRIKAKULAM,MELIAPUTTI,NA,AGRICULTURE,Others,Others,Weather,WEATHER REPORT,THERE IS A CHANCE  OF CLOUDY WEATHER OCCUR IN YOUR AREA,2018-03-15T17:33:15.513,2018,3
ANDHRA PRADESH,KURNOOL,PAGIDYALA,NA,AGRICULTURE,Oilseeds,Sesame (Gingelly/Til)/Sesamum,	Plant Protection	,SESAME LEAF EATING CATERPILLAR MANAGEMENT,RECOMMENDED TO SPRAY CHLORIPYRIPHOS 500 ML /200 LITRES OF WATER /  ACRE,2018-03-15T15:02:05.19,2018,3
ANDHRA PRADESH,KRISHNA,A.KONDURU,NA,AGRICULTURE,Cereals,Paddy (Dhan),	Plant Protection	,PADDY STEM BORER MANAGEMENT,RECOMMENDED TO SPRAY CARTAP HYDROCHLORIDE 400 GRAMS/ 200 LITRES OF WATER / ACRE,2018-03-15T15:15:31.283,2018,3
ANDHRA PRADESH,SRIKAKULAM,MANDASA,NA,HORTICULTURE,Plantation Crops,Arecanut,	Plant Protection	,sucking pest management,RECOMMENDED TO SPRAY ACEPHATE 1.5 GRAMS  / LITRES OF WATER,2018-03-17T12:52:22.22,2018,3
ANDHRA PRADESH,CHITTOOR,SOMALA,NA,AGRICULTURE,Others,Others,Weather,WEATHER REPORT,Overcast this morning; clouds and sunshine this afternoon,2018-03-17T13:00:39.747,2018,3
ANDHRA PRADESH,NELLORE,DORAVARISATRAM,NA,AGRICULTURE,Others,Others,Weather,weather report,Cloudy and humid with a shower or thunderstorm in spots,2018-03-17T13:19:28.503,2018,3
ANDHRA PRADESH,NELLORE,SANGAM,NA,AGRICULTURE,Cereals,Paddy (Dhan),	Plant Protection	,RICE BLAST MANAGEMENT IN PADDY,RECOMMENDED TO SPRAT   HEXACONAZOLE+ZINEB (AVATAR)  500  GRAMS / 200 LITRES OF WATER /ACRE,2018-03-17T13:44:36.433,2018,3
ANDHRA PRADESH,WEST GODAVARI,CHAGALLU,NA,AGRICULTURE,Others,Others,Weather,WEATHER REPORT,"WEATHER REPORT
THERE IS A CHANCE  OF CLOUDY WEATHER OCCUR IN YOUR AREA",2018-03-17T18:37:54.577,2018,3
ANDHRA PRADESH,ANANTPUR,GUNTAKAL,NA,AGRICULTURE,Others,Others,Weather,WEATHER REPORT,Periods of rain and a thunderstorm,2018-03-17T18:40:23.823,2018,3
ANDHRA PRADESH,Y S R ,SIMHADRIPURAM,RABI,HORTICULTURE,Vegetables,Bhindi(Okra/Ladysfinger),Nutrient Management,okra nutrient management,RECOMMENDED TO SPRAY NPK 19-19-19 MIXTURE  5 GRAMS/1 LITRE OF WATER,2018-03-17T19:49:27.67,2018,3
ANDHRA PRADESH,Y S R ,SIMHADRIPURAM,NA,HORTICULTURE,Vegetables,Bhindi(Okra/Ladysfinger),Agriculture Mechanization,Bhindi Helicoverpa leaf eating cater pillar management,RECOMMENDED TO SPRAY EMAMECTIN BENZOATE  90 GRAMS /200 LITRES OF WATER / ACRE,2018-03-17T20:06:18.127,2018,3
ANDHRA PRADESH,KRISHNA,G.KONDURU,NA,AGRICULTURE,Others,Others,Weather,WEATHER REPORT,today a moderate thunderstorm is likely  to take place in your area.,2018-03-17T17:28:32.767,2018,3
ANDHRA PRADESH,ANANTPUR,DHARMAVARAM,NA,HORTICULTURE,Fruits,Guava,	Plant Protection	,GUAVA ALGAL LEAF SPOT MANAGEMENT,RECOMMENDED  TO SPRAY COPPER OXY CHLORIDE  600 GRAMS   +   STREPTOCYCLINE   20 GRAM  / 200 LITRES OF WATER /ACRE,2018-03-17T17:44:20.427,2018,3
ANDHRA PRADESH,SRIKAKULAM,KAVITI,NA,HORTICULTURE,Vegetables,Chillies,	Plant Protection	,CHILLI THRIPS MANAGEMENT,RECOMMENDED TO SPRAY DIFENTHIURON   300 GRAMS/200 LITRES OF WATER /ACRE,2018-03-17T17:53:40.17,2018,3
ANDHRA PRADESH,KRISHNA,AGIRIPALLI,NA,AGRICULTURE,Cereals,Paddy (Dhan),	Plant Protection	,PADDY STEM BORER MANAGEMENT,RECOMMENDED TO SPRAY CARTAP HYDROCHLORIDE 400 GRAMS/ 200 LITRES OF WATER / ACRE,2018-03-17T18:02:48.913,2018,3
ANDHRA PRADESH,KURNOOL,TUGGALI,NA,AGRICULTURE,Others,Others,Weather,WEATHER REPORT,"WEATHER REPORT
THERE IS A CHANCE  OF CLOUDY WEATHER OCCUR IN YOUR AREA",2018-03-17T18:10:33.477,2018,3
ANDHRA PRADESH,ANANTPUR,ANANTAPUR,NA,AGRICULTURE,Millets,Sorghum (Jowar/Great Millet),	Plant Protection	,SUCKING PESTS MANAGEMENT IN SORGHUM,RECOMMENDED TO USE ACEPHATE 300 GM PER 200 LITRES OF WATER PER ACRE,2018-03-12T11:44:02.693,2018,3
ANDHRA PRADESH,ANANTPUR,ATMAKUR,NA,AGRICULTURE,Oilseeds,Groundnut (pea nut/mung phalli),Market Information,ground nut market information,"ground nut market information :
minimum- 2266 /-Rs/quintal
maximum- 4369 /-Rs/quintal
average -3829 /-Rs/quintal",2018-03-12T12:32:22.63,2018,3
ANDHRA PRADESH,NELLORE,KAVALI,NA,AGRICULTURE,Others,Others,Weather,WEATHER REPORT,"NO RAIN IN YOUR AREA ,CLOUDY WEATHER OCCUR",2018-03-12T12:36:18.967,2018,3
ANDHRA PRADESH,KRISHNA,TIRUVURU,NA,HORTICULTURE,Fruits,Mango,	Plant Protection	,mango fruit borer & FRUIT CRAKING management,"RECOMMENDED TO SPRAY DICHLORVOS 1ml / LIT OF WATER 
RECOMMENDED TO SPRAY BORAX 2GM / LIT OF WATER",2018-03-12T13:47:00.953,2018,3
ANDHRA PRADESH,Y S R ,B KODUR,NA,AGRICULTURE,Oilseeds,Sesame (Gingelly/Til)/Sesamum,	Plant Protection	,ROOT ROT MANAGEMENT IN SESAMUM,RECOMMENDED  TO DRENCH  COPPER OXY CHLORIDE  3 GRAMS / 1 LITRE OF WATER,2018-03-12T13:54:07.84,2018,3
ANDHRA PRADESH,KURNOOL,TUGGALI,NA,HORTICULTURE,Vegetables,Chillies,Market Information,DRY CHILLI MARKET INFORMATION,"DRY CHILLI MARKET INFORMATION : 
minimum- 3000 /-Rs/quintal
maximum- 13300/-Rs/quintal
average -9000/-Rs/quintal",2018-03-12T13:56:37.983,2018,3
ANDHRA PRADESH,PRAKASAM,NAGULUPPALA PADU,NA,AGRICULTURE,Others,Others,Soil Testing,Soil testing information,Recommended to contact your mandal agriculture officer,2018-03-12T14:11:16.857,2018,3
ANDHRA PRADESH,ANANTPUR,BELUGUPPA,NA,AGRICULTURE,Cereals,Paddy (Dhan),Fertilizer Use and Availability,PADDY FERTILIZER MANAGEMENT,RECOMMENDED TO APPLY ;;50UREA;;120;GRAMS;; CARBENDAZIM+MANCOZEB /ACER,2018-03-12T14:11:39.593,2018,3
ANDHRA PRADESH,GUNTUR,BELLAMKONDA,NA,HORTICULTURE,Vegetables,Tomato,Bio-Pesticides and Bio-Fertilizers,tomato fertilizer,60 KG UREA 2 BAGS SSP 1/2 BAG POTAH,2018-03-12T14:12:44.593,2018,3
ANDHRA PRADESH,SRIKAKULAM,SANTHABOMMALI,NA,AGRICULTURE,Others,Others,Bio-Pesticides and Bio-Fertilizers,WASTE DECOMPOSERER MANUFACTURES CONTACT NUMBER,RECOMMENDED TO CONTACT WASTE DECOMPOSER CONTACT NUMBER-8876505340,2018-03-12T15:01:30.793,2018,3
ANDHRA PRADESH,CHITTOOR,GANGADHARA NELLORE,NA,AGRICULTURE,Sugar and Starch Crops,Sugarcane (Noble Cane),Weed Management,weed management in sugercane sown after 2-4 days crop,RECOMMENDED TO SPRAY ATRAZINE 8 to 10 grams per 1 litre,2018-03-15T15:28:14.98,2018,3
ANDHRA PRADESH,KURNOOL,TUGGALI,NA,AGRICULTURE,Others,Others,Market Information,red gram market information,"red gram market information 
minimum, price 1421/quintal
;maximum  price 3899/quintal",2018-03-15T15:48:33.713,2018,3
ANDHRA PRADESH,EAST GODAVARI,KAJULURU,NA,AGRICULTURE,Others,Others,Weather,weather report,"WEATHER REPORT;NO RAIN ,CLOUDY WEATHER OCCUR IN YOUR AREA",2018-03-15T09:44:34.19,2018,3
ANDHRA PRADESH,WEST GODAVARI,GOPALAPURAM,NA,AGRICULTURE,Oilseeds,Groundnut (pea nut/mung phalli),Sowing Time and Weather,SOWING TIME OF GROUNDNUT,BEST SOWING TIME OF GROUNDNUT ;  NOV - DEC,2018-03-15T09:47:31.447,2018,3
ANDHRA PRADESH,KURNOOL,UYYALAWADA,NA,HORTICULTURE,Vegetables,Bitter Gourd,	Plant Protection	,REGARDING GROWTH DETAILS,CALL DISCONNECTED WHILE HANDLING THE CALL,2018-03-15T10:06:13.197,2018,3
ANDHRA PRADESH,CHITTOOR,YERPEDU,NA,AGRICULTURE,Millets,Maize (Makka),Sowing Time and Weather,MAIZE SOWING TIME,MAIZE SOWING TIME: RECOMMENDED TO SOW JUNE- JULY MONTHS,2018-03-15T14:19:32.02,2018,3
ANDHRA PRADESH,KURNOOL,GADIVEMULA,NA,AGRICULTURE,Oilseeds,Groundnut (pea nut/mung phalli),Market Information,ground nut market information ;,"ground nut market information ;minimum price;3070, maximum price;4360 per rs/quintal",2018-03-15T14:42:11.05,2018,3
ANDHRA PRADESH,CHITTOOR,RAMACHANDRAPURAM,RABI,HORTICULTURE,Fruits,Mango,	Plant Protection	,mango hopper management,RECOMMENDED TO SPRAY IMIDACLOPRID 60 ML /200 LITRES OF WATER,2018-03-15T14:45:39.743,2018,3
ANDHRA PRADESH,NELLORE,KODAVALUR,NA,AGRICULTURE,Others,Others,Weather,WEATHER REPORT,THERE IS A CHANCE  OF CLOUDY WEATHER OCCUR IN YOUR AREA,2018-03-15T14:50:44.317,2018,3
ANDHRA PRADESH,GUNTUR,SATTENAPALLE,NA,HORTICULTURE,Vegetables,Chillies,Agriculture Mechanization,chilli coeanephora blight management ;,RECOMMENDED  TO SPRAY COPPER OXY CHLORIDE  600 GRAMS   +   STREPTOCYCLINE   20 GRAM  / 200 LITRES OF WATER /ACRE,2018-03-15T14:55:20.2,2018,3
ANDHRA PRADESH,CHITTOOR,RAMACHANDRAPURAM,NA,HORTICULTURE,Fruits,Mango,"Water Management, Micro Irrigation",can we give irrigation after spraying of insecticide  in mango,no dont give irrigation after spraying of insecticide  in mango,2018-03-15T14:56:01.257,2018,3
ANDHRA PRADESH,WEST GODAVARI,JANGAREDDIGUDEM,NA,HORTICULTURE,Flowers,Rose,	Plant Protection	,rose leaf spot management,RECOMMENDED TO SPRAY CARBENDAZIM   200  GRAMS/  200 LITRES OF WATER /ACRE,2018-03-15T08:39:02.547,2018,3
ANDHRA PRADESH,KURNOOL,ADONI,NA,AGRICULTURE,Others,Others,Weather,WEATHER REPORT,WEATHER REPORT: NO RAIN IN YOUR AREA CLOUDY WEATHER OCCUR,2018-03-15T07:43:19.93,2018,3
ANDHRA PRADESH,CHITTOOR,KALAKADA,NA,HORTICULTURE,Vegetables,Tomato,Market Information,MARKET INFORMATION OF TOMATO,"MARKET INFORMATION  : 
MINIMUM PRICE -Rs - / QUINTAL  
MAXIMUM PRICE -Rs -/ QUINTAL",2018-03-15T12:16:18.697,2018,3
ANDHRA PRADESH,Y S R ,KAMALAPURAM,NA,AGRICULTURE,Oilseeds,Groundnut (pea nut/mung phalli),Sowing Time and Weather,GROUNFD NUT SOWING TIME,"GROUNFD NUT SOWING TIME
JUNE -JULY",2018-03-19T07:52:40.037,2018,3
ANDHRA PRADESH,EAST GODAVARI,RANGAMPETA,NA,AGRICULTURE,Cereals,Paddy (Dhan),	Plant Protection	,bph in paddy,RECOMMENDED TO SPRAY  BUPROFEZIN +ACEPHATE  500 GRAMS /200 LITRES OF WATER/ ACRE,2018-03-19T07:57:57,2018,3
ANDHRA PRADESH,KURNOOL,ADONI,NA,ANIMAL HUSBANDRY,Animal,Others,Animal Breeding,Andhra pradesh  verternary  contact number,"Andhra pradesh  verternary  contact number 
8790997453
TOLL FREE 18001204208",2018-03-19T08:10:20.527,2018,3
ANDHRA PRADESH,KRISHNA,CHANDARLAPADU,NA,HORTICULTURE,Vegetables,Chillies,	Plant Protection	,CHILLI FRUIT ROT,RECOMMENDED TO SPRAY PROPICONAZOLE    200 ML / 200 LITRES OF WATER /ACRE,2018-03-19T08:59:15.957,2018,3
ANDHRA PRADESH,WEST GODAVARI,DENDULURU,NA,AGRICULTURE,Others,Others,Weather,WEATHER REPORT,Cloudy weather with a light shower in your area,2018-03-19T09:22:59.33,2018,3
ANDHRA PRADESH,ANANTPUR,PEDDAVADUGUR,NA,AGRICULTURE,Others,Others,Weather,WEATHER REPORT,MOSTLY CLOUDY WEATHER OCCURS IN YOUR AREA,2018-03-19T09:48:37.187,2018,3
ANDHRA PRADESH,KURNOOL,KURNOOL,NA,HORTICULTURE,Vegetables,Brinjal,	Plant Protection	,BRINJAL SUCKING PEST MANAGEMENT,RECOMMENDED TO SPRAY DIMETHOATE  400 ML /200 LITRES OF WATER /ACRE,2018-03-19T10:52:33.383,2018,3
ANDHRA PRADESH,EAST GODAVARI,RANGAMPETA,NA,HORTICULTURE,Fruits,Mango,	Plant Protection	,MEALY BUG Management in mango,RECOMMENDED TO SPRAY DICHLORVOS  1 ML / 1 LITERS OF WATER.,2018-03-19T10:59:17.433,2018,3
ANDHRA PRADESH,GUNTUR,VINUKONDA,NA,AGRICULTURE,Cereals,Paddy (Dhan),	Plant Protection	,PADDY STEM BORER MANAGEMENT,RECOMMENDED TO SPRAY PROFENOFOS 400 ML/200 LITRES OF WATER /  ACRE,2018-03-19T11:04:01.76,2018,3
ANDHRA PRADESH,KURNOOL,KOTHAPALLE,NA,AGRICULTURE,Others,Others,Weather,WEATHER REPORT,"Mostly sunny, very warm and less humid",2018-03-18T19:43:33.807,2018,3
ANDHRA PRADESH,KURNOOL,TUGGALI,NA,AGRICULTURE,Others,Others,Weather,WEATHER REPORT,"Mostly sunny, very warm and less humid",2018-03-18T20:01:55.843,2018,3
ANDHRA PRADESH,ANANTPUR,VAJRAKARUR,NA,AGRICULTURE,Others,Others,Weather,WEATHER REPORT,"NO RAIN ,MOSTLY CLOUDY WEATHER OCCURS IN YOUR AREA.",2018-03-18T20:24:47.617,2018,3
ANDHRA PRADESH,GUNTUR,NEKARIKALLU,RABI,AGRICULTURE,Cereals,Paddy (Dhan),	Plant Protection	,PADDY YELLOW STEM BORER CONTROL,RECOMMENDED TO SPRAY CARTAP HYDROCHLORIDE 400 GRAMS/ 200 LITRES OF WATER / ACRE,2018-03-19T07:24:10.63,2018,3
ANDHRA PRADESH,ANANTPUR,NALLAMADA,NA,HORTICULTURE,Flowers,Crossandra,Nutrient Management,NUTRIENT MANAGEMENT IN CROSSANDRA,RECOMMENDED TO SPRAY 13;0;45 / POTASSIUM NITRATE  5 GRAMS/1 LITRE OF WATER,2018-03-14T08:54:24.733,2018,3
ANDHRA PRADESH,ANANTPUR,MADAKASIRA,NA,AGRICULTURE,Others,Others,Weather,WEATHER REPORT:,NO RAIN IN YOUR AREA CLOUDY WEATHER OCCUR,2018-03-14T09:00:30.237,2018,3
ANDHRA PRADESH,CHITTOOR,KALAKADA,NA,AGRICULTURE,Others,Others,Weather,WEATHER REPORT,";NO RAIN ,CLOUDY WEATHER OCCUR IN YOUR AREA",2018-03-14T09:04:04.71,2018,3
ANDHRA PRADESH,KURNOOL,BETHAMCHERLA,NA,AGRICULTURE,Others,Others,Weather,WEATHER INFORMATION :,"DRY WEATHER , LESS CHANCE OF RAIN IN YOUR AREA",2018-03-14T09:30:52.287,2018,3
ANDHRA PRADESH,Y S R ,VEMPALLE,NA,AGRICULTURE,Others,Others,Soil Testing,SOIL TESTING PHONE NUMBER,"SOIL TESTING PHONE NUMBER  
8886613454",2018-03-14T09:58:22.363,2018,3
ANDHRA PRADESH,ANANTPUR,VIDAPANAKAL,NA,AGRICULTURE,Others,Others,Weather,WEATHER REPORT:,"CLOUDY WEATHER OCCUR,NO CHANCE OF RAINFALL IN YOUR AREA",2018-03-14T19:00:29.377,2018,3
ANDHRA PRADESH,ANANTPUR,VAJRAKARUR,NA,AGRICULTURE,Others,Others,Weather,WEATHER REPORT,"WEATHER REPORT
THERE IS A CHANCE  OF CLOUDY WEATHER OCCUR IN YOUR AREA",2018-03-14T19:46:36.883,2018,3
ANDHRA PRADESH,KURNOOL,DHONE ALIAS DRONACHALAM,NA,HORTICULTURE,Fruits,Loquat,	Plant Protection	,MANGO FRUIT FLY MANAGEMENT:,RECOMMENDED TO SPRAY NAPHTHALENE ACETIC ACID 50 ML/ 200 LITRES OF WATER /ACRE,2018-03-14T18:22:58.693,2018,3
ANDHRA PRADESH,KRISHNA,VATSAVAI,NA,AGRICULTURE,Others,Others,Varieties,WEATHER REPORT:,"CLOUDY WEATHER OCCUR,NO CHANCE OF RAINFALL IN YOUR AREA",2018-03-14T18:34:29.22,2018,3
ANDHRA PRADESH,KURNOOL,ALUR,NA,AGRICULTURE,Fiber Crops,Cotton (Kapas),Market Information,COTTON MARKET INFORMATION,COTTON MARKET INFORMATION:MINIMUM PRICE -Rs 3349/-MAXIMUM PRICE-Rs 5165/-PER QUINTAL,2018-03-18T07:30:05.903,2018,3
ANDHRA PRADESH,WEST GODAVARI,KALLA,NA,ANIMAL HUSBANDRY,Animal,"Bovine(Cow,Buffalo)",Dairy Production,GOVERNMENT SCHEMES,CONTACT NUMBER PHONE NUMBER  8790997453,2018-03-18T08:26:25.72,2018,3
ANDHRA PRADESH,KURNOOL,ASPARI,NA,HORTICULTURE,Fruits,Mango,Nutrient Management,nutrient management in mango,RECOMMENDED TO SPRAY NAPTHALENE ACITIC ACID 50 ML/ 200 LITERS OF WATER /ACRE  .,2018-03-19T12:57:40.487,2018,3
ANDHRA PRADESH,CHITTOOR,IRALA,NA,HORTICULTURE,Vegetables,Chillies,	Plant Protection	,chilli bacterial leaf spot management,RECOMMENDED TO SPRAY COPPER OXY CHLORIDE  600  GM + STREPTOCYCLINE   20 GRAM  /200 LITRES OF WATER / ACRE,2018-03-18T14:41:23.12,2018,3
ANDHRA PRADESH,ANANTPUR,TALUPULA,NA,AGRICULTURE,Others,Others,Weather,WEATHER REPORT,Intervals of clouds and sunshine in your area,2018-03-18T14:41:58.393,2018,3
ANDHRA PRADESH,NELLORE,MARRIPADU,NA,AGRICULTURE,Others,Others,Weather,weather report,"Mostly sunny, very warm and less humid",2018-03-18T14:42:32.39,2018,3
ANDHRA PRADESH,EAST GODAVARI,RANGAMPETA,NA,HORTICULTURE,Vegetables,Chillies,	Plant Protection	,chilli suckiung pest management,RECOMMENDED TO SPRAY IMIDACLOPRID 60 ML /200 LITRES OF WATER / ACRE,2018-03-18T17:58:19.32,2018,3
ANDHRA PRADESH,KRISHNA,VATSAVAI,NA,AGRICULTURE,Others,Others,Weather,weather report,Clouds and sun,2018-03-18T18:12:16.303,2018,3
