StateName,DistrictName,BlockName,Season,Sector,Category,Crop,QueryType,QueryText,KccAns,CreatedOn,year,month
ANDHRA PRADESH,Y S R ,KONDAPURAM,NA,AGRICULTURE,Oilseeds,Groundnut (pea nut/mung phalli),Market Information,GROUNDNUT MARKET INFORMATION,"GROUNDNUT MARKET INFORMATION:MINIMUM PRICE -Rs2100 /-  QUINTAL  
MAXIMUM PRICE -Rs4300/- QUINTAL",2018-03-16T14:32:42.69,2018,3
ANDHRA PRADESH,WEST GODAVARI,POLAVARAM,NA,HORTICULTURE,Fruits,Banana,	Plant Protection	,banana nutrient management,recommended to spray micro nutrient 5gm / lit,2018-03-22T15:22:48.247,2018,3
ANDHRA PRADESH,CHITTOOR,K.V.B.PURAM,NA,AGRICULTURE,Others,Others,Weather,weather report :,weather report :no rain in your area cloudy weather occur,2018-03-22T11:05:05.947,2018,3
ANDHRA PRADESH,ANANTPUR,BATHALAPALLE,NA,HORTICULTURE,Fruits,Citrus,	Plant Protection	,citrus mite management,RECOMMENDED TO SPRAY  PROPARGITE 1  LITRES OF WATER,2018-03-22T17:07:30.74,2018,3
ANDHRA PRADESH,NELLORE,KALIGIRI,NA,AGRICULTURE,Millets,Pearl Millet (Bajra/Bulrush Millet/Spiked Millet),Cultural Practices,BAJRA SOWING TIME INFORMATION,BAJRA SOWING TIME INFORMATION:RECOMMENDED JANUARY AS A SUMMER CROP,2018-03-22T17:08:09.007,2018,3
ANDHRA PRADESH,PRAKASAM,ADDANKI,NA,HORTICULTURE,Vegetables,Watermelon,	Plant Protection	,SUCKING PEST MANAGEMENT IN WATERMELON,RECOMMENDED TO SPRAY DIFENTHIURON   300 GRAMS/200 LITRES OF WATER /ACRE,2018-03-22T17:20:38.61,2018,3
ANDHRA PRADESH,ANANTPUR,PAMIDI,NA,AGRICULTURE,Others,Others,Weather,weather report,Mostly cloudy and very warm,2018-03-22T17:58:36.657,2018,3
ANDHRA PRADESH,GUNTUR,ACHAMPET,NA,AGRICULTURE,Others,Others,Crop Insurance,"Agriculture Department, Gov't of Andhra Pradesh. 
Commissioner contact number","Agriculture Department, Gov't of Andhra Pradesh. 
Commissioner contact number  : (+0863)-2216461",2018-03-22T18:38:05.753,2018,3
ANDHRA PRADESH,CHITTOOR,KALAKADA,NA,AGRICULTURE,Cereals,Paddy (Dhan),Market Information,PADDY MARKET INFORMATION,MINIMUM PRICE;;1590/Q;;MAXIMUM PRICE;;1590/Q;;AVERAGE PRICE; 1590/Q,2018-03-22T18:57:33.127,2018,3
ANDHRA PRADESH,NELLORE,PODALAKUR,NA,HORTICULTURE,Vegetables,Cucumber,Nutrient Management,CUCUMBER NUTRIENT MANAGEMENT ;,RECOMMENDED TO SPRAY 13;0;45 / POTASSIUM NITRATE  5 GRAMS/1 LITRE OF WATER,2018-03-22T08:30:36.49,2018,3
ANDHRA PRADESH,KRISHNA,GAMPALAGUDEM,NA,AGRICULTURE,Cereals,Paddy (Dhan),	Plant Protection	,PADDY BACTERIAL LEAF BLIGHT MANAGEMENT,RECOMMENDED  TO SPRAY  STREPTOCYCLINE   20 GRAM  / 200 LITRES OF WATER /ACRE,2018-03-22T09:13:25.513,2018,3
ANDHRA PRADESH,ANANTPUR,GARLADINNE,NA,AGRICULTURE,Cereals,Paddy (Dhan),	Plant Protection	,PADDY STEM BORER,RECOMMENDED TO SPRAY CARTAP HYDROCHLORIDE 400 GRAMS/ 200 LITRES OF WATER / ACRE,2018-03-22T09:31:31.44,2018,3
ANDHRA PRADESH,ANANTPUR,BUKKAPATNAM,NA,HORTICULTURE,Fruits,Mango,	Plant Protection	,MANGO FLOWER AND FRUIT DROP MANAGEMENT:,RECOMMENDED TO SPRAY NAPTHALENE ACITIC ACID 50 ML/ 200 LITERS OF WATER /ACRE,2018-03-22T09:46:10.607,2018,3
ANDHRA PRADESH,GUNTUR,BAPATLA,NA,HORTICULTURE,Vegetables,Chillies,	Plant Protection	,fruit rot in chilli management,RECOMMENDED TO SPRAY PROPICONAZOLE    200 ML / 200 LITRES OF WATER /ACRE,2018-03-22T09:51:37.167,2018,3
ANDHRA PRADESH,0   ,0   ,NA,AGRICULTURE,Others,Others,Weather,WEATHER REPORT,NO RAIN YOUR AREA CLOUDY WEATHER OCCUR,2018-03-21T18:35:12.44,2018,3
ANDHRA PRADESH,KURNOOL,KOLIMIGUNDLA,NA,HORTICULTURE,Fruits,Banana,Fertilizer Use and Availability,FERTILIZER MANAGEMENT IN BANANA,"RECOMMENDED TO APPLY 110 GRAMS OF UREA AND 80 GRAMS POTASH PER PLANT AT 45, 90, 135 AND 180 DAYS OF TRANSPLANTING",2018-03-21T18:43:06.87,2018,3
ANDHRA PRADESH,GUNTUR,0   ,NA,AGRICULTURE,Cereals,Paddy (Dhan),	Plant Protection	,RICE BLAST MANAGEMENT,RECOMMENDED TO SPRAY HEXACONAZOLE+ZINEB   500  GRAMS / 200 LITRES OF WATER /ACRE,2018-03-21T20:21:39,2018,3
ANDHRA PRADESH,KURNOOL,UYYALAWADA,NA,AGRICULTURE,Cereals,Paddy (Dhan),Seeds,RICE RESEARCH STATION HYDERABAD TOLL FREE NUMBER,RICE RESEARCH STATION HYDERABAD TOLL FREE NUMBER ;040-24015817,2018-03-23T11:44:46.52,2018,3
ANDHRA PRADESH,KRISHNA,G.KONDURU,NA,AGRICULTURE,Others,Others,Weather,WEATHER REPORT,"WEATHER REPORT
WEATHER REPORT: NO RAIN IN YOUR AREA CLOUDY WEATHER OCCUR",2018-03-23T13:36:10.163,2018,3
ANDHRA PRADESH,WEST GODAVARI,NALLAJERLA,NA,HORTICULTURE,Plantation Crops,Cashew,Fertilizer Use and Availability,FERTILIZER USE RECOMMENDATION,RECOMMENDED TO SPRAY 13;0;45 / POTASSIUM NITRATE  5 GRAMS/1 LITRE OF WATER,2018-03-03T13:07:15.92,2018,3
ANDHRA PRADESH,WEST GODAVARI,KAMAVARAPUKOTA,NA,HORTICULTURE,Fruits,Chestnut,Cultural Practices,water management in cashew,watering is done once in aweek,2018-03-03T13:42:17.72,2018,3
ANDHRA PRADESH,NELLORE,BALAYAPALLE,NA,AGRICULTURE,Cereals,Paddy (Dhan),	Plant Protection	,paddy brown plant hopper management ;,RECOMMENDED TO SPRAY DINOTEFURAN 80 GRAMS/200 LITRES OF WATER/ ACRE,2018-03-03T13:44:01.82,2018,3
ANDHRA PRADESH,KURNOOL,KRISHNAGIRI,NA,HORTICULTURE,Fruits,Mango,Nutrient Management,mango nutrient management ;,RECOMMENDED TO SPRAY POTASSIUM NITRATE  5 GRAMS/1 LITRE OF WATER,2018-03-03T13:56:16.837,2018,3
ANDHRA PRADESH,CHITTOOR,GANGAVARAM,NA,HORTICULTURE,Vegetables,Tomato,Fertilizer Use and Availability,tomato fertilizer management,recommended to apply urea 40 kg /acre,2018-03-03T14:23:06.95,2018,3
ANDHRA PRADESH,Y S R ,KHAJIPET,NA,AGRICULTURE,Others,Others,Weather,weather report,"WEATHER REPORT: CLOUDY WEATHER OCCUR,NO CHANCE OF RAINFALL IN YOUR AREA",2018-03-05T09:59:39.8,2018,3
ANDHRA PRADESH,NELLORE,PODALAKUR,NA,AGRICULTURE,Cereals,Paddy (Dhan),	Plant Protection	,BLAST IN PADDY MANAGEMENT,RECOMMENDED TO SPRAT   HEXACONAZOLE+ZINEB   500  GRAMS / 200 LITRES OF WATER /ACRE,2018-03-05T10:15:45.927,2018,3
ANDHRA PRADESH,KURNOOL,ATMAKUR,NA,HORTICULTURE,Vegetables,Tomato,Market Information,MARKET INFORMATION OF TOMATO,"MINIMUM PRICE 200,MAXIMUM PRICE 400",2018-03-05T10:20:14.227,2018,3
ANDHRA PRADESH,ANANTPUR,NARPALA,NA,AGRICULTURE,Oilseeds,Groundnut (pea nut/mung phalli),Market Information,GROUNDNUT MARKET INFORMATION  :,"L  GROUNDNUT MARKET INFORMATION  : 
MINIMUM PRICE -2468/- Rs/ QUINTAL  
MAXIMUM PRICE -4327/- Rs/ QUINTA",2018-03-05T11:25:46.663,2018,3
ANDHRA PRADESH,VIZIANAGARM,KOMARADA,NA,HORTICULTURE,Vegetables,Bitter Gourd,	Plant Protection	,BITTER GOURD NUTRIENT MANAGEMENT,RECOMMENDED TO SPRAY NPK 19-19-19 MIXTURE  5 GRAMS/1 LITRE OF WATER,2018-03-05T18:05:15.48,2018,3
ANDHRA PRADESH,NELLORE,CHILLAKUR,NA,AGRICULTURE,Cereals,Paddy (Dhan),	Plant Protection	,paddy blast management,RECOMMENDED TO SPRAY   TEBUCONAZOLE + TRIFLOXYSTROBIN  160 GRAMS /200 LITRES OF WATER /ACRE,2018-03-05T18:11:10.06,2018,3
ANDHRA PRADESH,NELLORE,VINJAMUR,NA,HORTICULTURE,Fruits,Citrus,Agriculture Mechanization,CITRUS GOMMOSIS MANAGEMENT,"BORDEAUX PASTE PREPARATION: It is prepared by mixing 1 kg of copper sulphate and 1 kg of lime in 10 litters of water.
 Bordeaux paste applies usually during Feb.- march ,set- Oct & Dec- Jan to protect healthy plant from soil borne pathogen. It is a wound dresser and used to protect the wounded portions ,cut ends of trees after pruning etc., against the infection by fungal pathogens .",2018-03-05T18:37:45.26,2018,3
ANDHRA PRADESH,SRIKAKULAM,BHAMINI,NA,HORTICULTURE,Fruits,Mango,Nutrient Management,MANGO NUTRIENT MANAGEMENT,RECOMMENDED TO SPRAY NAPHTHALENE ACETIC ACID 50 ML/ 200 LITRES OF WATER /ACRE,2018-03-05T18:38:15.01,2018,3
ANDHRA PRADESH,WEST GODAVARI,CHAGALLU,NA,AGRICULTURE,Pulses,Black Gram (urd bean),	Plant Protection	,black gram pod borer management,RECOMMENDED TO SPRAY  CHLORPYRIFOS  500 ML/200 LITRES OF WATER / ACRE,2018-03-05T19:10:20.05,2018,3
ANDHRA PRADESH,ANANTPUR,ATMAKUR,NA,HORTICULTURE,Fruits,Citrus,Agriculture Mechanization,citrus root rot management,RECOMMENDED  TO DRENCH  COPPER OXY CHLORIDE  3 GRAMS / 1 LITRE OF WATER,2018-03-05T19:22:57.793,2018,3
ANDHRA PRADESH,NELLORE,ALLUR,NA,HORTICULTURE,Fruits,Lemon,	Plant Protection	,LEAF SPOT MANAGEMENT IN LEMON,RECOMMENDED TO SPRAY CARBENDAZIM   200  GRAMS/  200 LITERS OF WATER /ACRE .,2018-03-05T13:21:36.187,2018,3
ANDHRA PRADESH,KRISHNA,MUSUNURU,NA,AGRICULTURE,Others,Others,Market Information,maize market information,"maize market information 
minimum price 1425/quintal
;maximum price 1425/quintal",2018-03-05T14:37:24.197,2018,3
ANDHRA PRADESH,VIZIANAGARM,BADANGI,RABI,HORTICULTURE,Vegetables,Brinjal,	Plant Protection	,BRINJAL LEAF BLIGHT  AND FRUIT ROT CONTROL,RECOMMENDED TO SPRAY PROPICONAZOLE    200 ML / 200 LITRES OF WATER /ACRE,2018-03-05T14:41:14.69,2018,3
ANDHRA PRADESH,NELLORE,BALAYAPALLE,RABI,AGRICULTURE,Millets,Maize (Makka),Market Information,market information;,"market information;
minimum price - 1500 rupees/quintol
maximum price -  2000rupees/quintol",2018-03-05T16:36:23.247,2018,3
ANDHRA PRADESH,EAST GODAVARI,PEDDAPURAM,NA,AGRICULTURE,Cereals,Paddy (Dhan),	Plant Protection	,PADDY BLAST MANAGEMENT,RECOMMENDED TO SPRAY TRICYCLAZOLE + MANCOZEB  400 GRAMS/200 LITRES OF WATER /ACRE,2018-03-05T16:40:16.73,2018,3
ANDHRA PRADESH,ANANTPUR,PEDDAPAPPUR,NA,HORTICULTURE,Vegetables,Bhindi(Okra/Ladysfinger),Agriculture Mechanization,BHINDI RED SPIDER MITE & WHITE FLY  MANAGEMENT,RECOMMENDED TO SPRAY SPIROMESIFEN  200ML /200 LITRES OF WATER /ACRE,2018-03-05T16:55:46.297,2018,3
ANDHRA PRADESH,KURNOOL,PAMULAPADU,NA,AGRICULTURE,Pulses,Bengal Gram (Gram/Chick Pea/Kabuli/Chana),Market Information,BENGAL GRAM MARKET INFORMATION,"BENGAL GRAM MARKET INFORMATION  : 
MINIMUM PRICE -1000 /- Rs/ QUINTAL  
MAXIMUM PRICE - 3622- Rs/ QUINTAL",2018-03-05T17:43:11.787,2018,3
ANDHRA PRADESH,PRAKASAM,BALLIKURAVA,NA,AGRICULTURE,Millets,Maize (Makka),	Plant Protection	,MAIZE STEM BORER MANAGEMENT,RECOMMENDED TO APPLY CARBOFURAN 3 G  GRANULES  3 KG /ACRE,2018-03-05T16:29:57.577,2018,3
ANDHRA PRADESH,CHITTOOR,CHANDRAGIRI,NA,AGRICULTURE,Cereals,Paddy (Dhan),Market Information,MARKET INFORMATION OF PADDY,"MINIMUM PRICE 1450,MAXIMUM PRICE 1530",2018-03-05T12:17:53.34,2018,3
ANDHRA PRADESH,EAST GODAVARI,JAGGAMPETA,NA,AGRICULTURE,Others,Others,Weather,WEATHER REPORT,THERE IS A CHANCE  OF CLOUDY WEATHER OCCUR IN YOUR AREA,2018-03-15T12:42:19.48,2018,3
ANDHRA PRADESH,ANANTPUR,BOMMANAHAL,NA,AGRICULTURE,Others,Others,Weather,WEATHER REPORT,WEATHER REPORT :THERE IS CHANCE OF CLOUDY WEATHER IN YOUR AREA,2018-03-15T13:04:11.44,2018,3
ANDHRA PRADESH,ANANTPUR,D.HIREHAL,NA,AGRICULTURE,Cereals,Paddy (Dhan),Weather,weather report:,weather report:32°C RealFeel® 35°C Clouds and sun,2018-03-15T13:21:06.027,2018,3
ANDHRA PRADESH,WEST GODAVARI,KOYYALAGUDEM,NA,AGRICULTURE,Others,Others,Weather,WEATHER REPORT,CLOUDY WEATHER AND CHANCE OF SHOWERS IN YOUR AREA,2018-03-16T08:02:48.98,2018,3
ANDHRA PRADESH,CHITTOOR,BUCHINADIDU KHANDRIGA,NA,AGRICULTURE,Others,Others,Market Information,MARKET INFORMATION  : GROUND NUT,"MARKET INFORMATION  : GROUND NUT
MINIMUM PRICE -3110 /- Rs/ QUINTAL  
MAXIMUM PRICE -4640 /- Rs/ QUINTAL",2018-03-16T08:32:13.277,2018,3
ANDHRA PRADESH,GUNTUR,VELDURTHY,NA,AGRICULTURE,Others,Others,Weather,WEATHER REPORT,WEATHER REPORT :THERE IS CHANCE OF CLOUDY WEATHER IN YOUR AREA,2018-03-16T07:05:06.18,2018,3
ANDHRA PRADESH,ANANTPUR,VIDAPANAKAL,NA,AGRICULTURE,Others,Others,Weather,weather report,MOSTLY CLOUDY WEATHER OCCURS IN YOUR AREA,2018-03-16T07:15:21.823,2018,3
ANDHRA PRADESH,SRIKAKULAM,KOTABOMMILI,NA,HORTICULTURE,Vegetables,Watermelon,	Plant Protection	,watermelon sucking pest,RECOMMENDED TO SPRAY IMIDACLOPRID  60 ML /200 LITRES OF WATER / ACRE,2018-03-16T07:17:45.34,2018,3
ANDHRA PRADESH,KURNOOL,DEVANAKONDA,NA,AGRICULTURE,Others,Others,Weather,weather report,"WEATHER REPORT;NO RAIN ,CLOUDY WEATHER OCCUR IN YOUR AREA",2018-03-16T07:22:53.34,2018,3
ANDHRA PRADESH,KURNOOL,ADONI,NA,AGRICULTURE,Others,Others,Weather,WEATHER REPORT,THERE IS A CHANCE  OF CLOUDY SHOWERS IN YOUR AREA,2018-03-16T07:23:52.007,2018,3
ANDHRA PRADESH,ANANTPUR,VIDAPANAKAL,NA,AGRICULTURE,Others,Others,Weather,weather information,: Today there is no chance of rainfall in your area,2018-03-16T07:27:52.033,2018,3
ANDHRA PRADESH,PRAKASAM,NAGULUPPALA PADU,NA,AGRICULTURE,Others,Others,Weather,WEATHER REPORT,THERE IS A CHANCE  OF CLOUDY SHOWERS IN YOUR AREA,2018-03-16T07:34:44.307,2018,3
ANDHRA PRADESH,GUNTUR,AMARAVATHI,NA,AGRICULTURE,Fiber Crops,Cotton (Kapas),Market Information,COTTON MARKET INFORMATION;,"COTTON MARKET INFORMATION;	                                                       MAXIMUM-       3800/-RUPEES/QUINTOL                       
MINIMUM -       4500/-RUPEES/QUINTOL",2018-03-15T13:41:08.787,2018,3
ANDHRA PRADESH,NELLORE,THOTAPALLIGUDUR,NA,AGRICULTURE,Cereals,Paddy (Dhan),	Plant Protection	,PADDY PANICLE MITE MANAGEMENT,RECOMMENDED TO SPRAY PROFENOFOS 2 ML/1LITRES OF WATER,2018-03-22T11:32:50.903,2018,3
ANDHRA PRADESH,Y S R ,B KODUR,NA,AGRICULTURE,Cereals,Paddy (Dhan),	Plant Protection	,cotton sukking pest,RECOMMENDED TO SPRAY  FIPRONIL  400 ML/ 200 LITRES OF WATER /ACRE,2018-03-22T11:55:02.53,2018,3
ANDHRA PRADESH,VIZIANAGARM,PARVATHIPURAM,NA,AGRICULTURE,Others,Others,Weather,WEATHER REPORT,THERE IS A CHANCE  OF CLOUDY WEATHER OCCUR IN YOUR AREA,2018-03-15T17:48:58.47,2018,3
ANDHRA PRADESH,Y S R ,RAYACHOTY,NA,HORTICULTURE,Fruits,Mango,Nutrient Management,MANGO FLOWER DROPPING MANAGEMENT:,recommended to spray (13;0;45) potassium nitrate 5 gr/liter of water,2018-03-15T17:53:27.247,2018,3
ANDHRA PRADESH,EAST GODAVARI,PEDAPUDI,NA,AGRICULTURE,Cereals,Paddy (Dhan),	Plant Protection	,PADDY STEM ROT MANAGEMENT ;,RECOMMENDED TO SPRAY   TEBUCONAZOLE + TRIFLOXYSTROBIN  160 GRAMS /200 LITRES OF WATER /ACRE,2018-03-15T17:58:55.58,2018,3
ANDHRA PRADESH,NELLORE,CHILLAKUR,NA,AGRICULTURE,Others,Others,Crop Insurance,Fisheries contact number ;,Fisheries contact number ; 1800-425-1660,2018-03-15T18:01:50.68,2018,3
ANDHRA PRADESH,VISAKHAPATNAM,KOTAURATLA,NA,AGRICULTURE,Oilseeds,Groundnut (pea nut/mung phalli),	Plant Protection	,LEAF FOLDER IN GROUNDNUT,RECOMMENDED TO SPRAY  CHLORPYRIFOS  500 ML/200 LITRES OF WATER / ACRE,2018-03-15T18:15:27.493,2018,3
ANDHRA PRADESH,VISAKHAPATNAM,CHEEDIKADA,NA,AGRICULTURE,Others,Others,Weather,WEATHER REPORT,"WEATHER REPORT: CLOUDY TYPE OF WEATHER OCCUR, CHANCE OF RAIN IN YOUR AREA",2018-03-15T18:25:56.747,2018,3
ANDHRA PRADESH,KURNOOL,CHAGALAMARRI,NA,AGRICULTURE,Others,Others,Weather,WEATHER REPORT,WEATHER REPORT: NO RAIN IN YOUR AREA CLOUDY WEATHER OCCUR,2018-03-15T19:04:02.64,2018,3
ANDHRA PRADESH,KURNOOL,BETHAMCHERLA,NA,AGRICULTURE,Cereals,Paddy (Dhan),Fertilizer Use and Availability,PADDY FERTILIZER MANAGEMENT,RECOMMENDED TO APPLY 35 KG UREA AND 15KG POTASH PER ACRE,2018-03-15T19:06:01.627,2018,3
ANDHRA PRADESH,EAST GODAVARI,GANDEPALLE,NA,AGRICULTURE,Cereals,Paddy (Dhan),	Plant Protection	,RICE BLAST MANAGEMENT,RECOMMENDED TO SPRAY TRICYCLAZOLE + MANCOZEB  400 GRAMS/150 LITRES OF WATER /ACRE,2018-03-15T19:09:07.3,2018,3
ANDHRA PRADESH,KRISHNA,PENUGANCHIPROLU,NA,AGRICULTURE,Others,Others,Weather,WEATHER REPORT,"NO RAIN IN YOUR AREA ,CLOUDY WEATHER OCCUR",2018-03-15T19:38:07.96,2018,3
ANDHRA PRADESH,CHITTOOR,BANGARUPALEM,NA,HORTICULTURE,Fruits,Mango,	Plant Protection	,MANGO THRIPS MANAGEMENT,RECOMMENDED TO SPRAY  FIPRONIL  400 ML/ 200 LITRES OF WATER /ACRE,2018-03-15T15:43:27.173,2018,3
ANDHRA PRADESH,CHITTOOR,NARAYANAVANAM,NA,AGRICULTURE,Others,Others,Weather,WEATHER REPORT,"NO RAIN IN YOUR AREA ,CLOUDY WEATHER OCCUR",2018-03-15T15:52:13.31,2018,3
ANDHRA PRADESH,KURNOOL,ALLAGADDA,NA,AGRICULTURE,Others,Others,Weather,WEATHER REPORT,"NO RAIN IN YOUR AREA ,CLOUDY WEATHER OCCUR",2018-03-15T16:29:52.41,2018,3
ANDHRA PRADESH,ANANTPUR,NARPALA,NA,AGRICULTURE,Others,Others,Weather,weather report :,weather report :no rain in your area cloudy weather occur,2018-03-15T19:52:32.11,2018,3
ANDHRA PRADESH,KURNOOL,DHONE ALIAS DRONACHALAM,NA,AGRICULTURE,Others,Others,Weather,weather report,"WEATHER REPORT: CLOUDY WEATHER OCCUR,NO CHANCE OF RAINFALL IN YOUR AREA",2018-03-15T20:09:18.293,2018,3
ANDHRA PRADESH,GUNTUR,BAPATLA,NA,AGRICULTURE,Oilseeds,Sesame (Gingelly/Til)/Sesamum,Weed Management,SESAMUM WEED MANAGEMENT,RECOMMENDED TO SPRAY QUIZALOPOP ETHYL(TARGA SUPER) 400 ML PER ACRE,2018-03-15T20:24:08.42,2018,3
ANDHRA PRADESH,ANANTPUR,URAVAKONDA,NA,AGRICULTURE,Others,Others,Weather,WEATHER REPORT,WEATHER REPORT :THERE IS CHANCE OF CLOUDY WEATHER IN YOUR AREA,2018-03-16T06:12:51.11,2018,3
ANDHRA PRADESH,ANANTPUR,VAJRAKARUR,NA,HORTICULTURE,Vegetables,Chillies,Market Information,market information of dry chilli,"MARKET INFORMATION of dry chilli  : 
MINIMUM PRICE -Rs - 8000/ QUINTAL  
MAXIMUM PRICE -Rs -13000/ QUINTAL",2018-03-15T16:57:37.63,2018,3
ANDHRA PRADESH,KRISHNA,NUZVID,NA,HORTICULTURE,Fruits,Citrus,	Plant Protection	,citrus sukking pest,RECOMMENDED TO SPRAY DIMETHOATE  400 ML /200 LITRES OF WATER /ACRE,2018-03-22T13:39:36.42,2018,3
ANDHRA PRADESH,KURNOOL,TUGGALI,NA,AGRICULTURE,Pulses,Pigeon pea (red gram/arhar/tur),Market Information,market information of red gram,"minimum price 2589,maximum price 3949",2018-03-22T13:44:44.807,2018,3
ANDHRA PRADESH,EAST GODAVARI,AMBAJIPETA,NA,AGRICULTURE,Others,Others,Government Schemes,MANDAL AGRICULTURAL CONTACT NUMBER,MANDAL AGRICULTURAL CONTACT NUMBER ;Ambajipeta; 8886613551,2018-03-22T13:56:47.89,2018,3
ANDHRA PRADESH,ANANTPUR,KALYANDRUG,NA,AGRICULTURE,Oilseeds,Groundnut (pea nut/mung phalli),Market Information,MARKET INFORMATION OF GROUNDNUT :,"MARKET INFORMATION OF GROUNDNUT : 
MINIMUM PRICE - 2268/- Rs/ QUINTAL  
MAXIMUM PRICE - 4188/- Rs/ QUINTAL",2018-03-22T20:23:18.497,2018,3
ANDHRA PRADESH,ANANTPUR,RAPTADU,NA,HORTICULTURE,Vegetables,Bhindi(Okra/Ladysfinger),	Plant Protection	,BHENDI MITE MANAGEMENT,BHENDI MITE MANAGEMENT : RECOMMENDED TO SPRAY  SPIROMESIFEN  200 ML/200 LITRES OF WATER /ACRE,2018-03-22T20:33:48.697,2018,3
ANDHRA PRADESH,KURNOOL,DORNIPADU,NA,AGRICULTURE,Others,Others,Weather,WEATHER REPORT,weather report :no rain in your area cloudy weather occur,2018-03-22T21:06:18.157,2018,3
ANDHRA PRADESH,CHITTOOR,KAMBHAMVARIPALLE,NA,HORTICULTURE,Fruits,Mango,	Plant Protection	,LEAF HOPPER MANAGEMENT IN MANGO,RECOMMENDED TO SPRAY MONOCROTOPHOS 1.5 ML /1 LITER OF WATER.,2018-03-05T12:59:10.28,2018,3
ANDHRA PRADESH,GUNTUR,CHERUKUPALLE,NA,HORTICULTURE,Fruits,Mango,	Plant Protection	,SUCKING PESTS MANAGEMENT IN MANGO,RECOMMENDED TO SPRAY MONOCROTOPHOS 400 ML /200 LITRES OF WATER /ACRE,2018-03-05T13:02:57.337,2018,3
ANDHRA PRADESH,ANANTPUR,DHARMAVARAM,NA,HORTICULTURE,Vegetables,Chillies,	Plant Protection	,chilli thrips,RECOMMENDED TO SPRAY  FIPRONIL  400 ML/ 200 LITRES OF WATER /ACRE,2018-03-05T13:11:10.97,2018,3
ANDHRA PRADESH,KURNOOL,CHIPPAGIRI,NA,HORTICULTURE,Condiments and Spices,Cinnamon,Market Information,AJWAN MARKET INFORMATION,MANIMUM PRICE;;RS;;4112/QUINTAL;;MAXIMUM PRICE;;RS;;15888/QUINTAL,2018-03-04T20:39:06.803,2018,3
ANDHRA PRADESH,CHITTOOR,K.V.B.PURAM,NA,AGRICULTURE,Cereals,Paddy (Dhan),Market Information,PADDY MARKET INFORMATION,PADDY MARKET INFORMATION MINIMUM: 1550 RS/QUINTAL MAXIMUM:1590 RS/QUINTAL,2018-03-05T07:28:02.797,2018,3
ANDHRA PRADESH,VIZIANAGARM,KOMARADA,NA,HORTICULTURE,Vegetables,Watermelon,Nutrient Management,NUTRIENT MANAGEMENT IN WATERMELON,RECOMMENDED TO SPRAY BORAX 2 GR/1 LITRE OF WATER,2018-03-05T07:39:47.243,2018,3
ANDHRA PRADESH,CHITTOOR,SANTHIPURAM HO ARIMUTHANAPALLE,NA,AGRICULTURE,Others,Others,Cultural Practices,small indusrty loans information,small indusrty loans information; contact to bank manager,2018-03-05T07:49:45.253,2018,3
ANDHRA PRADESH,EAST GODAVARI,RAJANAGARAM,NA,AGRICULTURE,Cereals,Paddy (Dhan),Varieties,VARIETY OF PADDY,"MTU-1001 (VIJETHA), CROP DURATION : 135 DAYS, YIELD: 7 -7.5 TONNES/ HECTARE, RESISTANT TO BROWN PLANT HOPPER AND BLAST",2018-03-08T12:41:18.19,2018,3
ANDHRA PRADESH,NELLORE,CHEJERLA,NA,AGRICULTURE,Cereals,Paddy (Dhan),	Plant Protection	,BROWN PLANT HOPPER MANAGEMENT IN PADDY,RECOMMENDED TO SPRAY  PYMETROZINE   100 GRAMS /200 LITRES OF WATER/ ACRE,2018-03-08T12:58:29.757,2018,3
ANDHRA PRADESH,CHITTOOR,SODAM,NA,HORTICULTURE,Vegetables,Tomato,	Plant Protection	,TOMATO SUCKING,RECOMMENDED FOR SPRAY ACEPHATE 300 GR/ACRE IN  200 LT WATER,2018-03-08T13:13:37.583,2018,3
ANDHRA PRADESH,Y S R ,T.SUNDUPALLE,NA,AGRICULTURE,Cereals,Paddy (Dhan),Storage,STORAGE OF PADDY,RECOMMENDED TO SPRAY MALATHION  2 ML /1 LITRES OF WATER,2018-03-08T13:39:28.223,2018,3
ANDHRA PRADESH,PRAKASAM,CHINAGANJAM,NA,AGRICULTURE,Oilseeds,Groundnut (pea nut/mung phalli),	Plant Protection	,crown rot in ground nut,recommended to apply gypsum 200 kgs/acre,2018-03-08T13:43:41.943,2018,3
ANDHRA PRADESH,CHITTOOR,THOTTAMBEDU,NA,HORTICULTURE,Vegetables,Chillies,	Plant Protection	,MIDGE FLY MANAGEMENT IN CHILLI,RECOMMENDED TO SPRAY TRIAZOPHOS 300 ML /200 LITRES OF WATER / ACRE,2018-03-08T13:59:41.16,2018,3
ANDHRA PRADESH,KRISHNA,NANDIGAMA,NA,ANIMAL HUSBANDRY,Animal,POULTRY  FARM ,Animal Breeding,poiultry farm information,poiultry farm information contact these number 040-24015600,2018-03-08T14:41:08.323,2018,3
ANDHRA PRADESH,GUNTUR,ROMPICHERLA,NA,AGRICULTURE,Cereals,Paddy (Dhan),	Plant Protection	,PADDY STEM BORER MANAGEMENT,RECOMMENDED TO SPRAY CHLORANTRANILIPROLE 60 ML/150 LITRES OF WATER / ACRE,2018-03-07T16:57:56.58,2018,3
ANDHRA PRADESH,KURNOOL,PAGIDYALA,NA,HORTICULTURE,Fruits,Mango,	Plant Protection	,mango fruit,RECOMMENDED TO SPRAY DICHLORVOS  250 ML / 200 LITRES OF WATER,2018-03-07T17:05:19.34,2018,3
ANDHRA PRADESH,CHITTOOR,BANGARUPALEM,NA,HORTICULTURE,Vegetables,Chillies,	Plant Protection	,CHILLI THRIPS MANAGEMENT,RECOMMENDED TO SPRAY  FIPRONIL  2ML /   LITRES OF WATER,2018-03-07T17:47:47.873,2018,3
ANDHRA PRADESH,PRAKASAM,ULAVAPADU,NA,HORTICULTURE,Fruits,Mango,	Plant Protection	,mango mite management,RECOMMENDED TO SPRAY IMIDACLOPRID 0.3ml / lit of water,2018-03-07T18:05:26.003,2018,3
ANDHRA PRADESH,GUNTUR,MACHERLA,NA,AGRICULTURE,Cereals,Paddy (Dhan),	Plant Protection	,paddy brown plant hopper management ;,RECOMMENDED TO SPRAY  BUPROFEZIN +ACEPHATE   500 GRAMS /ACRE,2018-03-07T18:06:29.813,2018,3
ANDHRA PRADESH,SRIKAKULAM,VEERAGHATTAM,NA,HORTICULTURE,Vegetables,Bitter Gourd,	Plant Protection	,BITTER GOURD FRUIT BORER MANAGEMENT,RECOMMENDED TO SPRAY EMAMECTIN BENZOATE  90 GRAMS /200 LITRES OF WATER / ACRE,2018-03-07T18:35:31.967,2018,3
ANDHRA PRADESH,SRIKAKULAM,SRIKAKULAM,NA,HORTICULTURE,Vegetables,Brinjal,	Plant Protection	,REGARDING LURES FOR SPODOPTERA LITURA,RECOMMENDED TO CONTACT MANDAL AGRICULTURAL OFIICER,2018-03-08T10:51:04.717,2018,3
ANDHRA PRADESH,VISAKHAPATNAM,S.RAYAVARAM,NA,HORTICULTURE,Fruits,Chestnut,Field Preparation,chestnut fruit borer management,RECOMMENDED TO SPRAY MONOCROTOPHOS 1.4  ML /1LITRES OF WATER,2018-03-18T10:35:57.087,2018,3
ANDHRA PRADESH,NELLORE,VAKADU,NA,AGRICULTURE,Oilseeds,Groundnut (pea nut/mung phalli),Nutrient Management,nutrient management in groundnut,RECOMMENDED TO SPRAY 13;0;45 / POTASSIUM NITRATE  5 GRAMS/1 LITRE OF WATER,2018-03-18T10:52:10.747,2018,3
ANDHRA PRADESH,NELLORE,BALAYAPALLE,NA,AGRICULTURE,Cereals,Paddy (Dhan),	Plant Protection	,PADDY SHEATH BLIGHT MANAGEMENT,PADDY SHEATH BLIGHT MANAGEMENT :RECOMMENDED TO SPRAY PROPICONAZOLE    200 ML / 200 LITRES OF WATER /ACRE,2018-03-18T10:53:59.467,2018,3
ANDHRA PRADESH,KRISHNA,PEDANA,NA,AGRICULTURE,Others,Others,Weather,weather report,"WEATHER REPORT: CLOUDY WEATHER OCCUR,CHANCE OF RAINFALL IN YOUR AREA",2018-03-18T12:37:54.077,2018,3
ANDHRA PRADESH,ANANTPUR,KANAGANAPALLE,NA,AGRICULTURE,Others,Others,Weather,WEATHER REPORT,"NO RAIN ,MOSTLY CLOUDY WEATHER OCCURS IN YOUR AREA.",2018-03-18T13:19:43.963,2018,3
ANDHRA PRADESH,ANANTPUR,KALYANDRUG,NA,AGRICULTURE,Oilseeds,Groundnut (pea nut/mung phalli),Market Information,market information of groundnut,"MARKET INFORMATION  : groundnut
MINIMUM PRICE -Rs4400  - / QUINTAL  
MAXIMUM PRICE -Rs 4500 -/ QUINTAL",2018-03-18T13:26:31.983,2018,3
ANDHRA PRADESH,ANANTPUR,AGALI,NA,AGRICULTURE,Others,Others,Weather,weather report,";cloudy weather occur , no chance of rainfall in your area",2018-03-18T13:32:27.4,2018,3
ANDHRA PRADESH,KURNOOL,GONEGANDLA,NA,HORTICULTURE,Vegetables,Chillies,Cultural Practices,CHILLI SOWING TIME,CHILLI SOWING TIME-JUNE TO JULY,2018-03-18T17:33:44.497,2018,3
ANDHRA PRADESH,NELLORE,SYDAPURAM,NA,AGRICULTURE,Pulses,Black Gram (urd bean),Varieties,BLACKGRAM SOWING TIME,BLACKGRAM SOWING TIME-FEBRUARY TO MARCH,2018-03-18T17:54:37.927,2018,3
ANDHRA PRADESH,KRISHNA,CHALLAPALLI,NA,HORTICULTURE,Vegetables,Bottle Gourd ,	Plant Protection	,BOTTLE GOURD WHITE FLY MANAGEMENT:,RECOMMENDED TO SPRAY DIMETHOATE  400ML /200 LITRES OF WATER /ACRE,2018-03-18T17:56:45.947,2018,3
ANDHRA PRADESH,CHITTOOR,PULICHERLA H/O REDDIVARIPALLE,NA,HORTICULTURE,Flowers,Marigold,	Plant Protection	,marigold thrips management,RECOMMENDED TO SPRAY DIMETHOATE  400ML /200 LITRES OF WATER /ACRE,2018-03-18T18:04:40.993,2018,3
ANDHRA PRADESH,ANANTPUR,URAVAKONDA,NA,AGRICULTURE,Others,Others,Weather,weather report,"WEATHER REPORT:CLOUDY TYPE OF WEATHER OCCUR, CHANCE OF RAIN IN YOUR AREA",2018-03-17T19:52:35.697,2018,3
ANDHRA PRADESH,KRISHNA,KANCHIKACHERLA,NA,AGRICULTURE,Fiber Crops,Cotton (Kapas),Market Information,COTTON MARKET INFORMATION,"COTTON MARKET INFORMATION :
MINIMUM- 3349/-RS/QUINTAL
MAXIMUM-5165 /-RS/QUINTAL
AVERAGE -4329 /-RS/QUINTAL",2018-03-17T20:09:59.98,2018,3
ANDHRA PRADESH,PRAKASAM,KANDUKUR,NA,AGRICULTURE,Millets,Kodo Millet (Kodara/Varagu),Cultural Practices,MAIZE VARIETIS:,"DHM119,DHM118",2018-03-17T20:54:20.677,2018,3
ANDHRA PRADESH,KURNOOL,MADDIKERA (EAST),NA,AGRICULTURE,Oilseeds,Groundnut (pea nut/mung phalli),Market Information,ground nut market information ;,"ground nut market information ;minumum price;2460, maximum price;4373 per rs/quintal",2018-03-17T21:30:50.697,2018,3
ANDHRA PRADESH,EAST GODAVARI,GOKAVARAM,NA,HORTICULTURE,Vegetables,Ridge Gourd,	Plant Protection	,RIDGE GOURD FRUIT FLY MANAGEMENT,RECOMMENDED TO SPRAY MALATHION   400 ML /200 LITRES OF WATER / ACRE,2018-03-19T14:36:02.823,2018,3
ANDHRA PRADESH,CHITTOOR,PULICHERLA H/O REDDIVARIPALLE,RABI,AGRICULTURE,Cereals,Paddy (Dhan),Nutrient Management,PADDY ZINC DEFICIENCY MANAGENENT,RECOMMENDED TO SPRAY  ZINC SULPHATE  2 GRAMS / 1 LITRE OF WATER,2018-03-19T15:24:23.693,2018,3
