QueryText,KccAns,Language
   farmer asked query on borer/caterpillar control in red gram,recommended to spray quinalphos ( syngenta- ekalux) 400 ml per acre with 200 lit of  water,en
farmer asked query on  borers ( pod borer ) red gram ?, chemical composition: flubendiamide 19.92% + thiacloprid 19.92% w/w sc (480 sc) Â· dosage: chillli-80-100ml/acre,en
" farmer asked query on  borers on and caterpillar management in red gram 
","--recommended to spray flubendiamide + thiacloprid (belt expert) 80ml/acre
",en
farmer asked query on  borers in red gram ?,technical name - flubendiamide 19.92% + thiacloprid 19.92% w/w sc 9 (belt expert) 80-100 ml  ,en
farmer asked query on pest management in red gram-leaf webber,recommended to spry quinolphos 2 ml/lt water 400 ml/200lt water /acre,en
farmer asked query on borer  management red gram ,recommended to spray novaluron 5.25% + emamectin benzoate 0.9%(barazide) 320ml/200 liter of water/acre,en
" farmer asked query on weed management in red gram
",recommended for manual weeding ,en
farmer asked query about borer or caterpillar management in red gram,"recommended to spray flubendiamide + thiacloprid (belt expert) 80ml/acre
",en
gram pod borer in red gram  ?,recommended to spray  novaluron+indoxacarb  (plithora) ,en
nutrient management in red gram ,recommended to spray 13,en
farmer asked about indoxacarb chemical?,recommended to spray for caterpillar management ,en
farmer asked about fenpropathrin 30% ec,recommended to spray for sucking pest and caterpillar management,en
root nematode management,"recommended to apply carbofuran 3 g  granules  8-10 kg /acre  
",en
red gram blight management,"recommended to spray metalaxyl   200 grams / 200 litres of water /acre   
",en
details of fertilizer dosage in redgram,there is a chance  of cloudy showers in your area  ,en
"red gram leaf eating caterpillar manage,ment"," : there is a chance of cloudy weather 
",en
about application of cam super in red gram,recommended to  apply 25 kg per acrae,en
redgram  fertilizer management , recommended to spray potassium nitrate (13-0-45) 5 grams/1 litre of water ,en
red gram  white grub management,recommended to chlorpyrifos 2.5 ml/liter of water ,en
root rot management in redgram,recommended to drench copper oxy chloride  3 grams / 1 litre of water,en
red gram  wilt  management, recommended to spot drenching with  carbendazim @ 1 gm/ litre,en
red gram tobacco caterpiller ," recommended to spray  chlorpyrifos  500 ml/200 litres of water / acre
",en
preventive measure for pod borer in red gram," recommended to spray  chlorpyrifos  500 ml/200 litres of water / acre
",en
red gram weed mangement,recommended to manual weeding,en
root rot management in  rd gram,"recommended to spray copper oxy chloride  600  gm /200 litres of water / acre  
",en
weedicides in red gram,there is no herbicides for controlling broad leaved weeds in red gram. go for inter cultivation ,en
re gram weed management (35 days ), recommended to in this time no need of use weedicide ,en
farmer asked query phytopthora blight  management in redgram ,recommended to spray metaloxyl (ridomil ) 25%w.p 2 gms/ 1 ltr of water,en
farmer asked query on  caterpillar and sucking pest in pigeon pea,recommended to spray crystal apex-50 (ememectin benzoate 1.5%  + fipronil 3.5% sc) 200-250ml/ 200 litres of water / acre -,en
farmer asked query about weed management in redgram,"no recommendation of weedicide,recommended to do manual weeding.",en
 farmer asked query on borer management in red gram ,"recommended to spray novaluron (remon) 300 ml/200 litres of water 
",en
farmer asked query about on maruca management in red gram ,recommended to  spray chloripyriphos 20 %e.c 500 ml/ 200 ltrs of water /acre or   profenophos  50%e.c 400 ml/ 200 ltrs of water /acre,en
 farmer asked query on pest management in red gram - leaf webber,"recommended to spray novaluron(remon) 300 ml/200 litres of water/acre 
recommended to spray emamectin benzoate  (proclaim) 90 grams /200 litres of water / acre  
à°Žà°®à°¾à°®à±†à°•à±à°Ÿà°¿à°¨à±  à°¬à±†à°‚à°œà±‹à°¯à±‡à°Ÿà±  90 à°—à±à°°à°¾à°®à±à°²à±   /200 à°²à±€à°Ÿà°°à±à°² à°¨à±€à°Ÿà°¿à°•à°¿ à°šà±Šà°ªà±à°ªà±à°¨ à°•à°²à°¿à°ªà°¿  à°’à°• à°Žà°•à°°à°¾à°•à± à°ªà°¿à°šà°¿à°•à°¾à°°à°¿ à°šà±‡à°¯à°¾à°²à°¿ 
",en
 farmer asked query on  sucking pest management in redgram ,"recomended to spray acetamiprid(pride)   40 grams  /200 litres of water /acre 
à°…à°¸à°¿à°Ÿà°¾à°®à°¿à°ªà±à°°à±ˆà°¡à±   40 à°—à±à°°à°¾à°®à±à°²à±   / 200 à°²à±€à°Ÿà°°à±à°² à°¨à±€à°Ÿà°¿à°•à°¿ à°šà±Šà°ªà±à°ªà±à°¨ à°•à°²à°¿à°ªà°¿ à°’à°• à°Žà°•à°°à°¾à°•à± à°ªà°¿à°šà°¿à°•à°¾à°°à°¿ à°šà±‡à°¯à°¾à°²à°¿  (or)
recommended to spray imidacloprid (confidor) 60 ml/200 litres of water /acre ",en
"farmer asked query on maruka, helicoverpa in red gram","recommended to spray emamectin benzoate  (proclaim) 90 grams /200 litres of water / acre  
",en
farmer asked query about on maruca vitrata management in red gram ,recommended to spray chloripyriphos 2.5 ml/ 1ltr 500 ml/200 ltr of water/acre,en
farmer asked query about maruca vitrata management ,--emamectin benzoate 0.4 gm / 1 ltr of water,en
"farmer asked query on  sucking pest management in red gram
","recommended to spray  fipronil (regent) 400 ml / 200 litres of water /acre  
 à°«à°¿à°ªà±à°°à±‹à°¨à°¿à°²à± 400  à°®à°¿à°²à±à°²à°¿ à°²à±€à°Ÿà°°à±à°²à± /200 à°²à±€à°Ÿà°°à±à°² à°¨à±€à°Ÿà°¿à°•à°¿ à°šà±Šà°ªà±à°ªà±à°¨ à°•à°²à°¿à°ªà°¿ à°’à°• à°Žà°•à°°à°¾à°•à± à°ªà°¿à°šà°¿à°•à°¾à°°à°¿ à°šà±‡à°¯à°¾à°²à°¿ 
recommended to spray  thiamethoxam (actara) 40 gm/ 200 liters of water / acre",en
farmer asked query on micronutrient  spray at flowering stage,recommended to flowers are good  no need  if flowers are not good  spray,en
"  farmer asked query on sucking pest  management in redgram
","recommended to spray fipronil +imidacloprid (police,lesenta)100gm/ 200 liter of water/ acre
recommended to spray difenthiuron(pegasus) 240 gm /150 litres of water /acre 
à°¡à°¿à°«à±†à°‚à°¤à°¿à°¯à±‚à°°à±‹à°¨à± 240 à°—à±à°°à°¾à°®à±à°²à± /150 à°²à±€à°Ÿà°°à± à°¨à±€à°Ÿà°¿à°•à°¿ à°•à°²à°¿à°ªà°¿ à°Žà°•à°°à°¾à°¨à°¿à°•à°¿ à°ªà°¿à°šà°¿à°•à°¾à°°à±€ à°šà±‡à°¯à°¾à°²à°¿ 
",en
farmer asked  query about on leaf hopper management in red gram ,recommended to spray dimethoate ( rogar ) 30 % e.c 400 ml/200 ltrs of water /acre ,en
farmer asked query about on midge fly on blossom in redgram  ,no insecticides were not recommended please remove and destroy,en
farmer asked about jassids control in red gram ?,"recommended to spray  acephate+ imidacloprid (lancer gold) 400gm/200 lit of water/acre
recommended to spray azadirhachtin (neem seed kernal oil )  1 litre  /200 litres of water /acre 
 à°µà±‡à°ª à°¨à±‚à°¨à±† 1 à°²à±€à°Ÿà°°à± /200 à°²à±€à°Ÿà°°à±à°² à°¨à±€à°Ÿà°¿à°•à°¿ à°šà±Šà°ªà±à°ªà±à°¨ à°•à°²à°¿à°ªà°¿  à°’à°•  à°Žà°•à°°à°¾à°•à±  à°ªà°¿à°šà°¿à°•à°¾à°°à°¿ à°šà±‡à°¯à°¾à°²à°¿ 
",en
farmer asked query about on leaf hoppers management in red gram ,recommended to spray monocrotophos 1.6 ml/ 1ltr of water 320 ml/200 ltr of water/acre,en
"

   farmer asked query on disease powdery mildew  control in red gram 
",recommended to spray wettable sulphur 3gm/1 ltr of water or carbandyzum ( baviston ) 50%w.p 1gm / 1 ltr of water ,en
"farmer asked query on pest management in red gram about --teevra
chlorpyrifos 50% ec","--teevra
chlorpyrifos 50% ec

focus crops
paddy, cotton

insects
stem borer, leaf roller, bollworms

dose
300-480 ml/acre",en
farmer asked query on  borers in red gram ,"--recommended to spray carbosulfan (marshal) 400 ml /200 litres of water /acre 
",en
 farmer asked query on sucking pest management in redgram,"recommended to spray monocrotophos (nuvacron) 400 ml /200 litres of water /acre à°®à±‹à°¨à±‹à°•à±à°°à±‹à°Ÿà±‹à°ªà°¾à°¸à±  400  à°®à°¿à°²à±à°²à°¿ à°²à±€à°Ÿà°°à±à°²à±  /à°’à°• à°Žà°•à°°à°¾à°•à± à°ªà°¿à°šà°¿à°•à°¾à°°à°¿ à°šà±‡à°¯à°¾à°²à°¿
   recommended to spray azadirhachtin (neem seed kernal oil )  1 litre  /200 litres of water /acre(1500 ppm) 
",en
farmer asked about post emergent weed management in red gram?(50 days after planting),recommended to go for manual weeding,en
farmer asked about post emergent weed management in red gram ?(40 days after sowing),recommended to go for manual weeding ,en
"farmer asked query on fertilizer application in red gram 
",recomneded to urea  40 kg per acre in redgram,en
  farmer asked query on fertilizer application in redgram,recommended to urea 30 kg+dap50 kg or ssp 150 kg + mop 20 kg /acre,en
"                                                                               
  farmer asked query on weed management in redgram
                                                                                                                                                                                                                                                                             ",--recommended to weedcide apply between 25 to 30 days old crop,en
farmer asked  query on nutrient management in redgram,"----recommended to spray borax 3 grams /1 litr of water (600 grams /acre/200 liter water)
--recommended to spray potassium nitrate 13-0-45 @ 5 grams/1 liter of water.
à°ªà±Šà°Ÿà°¾à°·à°¿à°¯à°‚  à°¨à±ˆà°Ÿà±à°°à±‡à°Ÿà±  13-0-45 @ 5 à°—à±à°°à°¾à°®à±à°²à± à°²à±€à°Ÿà°°à± à°¨à±€à°Ÿà°¿à°•à°¿ à°•à°²à°¿à°ªà°¿  à°ªà°¿à°šà°¿à°•à°¾à°°à±€ à°šà±‡à°¯à°‚à°¡à°¿ 
",en
farmer asked query on  borers  in red gram ? ,"recommended to spray lambda cyhalothrin (karate) 400 ml /200 litres of water / acre  
",en
farmer asked query on fertilizer management in red gram ,recommended to apply urea and murate of potash ,en
"farmer asked query on spotted pod borer: maruca testulalis management in pigeon pea
","recommended to spray  chlorpyrifos  (corabon/predator) 1.5 ml/1 litre of water 
",en
farmer asked query on better flowering in red gram ,"recommended to spray ambition 250ml/acre/200lit water
",en
farmer asked about sterility mosaic virus (spread through mite) management in red gram ?,"recommended to control vector 
recommended to spray wettable sulphur (thiovit) 600 grams/200 litres of water / acre 
 à°¨à±€à°Ÿà°¿à°²à±‹ à°•à°°à°¿à°—à±‡ à°—à°‚à°§à°•à°‚ à°ªà±Šà°¡à°¿    600 à°—à±à°°à°¾à°®à±à°²à±   / 200 à°²à±€à°Ÿà°°à±à°² à°¨à±€à°Ÿà°¿à°•à°¿ à°šà±Šà°ªà±à°ªà±à°¨ à°•à°²à°¿à°ªà°¿  à°’à°• à°Žà°•à°°à°¾à°•à± à°ªà°¿à°šà°¿à°•à°¾à°°à°¿ à°šà±‡à°¯à°¾à°²à°¿ 
recommended to go for resistant varieties lrg-105, icpl-87119",en
farmer asked query  about powdery mildew management in redgram,"recommended to spray myclobutanil ( indexÂ ) 150gm /acre 
",en
farmer asked query about flower drop management in redgram ,"recommended to spray naphthalene acetic acid (planofix) 50 ml/ 200 litres of water /acre (1 ml/ 4.5 liters of water)  
",en
"  farmer asked query on  borers on and caterpillar management  in black gram ?
",flubendiamide 19.92% + thiacloprid 19.92% w/w sc 100 ml  ( bayer expert ),en
 farmer asked query on market information of red gram,"                                                                                           min price	modal price	max price
andhra pradesh	kurnool	redgram-red	2,008	4,580	6,268",en
farmer asked query on    red gram leaf spot management ,"recommended to spray propiconazole (tilt) 200 ml/200 liters of water/acre
",en
farmer asked about permethrin 25 ec chemical usage?,recommended to use for control of  sucking pest and pod borers,en
red gram macrophomina wilt management??,"recomended to spray copper oxy chloride 600 gr +
streptocycline 20 gr  per acre with  200 lit water
",en
farmer askedquery on borer/caterpillar management in red gram,recommended to spray novaluron ( remon) 300 ml per 200 liters of water per acre.,en
farmer asked query ampligo insecticide uses,recommended to apply,en
farmer asked query on over dosage of chemical management in red gram ?,----recommended to spray 2% urea 10 gr/1 litre of water,en
farmer asked query about pest management( caterpillar management) in pigeon pea ,recommended to spray quinolphos @ 2ml per one liter of water,en
red gram fertilizer schedule management ,recommended to apply basal dose - n.p.k- 8:20:0 acre ,en
 farmer asked query on borer/caterpillar control in  red gram,recommended to spray quinolphos @ 400 ml per 200 liters of water per acre.,en
farmer asked query on fertilizer management in redgram,fertilisers: urea 30kg+dap 50 kg +mop-20kg/acre in redgram,en
"farmer asked query on red gram, seed rate","early maturing var. - 20 - 25 k g/ha (row to row - 45 - 60 cm & plant to plant - 10 - 15 cm)

medium/late maturing var. - 15 - 20 k g/ha (row to row - 60 - 75 & plant to plant - 15 - 20 cm)

",en
farmer asked query on seed treatment of redgram,"seeed treatment with fungicide - captan/thiram /mancozeb 3 grams  ; 
seeed treatment with insecticide -imidacloprid 3ml  (sucking pests) ,/1 kg of seeds, 
",en
farmer asked about post emergent weed management in castor intercropped with red gram ?,recommended to go for manual weeding with hoe ,en
farmer asked query on fertilizer management in red gram,mop-13/ kg acre,en
  farmer asked query on  irrigation   managemet in redgram, recommeded to  give light irrigation ,en
farmer asked query about borer management in redgram ,recommended to spray quinalphos ( syngenta- ekalux) 400 ml per acre with 200 lit of  water,en
farmer asked query about  borer management in redgram ,recommended to spray quinalphos ( syngenta- ekalux) 400 ml per acre with 200 lit of  water,en
farmer asked query on sterility mosaic in red gram,recommended to please grow resistant varities,en
farmer asked query on borer  management in redgram,recommended to spray quinalphos ( syngenta- ekalux) 400 ml per acre with 200 lit of  water,en
farmer asked query about caterpillar management in redgram ,recommended to spray quinalphos ( syngenta- ekalux) 400 ml per acre with 200 lit of  water,en
farmaer asked about flowering in red gram,recommended to spray borax 3 grams /1 litr of water  (600 grams /acre/200 liter water ),en
farmer asked query on weed  management in red gram ?,"recmmended to spray imazitapyr (basf -pursuit,weedblock) 300- 400 ml/200 litres of water per acre ",en
farmer asked query weed management in redgram ,no recommendation of herbicide.,en
   farmer asked query on borer/caterpillar control in redgram,recommended to spray quinolphos @ 200 ml per 200 liter of water per acre,en
"  farmer asked query on nutrient management  in red gram 
","----recommended to spray borax 3 grams /1 litr of water (600 grams /acre/200 liter water)
--recommended to spray potassium nitrate 13-0-45 @ 5 grams/1 liter of water.
",en
 farmer asked query on spine pod borer  in red gram crop ?,"recommended to spray belt expert (flubendamide + thiachloprid) @ 80 ml per acre
",en
farmer asked query on nutrient management in red gram-prevent flower drop,"recommended to spray naphthalene acetic acid (planofix) 50 ml/ 200 litres of water /acre (1 ml/ 4.5 liters of water)  
",en
farmer asked query on weed management in pigeon pea,recommended to do hand weeding,en
farmer asked query on nutrient management in pigeon pea,"recommended to spray 13;0;45 potassium nitrate  5 grams/1 litre of water 13;0;45 à°ªà±Šà°Ÿà°¾à°·à°¿à°¯à°‚  à°¨à±ˆà°Ÿà±à°°à±‡à°Ÿà±   5 à°—à±à°°à°¾à°®à±à°²à±  à°’à°• à°²à±€à°Ÿà°°à± à°¨à±€à°Ÿà°¿à°•à°¿ à°•à°²à°¿à°ªà°¿  à°ªà°¿à°šà°¿à°•à°¾à°°à±€ à°šà±‡à°¯à°‚à°¡à°¿ 
recommended to spray borax 3 grams/1 litre of water",en
 farmer asked query on  how much time  that the plant take time to absorb chemical spraying.,"minimum time for plant to  absorb  chemical spraying is 3-6 hours  
",en
farmer asked query on nutrient management in red gram ?,"---recommended to spray borax 3 grams /1 litr of water (600 grams /acre/200 liter water)
--recommended to spray potassium nitrate 13-0-45 @ 5 grams/1 liter of water.
à°ªà±Šà°Ÿà°¾à°·à°¿à°¯à°‚  à°¨à±ˆà°Ÿà±à°°à±‡à°Ÿà±  13-0-45 @ 5 à°—à±à°°à°¾à°®à±à°²à± à°²à±€à°Ÿà°°à± à°¨à±€à°Ÿà°¿à°•à°¿ à°•à°²à°¿à°ªà°¿  à°ªà°¿à°šà°¿à°•à°¾à°°à±€ à°šà±‡à°¯à°‚à°¡à°¿. 
",en
red gram weed  management 1month ,recommended to hand weeding is the best method,en
farmer asked query on pod borer in red gram ?,technical name - flubendiamide 19.92% + thiacloprid 19.92% w/w sc,en
farmer asked query about leaf folder management in pigeon pea ,--recommended to spray quinolphos@ 400 ml per 200 liters of water per acre.,en
farmer asked query about leaf folder management in redgram,recommended to spray quinolphos @ 400 ml per 200 liters of water.,en
asking about pod borer control in redgram,query:pod borer control in redgram ans:spray chlorantraniliprole 3 ml/10 lit of water,en
 farmer asked query on  borers in red gram  ?,recommended to spray thiodicarb (larvin) 1.5 gram / 1 liter of water 300 gr 200 litres of water / acre   ,en
farmer asked query about caterpillar or borer management in red gram,recommended to spray quinolphos @ 400 ml per 200 liters of water per acre.,en
red gram crop  pod borer management ,"recommended to spray thiamethoxam (12.6%) + lambdacyhalothrin (alika) 320ml/200 liter of water/ acre
recommended to spray belt expert ( flubendamide  + thiachloprid ) @ 80 ml per acre
",en
  farmer asked query on sucking pest management in redgram,recommended to spray  acephate+ imidacloprid (lancer gold) 400gm/200 lit of water/acre,en
farmer asked query about spotted pod borer in redgram,recommended to spray quinolphos @ 400 ml per 200 liters of water per acre.,en
farmer asked query about on leaf (guudu) folding management in red gram ,recommended to spray monocrotophos 320 ml/acre red gram (guudu  purugu )management ,en
red gram weed management  40 days ,recommended to hand weeding is the best method ,en
farmer asked about spodoptera in redgram,recommended to spray quinalphos ( syngenta- ekalux) 400 ml per acre with 200 lit of  water,en
farmer asked query about can we spray phendal in cotton , recommended to spray phendal in cotton certainly,en
farmer asked query about on leaf gall fly management,monocrotophos 1.6 ml/ 1 ltr of water,en
farmer asked query about on maruca control in redgram,recommended to spray chloripyriphos 2.5 ml/ 1 ltr of water,en
farmer asked query about caterpillar or borer  management in redgram.,"recommended to spray azadirhachtin (neem seed kernal oil )  1 litre  /200 litres of water /acre 
 à°µà±‡à°ª à°¨à±‚à°¨à±† 1 à°²à±€à°Ÿà°°à± /200 à°²à±€à°Ÿà°°à±à°² à°¨à±€à°Ÿà°¿à°•à°¿ à°šà±Šà°ªà±à°ªà±à°¨ à°•à°²à°¿à°ªà°¿  à°’à°•  à°Žà°•à°°à°¾à°•à±  à°ªà°¿à°šà°¿à°•à°¾à°°à°¿ à°šà±‡à°¯à°¾à°²à°¿ 
recommended  to spray quinolphos @ 400 ml per 200 liters of water per acre.",en
red gram varieties information ,"red gram varieties ; l r g -41 , asha maruthi w r g - 27",en
weed management in redgram sown after 15 days crop ,"recmmended to spray imazitapyr (basf -pursuit,weedblock) 300- 400 ml/200 litres of water per acre ",en
red gram weed management ,recommended to spray pendimethalin extra 38.7% 700 ml /200 litres of water acre  ,en
pluemoth management in red gram ,recommended to spray quinalphos ( syngenta- ekalux) 400 ml per acre with 200 lit of  water,en
fertilizer application in red gram and soya inter crop ,recommended to apply dap-50kg or 20.20.0.13@100kg/acre and mop-15kg/acre,en
best sowing time of redgram for vanakalam ,best sowing time of redgram ,en
farmer asked query on dose of nagarjuna profenofos 40% cypermethrin 4% ec profex super insecticide,"recommended to  nagarjuna profenofos 40% cypermethrin 4% ec profex super insecticide
1 à°²à±€à°Ÿà°°à± à°¨à±€à°Ÿà°¿à°•à°¿ 2ml,  
à°Žà°•à°°à°¾à°¨à°¿à°•à°¿ 350-400ml 180-200 à°²à±€à°Ÿà°°à±à°²  à°¨à±€à°°à±",en
dosage of  danitol insecticide information ,dosage: 400 - 500 ml per acre. method of application: make a solution of the recommended dose of danitol in 200 litres of water per acre and spray. cotton.,en
sucking pest management in red gram crop ,recommended to spray  fipronil  +imidacloprid (police) 100 grams/200 litres of water /acre  ,en
incomplete call--call disconnected,incomplete call --please call back,en
farmer asked query about on pod borer management in red gram ,recommended to spray chlorpyriphos 2.5 ml/1 ltr of water 500 ml/200 ltrs of water /acre,en
farmer asked query about on iamgithfir dosage?,recommended to spray imagithfir 250 ml/acre 2.5 ml/1 ltr of water,en
farmer asked query on   fertilizers application  in red gram,recommended to urea-30kg+mop-15-20kg/acre in red gram,en
farmer asked query about spotted borer management in red gram ?,recommended  to spray emamectin benzoate 0.4 gm/1 ltr of water 80 gm/acre,en
farmer asked query about on spotted borer management in red gram ?,recommended to spray chlorpyriphos 2.5 ml/1 ltr of water 500 ml/acre,en
farmer asked query on leaf folder management in red gram ? ,"recommended to spray quinalphos ( syngenta- ekalux) 400 ml per acre with 200 lit of  water
",en
farmer asked about wilt management in red gram ?,"there is no chemical control for wilt 
have to cultivate resistant varieties and go for crop rotation with jowar or tobacco",en
farmer asked query about on tobacco caterpillar  management in red gram ?,"recommended to spray  quinalphos 25% ec (ekalux) 300ml to 400ml /200 liter of water/acre
",en
   farmer asked query on  dry root rot disease control in redgram,"recommended to spray copper oxy chloride  (blitox,blue copper) 600  gm /200 litres of water / acre  ",en
farmer asked query about on pod borer management in red gram ?,recommended to spray chlorpyriphos 2.5 ml/1 ltr of water 500 ml/acre,en
"farmer asked query on caterpillar(helicoverpa)  management in redgram ?
","recommended to spray novaluron (remon) 300 ml/200 litres of water /acre
",en
farmer asked query about collar rot management in redgram ,"recommended to spray copper oxy chloride  (blitox,blue copper) 600  gm /200 litres of water / acre.  

",en
farmer asked query about on leaf webber management in red gram ?,recommended to spray quinolphos 2ml/1 ltr of water 400 ml/200 ltrs of water /acre,en
farmer asked query about on wilt management in redgram ?,recommended to spray mancozeb 3 gm/1 ltr of water 600 gm/acre,en
"asked about pest management 
","suggested to spray chlorpyriphos @ 2 ml/ltr of water
",en
farmer asked query on leaf flder mangement in redgram,"recommended to spray  ( akalux )quinolphos  25 % ec  400 ml per acre with 200 lit of  water```
",en
farmer asked query about on  nutrient management in red gram ?,"recommended to spray agromin max 600 gm/acre
13-0-45 1 kg/acre",en
farmer asked query about on borer management in red gram ?,recommended to spray chlorpyriphos 500 ml/acre 2.5 ml/1 ltr of water ,en
farmer asked query about on root rot management in red gram ?,"recommended to spray copper oxy chloride  (blitox,blue copper) 600  gm /200 litres of water / acre  
",en
farmer asked query on leaf miner control in red gram,recommended to spray  syngenta-voliam targo (chlorantraniliprole + abamectin) 200 ml/ 200 litres of water ,en
"farmer asked query on root grub management in red gram ?
","recommended to apply carbofuran 3g granules 8-10 kgs/acre
",en
farmer asked query on weed management and sowing time of redgram,"recommended not to spray any weedicide 
sowing time of redgram=september to october 15",en
farmer asked query on imazethapyr 10 sl dosage ?,- imazethapyr 10 % sl dosage - 400ml/ 200 liters of water/acre,en
farmer asked query about on weed management in red gram ?,no herbicides were not recommended on that stage crop ,en
 farmer asked query on red gram intercropping black gram crop for weed management ?,recommended to hand weeding is the best method .,en
farmer asked query on weedicide use in 18 days old red gram crop ? ,recommended to no weedicide use in 18 days old red gram crop do manual weeding ,en
farmer asked about fertilizer application in red gram ?,"recommended to apply fym @ 2t per acre, 17 kg urea, and 125 kg ssp per acre as basal dose ",en
