StateName,DistrictName,BlockName,Season,Sector,Category,Crop,QueryType,QueryText,KccAns,CreatedOn,year,month
ANDHRA PRADESH,CHITTOOR,VARADAIAHPALEM,NA,AGRICULTURE,Cereals,1137,3,rice gundghi bug,Malathion  2 ml/ lt water,2011-05-23T02:17:00,2011,5
ANDHRA PRADESH,PRAKASAM,ADDANKI,NA,HORTICULTURE,Fruits,Citrus,0,ASKED ABOUT FERTILIZERS IN CHINI,INFORMATION GIVEN AS PER DATA,2011-05-23T02:47:00,2011,5
ANDHRA PRADESH,KURNOOL,KOSIGI,NA,AGRICULTURE,Oilseeds,"Castor (Rehri, Rendi, Arandi) ",0,control of weed in castor,sparying pendimithalin 1lit/ 1 acer,2011-05-09T02:51:00,2011,5
ANDHRA PRADESH,GUNTUR,DURGI,NA,AGRICULTURE,Oilseeds,Sesame (Gingelly/Til)/Sesamum,0,control of rice blasi,spraying trysichlojol 2ml/1 lit water,2011-05-09T03:16:00,2011,5
ANDHRA PRADESH,KRISHNA,GUDURU,NA,AGRICULTURE,Oilseeds,"Castor (Rehri, Rendi, Arandi) ",0,control of root rot in coconut,applying trykodarma viridi 50gr+nimcake5 kg/ acer,2011-05-09T03:16:00,2011,5
ANDHRA PRADESH,VIZIANAGARM,MAKKUVA,NA,HORTICULTURE,Fruits,Banana,95,control of weed in banana,sparying glyphoset 100 gr/ 10 lit water,2011-05-09T03:16:00,2011,5
ANDHRA PRADESH,Y S R ,PENDLIMARRI,NA,HORTICULTURE,Fruits,Passion Fruit,0,fruit borer,recommanded information has given,2011-05-09T08:19:00,2011,5
ANDHRA PRADESH,KRISHNA,PEDANA,NA,AGRICULTURE,Cereals,1137,0,new varities,NA,2011-05-09T08:19:00,2011,5
ANDHRA PRADESH,WEST GODAVARI,NALLAJERLA,NA,HORTICULTURE,Vegetables,1279,0,brinjal shoot n fruit borer damage control,recommended profenophos 2.5ml/lt,2011-05-10T11:55:00,2011,5
ANDHRA PRADESH,CHITTOOR,BUCHINADIDU KHANDRIGA,NA,HORTICULTURE,Vegetables,Tomato,0,flower dropping cotrol in tomato,recommended  the Planofix 2.5ml/10lit,2011-05-10T12:34:00,2011,5
ANDHRA PRADESH,Y S R ,MUDDANUR,NA,HORTICULTURE,Fruits,Banana,75,control of cigatoka in banana,sparying trydimarph 2ml/1 lit water,2011-05-11T06:38:00,2011,5
ANDHRA PRADESH,GUNTUR,GUNTUR,NA,HORTICULTURE,Fruits,Citrus,99,control of flower droping in citrus,spraying planopix 2.5ml/10 lit water,2011-05-11T06:38:00,2011,5
ANDHRA PRADESH,CHITTOOR,KALIKIRI,NA,AGRICULTURE,Others,Others,29,vareities of  grass,1730246,2011-05-11T06:38:00,2011,5
ANDHRA PRADESH,PRAKASAM,BALLIKURAVA,NA,HORTICULTURE,Vegetables,1279,0,red mite,dicofall 5ml/li,2011-05-11T06:45:00,2011,5
ANDHRA PRADESH,CHITTOOR,0   ,NA,AGRICULTURE,Sugar and Starch Crops,Sunnhemp (Patua),0,fertilizer dose,information given as per data,2011-05-11T06:45:00,2011,5
ANDHRA PRADESH,WEST GODAVARI,KOVVUR,NA,HORTICULTURE,Flowers,Rose,0,asked about sowing times and fertilizer application,information given as per data,2011-05-11T06:50:00,2011,5
ANDHRA PRADESH,NELLORE,BALAYAPALLE,NA,HORTICULTURE,Vegetables,1279,0,sucking pest,NA,2011-05-11T08:58:00,2011,5
ANDHRA PRADESH,CHITTOOR,0   ,NA,HORTICULTURE,Fruits,Guava,0,white flies,dimethoate 2ml/lit,2011-05-11T09:48:00,2011,5
ANDHRA PRADESH,NELLORE,VENKATAGIRI,NA,HORTICULTURE,Vegetables,1279,0,control of root rot in brinjal,spraying capperoxy chloraide 3gr/1 lit water,2011-05-14T10:30:00,2011,5
ANDHRA PRADESH,ANANTPUR,BOMMANAHAL,NA,HORTICULTURE,Vegetables,1280,76,control of thrips in chilli,spraying karbalril 3gr/1 lit water,2011-05-14T10:30:00,2011,5
ANDHRA PRADESH,KRISHNA,GANNAVARAM,NA,AGRICULTURE,Others,Others,Soil Testing,soil test information,given information as per  the data,2011-05-14T10:30:00,2011,5
ANDHRA PRADESH,NELLORE,MARRIPADU,NA,AGRICULTURE,Pulses,1037,0,ASKED ABOUT FLOWER DROP,SPRAY PLANOFIX 2.5ML/10LIT OF WATER,2011-05-14T11:38:00,2011,5
ANDHRA PRADESH,ANANTPUR,KALYANDRUG,NA,AGRICULTURE,Fiber Crops,Cotton (Kapas),0,ASKED ABOUT FLOWER DROP,SPRAY PLANOFIX 2.5ML/10LIT OF WATER,2011-05-14T12:19:00,2011,5
ANDHRA PRADESH,VIZIANAGARM,PUSAPATIREGA,NA,HORTICULTURE,Vegetables,1279,0,brinjal	damping off,soil drenching with coc 3 %,2011-05-14T12:58:00,2011,5
ANDHRA PRADESH,ANANTPUR,0   ,JAYAD,AGRICULTURE,Cereals,1137,Cultural Practices,total cultivation information in rice,given information as per the data,2011-05-15T01:07:00,2011,5
ANDHRA PRADESH,WEST GODAVARI,T.NARASAPURAM,NA,HORTICULTURE,Fruits,1324,0,Asked about papaya powdary mildew control,"wettable sulpher 3g/lit,carathane (1ml),Hexaconazole (2ml)",2011-05-15T04:35:00,2011,5
ANDHRA PRADESH,PRAKASAM,0   ,NA,AGRICULTURE,Cereals,1075,0,maize seed rate,5-6 kg acare,2011-05-15T07:55:00,2011,5
ANDHRA PRADESH,EAST GODAVARI,KAKINADA URBAN,NA,AGRICULTURE,Others,Others,Soil Testing,soil test information,given information as per  the data,2011-05-15T09:25:00,2011,5
ANDHRA PRADESH,Y S R ,DUVVUR,NA,HORTICULTURE,Fruits,1324,76,control of power mildu in papaya,sparying propinophas 2ml/1 lit water,2011-05-12T05:30:00,2011,5
ANDHRA PRADESH,Y S R ,KALASAPADU,NA,HORTICULTURE,Fruits,Banana,"Water Management, Micro Irrigation",water management in banana,given information as per  the data,2011-05-12T05:30:00,2011,5
ANDHRA PRADESH,NELLORE,KODAVALUR,NA,AGRICULTURE,Others,Others,0,control of selin soils,applying zipssam 20kg/1 acer,2011-05-12T05:30:00,2011,5
ANDHRA PRADESH,KURNOOL,0   ,NA,HORTICULTURE,Condiments and Spices,Turmeric,0,sowing seasion of  turmaric,june-july,2011-05-12T05:30:00,2011,5
ANDHRA PRADESH,ANANTPUR,KALYANDRUG,NA,AGRICULTURE,Oilseeds,"Castor (Rehri, Rendi, Arandi) ",0,date of sowing,recommanded information has given,2011-05-12T05:44:00,2011,5
ANDHRA PRADESH,GUNTUR,0   ,NA,HORTICULTURE,Vegetables,1282,0,season and varities,infoermation given as per data,2011-05-12T07:17:00,2011,5
ANDHRA PRADESH,EAST GODAVARI,0   ,NA,AGRICULTURE,Pulses,Black Gram (urd bean),0,asked about control fruit borer,cloripiripose 2.5ml,2011-05-12T07:17:00,2011,5
ANDHRA PRADESH,Y S R ,0   ,NA,HORTICULTURE,Fruits,Citrus,0,fertilizer dose,information given,2011-05-12T10:34:00,2011,5
ANDHRA PRADESH,GUNTUR,0   ,NA,HORTICULTURE,Vegetables,1282,0,ASKED ABOUT CONTROL FRUIT BORER,profinophos,2011-05-12T10:34:00,2011,5
ANDHRA PRADESH,KRISHNA,TIRUVURU,NA,AGRICULTURE,Others,Others,0,asked about soil testing,information given as per given data,2011-05-13T02:30:00,2011,5
ANDHRA PRADESH,ANANTPUR,BUKKARAYASAMUDRAM,NA,HORTICULTURE,Vegetables,1279,0,brinjal root rot control,reccommended coc 3g/lt,2011-05-13T04:17:00,2011,5
ANDHRA PRADESH,PRAKASAM,ARDHAVEEDU,NA,AGRICULTURE,Others,Others,0,soil testing,infon given,2011-05-13T04:51:00,2011,5
ANDHRA PRADESH,KRISHNA,0   ,NA,AGRICULTURE,Others,Others,0,weather report,info given,2011-05-13T04:51:00,2011,5
ANDHRA PRADESH,ANANTPUR,PEDDAVADUGUR,NA,AGRICULTURE,Fiber Crops,Cotton (Kapas),0,asked aout cotton leaf folding control,recommended monocrotophos 2ml/lt,2011-05-13T10:45:00,2011,5
ANDHRA PRADESH,KRISHNA,KODURU,NA,HORTICULTURE,Plantation Crops,2053,0,weather report,given information as per  the data,2011-05-13T12:05:00,2011,5
ANDHRA PRADESH,Y S R ,0   ,NA,AGRICULTURE,Fodder Crops,2767,0,fodder crops availability,NA,2011-05-14T04:43:00,2011,5
ANDHRA PRADESH,VISAKHAPATNAM,SABBAVARAM,NA,HORTICULTURE,Vegetables,1279,76,control of thrips in brinjal,spraying karbalril 3gr/1 lit water,2011-05-14T06:52:00,2011,5
ANDHRA PRADESH,SRIKAKULAM,POLAKI,NA,AGRICULTURE,417,7522,0,banana	fertilizer application,recommanded information has given,2011-05-16T12:46:00,2011,5
ANDHRA PRADESH,SRIKAKULAM,POLAKI,NA,AGRICULTURE,Others,Others,Soil Testing,soil test information,given information as per  the data,2011-05-17T06:30:00,2011,5
ANDHRA PRADESH,PRAKASAM,KANIGIRI,NA,HORTICULTURE,Vegetables,Tomato,0,tomato	floer drop,spraying of planofix 2.5 ml per one lit of water,2011-05-17T06:34:00,2011,5
ANDHRA PRADESH,KURNOOL,0   ,NA,AGRICULTURE,Fiber Crops,Cotton (Kapas),0,cotton	fertilizer application,recomanded information has given,2011-05-17T06:34:00,2011,5
ANDHRA PRADESH,VISAKHAPATNAM,0   ,NA,AGRICULTURE,Cereals,1576,0,sorghum shoot borer,spraying of endosulphon 2.0 ml per one lit of water,2011-05-21T12:56:00,2011,5
ANDHRA PRADESH,CHITTOOR,RAMAKUPPAM,NA,AGRICULTURE,Cereals,1137,0,zinc and iron defeciency,foliar application of iron and zinc sulphate 50 g per one lit of water,2011-05-22T02:26:00,2011,5
ANDHRA PRADESH,KRISHNA,VISSANNAPET,NA,AGRICULTURE,Cereals,1137,0,seed bed preparation,recommanded information has given,2011-05-22T02:26:00,2011,5
ANDHRA PRADESH,CHITTOOR,NARAYANAVANAM,NA,HORTICULTURE,Vegetables,Onion,74,sowing time,agust first week,2011-05-22T06:58:00,2011,5
ANDHRA PRADESH,ANANTPUR,BELUGUPPA,NA,AGRICULTURE,Millets,7520,2,blast controle,spray carbandazim 1 gm or kitagen 3 ml/1 water,2011-05-22T06:58:00,2011,5
ANDHRA PRADESH,PRAKASAM,DONAKONDA,NA,AGRICULTURE,Fiber Crops,Cotton (Kapas),29,suitable seed enquiry,b2 varities,2011-05-22T06:58:00,2011,5
ANDHRA PRADESH,Y S R ,KHAJIPET,NA,HORTICULTURE,Flowers,Carnation,0,ASKED ABOUT FLOWER DROP,SPRAY PLANOFIX 2.5ML/10LIT OF WATER,2011-05-22T09:50:00,2011,5
ANDHRA PRADESH,GUNTUR,CHERUKUPALLE,NA,AGRICULTURE,Cereals,1137,0,ASKED ABOUT  RICE BLAST,SPRAY TRYCYCLOZOL 0.6GM/1LIT OF WATER,2011-05-22T09:56:00,2011,5
ANDHRA PRADESH,CHITTOOR,PILER,NA,HORTICULTURE,Vegetables,2108,0,TOMATO ROOT ROT CONTROL,RECOMMENDED TO SPRAY OF COPPER OXY CHLORIDE 3g/lt,2011-05-18T07:11:00,2011,5
ANDHRA PRADESH,CHITTOOR,0   ,NA,HORTICULTURE,Flowers,Rose,0,jasmine	fertilizer application,recommanded information has givcen,2011-05-19T02:47:00,2011,5
ANDHRA PRADESH,KURNOOL,C.BELAGAL,NA,AGRICULTURE,Others,Others,29,trichoderma viridae details,given information as per the data,2011-05-27T04:20:00,2011,5
ANDHRA PRADESH,ANANTPUR,RAPTADU,NA,AGRICULTURE,Oilseeds,Groundnut (pea nut/mung phalli),18,seed treatment,"Imidochlopride 2 ml/kg,ditahne m 45 3 gm/kg
,chloripyriphos 6.5ml/kg seed",2011-05-27T04:20:00,2011,5
ANDHRA PRADESH,ANANTPUR,BOMMANAHAL,NA,AGRICULTURE,Others,Others,0,asked about rain fall,INFORMATION GIVEN AS PER DATA,2011-05-26T01:05:00,2011,5
ANDHRA PRADESH,ANANTPUR,DHARMAVARAM,NA,HORTICULTURE,Vegetables,1280,0,thrips damage,spraying of pipronil 2.0 ml per one lit of water,2011-05-26T07:05:00,2011,5
ANDHRA PRADESH,PRAKASAM,KOTHA PATNAM,NA,AGRICULTURE,Fiber Crops,Cotton (Kapas),0,cotton seed varities,recommanded information has given,2011-05-26T07:05:00,2011,5
ANDHRA PRADESH,GUNTUR,DURGI,NA,HORTICULTURE,Vegetables,1280,0,control of mites in chilli,sparying dikophal 5ml/1 lit water,2011-05-24T12:59:00,2011,5
ANDHRA PRADESH,GUNTUR,GUNTUR,NA,AGRICULTURE,Others,Others,Soil Testing,soil test information,given information as per  the data,2011-05-24T12:59:00,2011,5
ANDHRA PRADESH,Y S R ,KAMALAPURAM,NA,AGRICULTURE,Oilseeds,Sunflower (suryamukhi),0,control of head borer in sunflower,sparying thayodikarb 1gr/1 lit water,2011-05-24T12:59:00,2011,5
ANDHRA PRADESH,Y S R ,CHINNAMANDEM,NA,AGRICULTURE,Cereals,1075,0,sowing seasion of maize,june-july,2011-05-24T12:59:00,2011,5
ANDHRA PRADESH,KURNOOL,KODUMUR,NA,HORTICULTURE,Vegetables,Tomato,0,hyyeild vareity in tomato,NA,2011-05-24T12:59:00,2011,5
ANDHRA PRADESH,ANANTPUR,DHARMAVARAM,NA,AGRICULTURE,Fiber Crops,Cotton (Kapas),0,control of mgso4 in cotton,NA,2011-05-24T12:59:00,2011,5
ANDHRA PRADESH,EAST GODAVARI,RANGAMPETA,NA,AGRICULTURE,Others,Others,0,asked about kisan credit card,INFORMATION GIVEN AS PER DATA,2011-05-25T02:54:00,2011,5
ANDHRA PRADESH,PRAKASAM,TARLUPADU,NA,HORTICULTURE,Vegetables,Chillies,0,ASKED ABOUT FERTILIZERS IN CHILLI,INFORMATION GIVEN AS PER DATA(60-40-50),2011-05-25T06:26:00,2011,5
ANDHRA PRADESH,GUNTUR,NARASARAOPETA,NA,AGRICULTURE,Oilseeds,Sesame (Gingelly/Til)/Sesamum,0,asked about sesamum sowing dates,information given as per data,2011-05-20T09:26:00,2011,5
ANDHRA PRADESH,NELLORE,KAVALI,NA,AGRICULTURE,Others,Others,0,asked about rain fall,NA,2011-05-20T09:26:00,2011,5
ANDHRA PRADESH,CHITTOOR,KALAKADA,NA,AGRICULTURE,Oilseeds,Groundnut (pea nut/mung phalli),0,ground nut sowing dates,recommended as per data,2011-05-03T07:54:00,2011,5
ANDHRA PRADESH,WEST GODAVARI,BHIMAVARAM,NA,AGRICULTURE,Others,Others,0,asked about farm implements availability,information passed,2011-05-03T09:26:00,2011,5
ANDHRA PRADESH,Y S R ,GALIVEEDU,NA,HORTICULTURE,Fruits,1324,0,ASKED ABOUT MANAGEMENT,GIVEN INFORMATION AS PER THE DATA,2011-05-08T04:32:00,2011,5
ANDHRA PRADESH,PRAKASAM,BALLIKURAVA,NA,AGRICULTURE,Fiber Crops,Cotton (Kapas),0,mite damage,spraying of dicophol 2.0 ml per one lit of water,2011-05-08T06:30:00,2011,5
ANDHRA PRADESH,0   ,0   ,NA,HORTICULTURE,Medicinal and Aromatic Plants,Aloe Vera,0,total cultivation of  ashwagandha,given information as per  the data,2011-05-09T01:51:00,2011,5
ANDHRA PRADESH,ANANTPUR,ANANTAPUR,NA,AGRICULTURE,Oilseeds,"Castor (Rehri, Rendi, Arandi) ",0,castor	date of sowing,June-july,2011-05-23T12:11:00,2011,5
ANDHRA PRADESH,ANANTPUR,0   ,NA,HORTICULTURE,Fruits,1268,0,mango	micronutrient defeciency,recommanded information has given,2011-05-23T12:11:00,2011,5
ANDHRA PRADESH,ANANTPUR,PARIGI,NA,AGRICULTURE,Others,Others,Cultural Practices,mushroom cultivation,given information as per the data,2011-05-24T01:30:00,2011,5
ANDHRA PRADESH,KRISHNA,MANDAVALLI,NA,AGRICULTURE,Pulses,Black Gram (urd bean),0,black gram helicoverpa damage,spraying of indaxa carb 1.0 ml per one lit of water,2011-05-24T02:24:00,2011,5
ANDHRA PRADESH,ANANTPUR,SINGANAMALA,NA,HORTICULTURE,Vegetables,Tomato,0,date of sowing,june and july,2011-05-24T02:24:00,2011,5
ANDHRA PRADESH,ANANTPUR,ANANTAPUR,NA,HORTICULTURE,Fruits,Grape,Cultural Practices,summer cutting cultural practices,before cuttings P-60 KG After cuttings 1-30 days N-40 KG 60-120 days K-40 KG per acre,2011-05-23T02:17:00,2011,5
ANDHRA PRADESH,EAST GODAVARI,KOTHAPETA,NA,HORTICULTURE,Vegetables,Dolichos Bean,76,aphid effect,Dimethoate 2 ml/1 lt of water,2011-05-23T02:17:00,2011,5
ANDHRA PRADESH,ANANTPUR,GUDIBANDA,NA,AGRICULTURE,Cereals,1075,5,maize varieties details,given information as per the data,2011-05-23T02:17:00,2011,5
ANDHRA PRADESH,WEST GODAVARI,BHIMADOLE,NA,AGRICULTURE,Others,Others,0,asked about soils,INFORMATION GIVEN AS PER DATA,2011-05-23T02:47:00,2011,5
ANDHRA PRADESH,PRAKASAM,SANTHAMAGULURU,NA,AGRICULTURE,Cereals,1075,0,ASKED ABOUT MAIZE CULTIVATION,INFORMATION GIVEN AS PER DATA,2011-05-23T02:47:00,2011,5
ANDHRA PRADESH,KURNOOL,KRISHNAGIRI,NA,HORTICULTURE,Fruits,Citrus,0,ASKED ABOUT CITRUS GUMMOSIS DISEASE CONTROL,RECOMMENDED TO SPRAY OF COPPER OXY CHLORIDE 3g/lt,2011-05-23T02:47:00,2011,5
ANDHRA PRADESH,GUNTUR,NUZENDLA,NA,AGRICULTURE,Pulses,Green Gram (Moong Bean/ Moong),0,ASKED ABOUT GREEN GRAM YELLOW MOSAIC VIRUS CONTROL,information given as per data (PROFENOPHOS),2011-05-24T04:15:00,2011,5
ANDHRA PRADESH,NELLORE,ATMAKUR,NA,HORTICULTURE,Fruits,Citrus,0,asked about citrus gummosis damage control,recommended to spray bof coc 3g/lt,2011-05-24T07:42:00,2011,5
ANDHRA PRADESH,KURNOOL,GUDUR,NA,AGRICULTURE,Others,Others,0,asked about fertilizers in saline soils,information given as per data,2011-05-21T07:05:00,2011,5
ANDHRA PRADESH,WEST GODAVARI,DWARAKATIRUMALA,JAYAD,HORTICULTURE,Condiments and Spices,Saffron,91,seed treatment in turmaric,NA,2011-05-21T09:42:00,2011,5
ANDHRA PRADESH,CHITTOOR,KALAKADA,NA,ANIMAL HUSBANDRY,Animal,"Bovine(Cow,Buffalo)",Dairy Production,connect  to leval-2,given information as per  the data,2011-05-21T09:42:00,2011,5
ANDHRA PRADESH,PRAKASAM,BALLIKURAVA,NA,HORTICULTURE,Vegetables,2113,0,ASKED ABOUT BITTER GOURD LEAF FOLDING CONTROL,RECOMMENDED TO SPRAY OF DIMETHOATE,2011-05-21T10:05:00,2011,5
ANDHRA PRADESH,CHITTOOR,BUCHINADIDU KHANDRIGA,NA,AGRICULTURE,Others,Others,0,silk worm rearing,recommanded information has given,2011-05-21T10:25:00,2011,5
ANDHRA PRADESH,SRIKAKULAM,0   ,NA,HORTICULTURE,Fruits,Banana,0,babana varities,NA,2011-05-21T12:56:00,2011,5
ANDHRA PRADESH,GUNTUR,MACHERLA,NA,HORTICULTURE,Vegetables,1279,0,fruit borer damage,spraying of ddvp 2.0 ml per one lit of water,2011-05-21T12:56:00,2011,5
ANDHRA PRADESH,ANANTPUR,GUDIBANDA,NA,AGRICULTURE,Oilseeds,Linseed (alsi),0,seed rate,recommanded information has given,2011-05-21T12:56:00,2011,5
ANDHRA PRADESH,NELLORE,0   ,NA,AGRICULTURE,Cereals,1137,0,sri cultivation,recommanded information has given,2011-05-23T07:07:00,2011,5
ANDHRA PRADESH,ANANTPUR,BELUGUPPA,NA,AGRICULTURE,Fiber Crops,Cotton (Kapas),0,cotton	flower drop,spraying of planofix 2.5 ml in 10 lit of water,2011-05-23T07:07:00,2011,5
ANDHRA PRADESH,PRAKASAM,KOTHA PATNAM,NA,AGRICULTURE,Fiber Crops,Cotton (Kapas),0,cotton wilt,soil drenching with coc 3%,2011-05-23T07:07:00,2011,5
ANDHRA PRADESH,PRAKASAM,GUDLURU,NA,HORTICULTURE,Fruits,Citrus,0,plantation crops,recommanded information has given,2011-05-23T07:07:00,2011,5
ANDHRA PRADESH,GUNTUR,BELLAMKONDA,NA,AGRICULTURE,Fiber Crops,Cotton (Kapas),0,cotton fertilizer application,recommnaded information has given,2011-05-23T07:07:00,2011,5
ANDHRA PRADESH,Y S R ,CHITVEL,NA,AGRICULTURE,Cereals,1137,Cultural Practices,rice cultivation process,NA,2011-05-23T08:46:00,2011,5
ANDHRA PRADESH,CHITTOOR,SOMALA,NA,HORTICULTURE,Fruits,1268,0,mite damage,spraying of dicophol 2.0 ml per one lit of water,2011-05-09T07:31:00,2011,5
ANDHRA PRADESH,Y S R ,OBULAVARIPALLE,NA,AGRICULTURE,Sugar and Starch Crops,Sunnhemp (Patua),0,fertilizer recommendation,recommanded information has given,2011-05-09T08:19:00,2011,5
ANDHRA PRADESH,ANANTPUR,KADIRI,NA,ANIMAL HUSBANDRY,Animal,"Bovine(Cow,Buffalo)",Dairy Production,dairy information,connect  to leval-2,2011-05-10T03:51:00,2011,5
ANDHRA PRADESH,NELLORE,0   ,NA,AGRICULTURE,Fiber Crops,Cotton (Kapas),0,asked about fertiliuzer dose,information given as per data,2011-05-11T09:48:00,2011,5
ANDHRA PRADESH,ANANTPUR,0   ,NA,AGRICULTURE,417,7557,0,asked about seed rate,info given,2011-05-11T09:48:00,2011,5
ANDHRA PRADESH,ANANTPUR,GANDLAPENTA,NA,FISHERIES,Inland,Others,61,control of selin soils,applying zipssam 20kg/1 acer,2011-05-12T05:30:00,2011,5
ANDHRA PRADESH,Y S R ,PULIVENDLA,NA,AGRICULTURE,Others,Others,Soil Testing,soil test information,NA,2011-05-12T05:30:00,2011,5
ANDHRA PRADESH,WEST GODAVARI,ELURU,NA,AGRICULTURE,Pulses,1066,5,vareities of  redgram,"l.r.g-30,38,41,laxmi",2011-05-12T05:30:00,2011,5
ANDHRA PRADESH,PRAKASAM,KARAMCHEDU,NA,FISHERIES,Inland,Others,0,control of thrips in brinjal,spraying karbalril 3gr/1 lit water,2011-05-12T05:30:00,2011,5
ANDHRA PRADESH,GUNTUR,KROSURU,NA,AGRICULTURE,Oilseeds,"Castor (Rehri, Rendi, Arandi) ",0,sesame	seed rate,2.5kg per acare,2011-05-12T07:39:00,2011,5
ANDHRA PRADESH,ANANTPUR,GORANTLA,NA,AGRICULTURE,Oilseeds,"Castor (Rehri, Rendi, Arandi) ",0,vareities of  sunflower,"k.b.s.h-1,n.d.s.h-1,d.r.s.h-1",2011-05-12T07:45:00,2011,5
ANDHRA PRADESH,KRISHNA,JAGGAYYAPETA,NA,AGRICULTURE,Cereals,1075,0,fertilizer dosage in maize,"n-120kg,p-50kg,k-40kg/1 acer",2011-05-12T07:45:00,2011,5
ANDHRA PRADESH,KRISHNA,GUDIVADA,NA,AGRICULTURE,Sugar and Starch Crops,Sunnhemp (Patua),0,smut,Propiconazol 0.5 ml/lit,2011-05-02T07:17:00,2011,5
ANDHRA PRADESH,Y S R ,CHITVEL,NA,HORTICULTURE,Vegetables,1279,0,asked about brinjal sowing time,information given as per recommended data,2011-05-02T08:31:00,2011,5
ANDHRA PRADESH,WEST GODAVARI,ELAMANCHILI,NA,HORTICULTURE,Vegetables,1275,0,control of root rot in bottel gourd,spraying capperoxy chloraide 3gr/1 lit water,2011-05-09T03:16:00,2011,5
ANDHRA PRADESH,Y S R ,ATLUR,NA,AGRICULTURE,Pulses,Green Gram (Moong Bean/ Moong),1,sowing seasion of greengram,may last week,2011-05-09T03:16:00,2011,5
ANDHRA PRADESH,KRISHNA,A.KONDURU,NA,AGRICULTURE,Pulses,1808,0,chick pea date of sowing,winter seasion crop,2011-05-09T05:46:00,2011,5
ANDHRA PRADESH,VIZIANAGARM,BADANGI,NA,AGRICULTURE,Pulses,Green Gram (Moong Bean/ Moong),0,green gram harvesting,NA,2011-05-09T05:46:00,2011,5
ANDHRA PRADESH,WEST GODAVARI,NIDAMARRU,NA,HORTICULTURE,Fruits,Banana,0,bana leaf spot,spraying of mancozeb 2.0 g per one lit of water,2011-05-10T10:06:00,2011,5
ANDHRA PRADESH,GUNTUR,SATTENAPALLE,NA,HORTICULTURE,Flowers,Cymbidium,0,cymbidium yellow disease control,recommended mancozeb 3g/lt of water,2011-05-10T11:31:00,2011,5
ANDHRA PRADESH,ANANTPUR,VAJRAKARUR,NA,AGRICULTURE,Pulses,1818,0,control of roo rot in groundnut,spraying capperoxy chloraide 3gr/1 lit water,2011-05-11T06:38:00,2011,5
ANDHRA PRADESH,CHITTOOR,KAMBHAMVARIPALLE,NA,ANIMAL HUSBANDRY,Animal,"Bovine(Cow,Buffalo)",0,connect  to leval-2 animal husbandry,given information as per  the data,2011-05-11T06:38:00,2011,5
ANDHRA PRADESH,PRAKASAM,KARAMCHEDU,NA,AGRICULTURE,Others,Others,29,schems information,given information as per  the data,2011-05-11T06:38:00,2011,5
ANDHRA PRADESH,VIZIANAGARM,SALUR,NA,HORTICULTURE,Fruits,Orange,Weather,weather report,given information as per  the data,2011-05-11T06:38:00,2011,5
ANDHRA PRADESH,EAST GODAVARI,0   ,NA,AGRICULTURE,Others,Others,0,puttagodugula pempakam,information given as per data,2011-05-11T06:45:00,2011,5
ANDHRA PRADESH,Y S R ,0   ,NA,HORTICULTURE,Flowers,Gladiolus,0,seed treatment,blitoxblitox 3gr/li,2011-05-11T06:45:00,2011,5
ANDHRA PRADESH,ANANTPUR,0   ,NA,AGRICULTURE,Others,Others,0,soil testing,information given as per data,2011-05-11T06:45:00,2011,5
ANDHRA PRADESH,ANANTPUR,ANANTAPUR,NA,HORTICULTURE,Flowers,Rose,87,total cultivation of  jasmeen,given information as per  the data,2011-05-05T07:32:00,2011,5
ANDHRA PRADESH,GUNTUR,DURGI,NA,HORTICULTURE,Vegetables,1279,76,control of thrips in brinjal,spraying karbalril 3gr/1 lit water,2011-05-05T07:32:00,2011,5
ANDHRA PRADESH,ANANTPUR,GARLADINNE,NA,HORTICULTURE,Vegetables,Watermelon,0,asked about water melon sowing time,recommended as per guide lines,2011-05-05T09:13:00,2011,5
ANDHRA PRADESH,WEST GODAVARI,CHINTALAPUDI,NA,HORTICULTURE,Vegetables,1282,0,bhendi YVMV control,"recommended to spray dimethoate 2ml/li, acephate 1.5g/lt",2011-05-05T09:53:00,2011,5
ANDHRA PRADESH,CHITTOOR,SRIKALAHASTI,NA,AGRICULTURE,Oilseeds,Groundnut (pea nut/mung phalli),0,ground nut sucking pests control,"recommended monocrotophos 2ml/lit,dimethoate",2011-05-05T09:53:00,2011,5
ANDHRA PRADESH,ANANTPUR,GARLADINNE,NA,HORTICULTURE,Vegetables,Watermelon,0,watermelon sowin date,information given as per data,2011-05-05T11:07:00,2011,5
ANDHRA PRADESH,KRISHNA,GUDLAVALLERU,NA,HORTICULTURE,Condiments and Spices,Saffron,0,sowing seasion of  turmaric,june-july,2011-05-27T06:19:00,2011,5
ANDHRA PRADESH,CHITTOOR,PAKALA,NA,AGRICULTURE,Others,Others,29,connect  to leval-2,given information as per  the data,2011-05-27T06:19:00,2011,5
ANDHRA PRADESH,Y S R ,MYDUKUR,NA,AGRICULTURE,Fiber Crops,Cotton (Kapas),0,topping in cotton,recommanded information has given,2011-05-27T07:05:00,2011,5
ANDHRA PRADESH,Y S R ,SIDHOUT,NA,AGRICULTURE,Others,Others,0,organic farming,recommanded information has given,2011-05-27T07:05:00,2011,5
ANDHRA PRADESH,WEST GODAVARI,PENUGONDA,NA,825,Avian,1266,	Poultry	,poultry details,given information as per the data,2011-05-28T01:47:00,2011,5
ANDHRA PRADESH,ANANTPUR,RAYADURG,NA,AGRICULTURE,Fiber Crops,Cotton (Kapas),0,asked about fertilizers in cotton,INFORMATION GIVEN AS PER DATA,2011-05-26T08:39:00,2011,5
ANDHRA PRADESH,Y S R ,DUVVUR,NA,AGRICULTURE,Others,Others,0,asked about soil testing,information given as per data,2011-05-21T04:01:00,2011,5
ANDHRA PRADESH,KRISHNA,NANDIGAMA,NA,HORTICULTURE,Flowers,Zentedeschia,0,mite damage,spraying of dicoplhole 20 ml per one lit of water,2011-05-08T02:29:00,2011,5
ANDHRA PRADESH,PRAKASAM,KONDAPI,NA,HORTICULTURE,Vegetables,1282,75,virus diseases,spraying of dimithoate 20 ml per one lit of water,2011-05-08T03:28:00,2011,5
ANDHRA PRADESH,WEST GODAVARI,CHINTALAPUDI,NA,HORTICULTURE,Fruits,Banana,0,ASKED ABOUT BANANA SIGATOKA DISEASE CONTROL,RECOMMENDED TO SPRAY OF MANCOZEB 2.5G/LT,2011-05-17T03:10:00,2011,5
ANDHRA PRADESH,KURNOOL,KODUMUR,JAYAD,AGRICULTURE,Cereals,1137,2,control of rice blast,spraying trysichlojol 2ml/1 lit water,2011-05-17T06:30:00,2011,5
ANDHRA PRADESH,KRISHNA,0   ,NA,AGRICULTURE,Others,Others,Weather,weather report,given information as per  the data,2011-05-17T06:30:00,2011,5
ANDHRA PRADESH,KRISHNA,GHANTASALA,NA,AGRICULTURE,Cereals,1137,0,blb,spraying of coc and streptocyclin,2011-05-17T06:34:00,2011,5
ANDHRA PRADESH,WEST GODAVARI,JEELUGUMILLI,NA,HORTICULTURE,Fruits,1268,0,mango	fruit drop,spraying of 24d 10 ppm,2011-05-17T06:34:00,2011,5
ANDHRA PRADESH,Y S R ,KONDAPURAM,JAYAD,AGRICULTURE,Others,Others,0,scems information,given information as per  the data,2011-05-17T11:56:00,2011,5
ANDHRA PRADESH,GUNTUR,CHILAKALURIPET,NA,HORTICULTURE,Fruits,Citrus,0,asked about citrus plants,information given as per data,2011-05-15T05:47:00,2011,5
ANDHRA PRADESH,KURNOOL,KALLUR,NA,AGRICULTURE,Fiber Crops,Cotton (Kapas),0,asked about cotton sucking pests control,NA,2011-05-15T05:47:00,2011,5
ANDHRA PRADESH,KURNOOL,0   ,NA,AGRICULTURE,Others,Others,0,asked about KISAN CREDIT CARD,INFORMATION PASSED,2011-05-15T05:47:00,2011,5
ANDHRA PRADESH,KURNOOL,0   ,NA,AGRICULTURE,Others,Others,0,ASKED ABOUT SOIL TESTING,information given as per data,2011-05-15T05:47:00,2011,5
ANDHRA PRADESH,WEST GODAVARI,LINGAPALEM,NA,AGRICULTURE,Oilseeds,Groundnut (pea nut/mung phalli),0,asked about groundnut subsidies,INFORMATION PASSED,2011-05-15T05:47:00,2011,5
ANDHRA PRADESH,ANANTPUR,KAMBADUR,NA,HORTICULTURE,Fruits,Guava,0,control of power mildu in guava,sparying esifet 1gr/1 lit water,2011-05-15T07:32:00,2011,5
ANDHRA PRADESH,ANANTPUR,BUKKARAYASAMUDRAM,NA,HORTICULTURE,Fruits,Citrus,0,flower drop,spraying of plamofix 3.0 ml per 10 lit of water,2011-05-15T08:02:00,2011,5
ANDHRA PRADESH,EAST GODAVARI,KAKINADA URBAN,NA,AGRICULTURE,Others,Others,0,control of thrips in chilli,spraying karbalril 3gr/1 lit water,2011-05-15T09:25:00,2011,5
ANDHRA PRADESH,KURNOOL,HOLAGUNDA,NA,HORTICULTURE,Flowers,Carnation,0,cotton	flower drop,spraying of dimithoate 2.0 ml per one lit of water,2011-05-16T01:53:00,2011,5
ANDHRA PRADESH,Y S R ,MYDUKUR,NA,AGRICULTURE,Cereals,1075,0,MAIZE  STEM BORER DAMAGE CONTROL,RECOMMENDED  TO SPRAY OF ENDOSULPHAN 2ML/LT,2011-05-18T06:38:00,2011,5
ANDHRA PRADESH,WEST GODAVARI,KAMAVARAPUKOTA,NA,ANIMAL HUSBANDRY,Animal,Goat,0,ASKED ABOUT A &H,TRANSFERRED TO LEVEL 2,2011-05-18T07:11:00,2011,5
ANDHRA PRADESH,GUNTUR,0   ,NA,825,Avian,1266,0,asked about giriraja birds,info given,2011-05-12T10:34:00,2011,5
ANDHRA PRADESH,KRISHNA,0   ,NA,AGRICULTURE,Sugar and Starch Crops,Sunnhemp (Patua),0,stem borer,NA,2011-05-12T10:34:00,2011,5
