StateName,DistrictName,BlockName,Season,Sector,Category,Crop,QueryType,QueryText,KccAns,CreatedOn,year,month
ANDHRA PRADESH,NELLORE,0   ,NA,AGRICULTURE,Others,Others,0,asked about soil test,recommended to contact ao,2012-04-02T15:10:00,2012,4
ANDHRA PRADESH,GUNTUR,0   ,NA,AGRICULTURE,Cereals,1075,0,control of mg def in maize,spraying of mgso4 10gr/lit water,2012-04-02T16:49:00,2012,4
ANDHRA PRADESH,EAST GODAVARI,0   ,NA,AGRICULTURE,Cereals,1137,0,control of zn def in paddy,spraying of znso4 2gr/lit water,2012-04-02T17:22:00,2012,4
ANDHRA PRADESH,Y S R ,0   ,NA,HORTICULTURE,Vegetables,1280,76,control of upward curling in chilli,spraying of phipronil 400ml/acre,2012-04-03T07:59:00,2012,4
ANDHRA PRADESH,NELLORE,0   ,NA,AGRICULTURE,Fiber Crops,Cotton (Kapas),1,asked about sowing season of cotton,information is given as per panchangam,2012-04-03T07:59:00,2012,4
ANDHRA PRADESH,KRISHNA,0   ,NA,AGRICULTURE,Cereals,1075,0,control of leaf eating cater pillar in maize,spraying of quinolphos 2ml/lit water,2012-04-03T10:22:00,2012,4
ANDHRA PRADESH,ANANTPUR,PAMIDI,NA,AGRICULTURE,Others,Others,0,asked about castor fertilizers,recommended DAP,2012-04-18T12:11:00,2012,4
ANDHRA PRADESH,VISAKHAPATNAM,BHEEMUNIPATNAM,NA,AGRICULTURE,Cereals,1137,0,asked about rice var..,recommended MTU-1010,2012-04-18T12:11:00,2012,4
ANDHRA PRADESH,ANANTPUR,ANANTAPUR,NA,HORTICULTURE,Vegetables,1280,76,control of upward curling in chilli,spraying of phipronil 400ml/acre,2012-04-13T09:57:00,2012,4
ANDHRA PRADESH,ANANTPUR,0   ,NA,HORTICULTURE,Vegetables,1282,76,asked about in sucking pest in bhendi,spraying of dimthioate 2 ml/lit water,2012-04-13T09:57:00,2012,4
ANDHRA PRADESH,CHITTOOR,0   ,NA,AGRICULTURE,Oilseeds,Groundnut (pea nut/mung phalli),0,asked about usage of micro nutrients in ground nut,information is given as per panchangam,2012-04-13T10:32:00,2012,4
ANDHRA PRADESH,KURNOOL,0   ,NA,HORTICULTURE,Vegetables,1279,76,control of sucking pests in brinjal,spraying of dimthioate 2 ml/lit water,2012-04-15T07:39:00,2012,4
ANDHRA PRADESH,PRAKASAM,0   ,NA,AGRICULTURE,Pulses,1808,6,asked about market cost of bengal gram,infmatn is given as  per data,2012-04-15T07:39:00,2012,4
ANDHRA PRADESH,NELLORE,0   ,NA,AGRICULTURE,Fiber Crops,Cotton (Kapas),0,control of mealy bug in cotton,spraying of dichlorovas 1 ml/lit water,2012-04-15T07:39:00,2012,4
ANDHRA PRADESH,GUNTUR,0   ,NA,AGRICULTURE,Others,Others,Soil Testing,asked soil preparation,information is given as per panchangam,2012-04-16T07:56:00,2012,4
ANDHRA PRADESH,WEST GODAVARI,0   ,NA,ANIMAL HUSBANDRY,Animal,964,31,asked about animal husbandry,infmatn is given as  per data,2012-04-09T12:13:00,2012,4
ANDHRA PRADESH,ANANTPUR,GARLADINNE,NA,AGRICULTURE,Oilseeds,Groundnut (pea nut/mung phalli),3,control of tobacco cater pillar in ground nut,spraying of indoxycarb 200ml/acre,2012-04-09T12:29:00,2012,4
ANDHRA PRADESH,WEST GODAVARI,0   ,NA,AGRICULTURE,Cereals,1137,3,contreol of leaf folder in rice,spraying of cartaphydrocloride 2gm/lit water,2012-04-09T13:07:00,2012,4
ANDHRA PRADESH,GUNTUR,0   ,NA,HORTICULTURE,Flowers,Lilliums,0,asked about fertilizer dosage in jasmine,information is given as per panchangam,2012-04-09T14:08:00,2012,4
ANDHRA PRADESH,EAST GODAVARI,AMALAPURAM,NA,AGRICULTURE,Others,Others,0,asked about soil  testing,infmatn is given as  per data,2012-04-09T14:08:00,2012,4
ANDHRA PRADESH,EAST GODAVARI,RAMACHANDRAPURAM,NA,AGRICULTURE,Cereals,1137,0,asked about rice bph control,recommended acephate,2012-04-09T15:22:00,2012,4
ANDHRA PRADESH,ANANTPUR,TALUPULA,NA,AGRICULTURE,Pulses,Pigeon pea (red gram/arhar/tur),0,asked about yield of LRG-30,recommended 8-10q/acre,2012-04-09T15:22:00,2012,4
ANDHRA PRADESH,WEST GODAVARI,JEELUGUMILLI,NA,AGRICULTURE,Others,Others,0,asked about emu birds rearing,recommended to contact 040-24015323,2012-04-09T15:22:00,2012,4
ANDHRA PRADESH,KURNOOL,BANDI ATMAKUR,NA,AGRICULTURE,Cereals,1137,0,Asked about rice stem borer control,recommended cartaf hydrochloride 2g/lt,2012-04-09T15:22:00,2012,4
ANDHRA PRADESH,WEST GODAVARI,0   ,NA,AGRICULTURE,Others,Others,0,asked about mushroom cultivation,Level-2,2012-04-09T16:33:00,2012,4
ANDHRA PRADESH,VISAKHAPATNAM,0   ,NA,HORTICULTURE,Fruits,Banana,0,asked about banana reaserch station number,given information as per the panchangam,2012-04-09T16:33:00,2012,4
ANDHRA PRADESH,EAST GODAVARI,0   ,NA,HORTICULTURE,Vegetables,1296,0,control of tuber rot in potato,spraying of carbendigim1gr/lit water,2012-04-09T16:33:00,2012,4
ANDHRA PRADESH,EAST GODAVARI,0   ,NA,HORTICULTURE,Vegetables,Others,0,control of white spots in colacasia,spraying of arnabhedi powder 5 grm/lit water,2012-04-10T10:31:00,2012,4
ANDHRA PRADESH,PRAKASAM,TRIPURANTHAKAM,NA,AGRICULTURE,Fiber Crops,Cotton (Kapas),0,asked about cotton sowing time,recommended to sow in june,2012-04-10T15:33:00,2012,4
ANDHRA PRADESH,KRISHNA,MUDINEPALLE,NA,HORTICULTURE,Vegetables,1282,0,asked about bhendi sowing time,recommended to sow upto march in summer,2012-04-10T15:33:00,2012,4
ANDHRA PRADESH,SRIKAKULAM,SRIKAKULAM,NA,AGRICULTURE,Cereals,1075,0,asked about weedicide in maize,recommended atrazine,2012-04-10T15:33:00,2012,4
ANDHRA PRADESH,GUNTUR,ROMPICHERLA,NA,AGRICULTURE,Others,Others,0,asked about emu birds rearing,recommended to contact 040-24015323,2012-04-10T15:33:00,2012,4
ANDHRA PRADESH,NELLORE,VENKATAGIRI,NA,AGRICULTURE,Sugar and Starch Crops,Sunnhemp (Patua),0,asked about weedicide in sugarcane,recommended atrazine,2012-04-10T15:33:00,2012,4
ANDHRA PRADESH,GUNTUR,ROMPICHERLA,NA,AGRICULTURE,Fiber Crops,Cotton (Kapas),0,asked about cotton Bt var..,recommended any bt-2 seeds,2012-04-10T15:33:00,2012,4
ANDHRA PRADESH,KRISHNA,0   ,NA,HORTICULTURE,Vegetables,Drum Stick,0,control of flower drop in drum stick,spraying of planofix 2.5ml/10 lit water,2012-04-04T10:47:00,2012,4
ANDHRA PRADESH,PRAKASAM,0   ,NA,AGRICULTURE,Fiber Crops,Cotton (Kapas),0,control of flower drop in cotton,spraying of planofix 2.5ml/10 lit water,2012-04-04T10:47:00,2012,4
ANDHRA PRADESH,KURNOOL,0   ,NA,AGRICULTURE,Oilseeds,"Castor (Rehri, Rendi, Arandi) ",0,asked about sowing time,jun 15-july 31 sowing time,2012-04-04T10:47:00,2012,4
ANDHRA PRADESH,WEST GODAVARI,BHIMADOLE,NA,AGRICULTURE,Cereals,1137,0,control of sheath blight in paddy,spraying of ifrobenophaus200ml/lit water,2012-04-04T10:47:00,2012,4
ANDHRA PRADESH,CHITTOOR,0   ,NA,HORTICULTURE,Vegetables,Tomato,0,control of root rot desease in tomato,spraying of coc 2.5gr/lit water,2012-04-04T10:47:00,2012,4
ANDHRA PRADESH,GUNTUR,AMRUTHALUR,NA,HORTICULTURE,Condiments and Spices,Ginger,87,asked about cultivation details of ginger,information is given as per panchangam,2012-04-04T10:54:00,2012,4
ANDHRA PRADESH,KURNOOL,ADONI,NA,HORTICULTURE,Condiments and Spices,Turmeric,0,asked about feretilizers in turmeric,recommended 1000kg/acre fym+150kg super+200kg neem powder+25kg potash/acre,2012-04-26T12:24:00,2012,4
ANDHRA PRADESH,ANANTPUR,VAJRAKARUR,NA,AGRICULTURE,Oilseeds,"Castor (Rehri, Rendi, Arandi) ",0,asked about castor sucking pests control,recommended monocrotophos+acephate,2012-04-26T12:58:00,2012,4
ANDHRA PRADESH,SRIKAKULAM,PONDURU,NA,AGRICULTURE,Oilseeds,"Castor (Rehri, Rendi, Arandi) ",0,information reg var of castor,NA,2012-04-21T17:31:00,2012,4
ANDHRA PRADESH,KRISHNA,GUDIVADA,NA,AGRICULTURE,Cereals,1137,0,asked about control of storage pest,spraying of malathion 5ml/lit water,2012-04-23T11:25:00,2012,4
ANDHRA PRADESH,ANANTPUR,0   ,NA,AGRICULTURE,Pulses,Pigeon pea (red gram/arhar/tur),0,control  of helicoverpa in red gram,sprayuing of quinolphus 2ml/lit water,2012-04-23T11:25:00,2012,4
ANDHRA PRADESH,KRISHNA,0   ,NA,HORTICULTURE,Condiments and Spices,Saffron,0,asked about turmeric market rates,given information as per the agris net market rates,2012-04-23T11:25:00,2012,4
ANDHRA PRADESH,CHITTOOR,0   ,NA,HORTICULTURE,Vegetables,Onion,0,control of nursury seedlings die in onion crop,given infarmation as per the data,2012-04-23T11:25:00,2012,4
ANDHRA PRADESH,ANANTPUR,KALYANDRUG,NA,AGRICULTURE,Oilseeds,"Castor (Rehri, Rendi, Arandi) ",0,asked about hybrid variety,"G.C.H-4.D.C.H-177.,D.C.H-519",2012-04-23T12:13:00,2012,4
ANDHRA PRADESH,PRAKASAM,0   ,NA,AGRICULTURE,Pulses,1037,0,asked about pulses production,given infarmation as per the data,2012-04-23T12:13:00,2012,4
ANDHRA PRADESH,GUNTUR,CHERUKUPALLE,NA,AGRICULTURE,Cereals,1137,0,asked about paddy sedds,given infarmation as per the data,2012-04-23T12:13:00,2012,4
ANDHRA PRADESH,Y S R ,0   ,NA,HORTICULTURE,Vegetables,1280,99,control of flower drop in chilli,spraying of planofix 3ml/10li water,2012-04-30T08:25:00,2012,4
ANDHRA PRADESH,NELLORE,0   ,NA,HORTICULTURE,Fruits,Coconut,0,control of red palm weevil in coconut,give root treatment with monocrotophas,2012-04-30T08:25:00,2012,4
ANDHRA PRADESH,ANANTPUR,0   ,NA,HORTICULTURE,Vegetables,Drum Stick,0,control of flower drop in drum stick,spraying of boran 1.5 gm/lit water,2012-04-30T08:25:00,2012,4
ANDHRA PRADESH,ANANTPUR,0   ,NA,HORTICULTURE,Vegetables,Drum Stick,0,control of pod borer in drum stick,spraying of dichlorovas 1 ml/lit water,2012-04-30T08:25:00,2012,4
ANDHRA PRADESH,ANANTPUR,0   ,NA,HORTICULTURE,Vegetables,2108,99,control of flower drop in tomato,spraying of planofix 3ml/10li water,2012-04-30T08:54:00,2012,4
ANDHRA PRADESH,NELLORE,0   ,NA,ANIMAL HUSBANDRY,Animal,Others,32,asked about poultry information,given information as per the panchanagam,2012-04-24T18:15:00,2012,4
ANDHRA PRADESH,EAST GODAVARI,Y. RAMAVARAM,NA,FISHERIES,Inland,1262,0,asked about fisheries information,given information as per panchangam,2012-04-25T09:06:00,2012,4
ANDHRA PRADESH,CHITTOOR,0   ,NA,HORTICULTURE,Fruits,Mango,0,information reg fertilizer dosage in mango,given information as per the panchanagam,2012-04-25T09:06:00,2012,4
ANDHRA PRADESH,VISAKHAPATNAM,0   ,NA,AGRICULTURE,Others,Others,Soil Testing,asked about soil testing information,given information as per panchangam,2012-04-25T09:06:00,2012,4
ANDHRA PRADESH,ANANTPUR,0   ,NA,AGRICULTURE,Oilseeds,Groundnut (pea nut/mung phalli),0,asked about sowing time,july-aug sowing time,2012-04-25T09:06:00,2012,4
ANDHRA PRADESH,PRAKASAM,TRIPURANTHAKAM,NA,HORTICULTURE,Vegetables,Chillies,0,Asked about chilli root rot control,Advised the farmer coc  3g/lt,2012-04-25T12:20:00,2012,4
ANDHRA PRADESH,NELLORE,RAPUR,NA,AGRICULTURE,Pulses,Black Gram (urd bean),0,asked about black gram leaf eating control,Advised the farmer chloripyriphos/monocrotophos,2012-04-25T12:20:00,2012,4
ANDHRA PRADESH,EAST GODAVARI,KOTANANDURU,NA,AGRICULTURE,Others,Others,0,Asked about biosphere reserve,INfORMATION GIVEN AS PER DATA,2012-04-25T12:20:00,2012,4
ANDHRA PRADESH,KRISHNA,0   ,NA,HORTICULTURE,Vegetables,Chillies,0,Asked about chilli leaf damage control,Advised the farmer avant,2012-04-25T12:20:00,2012,4
ANDHRA PRADESH,CHITTOOR,CHINNAGOTTIGALLU,NA,HORTICULTURE,Vegetables,1279,0,asked about brinjal sucking pests control,Advised the farmer dimethoate 2ml/lt,2012-04-25T12:20:00,2012,4
ANDHRA PRADESH,NELLORE,RAPUR,NA,AGRICULTURE,Pulses,Black Gram (urd bean),0,asked about black gram sucking pests control,Advised the farmer dimethoate 2ml/lt,2012-04-25T12:20:00,2012,4
ANDHRA PRADESH,ANANTPUR,PUTTAPARTHI,RABI,AGRICULTURE,Others,Others,0,asked about fertilizers in ground nut,Advised the farmer as per panchangam,2012-04-25T12:20:00,2012,4
ANDHRA PRADESH,GUNTUR,GUNTUR,NA,AGRICULTURE,Others,Others,0,Asked about intercultivation in maize,INfORMATION GIVEN AS PER DATA,2012-04-25T12:20:00,2012,4
ANDHRA PRADESH,Y S R ,VEMULA,NA,AGRICULTURE,Fiber Crops,Cotton (Kapas),0,asked about flower drop in cotton,Advised the farmer planofix 2.5ml /10l,2012-04-25T12:20:00,2012,4
ANDHRA PRADESH,CHITTOOR,CHINNAGOTTIGALLU,NA,HORTICULTURE,Vegetables,1279,0,asked about brinjal flower drop control,Advised the farmer planofix 2.5ml /10l,2012-04-25T12:20:00,2012,4
ANDHRA PRADESH,PRAKASAM,TRIPURANTHAKAM,NA,HORTICULTURE,Vegetables,Chillies,0,asked about chilli trips control,Advised the farmer pegasis 300g/200lt of water,2012-04-25T12:20:00,2012,4
ANDHRA PRADESH,NELLORE,DUTTALUR,NA,AGRICULTURE,Fiber Crops,Cotton (Kapas),0,Asked about Bt cotton var.,recommended any Bt 2 var...,2012-04-25T12:20:00,2012,4
ANDHRA PRADESH,NELLORE,NELLORE,NA,AGRICULTURE,Others,Others,0,asked about prawns cultivation,I have given fisheries ph.no.9440814763,2012-04-25T12:20:00,2012,4
ANDHRA PRADESH,KRISHNA,GUDLAVALLERU,NA,AGRICULTURE,Pulses,Black Gram (urd bean),0,asked about blackgram var..,"Advised the farmer LBG-645,685",2012-04-25T12:20:00,2012,4
ANDHRA PRADESH,ANANTPUR,0   ,NA,AGRICULTURE,Pulses,1037,0,asked about n.p.k information,given infarmation as per the data,2012-04-25T12:52:00,2012,4
ANDHRA PRADESH,PRAKASAM,KANDUKUR,NA,AGRICULTURE,Others,Others,0,asked about cotton fertilizers application,recommended as per panchangam,2012-04-25T14:36:00,2012,4
ANDHRA PRADESH,ANANTPUR,0   ,NA,HORTICULTURE,Vegetables,1280,0,asked about chilli growing information,given information as per the data,2012-04-01T16:10:00,2012,4
ANDHRA PRADESH,EAST GODAVARI,KADIAM,NA,AGRICULTURE,Cereals,1137,0,control of BPH in paddy,spraying of bufrofejin 300ml/Acre,2012-04-01T16:10:00,2012,4
ANDHRA PRADESH,CHITTOOR,0   ,NA,HORTICULTURE,Vegetables,Dolichos Bean,0,control of leaf spot,spraying of mancojeb 2.5gr/lit water,2012-04-01T17:49:00,2012,4
ANDHRA PRADESH,WEST GODAVARI,NALLAJERLA,NA,HORTICULTURE,Vegetables,1279,0,control of white fly,spraying of trizopos 2ml/lit water,2012-04-01T17:49:00,2012,4
ANDHRA PRADESH,GUNTUR,NEKARIKALLU,NA,AGRICULTURE,Cereals,1075,6,asked about market price of maize,NA,2012-04-10T10:31:00,2012,4
ANDHRA PRADESH,CHITTOOR,0   ,NA,HORTICULTURE,Vegetables,1282,76,control of hoppers in bhendi,spraying of imidacloprid 2ml/li water,2012-04-10T10:31:00,2012,4
ANDHRA PRADESH,CHITTOOR,0   ,NA,HORTICULTURE,Vegetables,1280,76,control of upward curling in chilli,spraying of phipronil 400ml/acre,2012-04-10T10:31:00,2012,4
ANDHRA PRADESH,ANANTPUR,PENUKONDA,NA,AGRICULTURE,Others,Others,0,asked about sheep rearing,recommended to contact v.O.,2012-04-10T15:33:00,2012,4
ANDHRA PRADESH,PRAKASAM,TRIPURANTHAKAM,NA,AGRICULTURE,Fiber Crops,Cotton (Kapas),0,asked about cotton Bt var..,recommended any Bt-2 seeds,2012-04-10T15:33:00,2012,4
ANDHRA PRADESH,WEST GODAVARI,TANUKU,NA,AGRICULTURE,Others,Others,Soil Testing,asked about soil testing,provided information as per data,2012-04-10T17:54:00,2012,4
ANDHRA PRADESH,Y S R ,MYDUKUR,NA,AGRICULTURE,Others,Others,Soil Testing,asked about soil testing,given information as per apagrisnet.gov.in,2012-04-10T17:54:00,2012,4
ANDHRA PRADESH,KURNOOL,0   ,NA,AGRICULTURE,Pulses,1037,0,control of wilt in bengal gram,To cultivate resistentent vareity,2012-04-11T12:03:00,2012,4
ANDHRA PRADESH,PRAKASAM,0   ,NA,AGRICULTURE,Oilseeds,Sunflower (suryamukhi),0,control of helicoverpa in sunflower,spraying of quinolphus 2 ml/lit water,2012-04-11T12:03:00,2012,4
ANDHRA PRADESH,GUNTUR,0   ,NA,AGRICULTURE,Fiber Crops,Cotton (Kapas),0,asked about seed source of cotton,infmatn is given as  per data,2012-04-11T13:08:00,2012,4
ANDHRA PRADESH,GUNTUR,SAVALYAPURAM,NA,AGRICULTURE,Cereals,1137,0,control of BPH in paddy,spraying of aplaud 300ml /200lit water,2012-04-23T11:25:00,2012,4
ANDHRA PRADESH,PRAKASAM,0   ,NA,HORTICULTURE,Vegetables,1280,0,"control of flower drop,fruit  in chilli",spraying of planofix 2.5 ml/ 10 lit water,2012-04-23T11:25:00,2012,4
ANDHRA PRADESH,KRISHNA,0   ,NA,AGRICULTURE,Pulses,Green Gram (Moong Bean/ Moong),0,asked about best vareity in green gram,"L.G.G407,410,450,460",2012-04-23T12:13:00,2012,4
ANDHRA PRADESH,KURNOOL,0   ,NA,AGRICULTURE,Cereals,1137,0,control of BPH in paddy cultivated season,spraying of aplaud 300ml /200lit water,2012-04-23T12:13:00,2012,4
ANDHRA PRADESH,ANANTPUR,0   ,NA,HORTICULTURE,Vegetables,1279,0,asked about pesticide using information,given infarmation as per the data,2012-04-23T12:13:00,2012,4
ANDHRA PRADESH,ANANTPUR,0   ,NA,AGRICULTURE,Cereals,1137,Fertilizer Use and Availability,asked about fertilizers,recommended from panchangam,2012-04-17T13:38:00,2012,4
ANDHRA PRADESH,ANANTPUR,0   ,NA,AGRICULTURE,Cereals,1075,Weather,asked about wheather report,recommended from agrisnet,2012-04-17T13:38:00,2012,4
ANDHRA PRADESH,EAST GODAVARI,0   ,NA,AGRICULTURE,Cereals,1137,27,control of sheath rot in rice,spraying of hexaconazole 400ml/acre,2012-04-18T08:54:00,2012,4
ANDHRA PRADESH,KRISHNA,0   ,NA,AGRICULTURE,Cereals,1075,0,asked storage method of maize,infmatn is given as  per data,2012-04-18T09:21:00,2012,4
ANDHRA PRADESH,CHITTOOR,0   ,NA,ANIMAL HUSBANDRY,Animal,964,31,information reg animal husbandry,infmatn is given as  per data,2012-04-18T09:21:00,2012,4
ANDHRA PRADESH,KRISHNA,CHANDARLAPADU,NA,AGRICULTURE,Cereals,2051,Cultural Practices,asked about cultural practices,provided information as per data,2012-04-18T12:16:00,2012,4
ANDHRA PRADESH,KRISHNA,0   ,NA,AGRICULTURE,Oilseeds,Groundnut (pea nut/mung phalli),0,asked about fertilizer management,provided information as per vyavasaya panchangam,2012-04-19T15:15:00,2012,4
ANDHRA PRADESH,ANANTPUR,BRAHMASAMUDRAM,NA,HORTICULTURE,Vegetables,Tomato,76,asked about control of leaf hoppers,recommended to spray imidachloprid 2ml/lit,2012-04-20T11:00:00,2012,4
ANDHRA PRADESH,NELLORE,UDAYAGIRI,NA,HORTICULTURE,Fruits,1268,76,asked about control of stemborers,recommended to spray chloripyriphose 2.5ml/lit,2012-04-20T11:00:00,2012,4
ANDHRA PRADESH,KURNOOL,SANJAMALA,NA,AGRICULTURE,Others,Others,15,asked about subsidy & scheems,provided information as per apagrisnet.govt.in market rates,2012-04-20T11:00:00,2012,4
ANDHRA PRADESH,EAST GODAVARI,ATREYAPURAM,NA,AGRICULTURE,Others,Others,Soil Testing,asked about soil testing information,provided information as per data,2012-04-20T11:00:00,2012,4
ANDHRA PRADESH,ANANTPUR,PAMIDI,NA,AGRICULTURE,Oilseeds,"Castor (Rehri, Rendi, Arandi) ",0,asked about castor sucking pests control,RECOMMENDED Monocrotophos,2012-04-20T13:20:00,2012,4
ANDHRA PRADESH,KRISHNA,VISSANNAPET,NA,AGRICULTURE,Others,Others,0,asked about vegtables sowing time,recommended upto march,2012-04-20T13:29:00,2012,4
ANDHRA PRADESH,CHITTOOR,NARAYANAVANAM,NA,HORTICULTURE,Vegetables,1279,0,asked about brinjal fruit borer control,recommended indoxacarb 1ml/lt,2012-04-20T13:48:00,2012,4
ANDHRA PRADESH,CHITTOOR,PUNGANUR,NA,HORTICULTURE,Vegetables,2108,0,asked about tomato early blight control,recommended mancozeb,2012-04-20T13:48:00,2012,4
ANDHRA PRADESH,ANANTPUR,RAYADURG,NA,AGRICULTURE,Fiber Crops,Cotton (Kapas),0,asked about cotton sucking pests control,recommended imidachloprid,2012-04-20T13:48:00,2012,4
ANDHRA PRADESH,EAST GODAVARI,RAJANAGARAM,NA,AGRICULTURE,Others,Others,0,asked about soil testing and sampling,information giVEN AS PER DATA,2012-04-20T13:48:00,2012,4
ANDHRA PRADESH,VIZIANAGARM,PARVATHIPURAM,NA,HORTICULTURE,Vegetables,2108,0,asked about tomato problems,INfORMATION GIVEN AS PER DATA,2012-04-20T13:48:00,2012,4
ANDHRA PRADESH,PRAKASAM,0   ,NA,HORTICULTURE,Fruits,1268,0,control of fruit drop in mango,spraying of planofix 3ml/10li water,2012-04-12T08:20:00,2012,4
ANDHRA PRADESH,ANANTPUR,0   ,NA,HORTICULTURE,Vegetables,Onion,76,control of caterpillar in onion,spraying of quinolphos 2ml/lit water,2012-04-12T08:20:00,2012,4
ANDHRA PRADESH,PRAKASAM,KONDAPI,NA,HORTICULTURE,Vegetables,1279,0,asked about brinjal sucking pests control,recommended dimethoate 2ml/lt,2012-04-12T12:35:00,2012,4
ANDHRA PRADESH,KURNOOL,CHIPPAGIRI,NA,HORTICULTURE,Flowers,Gladiolus,Fertilizer Use and Availability,asked about fertilizer management,given information as per data,2012-04-12T18:09:00,2012,4
ANDHRA PRADESH,CHITTOOR,0   ,NA,AGRICULTURE,Cereals,1137,3,control of stem borer in rice,spraying of cartaphydrocloride 2gm/lit water,2012-04-13T09:57:00,2012,4
ANDHRA PRADESH,CHITTOOR,0   ,NA,HORTICULTURE,Flowers,Rose,0,asked about seed source of flower crops,infmatn is given as  per data,2012-04-13T10:32:00,2012,4
ANDHRA PRADESH,KURNOOL,0   ,NA,HORTICULTURE,Condiments and Spices,Turmeric,Market Information,asked about market costs of turmeric,infmatn is given as  per data,2012-04-13T10:32:00,2012,4
ANDHRA PRADESH,Y S R ,0   ,NA,HORTICULTURE,Vegetables,2108,76,control of leaf minor in tomato,spraying of dichlorovas 1 ml/lit water,2012-04-13T10:32:00,2012,4
ANDHRA PRADESH,PRAKASAM,0   ,NA,AGRICULTURE,Fiber Crops,Cotton (Kapas),0,asked about cotton buju thegulu control,recommended carbendazim 1g/lt,2012-04-13T14:18:00,2012,4
ANDHRA PRADESH,WEST GODAVARI,0   ,NA,HORTICULTURE,Vegetables,1275,76,control of shoot and fruit borer in brinjal,spraying of cypermetrine 300ml/acre,2012-04-02T11:33:00,2012,4
ANDHRA PRADESH,GUNTUR,0   ,NA,AGRICULTURE,Cereals,1075,0,asked about maize problem,given information as per the panchanagam,2012-04-02T16:49:00,2012,4
ANDHRA PRADESH,WEST GODAVARI,TADEPALLIGUDEM,NA,AGRICULTURE,Pulses,Pigeon pea (red gram/arhar/tur),6,asked about market rates,given information as per agrisnet.gov.in,2012-04-02T17:15:00,2012,4
ANDHRA PRADESH,Y S R ,0   ,NA,HORTICULTURE,Vegetables,1280,Fertilizer Use and Availability,asked about fertilizer dosage in chilli,information is given as per panchangam,2012-04-03T07:59:00,2012,4
ANDHRA PRADESH,KRISHNA,0   ,NA,HORTICULTURE,Fruits,1268,0,control of fruit borer in mango,spraying of dichlorovas 1 ml/lit water,2012-04-03T07:59:00,2012,4
ANDHRA PRADESH,WEST GODAVARI,0   ,NA,HORTICULTURE,Vegetables,Ridge Gourd,0,asked about seed varieties of ridge gourd,information is given as per panchangam,2012-04-03T10:22:00,2012,4
ANDHRA PRADESH,ANANTPUR,0   ,NA,AGRICULTURE,Oilseeds,Groundnut (pea nut/mung phalli),22,control of weeds in ground nut,information is given as per panchangam,2012-04-03T14:02:00,2012,4
ANDHRA PRADESH,EAST GODAVARI,0   ,NA,AGRICULTURE,Cereals,1075,6,asked about market costs of maize,infmatn is given as  per data,2012-04-01T08:29:00,2012,4
ANDHRA PRADESH,KRISHNA,BANTUMILLI,NA,HORTICULTURE,Fruits,Mango,0,asked about post harvest information,given information as per the panchanagam,2012-04-25T08:28:00,2012,4
ANDHRA PRADESH,WEST GODAVARI,0   ,NA,HORTICULTURE,Vegetables,Tomato,0,asked about desease,given infarmation as per the data,2012-04-25T08:43:00,2012,4
ANDHRA PRADESH,PRAKASAM,TRIPURANTHAKAM,NA,HORTICULTURE,Vegetables,Chillies,0,asked about chilli flower drop control,Advised the farmer planofix 2.5ml /10l,2012-04-25T12:20:00,2012,4
ANDHRA PRADESH,GUNTUR,REPALLE,NA,AGRICULTURE,Cereals,1137,0,Asked about rice bph control,Advised the farmer acephate,2012-04-25T12:20:00,2012,4
ANDHRA PRADESH,KURNOOL,YEMMIGANUR,NA,HORTICULTURE,Vegetables,Chillies,0,asked about chilli flower drop control,recommended planofix 2.5ml/10lt of water,2012-04-25T12:20:00,2012,4
ANDHRA PRADESH,EAST GODAVARI,Y. RAMAVARAM,NA,AGRICULTURE,Others,Others,0,asked about fishes at bottom are not growing propoerly,I have given ph.no.9440814713,2012-04-25T12:20:00,2012,4
ANDHRA PRADESH,NELLORE,RAPUR,NA,AGRICULTURE,Pulses,Green Gram (Moong Bean/ Moong),0,asked about green gram var.,"Advised the farmer LGG-407, ML-267",2012-04-25T12:20:00,2012,4
ANDHRA PRADESH,Y S R ,CHINNAMANDEM,NA,AGRICULTURE,Others,Others,0,Asked about banana fruits damage,INfORMATION GIVEN AS PER DATA,2012-04-25T12:20:00,2012,4
ANDHRA PRADESH,EAST GODAVARI,GOKAVARAM,NA,AGRICULTURE,Cereals,1137,0,asked about rice sheeth blight control,Advised the farmer hexaconazole 2ml/lt,2012-04-25T12:20:00,2012,4
ANDHRA PRADESH,KURNOOL,ADONI,NA,AGRICULTURE,Cereals,1137,0,asked about rice sheeth blight control,Advised the farmer Validamysin 2ml/lt,2012-04-25T12:20:00,2012,4
ANDHRA PRADESH,Y S R ,CHITVEL,NA,AGRICULTURE,Others,Others,0,Asked about root rot disease control in crossandra,Advised the farmer copper oxy chloride 3g/lt of water,2012-04-25T12:20:00,2012,4
ANDHRA PRADESH,NELLORE,NELLORE,NA,AGRICULTURE,Others,Others,0,asked about subsidy of fish feeding,I have given fisheries ph.no.9440814763,2012-04-25T12:20:00,2012,4
ANDHRA PRADESH,ANANTPUR,GOOTY,NA,HORTICULTURE,Fruits,8101,0,asked about chini flower drop control,recommended planofix 2.5ml/10lt of water,2012-04-25T14:36:00,2012,4
ANDHRA PRADESH,ANANTPUR,PAMIDI,NA,AGRICULTURE,Oilseeds,"Castor (Rehri, Rendi, Arandi) ",0,asked about castor fruit borer control,recommended indoxacarb 1ml/lt,2012-04-25T14:36:00,2012,4
ANDHRA PRADESH,Y S R ,MYDUKUR,NA,AGRICULTURE,Others,Others,0,asked about chilli fertilizers,recommended as per AGRISNET Web site,2012-04-25T14:36:00,2012,4
ANDHRA PRADESH,ANANTPUR,BRAHMASAMUDRAM,NA,HORTICULTURE,Vegetables,2108,0,asked about tomato root control,recommended coc  3g/lt,2012-04-25T14:36:00,2012,4
ANDHRA PRADESH,GUNTUR,NEKARIKALLU,NA,AGRICULTURE,Others,Others,0,asked about weather report,information given as per AGRISNET web site,2012-04-25T15:08:00,2012,4
ANDHRA PRADESH,VISAKHAPATNAM,0   ,NA,AGRICULTURE,Pulses,1808,1,asked about sowing season of bengal gram,information is given as per panchangam,2012-04-30T08:54:00,2012,4
ANDHRA PRADESH,EAST GODAVARI,0   ,NA,AGRICULTURE,Oilseeds,Groundnut (pea nut/mung phalli),3,control of tobacco cater pillar in ground nut,spraying of indoxycarb 200ml/acre,2012-04-30T08:54:00,2012,4
ANDHRA PRADESH,CHITTOOR,0   ,NA,HORTICULTURE,Vegetables,2108,74,asked sowing season of tomato,information is given as per panchangam,2012-04-30T11:50:00,2012,4
ANDHRA PRADESH,ANANTPUR,KALYANDRUG,NA,AGRICULTURE,Pulses,Green Gram (Moong Bean/ Moong),0,Asked about green gram var...,"recommended LGG-407, 460",2012-04-26T12:24:00,2012,4
ANDHRA PRADESH,KURNOOL,KRISHNAGIRI,NA,HORTICULTURE,Vegetables,2108,0,asked about tomato sucking pests control,recommended monocrotophos+acephate,2012-04-26T12:24:00,2012,4
ANDHRA PRADESH,ANANTPUR,BRAHMASAMUDRAM,NA,AGRICULTURE,Oilseeds,Groundnut (pea nut/mung phalli),0,asked about ground nut var.,recommended k-6,2012-04-26T12:24:00,2012,4
ANDHRA PRADESH,KURNOOL,0   ,NA,HORTICULTURE,Vegetables,1280,0,asked about chilly down curling,recommended pegasis 400ml/acre,2012-04-07T11:36:00,2012,4
ANDHRA PRADESH,WEST GODAVARI,TANUKU,NA,HORTICULTURE,Vegetables,2108,0,asked about tomato flower drop control,recommended planofix 2.5ml/10lt of water,2012-04-08T12:48:00,2012,4
