StateName,DistrictName,BlockName,Season,Sector,Category,Crop,QueryType,QueryText,KccAns,CreatedOn,year,month
ANDHRA PRADESH,PRAKASAM,0   ,NA,HORTICULTURE,Fruits,Citrus,75,control of bactcrial blight in citrus,spraying of streptocycline 1gm+ 30 gm coc/10 lit water,2012-04-02T07:53:00,2012,4
ANDHRA PRADESH,KURNOOL,0   ,NA,AGRICULTURE,Fiber Crops,Cotton (Kapas),1,asked about sowing season of  cotton,information is given as per panchangam,2012-04-02T11:33:00,2012,4
ANDHRA PRADESH,GUNTUR,0   ,NA,AGRICULTURE,Others,Others,Soil Testing,asked about soil  testing,infmatn is given as  per data,2012-04-02T11:33:00,2012,4
ANDHRA PRADESH,VISAKHAPATNAM,0   ,NA,HORTICULTURE,Fruits,1268,0,control of fruit drop in mango,spraying of planofix 3ml/10li water,2012-04-02T11:33:00,2012,4
ANDHRA PRADESH,NELLORE,0   ,NA,HORTICULTURE,Fruits,Mango,0,asked about harvest induces,given information as per the panchanagam,2012-04-02T16:49:00,2012,4
ANDHRA PRADESH,VISAKHAPATNAM,0   ,NA,HORTICULTURE,Vegetables,1282,0,aked about market rates,given information as per the net,2012-04-02T16:49:00,2012,4
ANDHRA PRADESH,PRAKASAM,TARLUPADU,NA,AGRICULTURE,Cereals,1137,0,Asked about rice stem borer control,recommended cartaf hydrochloride 2g/lt,2012-04-08T12:48:00,2012,4
ANDHRA PRADESH,CHITTOOR,GANGADHARA NELLORE,NA,AGRICULTURE,Cereals,1137,0,Asked about rice blast control,recommended tricyclozole,2012-04-08T12:48:00,2012,4
ANDHRA PRADESH,PRAKASAM,MARKAPUR,NA,HORTICULTURE,Fruits,8101,0,asked about chini flower drop control,recommended planofix 2.5ml/10lt of water,2012-04-08T12:48:00,2012,4
ANDHRA PRADESH,ANANTPUR,BUKKARAYASAMUDRAM,NA,AGRICULTURE,Cereals,1137,0,Asked about rice stem borer control,recommended cartaf hydrochloride 2g/lt,2012-04-08T12:48:00,2012,4
ANDHRA PRADESH,VISAKHAPATNAM,0   ,NA,AGRICULTURE,Others,Others,0,asked about solar usability in driving of motor	.,recommended to contact A.O,2012-04-08T14:16:00,2012,4
ANDHRA PRADESH,ANANTPUR,KALYANDRUG,NA,HORTICULTURE,Vegetables,2108,0,asked about tomato helicoverpa control,recommended indoxacarb 1ml/lt,2012-04-08T14:16:00,2012,4
ANDHRA PRADESH,EAST GODAVARI,PEDAPUDI,NA,AGRICULTURE,Cereals,1137,0,Asked about rice blast control,recommended to spray of tricyclozole 0.6gm/lt of water,2012-04-08T14:16:00,2012,4
ANDHRA PRADESH,CHITTOOR,PUTHALAPATTU,NA,AGRICULTURE,Others,Others,0,asked about fisheries cultivation,I have given ph.no. 9440814713,2012-04-08T14:16:00,2012,4
ANDHRA PRADESH,ANANTPUR,KALYANDRUG,NA,HORTICULTURE,Vegetables,2108,0,asked about tomato flower drop control,recommended planofix 2.5ml/10lt of water,2012-04-08T14:16:00,2012,4
ANDHRA PRADESH,WEST GODAVARI,0   ,NA,AGRICULTURE,Cereals,1137,0,asked about control of greenleafhopper,recommended to spray dymithoate 2ml/lit,2012-04-08T15:03:00,2012,4
ANDHRA PRADESH,KRISHNA,0   ,NA,AGRICULTURE,Fiber Crops,Cotton (Kapas),0,asked about soil test & marketrates,recommended from agrisnet,2012-04-08T15:20:00,2012,4
ANDHRA PRADESH,ANANTPUR,0   ,NA,AGRICULTURE,Oilseeds,Groundnut (pea nut/mung phalli),0,control of groundnut root rot,recommended corbandyzim 2gr/lit,2012-04-08T15:27:00,2012,4
ANDHRA PRADESH,Y S R ,0   ,NA,HORTICULTURE,Condiments and Spices,Turmeric,0,asked about market rates,given information as per the net,2012-04-08T16:07:00,2012,4
ANDHRA PRADESH,EAST GODAVARI,0   ,NA,AGRICULTURE,Pulses,1818,0,asked about fertiliserapplication,information is given as per data,2012-04-08T17:11:00,2012,4
ANDHRA PRADESH,WEST GODAVARI,CHAGALLU,NA,AGRICULTURE,Cereals,1137,2,control of rice blast,Spraying of tricyclozole 0.6 gm/lit water,2012-04-09T13:07:00,2012,4
ANDHRA PRADESH,VIZIANAGARM,0   ,NA,HORTICULTURE,Fruits,Mango,0,asked about  inter crops growing in mango,information is given as per panchangam,2012-04-09T13:17:00,2012,4
ANDHRA PRADESH,GUNTUR,0   ,NA,AGRICULTURE,Others,Others,0,asked about animal husbandry,given number,2012-04-09T13:47:00,2012,4
ANDHRA PRADESH,WEST GODAVARI,0   ,NA,HORTICULTURE,Fruits,Grape,0,asked about water management in grapes,recommended from panchangam,2012-04-09T14:08:00,2012,4
ANDHRA PRADESH,KURNOOL,0   ,NA,AGRICULTURE,Cereals,1075,0,asked about control of stemborer in maize,recommended corbofuran 3g granuals 40gm/plant,2012-04-09T14:08:00,2012,4
ANDHRA PRADESH,EAST GODAVARI,0   ,NA,HORTICULTURE,Fruits,Coconut,0,asked about  coconut drier,infmatn is given as  per data,2012-04-09T14:08:00,2012,4
ANDHRA PRADESH,KURNOOL,KOILAKUNTLA,NA,AGRICULTURE,Pulses,1066,0,asked about bengal gram market rate,information given as per AGRISNET web site,2012-04-09T15:22:00,2012,4
ANDHRA PRADESH,CHITTOOR,0   ,NA,AGRICULTURE,Oilseeds,Groundnut (pea nut/mung phalli),0,asked about irrigation shedule in ground nut,given information as per the panchangam,2012-04-09T16:33:00,2012,4
ANDHRA PRADESH,ANANTPUR,0   ,NA,AGRICULTURE,Oilseeds,Groundnut (pea nut/mung phalli),0,asked about rust,recommended mancozeb 400gm/acre,2012-04-09T17:43:00,2012,4
ANDHRA PRADESH,VIZIANAGARM,0   ,NA,HORTICULTURE,Vegetables,2103,0,control of shoot borer in okra,spraying of profinophaus 2ml/lit water,2012-04-04T10:47:00,2012,4
ANDHRA PRADESH,WEST GODAVARI,0   ,NA,HORTICULTURE,Condiments and Spices,Saffron,0,asked about market rates,given information as per agris net,2012-04-04T10:47:00,2012,4
ANDHRA PRADESH,GUNTUR,0   ,NA,AGRICULTURE,Others,Others,Soil Testing,asked about soil  testing,infmatn is given as  per data,2012-04-04T10:54:00,2012,4
ANDHRA PRADESH,KRISHNA,0   ,NA,HORTICULTURE,Vegetables,1280,0,upward leaf,dymithoate 2ml /lit water,2012-04-05T19:43:00,2012,4
ANDHRA PRADESH,ANANTPUR,0   ,NA,HORTICULTURE,Flowers,Lilliums,0,asked about  diseases in flowers,recemmended  mancozeb 3g/lit,2012-04-06T09:00:00,2012,4
ANDHRA PRADESH,Y S R ,0   ,NA,HORTICULTURE,Fruits,Papaya,0,asked about n.p.k information,given information as per the panchanagam,2012-04-25T08:28:00,2012,4
ANDHRA PRADESH,NELLORE,0   ,NA,AGRICULTURE,Pulses,1037,0,asked about sowing time,given information as per the panchanagam,2012-04-25T08:28:00,2012,4
ANDHRA PRADESH,NELLORE,UDAYAGIRI,NA,AGRICULTURE,417,7528,	Plant Protection	,asked about crop information,given information as per the panchanagam,2012-04-25T08:28:00,2012,4
ANDHRA PRADESH,KRISHNA,VATSAVAI,NA,HORTICULTURE,Vegetables,1280,0,asked about chilli vareity,given information as per the panchanagam,2012-04-25T08:28:00,2012,4
ANDHRA PRADESH,ANANTPUR,0   ,NA,AGRICULTURE,Pulses,Pigeon pea (red gram/arhar/tur),0,asked about market costs of red gram,given information as per the net,2012-04-25T09:06:00,2012,4
ANDHRA PRADESH,ANANTPUR,0   ,NA,HORTICULTURE,Vegetables,Tomato,0,asked about n.p.k information,given information as per panchangam,2012-04-25T09:06:00,2012,4
ANDHRA PRADESH,ANANTPUR,D.HIREHAL,NA,HORTICULTURE,Vegetables,1280,0,asked about chilli n.p.k,given information as per panchangam,2012-04-25T09:06:00,2012,4
ANDHRA PRADESH,ANANTPUR,BELUGUPPA,NA,HORTICULTURE,Vegetables,2108,0,asked about tomato flower drop control,Advised the farmer planofix 2.5ml /10l,2012-04-25T12:20:00,2012,4
ANDHRA PRADESH,ANANTPUR,PUTTAPARTHI,NA,HORTICULTURE,Fruits,Citrus,0,Asked about chini market rate,INfORMATION GIVEN AS PER DATA,2012-04-25T12:20:00,2012,4
ANDHRA PRADESH,EAST GODAVARI,GOKAVARAM,NA,AGRICULTURE,Cereals,1137,0,Asked about rice bph control,Advised the farmer acephate,2012-04-25T12:20:00,2012,4
ANDHRA PRADESH,PRAKASAM,HANUMANTHUNI PADU,NA,AGRICULTURE,Others,Others,0,asked about weedicide in chini,I have trasferred call to H.O.,2012-04-25T12:20:00,2012,4
ANDHRA PRADESH,PRAKASAM,DORNALA,NA,HORTICULTURE,Fruits,Banana,0,Asked about banana fruits damage,INfORMATION GIVEN AS PER DATA,2012-04-25T12:20:00,2012,4
ANDHRA PRADESH,PRAKASAM,TALLUR,NA,HORTICULTURE,Vegetables,Onion,0,Asked about onion root rot disease control,Advised the farmer copper oxy chloride 3g/lt of water,2012-04-25T12:20:00,2012,4
ANDHRA PRADESH,GUNTUR,GUNTUR,NA,AGRICULTURE,Others,Others,0,Asked about how to reduce ph in fish ponds,I have given fisheries ph.no.9440814763,2012-04-25T12:20:00,2012,4
ANDHRA PRADESH,NELLORE,UDAYAGIRI,NA,AGRICULTURE,Cereals,1137,0,asked about weedicide in rice,Advised the farmer nomini gold,2012-04-25T12:20:00,2012,4
ANDHRA PRADESH,EAST GODAVARI,ANAPARTHY,NA,AGRICULTURE,Others,Others,0,asked about srivari cultivation,information given as per panchangam,2012-04-25T12:20:00,2012,4
ANDHRA PRADESH,KURNOOL,VELUGODU,NA,AGRICULTURE,Fiber Crops,Cotton (Kapas),0,Asked about Bt cotton var.,"Advised the farmer mahyco var. Kanak, Neeraj, Dr.Brent , Monsanto -Bramha and Mallika from Nuzeveedu seeds pvt lmt.",2012-04-25T12:20:00,2012,4
ANDHRA PRADESH,ANANTPUR,0   ,NA,AGRICULTURE,Pulses,1037,0,ased about vareity in green gram,"j.g-11,,J.A.I.K-9218.",2012-04-25T12:52:00,2012,4
ANDHRA PRADESH,WEST GODAVARI,0   ,NA,HORTICULTURE,Vegetables,Ridge Gourd,0,Control of pest in cucurbits,given information as per panchangam,2012-04-25T12:52:00,2012,4
ANDHRA PRADESH,CHITTOOR,MADANAPALLE,NA,AGRICULTURE,Others,Others,0,asked about weather report,information given as per AGRISNET web site,2012-04-25T14:36:00,2012,4
ANDHRA PRADESH,ANANTPUR,GOOTY,NA,HORTICULTURE,Fruits,Citrus,0,asked about chini root rot control,recommended coc  3g/lt,2012-04-25T14:36:00,2012,4
ANDHRA PRADESH,Y S R ,MYDUKUR,NA,HORTICULTURE,Vegetables,Chillies,0,asked about chilli flower drop control,recommended planofix 2.5ml/10lt of water,2012-04-25T14:36:00,2012,4
ANDHRA PRADESH,WEST GODAVARI,GOPALAPURAM,NA,AGRICULTURE,Others,Others,0,asked about poultry problems,recommended to contact 9989932741,2012-04-25T14:36:00,2012,4
ANDHRA PRADESH,WEST GODAVARI,GOPALAPURAM,NA,AGRICULTURE,Others,Others,0,asked about vegetables growing in summer,recommended as per panchangam,2012-04-25T14:36:00,2012,4
ANDHRA PRADESH,Y S R ,MYDUKUR,NA,HORTICULTURE,Condiments and Spices,Turmeric,0,asked about turmeric seed treatment chemical,recommended mancozeb,2012-04-25T14:36:00,2012,4
ANDHRA PRADESH,ANANTPUR,MUDIGUBBA,NA,HORTICULTURE,Vegetables,Chillies,0,asked about chilli sowing time,recommended in june,2012-04-26T12:24:00,2012,4
ANDHRA PRADESH,Y S R ,CHENNUR,NA,AGRICULTURE,Others,Others,0,asked about soil testing and sampling,infoRMATION GIVEN AS PER DATA,2012-04-26T12:24:00,2012,4
ANDHRA PRADESH,NELLORE,0   ,NA,HORTICULTURE,Vegetables,2108,0,ASked about  tomato wilt,Coc 3 gm/lit,2012-04-19T18:04:00,2012,4
ANDHRA PRADESH,PRAKASAM,0   ,NA,AGRICULTURE,Cereals,1075,0,ASked about  maize root parasite,given atic ph no 20023382,2012-04-20T08:55:00,2012,4
ANDHRA PRADESH,EAST GODAVARI,MAMIDIKUDURU,NA,HORTICULTURE,Fruits,Banana,74,asked about banana varieties nd crop period,provided information,2012-04-20T11:00:00,2012,4
ANDHRA PRADESH,ANANTPUR,SINGANAMALA,NA,AGRICULTURE,Others,Others,0,asked about cucurbits sucking pests control,recommended dimethoate 2ml/lt,2012-04-20T11:39:00,2012,4
ANDHRA PRADESH,PRAKASAM,TALLUR,NA,AGRICULTURE,Others,Others,0,asked about jama oil,recommended to contact 040-20023382,2012-04-20T13:48:00,2012,4
ANDHRA PRADESH,CHITTOOR,VIJAYAPURAM,NA,AGRICULTURE,Others,Others,0,asked about dairy problems,recommended to contact 9989932741,2012-04-20T13:48:00,2012,4
ANDHRA PRADESH,CHITTOOR,RAMASAMUDRAM,NA,AGRICULTURE,Others,Others,0,asked about weather report,information given as per AGRISNET web site,2012-04-20T13:48:00,2012,4
ANDHRA PRADESH,ANANTPUR,KADIRI,NA,AGRICULTURE,Others,Others,0,asked about NREGS,recommended to contact A.O.,2012-04-20T13:48:00,2012,4
ANDHRA PRADESH,ANANTPUR,RAYADURG,NA,AGRICULTURE,Fiber Crops,Cotton (Kapas),0,asked about fertilizers in cotton,recommended as per panchangam,2012-04-20T13:48:00,2012,4
ANDHRA PRADESH,SRIKAKULAM,TEKKALI,NA,AGRICULTURE,Others,Others,0,asked about new manchine in market,recommended to contact A.O.,2012-04-20T13:48:00,2012,4
ANDHRA PRADESH,SRIKAKULAM,MELIAPUTTI,NA,HORTICULTURE,Fruits,1324,0,asked about papaya cultivation,given information as per the data,2012-04-20T14:42:00,2012,4
ANDHRA PRADESH,KURNOOL,DORNIPADU,NA,AGRICULTURE,Oilseeds,"Castor (Rehri, Rendi, Arandi) ",0,control of tobacco cater filler,spraying of monocrotopos 2ml/lit water,2012-04-20T14:42:00,2012,4
ANDHRA PRADESH,PRAKASAM,0   ,NA,AGRICULTURE,Pulses,1037,6,asked about marketrates,recommended from agrisnet,2012-04-20T15:56:00,2012,4
ANDHRA PRADESH,KURNOOL,OWK,NA,AGRICULTURE,Others,Others,0,asked about subsidy & scheems,provided information as per apagrisnet.govt.in market rates,2012-04-20T16:09:00,2012,4
ANDHRA PRADESH,CHITTOOR,0   ,NA,AGRICULTURE,Others,Others,Weather,asked about weather information,given information as per the net,2012-04-20T16:38:00,2012,4
ANDHRA PRADESH,CHITTOOR,0   ,NA,ANIMAL HUSBANDRY,Animal,964,0,asked about dairy information,given contact number,2012-04-20T16:38:00,2012,4
ANDHRA PRADESH,WEST GODAVARI,BUTTAYAGUDEM,NA,AGRICULTURE,Cereals,1075,0,asked about control of leaf blight,recommended to spray mancozeb2.5gm/lit,2012-04-20T16:50:00,2012,4
ANDHRA PRADESH,WEST GODAVARI,0   ,NA,AGRICULTURE,Others,Others,Weather,asked about weather information,given information as per the net,2012-04-20T20:07:00,2012,4
ANDHRA PRADESH,ANANTPUR,0   ,NA,AGRICULTURE,Cereals,1075,0,asked about seed sowing time,oct15-nov15 sow time,2012-04-20T20:23:00,2012,4
ANDHRA PRADESH,KURNOOL,0   ,NA,HORTICULTURE,Vegetables,1279,76,control of stem borer in brinal,spraying of cypermetrine 300ml/acre,2012-04-15T07:39:00,2012,4
ANDHRA PRADESH,WEST GODAVARI,0   ,NA,HORTICULTURE,Fruits,Citrus,75,control of powderymildew in citrus,spraying of dinocap 400ml/acre,2012-04-15T07:39:00,2012,4
ANDHRA PRADESH,VISAKHAPATNAM,0   ,NA,AGRICULTURE,Sugar and Starch Crops,Sunnhemp (Patua),22,control of weeds in sugar cane,information is given as per panchangam,2012-04-15T07:39:00,2012,4
ANDHRA PRADESH,NELLORE,0   ,NA,AGRICULTURE,Others,Others,0,asked about agriculture  books,advised to consult  ao,2012-04-15T08:35:00,2012,4
ANDHRA PRADESH,GUNTUR,0   ,NA,AGRICULTURE,Cereals,1075,0,asked about  maize fertilizer dosage,recemmended according to pachangam,2012-04-15T08:35:00,2012,4
ANDHRA PRADESH,EAST GODAVARI,0   ,NA,AGRICULTURE,Others,Others,Soil Testing,asked soil preparation,information is given as per panchangam,2012-04-16T07:56:00,2012,4
ANDHRA PRADESH,ANANTPUR,0   ,NA,HORTICULTURE,Flowers,Lilliums,0,asked about control of aphids,recommended to spray dymoithoate 2ml/lit,2012-04-16T15:02:00,2012,4
ANDHRA PRADESH,ANANTPUR,BELUGUPPA,NA,AGRICULTURE,Others,Others,Soil Testing,asked about soil  testing,infmatn is given as  per data,2012-04-30T08:54:00,2012,4
ANDHRA PRADESH,KURNOOL,0   ,NA,AGRICULTURE,Millets,1581,1,asked about sowing season of pearlmillet,information is given as per panchangam,2012-04-30T08:54:00,2012,4
ANDHRA PRADESH,NELLORE,0   ,NA,HORTICULTURE,Fruits,1268,99,control of fruit drop in mango,spraying of planofix 3ml/10li water,2012-04-30T08:54:00,2012,4
ANDHRA PRADESH,VISAKHAPATNAM,0   ,NA,HORTICULTURE,Fruits,1324,0,control of mealy bug in papaya,spraying of dichlorovas 1 ml/lit water,2012-04-30T08:54:00,2012,4
ANDHRA PRADESH,KURNOOL,ADONI,NA,AGRICULTURE,Pulses,Black Gram (urd bean),0,asked about black gram helicoverpa control,recommended indoxacarb 1ml/lt,2012-04-16T19:19:00,2012,4
ANDHRA PRADESH,KURNOOL,0   ,NA,HORTICULTURE,Flowers,Rose,0,increase the production of jasmine flower,application of zinc sulphate and magnesium sulphate,2012-04-17T08:24:00,2012,4
ANDHRA PRADESH,KURNOOL,0   ,NA,ANIMAL HUSBANDRY,Animal,Rabbit,38,asked about cultivation details of rabbits,infmatn is given as  per data,2012-04-17T09:33:00,2012,4
ANDHRA PRADESH,Y S R ,0   ,NA,AGRICULTURE,Others,Others,Soil Testing,asked about soil test,recommended to contact ao,2012-04-17T13:38:00,2012,4
ANDHRA PRADESH,EAST GODAVARI,TUNI,NA,AGRICULTURE,Cereals,1137,Fertilizer Use and Availability,asked about control of leafspot disease,recommended to spray mancozeb 2gm/lit,2012-04-18T08:45:00,2012,4
ANDHRA PRADESH,NELLORE,0   ,NA,HORTICULTURE,Fruits,Coconut,76,control of red palm weevil in coconut,give root treatment with monocrotophas,2012-04-18T09:21:00,2012,4
ANDHRA PRADESH,CHITTOOR,PUTTUR,NA,AGRICULTURE,Others,Others,0,asked about merigold cultivation,recommended as per panchangam,2012-04-18T12:11:00,2012,4
ANDHRA PRADESH,CHITTOOR,PUTTUR,NA,AGRICULTURE,Others,Others,0,asked about tomato sowing time,recommended upto march,2012-04-18T12:11:00,2012,4
ANDHRA PRADESH,ANANTPUR,0   ,NA,HORTICULTURE,Vegetables,Tomato,0,control of weedicide in tomato,given  horticulture toll free number,2012-04-23T11:25:00,2012,4
ANDHRA PRADESH,ANANTPUR,0   ,NA,HORTICULTURE,Vegetables,2108,0,control of flower drop in tomato,spraying of planofix 2.5 ml/ 10 lit water,2012-04-23T12:13:00,2012,4
ANDHRA PRADESH,PRAKASAM,0   ,NA,HORTICULTURE,Fruits,1268,74,asked about showing season time,recommended from panchangam,2012-04-16T19:40:00,2012,4
ANDHRA PRADESH,VISAKHAPATNAM,CHINTAPALLE,NA,AGRICULTURE,Cereals,1137,0,asked regarding seed material for rice,the nearest location for material collection was told,2012-04-17T08:24:00,2012,4
ANDHRA PRADESH,WEST GODAVARI,0   ,NA,AGRICULTURE,Oilseeds,Groundnut (pea nut/mung phalli),3,control of leaf eating caterpillar in ground nut,information is given as per panchangam,2012-04-17T08:24:00,2012,4
ANDHRA PRADESH,CHITTOOR,IRALA,NA,HORTICULTURE,Vegetables,1280,75,control of powderymildew in chilli,spraying of carbandizim 1 gm/lit water,2012-04-17T09:33:00,2012,4
ANDHRA PRADESH,GUNTUR,0   ,NA,AGRICULTURE,Oilseeds,"Castor (Rehri, Rendi, Arandi) ",6,asked about market costs of castor,infmatn is given as  per data,2012-04-17T09:33:00,2012,4
ANDHRA PRADESH,NELLORE,0   ,NA,AGRICULTURE,Oilseeds,Groundnut (pea nut/mung phalli),1,asked about sowing season of  ground nut,information is given as per panchangam,2012-04-17T09:33:00,2012,4
ANDHRA PRADESH,ANANTPUR,0   ,NA,HORTICULTURE,Vegetables,Tomato,99,asked about control of flower droping,recommended to spray planofix 2.5ml/10lit,2012-04-17T13:38:00,2012,4
ANDHRA PRADESH,Y S R ,0   ,NA,HORTICULTURE,Fruits,Citrus,99,asked about control of flower droping,recommended to spray planofix,2012-04-17T13:38:00,2012,4
ANDHRA PRADESH,NELLORE,0   ,NA,AGRICULTURE,Cereals,1075,0,ASked about      maize soetime,"recemmended  oct-nov ,jan in coastal",2012-04-17T13:54:00,2012,4
ANDHRA PRADESH,ANANTPUR,0   ,NA,AGRICULTURE,Cereals,1137,0,ASked about  marketprice,Informed  1060/-,2012-04-17T13:54:00,2012,4
ANDHRA PRADESH,NELLORE,0   ,NA,AGRICULTURE,Fiber Crops,Cotton (Kapas),0,control of sucking pest,spraying of asitamiprid 40gr/Acre,2012-04-03T11:17:00,2012,4
ANDHRA PRADESH,CHITTOOR,0   ,NA,AGRICULTURE,Sugar and Starch Crops,Sunnhemp (Patua),22,control of weeds in sugar cane,information is given as per panchangam,2012-04-04T09:34:00,2012,4
ANDHRA PRADESH,CHITTOOR,0   ,NA,HORTICULTURE,Fruits,1268,0,control of termites,suggested by linden dust 10kg/Acre,2012-04-04T10:09:00,2012,4
ANDHRA PRADESH,SRIKAKULAM,BURJA,NA,HORTICULTURE,Fruits,1268,0,asked about mango flower drop,"recommended 2,5ml planofix /10lit",2012-04-19T18:04:00,2012,4
ANDHRA PRADESH,KRISHNA,NANDIGAMA,NA,AGRICULTURE,Others,Others,0,asked about srivari cultivation,informaTION GIVEN AS PER DATA,2012-04-20T13:20:00,2012,4
ANDHRA PRADESH,NELLORE,BUTCHIREDDIPALEM,NA,AGRICULTURE,Oilseeds,Groundnut (pea nut/mung phalli),0,ASKED about seed treatment in ground nut,recommended mancozeb,2012-04-20T13:48:00,2012,4
ANDHRA PRADESH,SRIKAKULAM,TEKKALI,NA,AGRICULTURE,Cereals,1137,0,asked about one short duration var.. of rice,recommended MTU-1010,2012-04-20T13:48:00,2012,4
ANDHRA PRADESH,ANANTPUR,PAMIDI,NA,HORTICULTURE,Vegetables,1282,0,asked about bhendi fruit borer control,recommended chloripyriphos,2012-04-20T13:48:00,2012,4
ANDHRA PRADESH,ANANTPUR,0   ,NA,HORTICULTURE,Vegetables,2108,0,control of leaf spot in tomato,spraying of coc 3gr/lit water,2012-04-20T14:42:00,2012,4
ANDHRA PRADESH,PRAKASAM,0   ,NA,ANIMAL HUSBANDRY,Animal,Others,32,asked about poultry information,given information as per the panchangam,2012-04-20T14:42:00,2012,4
ANDHRA PRADESH,0   ,0   ,NA,AGRICULTURE,Fiber Crops,Cotton (Kapas),1,asked about seed vareities and showing season time,recommended from panchangam,2012-04-20T15:56:00,2012,4
ANDHRA PRADESH,WEST GODAVARI,0   ,NA,AGRICULTURE,Pulses,1037,6,provided information as per apagrisnet.govt.in market rates,asked abot market information,2012-04-20T16:09:00,2012,4
ANDHRA PRADESH,ANANTPUR,0   ,NA,HORTICULTURE,Vegetables,Tomato,75,asked about control of leaf hoppers,recommended to spray imidachloprid 2ml/lit,2012-04-20T16:09:00,2012,4
ANDHRA PRADESH,KRISHNA,0   ,NA,AGRICULTURE,Pulses,Green Gram (Moong Bean/ Moong),5,asked about seed vareities and showing season time,recommended lgg 460,2012-04-20T16:09:00,2012,4
ANDHRA PRADESH,CHITTOOR,0   ,NA,HORTICULTURE,Vegetables,Tomato,75,asked about control of rootrot disease,recommended to spray copperoxy chloride 2.5gm /lit,2012-04-20T16:09:00,2012,4
ANDHRA PRADESH,KURNOOL,BANDI ATMAKUR,NA,HORTICULTURE,Vegetables,Drum Stick,0,asked about drumseeds information,given contact number,2012-04-20T16:38:00,2012,4
ANDHRA PRADESH,WEST GODAVARI,0   ,NA,AGRICULTURE,Pulses,Black Gram (urd bean),0,asked about control of tobacco caterpillar,recommended to spray thioicorb 1gm+ dichlorovas 1ml / lit,2012-04-20T16:50:00,2012,4
ANDHRA PRADESH,PRAKASAM,0   ,NA,AGRICULTURE,Others,Others,0,asked about dairyform,given animal husbandary number,2012-04-20T17:28:00,2012,4
ANDHRA PRADESH,CHITTOOR,0   ,NA,AGRICULTURE,Oilseeds,Groundnut (pea nut/mung phalli),0,"asked about n.p,k",given infarmation as per the data,2012-04-20T20:23:00,2012,4
ANDHRA PRADESH,EAST GODAVARI,0   ,NA,AGRICULTURE,Cereals,1137,0,"asked about n.p,k",giveninformation  as per the data,2012-04-20T20:23:00,2012,4
ANDHRA PRADESH,KRISHNA,0   ,NA,825,Avian,1266,0,information reg poultry,infmatn is given as  per data,2012-04-01T08:29:00,2012,4
ANDHRA PRADESH,Y S R ,0   ,NA,AGRICULTURE,Oilseeds,Sunflower (suryamukhi),0,control of squirrels in sun flower,information is given as per panchangam,2012-04-01T08:29:00,2012,4
ANDHRA PRADESH,GUNTUR,ACHAMPET,NA,HORTICULTURE,Vegetables,1282,76,control of sucking pests in bhendi,spraying of dimthioate 2 ml/lit water,2012-04-01T08:29:00,2012,4
ANDHRA PRADESH,KRISHNA,0   ,NA,AGRICULTURE,Cereals,1137,0,asked anout iron deficiensy,"20 gr annabhedi,2 gr lemon salt/lit water",2012-04-06T17:43:00,2012,4
ANDHRA PRADESH,CHITTOOR,GANGADHARA NELLORE,NA,AGRICULTURE,Cereals,1137,0,asked about rice bph control,recommended bufrofegin 300ml/acre,2012-04-08T12:48:00,2012,4
ANDHRA PRADESH,ANANTPUR,BRAHMASAMUDRAM,NA,AGRICULTURE,Cereals,1137,0,asked about rice bph control,recommended bufrofegin 300ml/acre,2012-04-08T12:48:00,2012,4
ANDHRA PRADESH,WEST GODAVARI,CHAGALLU,NA,AGRICULTURE,Sugar and Starch Crops,Sunnhemp (Patua),0,asked about weedicide in sugarcane after 30DAP,recommended metribuzin,2012-04-08T12:48:00,2012,4
ANDHRA PRADESH,KURNOOL,DEVANAKONDA,NA,AGRICULTURE,Oilseeds,Groundnut (pea nut/mung phalli),0,asked about ground nut book,information passed,2012-04-08T14:16:00,2012,4
ANDHRA PRADESH,EAST GODAVARI,GANGAVARAM,NA,AGRICULTURE,Cereals,1137,0,asked about rice leaf folder control,recommended chloripyriphos,2012-04-08T14:16:00,2012,4
ANDHRA PRADESH,VISAKHAPATNAM,0   ,NA,AGRICULTURE,Cereals,1075,0,asked about seed vareities and showing season time,recommended from panchangam,2012-04-08T15:03:00,2012,4
ANDHRA PRADESH,NELLORE,0   ,NA,AGRICULTURE,Cereals,1137,0,asked about control of smut in rice,recommended cobbandyzim 1gm/lit,2012-04-08T15:27:00,2012,4
ANDHRA PRADESH,NELLORE,BUTCHIREDDIPALEM,NA,HORTICULTURE,Fruits,1268,Fertilizer Use and Availability,asked about fertilizer management,provided information as per vyavasayapanchangam,2012-04-10T17:54:00,2012,4
ANDHRA PRADESH,NELLORE,BUTCHIREDDIPALEM,NA,AGRICULTURE,Fiber Crops,Cotton (Kapas),1,asked about sowing time,provided information,2012-04-10T17:54:00,2012,4
ANDHRA PRADESH,GUNTUR,NARASARAOPETA,NA,AGRICULTURE,Cereals,1137,Cultural Practices,asked about seed source,given information to a.o. no.,2012-04-10T17:54:00,2012,4
ANDHRA PRADESH,CHITTOOR,NARAYANAVANAM,NA,AGRICULTURE,Oilseeds,Groundnut (pea nut/mung phalli),0,asked about storage method of ground nut,infmatn is given as  per data,2012-04-11T13:08:00,2012,4
ANDHRA PRADESH,ANANTPUR,0   ,NA,AGRICULTURE,Oilseeds,"Castor (Rehri, Rendi, Arandi) ",6,asked about market cost of castor	infmatn is given as  per data,NA,2012-04-11T13:08:00,2012,4
ANDHRA PRADESH,KURNOOL,0   ,NA,HORTICULTURE,Vegetables,2113,78,asked about seed varieties of bitter gourd,information is given as per panchangam,2012-04-12T08:20:00,2012,4
ANDHRA PRADESH,Y S R ,0   ,NA,HORTICULTURE,Fruits,8101,75,control of diplodia rot in citrus,spraying of coc 3gm/li water,2012-04-12T11:02:00,2012,4
ANDHRA PRADESH,NELLORE,0   ,NA,AGRICULTURE,Sugar and Starch Crops,Sunnhemp (Patua),0,ASked about  sugarcane redrot,recommended seed treatment carbendizimo.5g/lit,2012-04-12T11:45:00,2012,4
ANDHRA PRADESH,9999,0   ,NA,HORTICULTURE,Vegetables,2108,0,control of weeds in tomato,information is given as per panchangam,2012-04-12T12:17:00,2012,4
ANDHRA PRADESH,GUNTUR,MUPPALLA,NA,AGRICULTURE,Others,Others,0,asked about sheep research station ph.no,08579-252208,2012-04-12T12:35:00,2012,4
ANDHRA PRADESH,CHITTOOR,0   ,NA,HORTICULTURE,Vegetables,Dolichos Bean,0,control of leaf minar,spraying of neem oil 1000 ml/Acre,2012-04-01T16:10:00,2012,4
ANDHRA PRADESH,CHITTOOR,BANGARUPALEM,NA,HORTICULTURE,Fruits,Mango,0,asked about flower drop in mango,spraying of planofix 2.5ml/ 10 lit water,2012-04-01T17:49:00,2012,4
ANDHRA PRADESH,EAST GODAVARI,0   ,NA,HORTICULTURE,Vegetables,Ridge Gourd,0,asked about ridge gourd information,given information as per the panchangam,2012-04-01T17:49:00,2012,4
ANDHRA PRADESH,NELLORE,BUTCHIREDDIPALEM,NA,AGRICULTURE,Oilseeds,Groundnut (pea nut/mung phalli),0,asked about seed treatment,treated with mancojeb 3gr/ kg,2012-04-01T17:49:00,2012,4
ANDHRA PRADESH,GUNTUR,0   ,NA,HORTICULTURE,Vegetables,1279,76,control of shoot and fruit borer in brinjal,spraying of cypermetrine 300ml/acre,2012-04-02T11:33:00,2012,4
